DGE	Genes	Process~name	num_of_Genes	gene_group	percentage%	P-value	Benjamini and Hochberg (FDR)	 Hommel singlewise process	Bonferroni single-step process	Hommel singlewise process	Hochberg step-up process	Benjamini and Yekutieli
up	APBB1; HAS3; PSMD9; TAF4; ARNTL; FOXE1; NR5A2; WNT7A; ARID1A; DVL1; DVL2; MAP2K7; IKBKB; CEP290; ARHGEF11; AXIN1; TGFB1I1; TBX1; AIRE; CAND2; SS18L1; LRP5; MED24; NR1I2; SUPT3H; TADA3; LRP6; PIAS2; SEC14L2; NFATC1; BCL10; PDGFB; TGFB1; TNF; IL1B; APOE; ESR1; CD74; WNT1; TP53; IL5; JUN; TFAP2A; RB1; RET; SP1; INHBA; GLI3; ZBTB48; RARA; SPP1; IRF1; BMP4; SRC; TCF4; TCF3; CREB1; PPP3CB; SPI1; ERCC2; EGR1; ELK1; TFEB; TFE3; TBP; BCL3; HNF1A; MDK; FGF7; IL10; SP100; NFYA; GATA3; NR2F2; CDK2; F2R; PAX6; ARNT; POU1F1; SMARCA1; SHC1; KDM5A; NOS1; AKT1; CD80; MAP2K2; TGFBR1; NUP62; VHL; STAT3; WNT5A; MLLT3; NOTCH1; MAP2K3; YAP1; RFX3; SOX9; NRIP1; TNNI2; CTCF; DNM2; RORC; SMARCA2; SMARCA4; MECP2; HCFC1; HMGA2; NR1H2; BRPF1; PRMT2; MAZ; HDAC4; WNT3A; SOX8; ACTA2; RNF4; RHOG; FOXK1; DAB2; ZXDA; FOXK2; RUNX1; FLI1; XPC; ROR2; MECOM; KMT2A; RELA; ACVR1; YWHAH; SRY; SOX4; PPARA; EP300; MAP3K12; TP53BP1; ILF3; MLLT11; REST; RLF; NR1H3; TRIM28; ILK; SMAD4; HDAC1; PTCH1; RUNX2; HNRNPD; FHL2; NPAT; FZD2; HES1; NCOA6; ERBB4; IRF4; SHH; SIX1; TEAD2; ELF2; ZFHX3; HIF1A; ZNF423; ZXDC; LBH; HIVEP3; RNF187; RNF20; ZNF318; HMBOX1; RGMB; PSRC1; SMARCD3; ATF7IP; RNF111; CREB3L2; RAI1; TAF8; RBM23; SKAP1; SFR1; NPAS3; KMT2E; MYOCD; TAF1L; KDM8; SFRP1; RYBP; AFAP1L2; BANP; IL31RA; CTCFL; SMARCC2; FANK1; DTX3L; ZFP90; NAT14; PHIP; KAT6B; ING5; ZNF516; HDAC2; PROX1; CREBBP; KAT6A; KAT2A; GATA6; DVL3; MED12; TESC; TRIM44; GPATCH3; ZNF496; NSD1; TRERF1; CAMKK2; RSF1; MMS19; ELF4; SMAD5; NKX3-1; HINFP; ZKSCAN3; LGR4; ZNF341; PBX4; GLIS2; FGF23; EPC1; HIPK2; TP63; PRDM16; ZNF287; CHD8; GCM1; ENY2; PLCB1; PRDM11; MED17; PIM2; CALCOCO1; RNF14; MAD2L2; SIX4; USP21; TBX21; FZD4; FZD1; PHF8; USP22; MAPRE3; MYRF; MED16; ZNF281; GRIP1; ZNF711; DYRK1B; MAGED1; SPIN1; WBP2NL; ARID1B; PRDM2; ZFHX2; DYRK1A; ING1; MSANTD1; WBP2; SERTAD3; ABRA; NFE2L1; ZFHX4;	GO:0045893~positive regulation of transcription, DNA-templated	270	570	47.3684210526316	0	0	0	0	0	0	0
down	CIT; NDC80; AURKA; XRCC2; ENSA; BUB1B; OFD1; JTB; YEATS4; RRM1; CDC25B; CLIP1; CETN2; CENPF; NEK2; KIF11; PLK1; ARPP19; RAN; SRSF2; CENPE; CENPC; IK; KIF22; NOLC1; CENPW; KIF18B; SKA3; SKA2; SKA1; CDCA5; MASTL; PBK; CDC5L; NUP88; PKMYT1; CDC6; CDT1; TTYH1; AZI2; KIF15; NUDT15; ANAPC11; FBXL7; CDC23; TPX2; SMC3; USP16; USP3; TUBD1; TUBB2B; MYBL2; WDHD1; TUBB4B; TUBAL3; TUBB2A; PLK4; ORC1; PLK2; TUBA4A; TUBGCP4; TUBE1; TUBGCP5; TUBA1C;	GO:0000278~mitotic cell cycle	64	134	47.7611940298507	0	0	0	0	0	0	0
down	ORC5; ORC4; RAD1; CDC45; RAD17; CDK1; POLA1; RPA2; RRM1; RRM2; MCM4; RPA3; RFC4; RFC2; BRCA1; FEN1; RFC3; LIG4; SET; SSRP1; CHAF1A; ORC1; POLA2; RAD9B; MCM10; DTD1; ATRIP; TOPBP1; RMI2; FAM111A; DNAJC2; RBBP8; BARD1; CDC6; GRWD1; DSCC1; TIPIN; CINP; CLSPN; POLE3; DONSON; DTL; ORC3; DBF4; MCM8; TIMELESS; EXO1; ORC6; TOP1; PIF1; CDT1;	GO:0006260~DNA replication	51	132	38.6363636363636	0	0	0	0	0	0	0
down	PES1; MPHOSPH10; NOP56; WDR46; NVL; RRP8; RRP9; DKC1; NPM3; UTP20; RPP40; RPS17; EIF4A3; RPL5; SNU13; GEMIN4; RPL26; NOP14; RPP38; RPP30; EXOSC10; EXOSC9; TBL3; KRR1; EXOSC2; FRG1; PDCD11; BMS1; NOLC1; EXOSC7; WDR43; EXOSC6; DIEXF; WDR74; NOL8; WDR75; DHX37; PELP1; RBFA; WDR36; UTP15; EMG1; UTP4; EXOSC8; RRP36; IMP4; DDX27; MPHOSPH6; RPP25; WDR18; UTP14A; WDR12; REXO4; HEATR1; NOL6; NOL11; ISG20L2; EXOSC5; EXOSC3; UTP3; DDX21; DCAF13; IMP3; LYAR; DDX56; UTP6; MRM2; NOB1; WDR3; PA2G4; RCL1; DDX52; NOP58; UTP11; RRP7A; SBDS; EXOSC1; UTP18; DDX49; POP5; DDX10; RPF1; EBNA1BP2; POP4; RRP1; MRTO4; ESF1; PIH1D2;	GO:0006364~rRNA processing	88	139	63.3093525179856	0	0	0	0	0	0	0
down	PIR; TCERG1; ZBTB7B; FOXN1; NKX2-8; RNMT; KLF4; ZNF202; PTTG1; GTF2F2; PAX1; XBP1; NELFE; POLR2C; ERCC3; BTF3; TCEA1; GTF2E2; POLR2B; GTF2H1; DEK; AHR; POLR2I; CEBPA; CDK7; CCNH; MNAT1; POLR2H; POLR2J; GTF2A2; ZNF143; POLR2K; NRL; COPS2; LMO4; POLR2G; POU6F2; ELF3; GTF2B; POU5F1; CEBPZ; HSF2; GABPA; SSRP1; NCBP1; KLF5; GTF2H3; TRIM29; TAF5; TAF13; TAF11; TRIP13; NFE2L2; TAF12; TAF9; NFIL3; CTR9; GTF2H5; NCAPG2; LEO1; TFAP2B; TAF4B; COPS5; IRF7; EAF1; IWS1; EPAS1; WDR61; POLR2J3; TAF9B; MED4; DDX21; EHF; MBD1; NOCT; MAFF; HIF3A;	GO:0006366~transcription by RNA polymerase II	77	266	28.9473684210526	0	0	0	0	0	0	0
down	IGF2BP3; EGFR; RPS17; RPSA; MRPL3; RPL17; RPS4Y1; RPL22; GGT5; RPL4; RPL5; RPL21; RPS10; RPS3A; RPL26; RPL37A; RPS13; RPS27A; RPS21; MRPS36; MRPS15; MRPS21; MRPS6; RPL24; CPEB4; MRPL51; LARP4; CPEB2; MRPL55; MRPL10; MRPL52; MRPL41; GUF1; MRPL43; CPEB3; GEMIN5; COPS5; RPL36AL; RPL39L; MRPL13; MRPL37; MRPL18; METTL17; PDF; FARSB; MRPS18A; MRPL35; MRPL36; RPS6KB2; MRPS33; MRPS17; MRPL11; MRPS16; MRPS18C; MRPS18B; MRPL42; EEF1A2; HBS1L; RSL24D1; MRRF; MRPL24; MRPS5; MRPS7; MRPS12; MRPL57;	GO:0006412~translation	65	175	37.1428571428571	0	0	0	0	0	0	0
down	PFDN6; PPIH; PFDN1; TBCA; MPDU1; CLPX; HSPA4L; CRYAB; GNAI3; GNAO1; HSPA8; TCP1; ATF6; NPPC; CANX; CCT6A; CCT3; CCT8; RAD23B; HSPE1; PSMC1; GNAI1; CSNK2B; CSNK2A1; CCT2; FKBP4; UBXN1; PPID; FKBP5; NFYC; CWC27; GRPEL2; CCT6B; DNAJC19; DNAJA3; ERO1A; NGLY1; DNAJC1; TTC1; DNAJC7; CCT7; ERP44; SIL1; GRPEL1; MKKS; PFDN4; PDRG1; HSPBP1; DNAJB11; PFDN2; BAG5; PPIL1; TRAP1; DNAJC25; CLGN; NUDCD2; PTGES3; CDC37L1;	GO:0006457~protein folding	58	150	38.6666666666667	0	0	0	0	0	0	0
down	MAPK13; KLK10; OIP5; PRPF40A; USP2; RNF8; KLHL18; FAM107A; GNAI3; PIM1; ZNF16; MAPK3; AHR; PPP1CC; MAP3K8; MKI67; BRCC3; CSNK1A1; LIG4; DYNLT3; PSME3; ARF6; GNAI1; CSNK2A1; RAE1; TXNL4A; ERH; CHAF1A; ITGB3BP; MAPK6; ERCC6L; USP39; FIGN; AVPI1; LIN9; CDCA2; SPECC1L; LIN54; TET2; RINT1; DCLRE1A; TMPRSS11A; PIM3; NCAPG2; CCAR1; MRPL41; SPC24; HJURP; PIK3C3; NUP37; MPLKIP; URGCP; RB1CC1; PARD3B; PPP1R1C; ANAPC16; NSMCE2; CDCA3; PDCD2L; RIOK2; CINP; BEX2; KIF13A; BRD7; TXLNG; FANCI; ARL8B; TXNL4B; MIS18A; RCC2; APEX2; ANAPC5; MCTS1; CCPG1; ANAPC10; RUVBL1; RABGAP1;	GO:0007049~cell cycle	77	248	31.0483870967742	0	0	0	0	0	0	0
down	SRRM4; SAP18; MPHOSPH10; GEMIN2; LSM1; DHX15; PRPF4; SYNCRIP; NOL3; ZPR1; SF3B1; BCAS2; ECD; HNRNPC; SNRPA1; LGALS3; SNRPF; SNRPG; LSM6; SNRPD1; SNRPD3; PPP2CA; SRPK2; SRSF2; C1QBP; SRSF4; NCBP1; PPP1R8; PPIG; PRPF4B; RBM39; DHX8; SNRNP35; SRSF7; USP39; RBM20; THOC7; SNRNP48; ESRP1; CIR1; SREK1IP1; ZCRB1; SREK1; SNRNP40; RBMXL1; SRPK1; IWS1; PRPF18; DDX23; SNRNP25; NSRP1; RRAGC; RBM28; PPARGC1A; ZMAT5; TTF2; SMU1; SLU7; SCNM1; WBP4; MAGOH;	GO:0008380~RNA splicing	61	156	39.1025641025641	0	0	0	0	0	0	0
down	EVPLL; FOXN1; TGM5; KRT34; SCEL; GJB5; STS; KRT5; DSP; KRT15; SPRR1B; SPRR2E; SPRR2D; CRABP2; S100A7; CASP14; NTF4; SPRR1A; SPRR2B; SPRR2A; KLK7; EMP1; ELF3; FABP5; BNC1; KRT32; KRT31; CST6; UGCG; ZNF750; GRHL2; CERS3; ACER1; GRHL3; EVPL; SPRR2F; SPRR2G; GRHL1; CALML5; SPRR3; KLK5;	GO:0008544~epidermis development	41	82	50	0	0	0	0	0	0	0
down	PSMD11; PSMD12; PSMD14; PSMA7; AURKA; RAD21; PSMC3; PSMB1; PSMA1; PSMA3; PSMA4; PSMA5; PSMB6; PSMB5; PSMC2; PSMC4; PSMD8; PSMB2; PSMD7; PSMD4; PSMA6; PSME3; PSMC1; PSMC5; PSMC6; RBX1; SKP1; CUL1; PSMD6; PSMD5; PINX1; USP47; PSMB7; FBXL7; PSMD13;	GO:0010972~negative regulation of G2/M transition of mitotic cell cycle	35	56	62.5	0	0	0	0	0	0	0
down	GPR89A; SCAMP2; CETN3; ZW10; CHP2; TOM1; RAMP3; VPS4B; SEC22B; MTX2; KIF20A; SFT2D2; SNAP29; XBP1; BTF3; CETN2; RABIF; CENPF; PSEN1; GDI2; PPT1; GABARAPL2; TAP2; PPID; SPIRE1; SELENBP1; GPM6B; MTM1; MTX1; COG2; RABEP1; DUOXA1; HIKESHI; STXBP5; AP1AR; EIF5AL1; RINT1; DENND1B; AAGAB; AFTPH; RAB11FIP1; GOLT1A; CCDC91; UEVLD; VPS52; ARRDC1; JAGN1; COMMD1; NECAP1; KIF18A; EXOC6; BICD2; SCFD2; PDCD6IP; SCFD1; ATG4A; CHMP4C; ATG4C; SEC22A; SEC16B; VPS50; ANKRD27; TSG101; NDC1; NUP62CL; AKTIP; ECT2; COG4; LIN7B; SENP2; VTA1; EXOC1; ARL8B; UBAP1; CHMP5; CNIH4; HOOK1; MYO5B; COG5; EXOC6B; STXBP5L; SNX24; ARFGEF2; SERP1; CHMP2B; CHMP1B; CHMP2A;	GO:0015031~protein transport	87	310	28.0645161290323	0	0	0	0	0	0	0
down	PSMD11; PSMD12; PSMD14; PSMA7; USP2; USP1; IL33; DDX58; MYC; CDK1; ADRB2; UBC; AR; PSMC3; CCNA2; PSMB1; PSMA1; PSMA3; PSMA4; PSMA5; PSMB6; PSMB5; CDC25A; PSMC2; BRCA1; USP8; PSMC4; BRCC3; PSMD8; PSMB2; PSMD7; RAD23B; PSMD4; PSMA6; PSME3; PSMC1; PSMC5; PSMC6; RPS27A; CCNA1; CDC20; SKP2; BECN1; PSMD6; TOMM20; PSMD5; USP39; YOD1; INO80C; USP53; USP54; ASXL2; RHOT1; USP38; KDM1B; WDR48; WDR20; KAT2B; COPS5; USP47; PSMB7; BARD1; IFIH1; ACTR5; CLSPN; TAF9B; ZRANB1; USP25; USP18; PSMD13; RUVBL1; USP15; UCHL5; USP16; USP3; OTUD1;	GO:0016579~protein deubiquitination	76	263	28.8973384030418	0	0	0	0	0	0	0
down	PSMD11; PSMD12; PSMD14; UBE2C; PSMA7; AURKA; BUB1B; PTTG1; CDK1; UBC; CCNB1; PSMC3; PSMB1; PSMA1; PSMA3; PSMA4; PSMA5; PSMB6; PSMB5; PSMC2; PSMC4; PSMD8; PSMB2; PSMD7; UBE2E1; PLK1; PSMD4; PSMA6; PSME3; PSMC1; PSMC5; PSMC6; RPS27A; CDC20; MAD2L1; PSMD6; PSMD5; ANAPC16; AURKB; PSMB7; ANAPC1; ANAPC11; CDC23; ANAPC7; ANAPC5; FBXO5; ANAPC10; PSMD13;	GO:0031145~anaphase-promoting complex-dependent catabolic process	48	81	59.2592592592593	0	0	0	0	0	0	0
down	NDUFAB1; NDUFS4; NDUFB5; NDUFB3; NDUFC1; NDUFA2; NDUFS5; NDUFS2; NDUFB1; NDUFS3; NDUFB4; NDUFA7; NDUFC2; NDUFA10; NDUFB10; MT-ND2; MT-ND3; MT-ND4; NDUFA8; NDUFV3; NDUFA6; OXA1L; NDUFA5; NDUFA9; NDUFAF6; NDUFAF5; NDUFAF7; TMEM126B; NDUFAF2; FOXRED1; TIMM21; COA1; TIMMDC1; NDUFAF4; NDUFA12; BCS1L; NDUFAF1; NDUFB9;	GO:0032981~mitochondrial respiratory chain complex I assembly	38	64	59.375	0	0	0	0	0	0	0
down	PSMD11; PSMD12; PSMD14; PSMA7; CLOCK; FBXO45; PSMC3; PSMB1; PSMA1; PSMA3; PSMA4; PSMA5; PSMB6; PSMB5; DDIT3; PSMC2; IFI27; PSMC4; PSMD8; PSMB2; PSMD7; PSMD4; PSMA6; UBE2D3; PSME3; PSMC1; PSMC5; PSMC6; RBX1; UBE2B; UBXN1; SKP2; PPP2R5C; PSMD6; NFE2L2; PSMD5; SPOPL; ZFAND2B; PELI1; PSMB7; RBCK1; TBL1XR1; TRIM9; PSMD13; FAF1; CUL5; CUL2; RMND5A; FBXW7; UBE2K; NSFL1C; GID4; UBE2G1; RMND5B; RAD23B; CUL1; SPSB3; UBE3D; UBE2A; TRIM2; LTN1;	GO:0043161~proteasome-mediated ubiquitin-dependent protein catabolic process	61	183	33.3333333333333	0	0	0	0	0	0	0
down	PSMD11; PSMD12; IGF2BP3; PSMD14; PSMA7; HSPB1; UBC; HSPA8; SCGB1A1; PSMC3; PSMB1; PSMA1; PSMA3; PSMA4; PSMA5; PSMB6; PSMB5; PSMC2; ANP32A; PSMC4; PSMD8; PSMB2; PSMD7; PSMD4; PSMA6; PSME3; PSMC1; PSMC5; PSMC6; RPS27A; YWHAZ; SET; EXOSC9; EXOSC2; PSMD6; EXOSC7; PSMD5; PCID2; EXOSC6; SERBP1; PUM2; EXOSC8; PSMB7; DHX36; EXOSC5; EXOSC3; PSMD13; CARHSP1; EXOSC1; ZC3H14;	GO:0043488~regulation of mRNA stability	50	112	44.6428571428571	0	0	0	0	0	0	0
down	PSMD11; PSMD12; SLC33A1; PSMD14; PSMA7; GJB6; SLC25A5; EIF2S1; UBC; SLC25A4; PSMC3; EIF2S2; PSMB1; AZGP1; PSMA1; PSMA3; PSMA4; PSMA5; PSMB6; PSMB5; ABCD3; GJB2; SLC6A1; SLC6A4; PSMC2; MPV17; PEX19; EIF2S3; AQP2; PSMC4; ABCG1; SLC6A11; PSMD8; PSMB2; PSMD7; PSMD4; AQP5; PEX3; PSMA6; PSME3; PSMC1; PSMC5; PSMC6; RPS27A; PSMD6; RALBP1; PSMD5; SLC10A6; ABCA11P; PDZD11; SLC10A5; MFSD14B; LRRC8B; SLC23A3; SLC22A25; LRRC8D; NIPA1; SLCO6A1; SPNS2; SLC44A2; LRRC8A; SLC44A3; SLC44A5; SLC25A43; SLCO4A1; SLC47A1; RNF185; ABCC11; PSMB7; SLC25A21; MAGT1; MRS2; SLC39A9; SEL1L; PSMD13; FLVCR2; SLC22A14; SLC19A2; TAP2; ATP6V0E1; ABCB11;	GO:0055085~transmembrane transport	81	285	28.4210526315789	0	0	0	0	0	0	0
down	MRPS12; MRPL33; ERAL1; MRPL3; MRPL19; DAP3; MRPL12; MRPS22; MRPS10; MRPS35; MRPS5; MRPS36; MRPS15; MRPS21; MRPS34; MRPS6; MRPS9; MRPL49; MRPL58; OXA1L; MRPL51; MRPL54; MRPL14; MRPL21; MRPL55; MRPL10; MRPL52; MRPL41; MRPL50; MRPL43; GADD45GIP1; MRPL30; MRPS27; MRPS31; GFM2; MRPL24; CHCHD1; MRPL48; GFM1; MRPL57; MRPL45; MRPL20; MRPL13; MRPL1; MRPS26; MRPL37; MRPL18; MRPL44; MRPL47; MRPL40; MRPL17; MRPS18A; MRPL22; MRPL39; MRPL35; MRPL15; MRPL36; MRPS33; MRPS28; MRPS17; MRPS7; MRPL11; MRPS16; MRPS18C; MRPS23; MRPS18B; MRPL42; TSFM;	GO:0070125~mitochondrial translational elongation	68	89	76.4044943820225	0	0	0	0	0	0	0
down	MRPS12; MRPL33; ERAL1; MRPL3; MRPL19; DAP3; MRPL12; MRPS22; MRPS10; MRPS35; MRPS5; MRPS36; MRPS15; MRPS21; MRPS34; MRPS6; MRPS9; MRPL49; MRPL58; OXA1L; MRPL51; MRPL54; MRPL14; MRPL21; MRPL55; MRPL10; MRPL52; MRPL41; MRPL50; MRPL43; GADD45GIP1; MRPL30; MRPS27; MRPS31; GFM2; MRPL24; CHCHD1; MRRF; MRPL48; MRPL57; MRPL45; MRPL20; MRPL13; MRPL1; MRPS26; MRPL37; MRPL18; MRPL44; MRPL47; MRPL40; MRPL17; MRPS18A; MRPL22; MRPL39; MRPL35; MRPL15; MRPL36; MRPS33; MRPS28; MRPS17; MRPS7; MRPL11; MRPS16; MRPS18C; MRPS23; MRPS18B; MRPL42;	GO:0070126~mitochondrial translational termination	67	89	75.2808988764045	0	0	0	0	0	0	0
down	TGM5; PPL; KRT33A; KRT34; KRT36; KRT37; KRT75; CSTA; KRT6B; IVL; KRT16; KRT3; KRT13; KRT5; JUP; DSP; KRT15; KRT4; FLG; SPRR1B; SPRR2E; SPRR2D; TGM1; PCSK6; CASP14; DSG3; SPRR1A; SPRR2B; SPRR2A; KRT6C; KRT76; DSC2; TCHH; PKP1; KRT33B; KRT32; DSC3; KRT31; PRSS8; KRT24; KRT79; KAZN; KRT40; SPINK6; RPTN; KRT27; DSG4; CERS3; KRT78; EVPL; SPRR2F; PKP2; TMEM79; LCE3D; SPRR2G; SPINK5; SPRR3; KLK12; KLK13; KLK5; PKP3; ST14;	GO:0070268~cornification	62	113	54.8672566371681	0	0	0	0	0	0	0
down	PSMD11; PSMD12; PSMD14; PSMA7; CHUK; RIPK2; IL1A; UBC; PSMC3; IL1RN; PSMB1; PSMA1; PSMA3; PSMA4; MAPK3; PSMA5; PSMB6; PSMB5; PSMC2; MAP3K8; PSMC4; PSMD8; PSMB2; PSMD7; PSMD4; PSMA6; PSME3; PSMC1; PSMC5; PSMC6; RBX1; RPS27A; SKP1; CUL1; PSMD6; PSMD5; TAB3; PELI1; PSMB7; MYD88; TOLLIP; IL1RL2; NOD2; IL1RAP; TAB2; PSMD13;	GO:0070498~interleukin-1-mediated signaling pathway	46	95	48.4210526315789	0	0	0	0	0	0	0
down	PSMD11; PSMD12; PSMD14; UBE2C; PSMA7; BUB1B; CDK1; CCNB1; PSMC3; ERCC3; PSMB1; PSMA1; PSMA3; PSMA4; PSMA5; PSMB6; PSMB5; PSMC2; PSMC4; PSMD8; PSMB2; PSMD7; UBE2E1; PLK1; PSMD4; PSMA6; PSME3; PSMC1; PSMC5; PSMC6; SKP1; CDC20; MAD2L1; CUL1; PSMD6; PSMD5; ANAPC16; PSMB7; ANAPC1; ANAPC11; CDC23; ANAPC7; ANAPC5; FBXO5; ANAPC10; PSMD13;	GO:1901990~regulation of mitotic cell cycle phase transition	46	80	57.5	0	0	0	0	0	0	0
down	ACAA1; PEX2; ACSL1; HSD17B4; CYP4F2; ACOX1; ACSBG1; CYP4F12; SLC27A6;	GO:0000038~very long-chain fatty acid metabolic process	9	14	64.2857142857143	0.00010920980115858	0.00310364285533251	0.721767575857075	0.747977928135134	0.525517563175101	0.721767575857075	0.0292026306250836
up	TRAF5; PLPP3; DVL2; MBTPS2; LRP5; LRP6; TRIM37; TNF; IL1B; ESR1; WNT1; APP; IL5; CSF3; SRF; HCLS1; TRIM27; ATF2; FOSL1; TCF3; TRIM21; IL10; AKT1; SMARCA4; HDAC4; WNT3A; NHLH2; PPP3CA; EP300; SMARCB1; TP53BP1; TRIM26; TRAF2; TRIM32; TRIM14; TRIM25; FZD2; PPP2R5B; MYOCD; ABRA; FANK1; NODAL; PARK7; PHB2; NKX3-1; TRIM62; TRIM34; PRKD2; TRIM8; TRIM5; HIPK2; SAV1; BEX1; FZD4; PYCARD; FZD1; TRAF6; PPRC1;	GO:0051091~positive regulation of DNA-binding transcription factor activity	58	111	52.2522522522522	0.00011349556148221	0.0314324819305628	1	1	0.76515078374872	0.999999997500836	0.304420885731636
down	PLK4; AURKA; HMMR; OFD1; FGFR1OP; CDK1; CETN2; PAFAH1B1; CENPF; NEK2; PLK1; YWHAE; DYNLL1; TUBA4A; TUBB4B; MAPRE1; CEP57; CEP76; CDK5RAP2; HAUS4; HAUS2; TPX2;	GO:0010389~regulation of G2/M transition of mitotic cell cycle	22	80	27.5	0.00011443204174221	0.00322528828762327	0.756052499790837	0.783745053892454	0.53542752331184	0.756052499790837	0.0303472103309322
down	RPS17; RPSA; RPL17; RPS4Y1; RPL22; RPL4; EIF4A3; RPL5; RPL21; RPS10; EIF3E; RPS3A; RPL26; MAGOH; RPL37A; RPS13; ETF1; RPS27A; PPP2R2A; RPS21; PPP2CA; RPL24; EXOSC10; NCBP1; PYM1; UPF3B; UPF2; RBM8A;	GO:0000184~nuclear-transcribed mRNA catabolic process, nonsense-mediated decay	28	117	23.9316239316239	0.00011587065462825	0.00325245128503665	0.765441544474275	0.793598113548942	0.538180272189041	0.765441544474275	0.0306027909557358
down	ALOX15B; CIDEA; SC5D; ZNF202; CH25H; CYP3A4; UGT2B7; CD36; ALOX12; IL1RN; HMGCL; SREBF1; ALDH3B2; PITPNB; FABP6; LACTB; FABP5; HMGCS1; PPARD; ACOX1; TTC39B; OMA1; PAFAH2; MGLL; MGST2; ACAT2; EPHX3; GDE1; ACAD8; LIPT1;	GO:0006629~lipid metabolic process	30	130	23.0769230769231	0.00011789014889951	0.00329563114209292	0.778664433481285	0.807429629812766	0.542008275965375	0.778664433481285	0.0310090765610179
up	DNM1L; TAPBP; APBA3; F2; PTH; COL2A1; APP; PTHLH; GNB3; TFEB; NF1; IL10; SLC8A1; BMI1; G6PC; PIK3CA; CRIP1; AIF1; STX1B; UBXN2A; APBA1; ROM1; ZFP36L1; TAF10; TCIRG1; PIN1; NPAT; SART3; HIF1A; C9orf116; ZC3H12A; SHC4; NHLRC1; MEGF8; STK40; TSKU; PROX1; TRIM44; APBA2; HINFP; FUT8; POFUT2; POGZ; MOK; HMG20B; ZNF827; CDK11A; ZNF507; PRDM16; ZNF345; YBX3; DHH; NLK; HMG20A; ZNF485; ZFP64; ZNF335; TOB2; MAPK9; PRDM10; MAPK11; AFF1; ZNF71; CDK11B; MECOM; SHH; ZNF513; ZNF462; IHH; CDK2; PRDM15; ZNF580; MAPK12; ZNF451; ZNF784; REST; MAPK8; MAPK7;	GO:0010468~regulation of gene expression	78	166	46.9879518072289	0.00013348973167792	0.0354297452547534	1	1	0.789863276188054	0.999999997500836	0.343134037443322
down	ZW10; CDK1; IK; KNL1; MTBP; AURKB; MIS12; TTK;	GO:0034501~protein localization to kinetochore	8	11	72.7272727272727	0.00014458497040303	0.00388338220506044	0.953682464778444	0.990262462290413	0.581514132397976	0.953537879808041	0.0365393124777732
down	CALM1; NOS3; GCHFR; GCH1; PPT1; PTS; PRKG2; MMADHC;	GO:0051186~cofactor metabolic process	8	11	72.7272727272727	0.00014458497040303	0.00388338220506044	0.953682464778444	0.990262462290413	0.581514132397976	0.953537879808041	0.0365393124777732
up	DRGX; PIK3CD; GFRA2; CHL1; DVL1; NRP1; FLRT2; NRP2; PSPN; SLIT3; KLF7; TRIO; LYPLA2; SEMA4F; NTRK1; FYN; CSF1R; RET; GLI3; SRC; PTPRA; PLCG1; ANOS1; GATA3; PAX6; PIK3R1; EPHB2; SHC1; L1CAM; GPC1; MYH10; WNT5A; PIK3CA; DCC; ETV1; VASP; LAMB2; WNT3; WNT3A; SPTBN1; PRKCQ; PTK2; SCN1B; SOS1; MAPK7; SEMA3F; GRB10; SMAD4; TUBB3; CRMP1; SHH; EXT1; DPYSL2; FOXD1; ARTN; ENAH; DRAXIN; USP33; FRS2; NEO1; APBB2; ROBO3; FEZ1; DOK1; SEMA3C; SHANK3; OR10A4; NTN4; PDLIM7; FLRT3; MYOT; FEZ2; NRXN1; IRS2; ROBO1; SEMA6C; BSG; EFNA2; EPHA3; IGSF9; LAMA1; EFNB2; LGR6; EFNB1; EFNA1; KIF3A; EFNB3; UNC5C; EPHA7; KIF5A; PALLD; NEXN;	GO:0007411~axon guidance	92	206	44.6601941747573	0.00014777820777067	0.0381014441977882	1	1	0.807552545112967	0.999999997500836	0.369009212061847
down	CSTF2; FAM98B; ZBTB8OS; TSEN2; TSEN15; DDX1; CLP1; C2orf49; RTCB;	GO:0006388~tRNA splicing, via endonucleolytic cleavage and ligation	9	15	60	0.00016058652407968	0.00424400921460032	1	1	0.603731159921354	0.999913170749623	0.0399325048790597
down	COQ9; COQ5; PDSS1; PDSS2; COQ2; COQ7; COQ3; COQ10B; FDXR;	GO:0006744~ubiquinone biosynthetic process	9	15	60	0.00016058652407968	0.00424400921460032	1	1	0.603731159921354	0.999913170749623	0.0399325048790597
down	AURKA; MAP3K13; STK16; OXSR1; CHEK2; EGFR; EIF2S1; PIM1; FER; EPHA1; FGFR3; TTK; NEK2; EPHB3; EPHA4; TYRO3; CAMK2B; CAMK2D; PTK6; MELK; ULK3; VRK2; MAPKAPK5; LMTK2; MYO3A; MAPK15; AURKB; HTATIP2; RIOK2; SLK; EIF2AK3; STK26; ALK; STK24; MAPKAPK3; PIM3;	GO:0046777~protein autophosphorylation	36	173	20.8092485549133	0.00016082920603088	0.00424400921460032	1	1	0.604074497852015	0.999913170749623	0.0399325048790597
down	EXOSC9; EXOSC2; EXOSC6; EXOSC5; EXOSC8; EXOSC7; EXOSC3;	GO:0034475~U4 snRNA 3'-end processing	7	8	87.5	0.00017541896265815	0.00453375273677632	1	1	0.623764095883359	0.999913170749623	0.0426587441561011
down	CHUK; ADRA2A; AGTR1; SYNJ2BP; PHACTR4; EPS8L1; CNKSR1; ARHGEF3; ADGRG1; RHOD; CDC42EP5; RAC1; CDC42EP1; RHOJ; RHOV; EPS8; RHOT1; C15orf62; RND3; CDC42; RND1;	GO:0007266~Rho protein signal transduction	21	77	27.2727272727273	0.00017828102168904	0.0045904011937904	1	1	0.626808762701199	0.999913170749623	0.0431917577929056
up	WTIP; PDLIM1; PLOD2; APAF1; ACTN4; CBFA2T3; PLAU; PLAT; ADA; LTA; ANG; CYP1A1; TH; THBS1; F7; SRF; CYBA; DRD2; PKM; CREB1; ITGA2; CAPN2; ERCC2; EGR1; XRCC1; PAM; NF1; RYR1; KCNA5; EDNRA; DPP4; ARNT; NOS1; PML; ADSL; MTHFR; MMP14; MECP2; UCP2; UCP3; RHOA; TGFB2; ADAM17; PLOD1; CAV1; PPARA; EP300; KCNMA1; REST; PRKAA1; PAK1; SMAD4; BIRC2; PIN1; PTK2B; POSTN; HIF1A; ALKBH5; AGTRAP; MYOCD; CYGB; TM9SF4; CREBBP; AJUBA; EGLN2; WDR83; ANGPTL4; DDIT4; SLC2A8; DNMT3B; LIMD1; LOXL2; PGF; VEGFB; MMP2; VEGFC;	GO:0001666~response to hypoxia	76	163	46.6257668711656	0.00019364718674286	0.0451195961814462	1	1	0.858329834324978	0.999999997500836	0.43697941078125
up	MYO9A; PIK3R2; ARHGAP33; ARHGEF11; SIPA1L1; ARHGAP6; SRGAP3; SIPA1L3; SRGAP2; TRIO; PLEKHG5; RHOBTB1; RHOC; MCF2; RAC2; CHN1; RHOQ; GDI1; TSC2; ARHGDIA; ARHGDIB; VAV2; RAC3; RHOA; RHOB; RHOG; ARHGAP8; FGD1; SOS1; SOS2; ARHGAP1; MYO9B; GNA13; ARHGAP19; ITSN1; ARHGAP44; AMOT; ARHGAP29; ARHGAP21; ARHGEF16; ARHGAP17; ARHGEF18; SYDE1; ARHGAP22; NET1; SRGAP1; RALGAPB; TIAM2; ARHGEF19; ARHGAP12; RHOT2; ARHGAP24; ARHGAP18; ARAP3; ARHGEF1; ARHGEF2; SIPA1; ARAP1; ARHGEF17; DLC1; DEPDC7; RHOBTB2; ARHGAP39; PLEKHG2; FAM13B; GMIP; ARHGAP23; STARD13;	GO:0051056~regulation of small GTPase mediated signal transduction	68	141	48.2269503546099	0.00019499825477353	0.0451195961814462	1	1	0.859359204460884	0.999999997500836	0.43697941078125
up	ARID1A; DVL2; APAF1; PLXNB2; KDM6A; BCL10; ABL1; TGFB1; PFN1; RARA; BMP4; SKI; PRKACA; BRD2; MTHFR; TSC2; TGFB2; RPS7; NOG; PTCH1; SCRIB; TEAD2; TWIST1; TRIM71; MTHFD1L; TSC1; KAT2A; MED12; DLC1; BBS4; FUZ; SETD2; SEMA4C; IFT122; FZD3; IFT57; CELSR1; CC2D2A; SALL4; VANGL2; SUFU; TRAF6; LRP6; VASP;	GO:0001843~neural tube closure	44	78	56.4102564102564	0.00020763295768622	0.0468419952540115	1	1	0.869121810440535	0.999999997500836	0.453660697750952
down	GLI2; MTHFD1; BMP2; PTN; ERBB3; ADM; APLNR; ID1; FGF12; CXADR; IRX4; MEF2A; ID3; PPARD; PTPN11; FOXF1; FOXC1; COX17; RBM20; ADIPOR2; RB1CC1; PCSK5; KAT2B; FOXJ1; ALPK3; PKP2; CITED2; SENP2; ADAP2; MKKS; TAB2; MBD2; MBD1; HDAC9; CACYBP; PRICKLE4; SOX17; PDLIM3;	GO:0007507~heart development	38	190	20	0.00021625901468291	0.00550616353741006	1	1	0.667159060296802	0.999913170749623	0.051808299936322
down	MBD4; ASS1; CST3; PENK; CRYAB; GSTP1; ESRRA; HPGD; IGFBP2; BMP7; PTN; GJB2; SLC6A1; SLC6A4; ADCYAP1R1; FOXA1; STRN3; ENDOG; EZH2; RBBP8; ARNT2; MBD2; MBD1; ANXA1; GGT5;	GO:0032355~response to estradiol	25	103	24.2718446601942	0.00021744983983584	0.00551597760383602	1	1	0.668440807655397	0.999913170749623	0.0519006419260825
down	SCD; ZBTB7B; ADRB2; FH; FABP4; PRLR; CD36; ADCYAP1; ACADL; ACSL1; LEPR; GATM; ESRRG; FABP5; IL18; FFAR4; ADIPOR2; DIO2; ADIPOR1; OMA1; EPAS1; ELOVL6; PPARGC1A; PEMT;	GO:0120162~positive regulation of cold-induced thermogenesis	24	97	24.7422680412371	0.00022572485640193	0.00570475845570787	1	1	0.676736602147098	0.999913170749623	0.053676908636935
down	PTGES; MIF; EDN2; PTGS1; PLA2G4A; PTGES3; PLA2G4F; PNPLA8; MGST1;	GO:0001516~prostaglandin biosynthetic process	9	16	56.25	0.00023062068782475	0.0057857915418013	1	1	0.679856836158499	0.999913170749623	0.0544393608235747
down	AURKA; TTK; KIF11; KIZ; ASPM; AURKB; SPAG5; AUNIP; KNSTRN;	GO:0007051~spindle organization	9	16	56.25	0.00023062068782475	0.0057857915418013	1	1	0.679856836158499	0.999913170749623	0.0544393608235747
down	GBA; S100A8; S100A9; XBP1; PIK3CB; ARFIP2; TMBIM6; GABARAPL2; RAB1A; BECN1; IFI16; WIPI1; RAB12; ULK3; DRAM2; PIK3C3; RB1CC1; ATG4A; VTI1A; ATG4C; NRBF2; RNF185; TMEM208; TMEM59; TOLLIP; TBC1D14; CHMP2B; WDR45;	GO:0006914~autophagy	28	123	22.7642276422764	0.00023647384488401	0.0058894885949476	1	1	0.683497293644719	0.999913170749623	0.0554150615987906
down	PXDNL; RAD1; ENDOD1; TDP2; FEN1; G3BP1; TATDN3; TATDN1; DCLRE1A; RAD9B; APTX; FANCM; TSEN15; DDX1; EME1; HARBI1; RBBP8; TREX2; DCLRE1B; APEX2;	GO:0090305~nucleic acid phosphodiester bond hydrolysis	20	73	27.3972602739726	0.00023894937512414	0.00592958068922192	1	1	0.685067858480916	0.999913170749623	0.0557922939913861
up	TTC26; KIF3C; KIF3B; IFT88; TRIP11; TTC21B; IFT20; DYNC2H1; WDR19; TRAF3IP1; WDR60; IFT81; KIFAP3; CLUAP1; IFT43; IFT74; IFT140; IFT27; IFT22; IFT122; IFT57; KIF17; IFT80; WDR35; CEP131; SSX2IP; KIF3A; HSPB11;	GO:0035735~intraciliary transport involved in cilium assembly	28	40	70	0.00023970875333434	0.0527593119533933	1	1	0.884261910697782	0.999999997500836	0.510969401363977
down	HAX1; NRG2; ITGB1BP1; EREG; RAMP3; EGFR; TGFA; FGF1; MET; TXN; ERBB3; FGFR3; BTC; AKR1C3; PIK3CB; AKR1C2; RAC1; NRG1; MST1R; PTPN11; C1QBP; STK3; GAB1; IL18; FAM110C; TNFAIP8L3; EPGN; KLB; HBEGF; CCL19; GDF15; NOX4; HPSE; RICTOR;	GO:0051897~positive regulation of protein kinase B signaling	34	165	20.6060606060606	0.00028093703973342	0.00682318363522763	1	1	0.711340316173161	0.999913170749623	0.0642003351140479
down	EXOSC3; EXOSC5; EXOSC7; EXOSC8; EXOSC2; EXOSC6; EXOSC9;	GO:0034427~nuclear-transcribed mRNA catabolic process, exonucleolytic, 3'-5'	7	9	77.7777777777778	0.00028724507119481	0.00692725877680746	1	1	0.71530778165585	0.999913170749623	0.0651795933787632
down	DKC1; TCP1; CCT6A; CCT3; CCT8; CCT2; CCT7;	GO:1904871~positive regulation of protein localization to Cajal body	7	9	77.7777777777778	0.00028724507119481	0.00692725877680746	1	1	0.71530778165585	0.999913170749623	0.0651795933787632
down	HYKK; TK1; TOP1; CKB; CKMT1A; MAPK3; PIK3CB; AK2; ADK; MVK; COASY; PMVK; PPIP5K1; CLP1; ITPKC; SEPHS2; TOLLIP; PANK3; SHPK; AK3; ALK; DOLK; AK6; GK5;	GO:0016310~phosphorylation	24	99	24.2424242424242	0.00029192721131066	0.00701547182549725	1	1	0.718252940251428	0.999913170749623	0.0660096028860667
up	CTDSP2; TPP1; ASNA1; KDELR3; EXTL3; ERN1; WFS1; LMNA; SRPRA; PTPN1; SHC1; ADD1; SSR1; GSK3A; ATP6V0D1; ZBTB17; DNAJC3; DCTN1; PDIA5; CUL7; PPP2R5B; SYVN1; PARP16; ARFGAP1; EDEM1; TATDN2; MYDGF; KLHDC3; PREB; FKBP14; EXTL2; TLN1; HYOU1; ERN2;	GO:0036498~IRE1-mediated unfolded protein response	34	55	61.8181818181818	0.00030762534957984	0.0645583989443838	1	1	0.916303811863327	0.999999997500836	0.625242544686124
up	WNT7A; TBX3; LRP4; LRP5; GLI3; BMP4; BMPR1A; WNT5A; ECE1; ROR2; GNA12; TBX2; NOG; SMAD4; HDAC1; IHH; SHH; TWIST1; C2CD3; FREM2; OSR1; TRAF3IP1; LMBR1; HDAC2; CREBBP; TBC1D32; IFT140; LNPK; ALX4; TMEM231; IFT122; IMPAD1; B9D1; FLVCR1;	GO:0042733~embryonic digit morphogenesis	34	55	61.8181818181818	0.00030762534957984	0.0645583989443838	1	1	0.916303811863327	0.999999997500836	0.625242544686124
down	EIF6; RRP15; WDR12; MRPL1; SNU13; NSA2; RPF1; RSL1D1; MAK16;	GO:0000470~maturation of LSU-rRNA	9	17	52.9411764705882	0.00032421569233376	0.00746227215588165	1	1	0.738508027617067	0.999913170749623	0.070213612696333
