down	FABP4; CEBPA; LIG4; ID2; XRCC4;	GO:0071285~cellular response to lithium ion	5	14	35.7142857142857	0.0248432888223052	0.163751013163018	1	1	0.999913170749623	0.999913170749623	1
down	ARF6; RAC1; PIP5K1A; INPP5K; AIF1L;	GO:0097178~ruffle assembly	5	14	35.7142857142857	0.0248432888223052	0.163751013163018	1	1	0.999913170749623	0.999913170749623	1
down	CHUK; ASS1; GBA; FABP4; MAPK3; BRCA1; CEBPA; HYAL1; ASAH1; NFE2L2; ZFAND6; NPNT; TANK; INPP5K; SMPD3; PPARGC1A; CCL22; CCL17; CCL24; CCL19; CCL11;	GO:0071356~cellular response to tumor necrosis factor	21	125	16.8	0.0249740540285062	0.163751013163018	1	1	0.999913170749623	0.999913170749623	1
down	GLUL; SLC1A3; SLC6A9; SLC38A1;	GO:0001504~neurotransmitter uptake	4	9	44.4444444444444	0.0253671813353719	0.163751013163018	1	1	0.999913170749623	0.999913170749623	1
down	ILVBL; SLC27A2; SLC25A17; PEX13;	GO:0001561~fatty acid alpha-oxidation	4	9	44.4444444444444	0.0253671813353719	0.163751013163018	1	1	0.999913170749623	0.999913170749623	1
down	USP1; UBE2V2; SIRT7; PARG;	GO:0006282~regulation of DNA repair	4	9	44.4444444444444	0.0253671813353719	0.163751013163018	1	1	0.999913170749623	0.999913170749623	1
down	PLA2G4A; CYP2J2; CYP4F2; CYP4F22;	GO:0006690~icosanoid metabolic process	4	9	44.4444444444444	0.0253671813353719	0.163751013163018	1	1	0.999913170749623	0.999913170749623	1
down	ADAL; NT5C3A; NUDT5; REXO2;	GO:0009117~nucleotide metabolic process	4	9	44.4444444444444	0.0253671813353719	0.163751013163018	1	1	0.999913170749623	0.999913170749623	1
down	KLK8; CTSC; FIG4; EIF2AK3;	GO:0031642~negative regulation of myelination	4	9	44.4444444444444	0.0253671813353719	0.163751013163018	1	1	0.999913170749623	0.999913170749623	1
down	SREBF1; EIF2A; ARHGEF10L; INSIG2;	GO:0032933~SREBP signaling pathway	4	9	44.4444444444444	0.0253671813353719	0.163751013163018	1	1	0.999913170749623	0.999913170749623	1
down	RNF8; UBE2E1; CTR9; LEO1;	GO:0033523~histone H2B ubiquitination	4	9	44.4444444444444	0.0253671813353719	0.163751013163018	1	1	0.999913170749623	0.999913170749623	1
down	LIAS; AGXT; GRHPR; LIPT1;	GO:0034641~cellular nitrogen compound metabolic process	4	9	44.4444444444444	0.0253671813353719	0.163751013163018	1	1	0.999913170749623	0.999913170749623	1
down	SET; SDR16C5; NOC2L; BRCA1;	GO:0035067~negative regulation of histone acetylation	4	9	44.4444444444444	0.0253671813353719	0.163751013163018	1	1	0.999913170749623	0.999913170749623	1
down	PPP1R8; PPP1R11; ARPP19; ENSA;	GO:0035308~negative regulation of protein dephosphorylation	4	9	44.4444444444444	0.0253671813353719	0.163751013163018	1	1	0.999913170749623	0.999913170749623	1
down	HSPA5; XBP1; ATF6; DDIT3;	GO:0036500~ATF6-mediated unfolded protein response	4	9	44.4444444444444	0.0253671813353719	0.163751013163018	1	1	0.999913170749623	0.999913170749623	1
down	PIK3C2G; RAB5A; CDC42; EEA1;	GO:0039694~viral RNA genome replication	4	9	44.4444444444444	0.0253671813353719	0.163751013163018	1	1	0.999913170749623	0.999913170749623	1
down	AKR1B10; AKR1C3; AKR1C2; AKR1C1;	GO:0044597~daunorubicin metabolic process	4	9	44.4444444444444	0.0253671813353719	0.163751013163018	1	1	0.999913170749623	0.999913170749623	1
down	AKR1B10; AKR1C3; AKR1C2; AKR1C1;	GO:0044598~doxorubicin metabolic process	4	9	44.4444444444444	0.0253671813353719	0.163751013163018	1	1	0.999913170749623	0.999913170749623	1
down	CHMP2A; CHMP1B; CHMP2B; BECN1;	GO:0045324~late endosome to vacuole transport	4	9	44.4444444444444	0.0253671813353719	0.163751013163018	1	1	0.999913170749623	0.999913170749623	1
down	PDCD6IP; TSG101; VTA1; CHMP5;	GO:0046755~viral budding	4	9	44.4444444444444	0.0253671813353719	0.163751013163018	1	1	0.999913170749623	0.999913170749623	1
down	BRCA2; DONSON; TIPIN; TIMELESS;	GO:0048478~replication fork protection	4	9	44.4444444444444	0.0253671813353719	0.163751013163018	1	1	0.999913170749623	0.999913170749623	1
down	XRCC6; XRCC5; ELN; NPPC;	GO:0048660~regulation of smooth muscle cell proliferation	4	9	44.4444444444444	0.0253671813353719	0.163751013163018	1	1	0.999913170749623	0.999913170749623	1
down	PCSK6; ANGPTL8; GPIHBP1; PCSK5;	GO:0051004~regulation of lipoprotein lipase activity	4	9	44.4444444444444	0.0253671813353719	0.163751013163018	1	1	0.999913170749623	0.999913170749623	1
down	DDX3X; HMOX1; PPIF; CPEB2;	GO:0071243~cellular response to arsenic-containing substance	4	9	44.4444444444444	0.0253671813353719	0.163751013163018	1	1	0.999913170749623	0.999913170749623	1
down	RFC4; RFC2; RFC3; DSCC1;	GO:1900264~positive regulation of DNA-directed DNA polymerase activity	4	9	44.4444444444444	0.0253671813353719	0.163751013163018	1	1	0.999913170749623	0.999913170749623	1
down	GPR37; TXN; PYCR1; NFE2L2;	GO:1903206~negative regulation of hydrogen peroxide-induced cell death	4	9	44.4444444444444	0.0253671813353719	0.163751013163018	1	1	0.999913170749623	0.999913170749623	1
down	HMOX1; AGTR1; APLNR; FGFBP1;	GO:1903589~positive regulation of blood vessel endothelial cell proliferation involved in sprouting angiogenesis	4	9	44.4444444444444	0.0253671813353719	0.163751013163018	1	1	0.999913170749623	0.999913170749623	1
down	RPA2; RFWD3; FEM1B; WDR76;	GO:2000001~regulation of DNA damage checkpoint	4	9	44.4444444444444	0.0253671813353719	0.163751013163018	1	1	0.999913170749623	0.999913170749623	1
up	N4BP1; TP53; PARP1; TAF1; PIK3R1; POLD1; NEDD4; FMR1; BAX; EP300; ATR; NFATC4; PTPRK; BAK1; METTL3; CREBBP; ERCC4; BMF; NSMCE3; RHNO1; TMEM161A; EIF2AK4; POLK; ZBTB1;	GO:0034644~cellular response to UV	24	51	47.0588235294118	0.025466614174638	0.645457260535017	1	1	0.999999997500836	0.999999997500836	1
up	SOCS1; TNF; COL4A1; COL5A2; MMP2; CAPN2; GLRA1; DNMT1; MTOR; SESN2; COL16A1; LAMTOR4; HNRNPD; NTRK2; LAMTOR1; NSMF; RRAGA; RPTOR; SLC38A9; PDGFC; SH3BP4; LAMTOR2; DNMT3A; SESN1;	GO:0071230~cellular response to amino acid stimulus	24	51	47.0588235294118	0.025466614174638	0.645457260535017	1	1	0.999999997500836	0.999999997500836	1
up	SNAI2; TGFB1; FGFR2; TGFBR1; WNT5A; NOTCH1; LIMS1; SOX9; GSK3B; HMGA2; LOXL3; TGFB2; RBPJ; NOG; TRIM28; CUL7; HIF1A; DLG5; DDX17; LOXL2;	GO:0001837~epithelial to mesenchymal transition	20	40	50	0.0254919765811829	0.645457260535017	1	1	0.999999997500836	0.999999997500836	1
up	MBD3; ATF2; TAF1; PCGF2; MECP2; EP300; SRCAP; TAF1L; KAT6B; DPF1; DPF3; DPF2; CREBBP; KAT6A; KAT2A; RSF1; GTF3C4; MRGBP; MSL3; MSL3P1;	GO:0016573~histone acetylation	20	40	50	0.0254919765811829	0.645457260535017	1	1	0.999999997500836	0.999999997500836	1
up	PDLIM1; NPHP1; PIP5K1C; NPHP4; LRP6; NTN1; PAK4; PKHD1; SRC; CD44; CDH2; ITGA6; COL8A2; SHC1; CD200; SOX9; PPP1CA; RAPGEF1; SCRIB; FAT1; COL19A1; CNN3; COL13A1; KIRREL2; CBLL1; CDH24; NLGN2; DLG5; FBLIM1; NRCAM; VMP1; ELMO2; ROPN1B; TENM2; BAIAP2L1; CTNNA3; ICAM5; FNDC3A; F11R; CDH6; CDH11; LAMA3; ARVCF; LIMS1; CTNND2; LPP; CELSR1; CDH13; CELSR3; CDH3; FAT2; FAT4; COL16A1; DSG2; LAMA5; DLG4; FAT3; ICOS;	GO:0098609~cell-cell adhesion	58	152	38.1578947368421	0.0257821411685463	0.646195599248577	1	1	0.999999997500836	0.999999997500836	1
up	PRKAB2; ATG13; ULK1; ERN1; ATP6V1G2; CAPNS1; UCHL1; PRKACA; MTOR; MAPK8; NEDD4; ATP6V0D1; CDK5; LAMTOR4; PRKAA1; VPS26B; LAMTOR1; RRAGA; EXOC8; RPTOR; SLC38A9; EXOC4; ATP13A2; HDAC6; PRKAG2; UBQLN2; ATP6V1H; EXOC7; LAMTOR2; PRKAB1; ATP6V0A2;	GO:0016241~regulation of macroautophagy	31	71	43.6619718309859	0.0258506883121383	0.646195599248577	1	1	0.999999997500836	0.999999997500836	1
up	PLXNB2; SIPA1L1; GPR137B; TRAPPC6A; SBF1; SOD1; NF1; EPHA3; MTOR; VAV2; DYNLT1; FGD1; PTK2; NTRK2; ARHGAP44; TBC1D10B; DAB2IP; FGD5; FGD6; SBF2; BVES; AJUBA; RAB3GAP2; PYCARD; PLXNB1; CHN1; PLXNA3; PLXNA2; PLXNB3; ARHGAP12; PLXNA1;	GO:0043087~regulation of GTPase activity	31	71	43.6619718309859	0.0258506883121383	0.646195599248577	1	1	0.999999997500836	0.999999997500836	1
down	PRC1; ZNF207; TPPP; KIF20A; CLIP1; PLK1; MAPRE1; CDK5RAP2;	GO:0001578~microtubule bundle formation	8	32	25	0.0261778327052835	0.16819134727813	1	1	0.999913170749623	0.999913170749623	1
down	BRINP1; PENK; EIF4E; ADCYAP1; DRD4; BDNF; MAPK8IP2; VDAC3;	GO:0001662~behavioral fear response	8	32	25	0.0261778327052835	0.16819134727813	1	1	0.999913170749623	0.999913170749623	1
down	HMOX1; SCNN1B; SCNN1G; CLCN5; AMN; UGT1A7; ATP6V0A4; GRHPR;	GO:0007588~excretion	8	32	25	0.0261778327052835	0.16819134727813	1	1	0.999913170749623	0.999913170749623	1
down	TPPP; FAM107A; PAFAH1B1; EFNA5; PRKAA2; KIF18A; BICD2; MAP6D1;	GO:0070507~regulation of microtubule cytoskeleton organization	8	32	25	0.0261778327052835	0.16819134727813	1	1	0.999913170749623	0.999913170749623	1
down	DDX3X; PLRG1; EGFR; RDX; HYAL1; UBE2E2; ANXA1; CDC45;	GO:1900087~positive regulation of G1/S transition of mitotic cell cycle	8	32	25	0.0261778327052835	0.16819134727813	1	1	0.999913170749623	0.999913170749623	1
up	PIP5K1C; PIK3R1; PIK3CA; PI4KA; PIP4K2B; EFR3A; PIP5KL1; PIK3R6; TTC7B; IP6K1; PI4K2A; IMPAD1; IP6K2; PIKFYVE; SOCS2; PIK3C2A; TTC7A; PIK3R3; PI4KAP2; SOCS4; CISH; PIK3R2; SOCS7; PIK3CD; SOCS1;	GO:0046854~phosphatidylinositol phosphorylation	25	54	46.2962962962963	0.0262723195183406	0.647764533775226	1	1	0.999999997500836	0.999999997500836	1
up	AKT2; ABCD1; IRS1; CPT1A; PLIN5; PPARA; TWIST1; IRS2;	GO:0032000~positive regulation of fatty acid beta-oxidation	8	10	80	0.0263605220400537	0.647764533775226	1	1	0.999999997500836	0.999999997500836	1
up	DGKA; DGKQ; DGKZ; DGKE; DGKI; DGKH; DGKD; DGKK;	GO:0046486~glycerolipid metabolic process	8	10	80	0.0263605220400537	0.647764533775226	1	1	0.999999997500836	0.999999997500836	1
up	MECOM; EHMT2; SETD5; EHMT1; PRDM16; PRDM5; ASH1L; SETDB1;	GO:0051567~histone H3-K9 methylation	8	10	80	0.0263605220400537	0.647764533775226	1	1	0.999999997500836	0.999999997500836	1
up	MEN1; ROCK2; ENG; ROCK1; SMAD4; ZFHX3; FNDC4; MXRA5;	GO:0071559~response to transforming growth factor beta	8	10	80	0.0263605220400537	0.647764533775226	1	1	0.999999997500836	0.999999997500836	1
up	LRP4; EPHB2; NLGN2; NRXN2; NRXN1; NLGN4Y; NLGN4X; CEL;	GO:0097104~postsynaptic membrane assembly	8	10	80	0.0263605220400537	0.647764533775226	1	1	0.999999997500836	0.999999997500836	1
up	SH3PXD2B; BMPR1B; TBX3; MATN3; TLL1; SHOX2; ADAMTS4; PAPSS2; GDF11; PTH; IGF2; COL2A1; COL5A2; TRAPPC2; ACP2; VDR; PTHLH; BMP1; COL11A2; GNA11; TGFBR1; SOX9; CDH11; HDAC4; EVC; TGFB2; NKX3-2; SOX4; NOG; TCOF1; COL9A2; IHH; COL19A1; EXT1; RAI1; FGFRL1; CMKLR1; ALX4; TP63; ANKH; ASH1L; DLL3; CHD7; SUFU; JAG2; HSPB11; HOXA4; IMPAD1; HOXB4; MMP16; HOXC4; HAPLN3; MMP14;	GO:0001501~skeletal system development	53	137	38.6861313868613	0.0266612240891598	0.647764533775226	1	1	0.999999997500836	0.999999997500836	1
up	IGKV1-12; PSMB11; PSMD9; PIK3R2; MAP2K7; IKBKB; PDPK1; MAP3K7; LAT; NFATC1; BCL10; IGKV1D-16; IGKV1-5; IGKV3-20; IGKV3-15; IGLV1-47; IGLV1-40; IGLV2-14; IGLV2-23; IGLV2-11; IGLV2-8; IGLV3-19; IGLV3-1; IGHV1-46; IGHV3-13; IGHV3-7; IGHE; IGLV7-43; IGKV1-16; IGKV3-11; JUN; IGKV2-30; IGKV4-1; IGHV4-34; IGLC2; IGLC3; PPP3CB; PLCG1; IGHV1-2; PSMA2; PIK3R1; PSMB8; PSMB9; SHC1; PSMB10; PIK3CA; MAPK8; MAPK9; VAV2; LILRA4; RELA; PRKCQ; PSME1; SOS1; PPP3CA; NFATC3; PAK1; PSMD2; TAB1; PSMA8; CARD11; PSME2; TRAF6; IKBKG;	GO:0038095~Fc-epsilon receptor signaling pathway	64	171	37.4269005847953	0.0267381662131181	0.647764533775226	1	1	0.999999997500836	0.999999997500836	1
up	HIP1; PIK3C2A; BIN1; FCHO1; DVL2; HGS; GAK; ARPC5; SYNJ1; TGOLN2; PIP5K1C; VAMP4; STAM2; AP2A2; AP2A1; LDLR; CD3D; CLTA; CD3G; IGF2R; AREG; M6PR; SYT1; CBL; AVPR2; WNT5A; PRKCI; DNM2; AGFG1; CLTCL1; ARPC4; ACTB; AP2B1; DAB2; YWHAH; CLN3; SCARB2; CTTN; ITSN1; AAK1; CCDC88A; LDLRAP1; FNBP1L; LPCAT2; TBC1D1; STON2; ARPC1A; STAM; AP2M1; SLC2A8; FZD4; PACSIN2;	GO:0061024~membrane organization	52	134	38.8059701492537	0.0268137717639392	0.647764533775226	1	1	0.999999997500836	0.999999997500836	1
down	MTX2; SLC25A14; PSEN1; SLC25A46; SLC25A10; SLC25A13;	GO:0006839~mitochondrial transport	6	20	30	0.0269831410632999	0.171754212957752	1	1	0.999913170749623	0.999913170749623	1
down	CYP3A4; CYP2C9; CYP3A5; UGT1A1; HSD17B4; PLEKHA1;	GO:0008210~estrogen metabolic process	6	20	30	0.0269831410632999	0.171754212957752	1	1	0.999913170749623	0.999913170749623	1
down	HNRNPC; EXOSC10; PINX1; TINF2; NAT10; PIF1;	GO:0032211~negative regulation of telomere maintenance via telomerase	6	20	30	0.0269831410632999	0.171754212957752	1	1	0.999913170749623	0.999913170749623	1
down	SFN; YWHAE; ANP32B; XPO4; RBM22; GTSE1;	GO:0046827~positive regulation of protein export from nucleus	6	20	30	0.0269831410632999	0.171754212957752	1	1	0.999913170749623	0.999913170749623	1
down	FOXO3; SLC6A4; PAFAH1B1; PSEN1; FANCD2; MKKS;	GO:0048854~brain morphogenesis	6	20	30	0.0269831410632999	0.171754212957752	1	1	0.999913170749623	0.999913170749623	1
down	NUDT21; SHMT2; OXA1L; TRPM1; HOMER1; CUTC;	GO:0051262~protein tetramerization	6	20	30	0.0269831410632999	0.171754212957752	1	1	0.999913170749623	0.999913170749623	1
down	EGFR; HMOX1; ALOX12; ADCYAP1; NPPC; PPARD;	GO:0097755~positive regulation of blood vessel diameter	6	20	30	0.0269831410632999	0.171754212957752	1	1	0.999913170749623	0.999913170749623	1
up	ZFC3H1; DUSP11; RBMS1; RBM5; ATXN1; HNRNPU; PABPC4; HNRNPD; RBMS2; SETX; PABPN1; TRMT2A; M1AP; DDX54; DEDD2; DDX17; RBPMS; BICD1; LARP6; HNRNPUL1; XRN2; TFIP11; DDX20; ADAR; DROSHA; ADARB1;	GO:0006396~RNA processing	26	57	45.6140350877193	0.0269901889073011	0.647764533775226	1	1	0.999999997500836	0.999999997500836	1
up	PIK3R2; KCNH1; NTRK1; CSF1R; IGF1R; PTAFR; PIK3R1; IRS1; PIK3CA; GPR143; RHOA; NCS1; PLCH1; PITPNM2; IRS2; PIK3C2A; PI4KAP2; PLCB1; PLCB3; PLCB4; PLCD4; PIK3CD; PLCH2; PLCG1; PI4KA; PLCD3;	GO:0048015~phosphatidylinositol-mediated signaling	26	57	45.6140350877193	0.0269901889073011	0.647764533775226	1	1	0.999999997500836	0.999999997500836	1
down	DUSP14; RGS4; PPP2CA; GPS1; DUSP9; DUSP16; DUSP5;	GO:0000188~inactivation of MAPK activity	7	26	26.9230769230769	0.0271084833199511	0.171912965054023	1	1	0.999913170749623	0.999913170749623	1
down	C2CD2L; TRIAP1; PITPNB; TNFAIP8L3; OSBPL2; PRELID1; PRELID3B;	GO:0015914~phospholipid transport	7	26	26.9230769230769	0.0271084833199511	0.171912965054023	1	1	0.999913170749623	0.999913170749623	1
down	GBA; CALM1; CALM2; PPP2R5A; PPP1R7; CDCA2; SPPL3;	GO:0035307~positive regulation of protein dephosphorylation	7	26	26.9230769230769	0.0271084833199511	0.171912965054023	1	1	0.999913170749623	0.999913170749623	1
down	CLASP2; MET; TACSTD2; TJP1; CGNL1; INPP5K; ARHGAP28;	GO:0051497~negative regulation of stress fiber assembly	7	26	26.9230769230769	0.0271084833199511	0.171912965054023	1	1	0.999913170749623	0.999913170749623	1
up	KRIT1; HGS; SPRY2; ADGRB2; ADGRB3; ROCK2; PRL; PF4; THBS1; COL4A2; SPARC; ATF2; HOXA5; NF1; ATP2B4; GADD45A; PTPRM; PML; THBS2; SERPINF1; CCR2; GPR4; FASLG; MECP2; TGFB2; GTF2I; HSPG2; HHEX; ROCK1; AMOT; DAB2IP; VASH1; SPRED1; SULF1; FOXJ2; ADAMTS1; AGO1;	GO:0016525~negative regulation of angiogenesis	37	89	41.5730337078652	0.0273371015872323	0.652552464199493	1	1	0.999999997500836	0.999999997500836	1
up	KIF2A; DYNC1I1; KIF3C; KIF3B; SEC24D; AP2A2; AP2A1; HLA-DRA; CD74; HLA-DPB1; CTSD; CLTA; HLA-DOB; LAG3; HLA-DPA1; HLA-DMA; HLA-DMB; ACTR1B; CAPZB; DNM2; SEC13; ACTR1A; AP1S1; AP2B1; ARF1; KLC1; KIF5A; DCTN1; DYNC1H1; SEC23A; HLA-DRB5; KIFAP3; AP2M1; DCTN5; AP1M1; KLC2; CTSF; KIF3A; TRAF6; DYNC1LI1;	GO:0019886~antigen processing and presentation of exogenous peptide antigen via MHC class II	40	98	40.8163265306122	0.0276042889959921	0.652972298212938	1	1	0.999999997500836	0.999999997500836	1
up	BMPR1B; CLIC1; LRP3; LRP5; IL6R; GLI3; BMP4; MSX2; FBN2; BMPR1A; WNT7B; JAG1; ACVR1; ILK; ACVR2B; BMPR2; RUNX2; PRKD1; SMAD1; TMEM119; GNAS; FAM20C; CTHRC1; SMAD5; TP63; PDLIM7; SUCO;	GO:0045669~positive regulation of osteoblast differentiation	27	60	45	0.0276268355518862	0.652972298212938	1	1	0.999999997500836	0.999999997500836	1
up	TCIRG1; CARD11; TRAV2; IGKV3OR2-268; IGKV3-11; IGLV4-60; IGLV3-19; IGLV9-49; IGLV2-14; IGKV6-21; TRDV2; IGKV1-9; IGKV2D-29; IGLV4-69; IGLV2-23; IGKV1D-16; IGKV3-20; IGKV2-24; IGLV2-8; IGKV1-8; IGKV4-1; IGKV1-16; TRAV14DV4; IGLV2-11; TRDV1; IGKV1-27; IGKV1-12; IGLV1-40; TRAV38-2DV8; IGLV3-1; TRAV18; IGKV1-5; IGLV8-61; IGLV7-43; TRAV40; IGKV2-30; TRAV38-1; TRDV3; IGLV1-50; TRAV9-2; TRAV19; IGLV1-47; IGKV3-15;	GO:0002377~immunoglobulin production	43	107	40.1869158878505	0.0276413362053792	0.652972298212938	1	1	0.999999997500836	0.999999997500836	1
up	DVL2; TBX3; TBX1; JUN; ATF2; RYR1; BMPR1A; CRKL; NOTCH1; NEDD4; RBPJ; TBX2; NOG; ILK; BMPR2; FZD2; HES1; SIX1; HIF1A; ZFPM1; EYA1; FZD1;	GO:0003151~outflow tract morphogenesis	22	46	47.8260869565217	0.0278658077506624	0.654110075689377	1	1	0.999999997500836	0.999999997500836	1
up	BCL2L11; TNFRSF21; BCL10; CRKL; BAX; PKN1; BAK1;	GO:0001783~B cell apoptotic process	7	8	87.5	0.0279794425106493	0.654110075689377	1	1	0.999999997500836	0.999999997500836	1
up	PDLIM1; ARPC5; SLC9A1; GSK3B; NCKAP1L; DST; DLG5;	GO:0030011~maintenance of cell polarity	7	8	87.5	0.0279794425106493	0.654110075689377	1	1	0.999999997500836	0.999999997500836	1
up	DVL1; DVL2; WNT5A; DLG4; DVL3; FZD4; GRIP1;	GO:0150012~positive regulation of neuron projection arborization	7	8	87.5	0.0279794425106493	0.654110075689377	1	1	0.999999997500836	0.999999997500836	1
up	CDON; FUZ; GREM2; IFT122; ZNF281; MAB21L2;	GO:0010172~embryonic body morphogenesis	6	6	100	0.0287449659301748	0.657916585196702	1	1	0.999999997500836	0.999999997500836	1
up	ITGB1; ITGA5; CD40; CD40LG; TNIP2; RNF31;	GO:0023035~CD40 signaling pathway	6	6	100	0.0287449659301748	0.657916585196702	1	1	0.999999997500836	0.999999997500836	1
up	HRAS; KRAS; TH; LGALS1; NAPEPLD; ACO2;	GO:0035900~response to isolation stress	6	6	100	0.0287449659301748	0.657916585196702	1	1	0.999999997500836	0.999999997500836	1
up	ENG; EFNB2; CCBE1; PROX1; CCM2; HEG1;	GO:0048845~venous blood vessel morphogenesis	6	6	100	0.0287449659301748	0.657916585196702	1	1	0.999999997500836	0.999999997500836	1
up	BMP4; MSX1; MSX2; BMPR1A; ACVR1; NOG;	GO:0061312~BMP signaling pathway involved in heart development	6	6	100	0.0287449659301748	0.657916585196702	1	1	0.999999997500836	0.999999997500836	1
up	GPC6; GPC2; GPC1; GPC5; GPC3; GPC4;	GO:1905475~regulation of protein localization to membrane	6	6	100	0.0287449659301748	0.657916585196702	1	1	0.999999997500836	0.999999997500836	1
up	TRIM37; UBE4B; CNOT4; RAG1; TRIM21; RNF4; TRAF2; ERCC8; TRIM71; RNFT1; RNF187; RNF220; RNF213; TRIM68; KLHL24; LRSAM1; RNF19B; SH3RF1; DTX3L; DDB2; TRIM52; RNF183; UHRF2; RNF157; RNF122; BFAR; STUB1; TRAF6; RNF115; TRIM17;	GO:0051865~protein autoubiquitination	30	69	43.4782608695652	0.0291097090498665	0.657916585196702	1	1	0.999999997500836	0.999999997500836	1
down	ERBB3; PIK3CB; TYRO3; C1QBP; NYAP1; PREX2; PLEKHA1; PIK3C2G;	GO:0014065~phosphatidylinositol 3-kinase signaling	8	33	24.2424242424242	0.0300018994076221	0.181180564403234	1	1	0.999913170749623	0.999913170749623	1
down	AQP1; AQP5; PAX9; ID3; OSR2; AQP3; WNT10A; TUFT1;	GO:0042476~odontogenesis	8	33	24.2424242424242	0.0300018994076221	0.181180564403234	1	1	0.999913170749623	0.999913170749623	1
down	SLBP; CPSF2; CPSF3;	GO:0006398~mRNA 3'-end processing by stem-loop binding and cleavage	3	5	60	0.0300248124686335	0.181180564403234	1	1	0.999913170749623	0.999913170749623	1
down	GATC; YRDC; HSPA14;	GO:0006450~regulation of translational fidelity	3	5	60	0.0300248124686335	0.181180564403234	1	1	0.999913170749623	0.999913170749623	1
down	SHMT2; CBS; PSPH;	GO:0006563~L-serine metabolic process	3	5	60	0.0300248124686335	0.181180564403234	1	1	0.999913170749623	0.999913170749623	1
down	CYP3A4; STS; HSD11B1;	GO:0006706~steroid catabolic process	3	5	60	0.0300248124686335	0.181180564403234	1	1	0.999913170749623	0.999913170749623	1
down	ATP8B1; SLC22A3; TMEM30A;	GO:0006855~drug transmembrane transport	3	5	60	0.0300248124686335	0.181180564403234	1	1	0.999913170749623	0.999913170749623	1
down	PES1; NOLC1; RRN3;	GO:0007000~nucleolus organization	3	5	60	0.0300248124686335	0.181180564403234	1	1	0.999913170749623	0.999913170749623	1
down	MTHFD1; MTHFD2L; MTRR;	GO:0009086~methionine biosynthetic process	3	5	60	0.0300248124686335	0.181180564403234	1	1	0.999913170749623	0.999913170749623	1
down	HMOX1; ALOX12; ADCYAP1;	GO:0010656~negative regulation of muscle cell apoptotic process	3	5	60	0.0300248124686335	0.181180564403234	1	1	0.999913170749623	0.999913170749623	1
down	BMP2; WNT4; INSIG2;	GO:0010894~negative regulation of steroid biosynthetic process	3	5	60	0.0300248124686335	0.181180564403234	1	1	0.999913170749623	0.999913170749623	1
down	FOXC1; HEYL; HEY2;	GO:0014031~mesenchymal cell development	3	5	60	0.0300248124686335	0.181180564403234	1	1	0.999913170749623	0.999913170749623	1
down	AQP1; RHBG; RHCG;	GO:0015696~ammonium transport	3	5	60	0.0300248124686335	0.181180564403234	1	1	0.999913170749623	0.999913170749623	1
down	LRRC8D; LRRC8A; SLC6A1;	GO:0015734~taurine transport	3	5	60	0.0300248124686335	0.181180564403234	1	1	0.999913170749623	0.999913170749623	1
down	FNTB; PGGT1B; RABGGTB;	GO:0018342~protein prenylation	3	5	60	0.0300248124686335	0.181180564403234	1	1	0.999913170749623	0.999913170749623	1
down	MIF; PDXDC2P; UEVLD;	GO:0019752~carboxylic acid metabolic process	3	5	60	0.0300248124686335	0.181180564403234	1	1	0.999913170749623	0.999913170749623	1
down	RB1CC1; PIK3C3; TRAPPC8;	GO:0030242~autophagy of peroxisome	3	5	60	0.0300248124686335	0.181180564403234	1	1	0.999913170749623	0.999913170749623	1
down	VTA1; LEPROTL1; LEPROT;	GO:0032511~late endosome to vacuole transport via multivesicular body sorting pathway	3	5	60	0.0300248124686335	0.181180564403234	1	1	0.999913170749623	0.999913170749623	1
down	ATP8B1; PLD1; KLF5;	GO:0032534~regulation of microvillus assembly	3	5	60	0.0300248124686335	0.181180564403234	1	1	0.999913170749623	0.999913170749623	1
down	RNF8; UBE2A; UBE2B;	GO:0033522~histone H2A ubiquitination	3	5	60	0.0300248124686335	0.181180564403234	1	1	0.999913170749623	0.999913170749623	1
down	CBS; GLRX2; NUDT15;	GO:0042262~DNA protection	3	5	60	0.0300248124686335	0.181180564403234	1	1	0.999913170749623	0.999913170749623	1
down	SLC19A2; THTPA; SLC25A19;	GO:0042723~thiamine-containing compound metabolic process	3	5	60	0.0300248124686335	0.181180564403234	1	1	0.999913170749623	0.999913170749623	1
down	ABCD3; SLC27A4; SLC27A2;	GO:0042760~very long-chain fatty acid catabolic process	3	5	60	0.0300248124686335	0.181180564403234	1	1	0.999913170749623	0.999913170749623	1
down	SSB; TRNT1; ELAC2;	GO:0042780~tRNA 3'-end processing	3	5	60	0.0300248124686335	0.181180564403234	1	1	0.999913170749623	0.999913170749623	1
down	UBE2T; RNF6; UBE2D4;	GO:0044314~protein K27-linked ubiquitination	3	5	60	0.0300248124686335	0.181180564403234	1	1	0.999913170749623	0.999913170749623	1
down	SMC2; SGO1; NUF2;	GO:0045132~meiotic chromosome segregation	3	5	60	0.0300248124686335	0.181180564403234	1	1	0.999913170749623	0.999913170749623	1
down	ACADL; ACADVL; DGAT2;	GO:0046322~negative regulation of fatty acid oxidation	3	5	60	0.0300248124686335	0.181180564403234	1	1	0.999913170749623	0.999913170749623	1
down	ABHD12; MGLL; ABHD6;	GO:0046464~acylglycerol catabolic process	3	5	60	0.0300248124686335	0.181180564403234	1	1	0.999913170749623	0.999913170749623	1
down	DHFR; GART; GCH1;	GO:0046654~tetrahydrofolate biosynthetic process	3	5	60	0.0300248124686335	0.181180564403234	1	1	0.999913170749623	0.999913170749623	1
down	CD1A; CD1E; CD1B;	GO:0048006~antigen processing and presentation, endogenous lipid antigen via MHC class Ib	3	5	60	0.0300248124686335	0.181180564403234	1	1	0.999913170749623	0.999913170749623	1
down	PAFAH1B1; PLK1; NDEL1;	GO:0051081~nuclear envelope disassembly	3	5	60	0.0300248124686335	0.181180564403234	1	1	0.999913170749623	0.999913170749623	1
down	KRT16; PPARD; LTB4R2;	GO:0051546~keratinocyte migration	3	5	60	0.0300248124686335	0.181180564403234	1	1	0.999913170749623	0.999913170749623	1
down	WASL; ACTR3; ASPM;	GO:0051653~spindle localization	3	5	60	0.0300248124686335	0.181180564403234	1	1	0.999913170749623	0.999913170749623	1
down	SGO2; BUB1; BUB1B;	GO:0051754~meiotic sister chromatid cohesion, centromeric	3	5	60	0.0300248124686335	0.181180564403234	1	1	0.999913170749623	0.999913170749623	1
down	ABHD12; MGLL; ABHD6;	GO:0052651~monoacylglycerol catabolic process	3	5	60	0.0300248124686335	0.181180564403234	1	1	0.999913170749623	0.999913170749623	1
down	TRMT5; TRMT10C; TRMT61B;	GO:0070901~mitochondrial tRNA methylation	3	5	60	0.0300248124686335	0.181180564403234	1	1	0.999913170749623	0.999913170749623	1
down	TCF21; STAT1; WNT4;	GO:0072162~metanephric mesenchymal cell differentiation	3	5	60	0.0300248124686335	0.181180564403234	1	1	0.999913170749623	0.999913170749623	1
down	GTPBP2; LTN1; NEMF;	GO:0072344~rescue of stalled ribosome	3	5	60	0.0300248124686335	0.181180564403234	1	1	0.999913170749623	0.999913170749623	1
down	EIF3D; EIF3B; EIF3A;	GO:0075525~viral translational termination-reinitiation	3	5	60	0.0300248124686335	0.181180564403234	1	1	0.999913170749623	0.999913170749623	1
down	VPS4B; PDCD6IP; CHMP4C;	GO:0090611~ubiquitin-independent protein catabolic process via the multivesicular body sorting pathway	3	5	60	0.0300248124686335	0.181180564403234	1	1	0.999913170749623	0.999913170749623	1
down	DKC1; TCP1; CCT2;	GO:0090666~scaRNA localization to Cajal body	3	5	60	0.0300248124686335	0.181180564403234	1	1	0.999913170749623	0.999913170749623	1
down	HPGD; FOXF1; TFAP2B;	GO:0097070~ductus arteriosus closure	3	5	60	0.0300248124686335	0.181180564403234	1	1	0.999913170749623	0.999913170749623	1
down	GPSM2; MAPK15; SPAG5;	GO:1905832~positive regulation of spindle assembly	3	5	60	0.0300248124686335	0.181180564403234	1	1	0.999913170749623	0.999913170749623	1
down	CFAP73; NDEL1; PAFAH1B1;	GO:2000574~regulation of microtubule motor activity	3	5	60	0.0300248124686335	0.181180564403234	1	1	0.999913170749623	0.999913170749623	1
down	TRIAP1; DBI; PRELID1;	GO:2001140~positive regulation of phospholipid transport	3	5	60	0.0300248124686335	0.181180564403234	1	1	0.999913170749623	0.999913170749623	1
