down	SOX15; BMP4; SIRT2; LUC7L;	GO:0045843~negative regulation of striated muscle tissue development	4	5	80	0.02842430665304	0.172721998430176	1	1	1	1	1
down	ICAM1; CD81; GAS6; ACE2;	GO:0046813~receptor-mediated virion attachment to host cell	4	5	80	0.02842430665304	0.172721998430176	1	1	1	1	1
down	HOXA3; NKX3-2; SHH; GATA6;	GO:0048645~animal organ formation	4	5	80	0.02842430665304	0.172721998430176	1	1	1	1	1
down	WNT7A; SHH; MSI2; SETD2;	GO:0048864~stem cell development	4	5	80	0.02842430665304	0.172721998430176	1	1	1	1	1
down	TNF; CD40; TRAF2; TRAF6;	GO:0051023~regulation of immunoglobulin secretion	4	5	80	0.02842430665304	0.172721998430176	1	1	1	1	1
down	LRP4; APP; SHANK2; SHANK3;	GO:0051124~synaptic growth at neuromuscular junction	4	5	80	0.02842430665304	0.172721998430176	1	1	1	1	1
down	FOXE1; TBX1; COL11A2; TSHZ1;	GO:0060023~soft palate development	4	5	80	0.02842430665304	0.172721998430176	1	1	1	1	1
down	NFIB; TGM2; SHH; EDA;	GO:0060662~salivary gland cavitation	4	5	80	0.02842430665304	0.172721998430176	1	1	1	1	1
down	TNF; FGFR2; SHH; NKX3-1;	GO:0060664~epithelial cell proliferation involved in salivary gland morphogenesis	4	5	80	0.02842430665304	0.172721998430176	1	1	1	1	1
down	FZD5; HTRA1; E2F7; MAP3K4;	GO:0060718~chorionic trophoblast cell differentiation	4	5	80	0.02842430665304	0.172721998430176	1	1	1	1	1
down	NRP1; NRP2; SIX1; SIX4;	GO:0061551~trigeminal ganglion development	4	5	80	0.02842430665304	0.172721998430176	1	1	1	1	1
down	WNT9A; IHH; EXT1; OSR1;	GO:0072498~embryonic skeletal joint development	4	5	80	0.02842430665304	0.172721998430176	1	1	1	1	1
down	SLC15A4; SLC25A29; SLC38A5; SLC38A7;	GO:0089709~L-histidine transmembrane transport	4	5	80	0.02842430665304	0.172721998430176	1	1	1	1	1
down	PLA2G10; SREBF2; SHH; ABCA2;	GO:0090370~negative regulation of cholesterol efflux	4	5	80	0.02842430665304	0.172721998430176	1	1	1	1	1
down	PFAS; COL2A1; BMP5; SOX9;	GO:0097065~anterior head development	4	5	80	0.02842430665304	0.172721998430176	1	1	1	1	1
down	ADAM10; RPL18A; ADAM9; PTGR1;	GO:0097327~response to antineoplastic agent	4	5	80	0.02842430665304	0.172721998430176	1	1	1	1	1
down	ICAM1; FLNA; RAB13; ARID4B;	GO:0097368~establishment of Sertoli cell barrier	4	5	80	0.02842430665304	0.172721998430176	1	1	1	1	1
down	RAB29; ARL3; WDR19; GGA1;	GO:1903441~protein localization to ciliary membrane	4	5	80	0.02842430665304	0.172721998430176	1	1	1	1	1
down	ATM; TERF2; SMG6; RAD50;	GO:1904354~negative regulation of telomere capping	4	5	80	0.02842430665304	0.172721998430176	1	1	1	1	1
down	ENG; TGFBR2; TGFB2; ACVR1;	GO:1905007~positive regulation of epithelial to mesenchymal transition involved in endocardial cushion formation	4	5	80	0.02842430665304	0.172721998430176	1	1	1	1	1
down	WNT5A; CSNK1D; CSNK1E; SFRP1;	GO:2000052~positive regulation of non-canonical Wnt signaling pathway	4	5	80	0.02842430665304	0.172721998430176	1	1	1	1	1
down	NFATC1; BMP4; NOTCH1; TGFB2; JAG1; STRA6; ROBO1;	GO:0003184~pulmonary valve morphogenesis	7	15	46.6666666666667	0.0284408832866819	0.172721998430176	1	1	1	1	1
down	GNB5; ADCY6; RGS9; GSK3A; GSK3B; NCSTN; KLF16;	GO:0007212~dopamine receptor signaling pathway	7	15	46.6666666666667	0.0284408832866819	0.172721998430176	1	1	1	1	1
down	NFIB; FGF5; CDH2; DNER; KLF15; MMP24; METRN;	GO:0010001~glial cell differentiation	7	15	46.6666666666667	0.0284408832866819	0.172721998430176	1	1	1	1	1
down	ITGA5; VEGFA; MT3; ARNT; GRB10; HIF1A; PRKD2;	GO:0030949~positive regulation of vascular endothelial growth factor receptor signaling pathway	7	15	46.6666666666667	0.0284408832866819	0.172721998430176	1	1	1	1	1
down	ATF2; XPC; MDC1; NEK11; EME2; HUS1; MUS81;	GO:0031573~intra-S DNA damage checkpoint	7	15	46.6666666666667	0.0284408832866819	0.172721998430176	1	1	1	1	1
down	AXIN1; LATS1; ESR1; SRC; RUNX1; CBFB; CARM1;	GO:0033146~regulation of intracellular estrogen receptor signaling pathway	7	15	46.6666666666667	0.0284408832866819	0.172721998430176	1	1	1	1	1
down	KDM1A; PHF2; KDM4A; KDM4B; KDM4D; HSF4; KDM3B;	GO:0033169~histone H3-K9 demethylation	7	15	46.6666666666667	0.0284408832866819	0.172721998430176	1	1	1	1	1
down	CTNNB1; SOX18; TBX2; TRAF3IP1; FOXC2; IFT122; NDRG4;	GO:0035050~embryonic heart tube development	7	15	46.6666666666667	0.0284408832866819	0.172721998430176	1	1	1	1	1
down	EPHA3; MTMR2; PRKD1; LRSAM1; SNX33; PACSIN3; PACSIN2;	GO:0045806~negative regulation of endocytosis	7	15	46.6666666666667	0.0284408832866819	0.172721998430176	1	1	1	1	1
down	TNF; APOE; FURIN; ADAM9; SH3D19; SNX33; PACSIN3;	GO:0051044~positive regulation of membrane protein ectodomain proteolysis	7	15	46.6666666666667	0.0284408832866819	0.172721998430176	1	1	1	1	1
down	TP53; SRF; HOXB4; ERCC2; MLLT3; LMBR1L; SFRP1;	GO:0060218~hematopoietic stem cell differentiation	7	15	46.6666666666667	0.0284408832866819	0.172721998430176	1	1	1	1	1
down	ATP2B4; MTOR; GSK3B; MAPK7; FHL2; DYRK2; HOMER3;	GO:0070885~negative regulation of calcineurin-NFAT signaling cascade	7	15	46.6666666666667	0.0284408832866819	0.172721998430176	1	1	1	1	1
down	GLI3; DLG4; NLGN4X; NLGN4Y; SHANK3; CNTNAP2; SHANK2;	GO:0071625~vocalization behavior	7	15	46.6666666666667	0.0284408832866819	0.172721998430176	1	1	1	1	1
down	THBS1; NOTCH1; RHOA; MAP2K5; SPRED1; CARD10; STARD13;	GO:0090051~negative regulation of cell migration involved in sprouting angiogenesis	7	15	46.6666666666667	0.0284408832866819	0.172721998430176	1	1	1	1	1
down	NF1; GSK3B; ARC; NCSTN; SHANK3; YTHDF1; CYP46A1;	GO:1900271~regulation of long-term synaptic potentiation	7	15	46.6666666666667	0.0284408832866819	0.172721998430176	1	1	1	1	1
down	PDGFB; FGF2; SRC; FGFR4; DDX39B; PTK2B; PRKD2;	GO:2000573~positive regulation of DNA biosynthetic process	7	15	46.6666666666667	0.0284408832866819	0.172721998430176	1	1	1	1	1
up	CALM1; NOS3; GCH1; PPT1; PTS; PRKG2; MMADHC;	GO:0051186~cofactor metabolic process	7	11	63.6363636363636	0.0292179094535889	0.846496022620262	1	1	0.999999980296178	0.999999980296178	1
down	MSH4; DIAPH2; CGB7; TOB2; C17orf53; M1AP; USP9X; BCL2L10;	GO:0007292~female gamete generation	8	19	42.1052631578947	0.0300538128188946	0.179275920319267	1	1	1	1	1
down	WDR1; SRF; ACTN1; MYH9; EP300; ZFPM1; ZNF385A; CIB1;	GO:0030220~platelet formation	8	19	42.1052631578947	0.0300538128188946	0.179275920319267	1	1	1	1	1
down	TBX3; WT1; BMP5; CTNNB1; HOXD13; SHH; LGR4; ASB1;	GO:0030539~male genitalia development	8	19	42.1052631578947	0.0300538128188946	0.179275920319267	1	1	1	1	1
down	CYP26A1; CYP1A1; TYMS; RARA; GATA4; MAP1B; DNMT3B; DNMT3A;	GO:0033189~response to vitamin A	8	19	42.1052631578947	0.0300538128188946	0.179275920319267	1	1	1	1	1
down	B4GAT1; FKTN; LARGE1; TMTC4; TMTC3; LARGE2; FKRP; POMT2;	GO:0035269~protein O-linked mannosylation	8	19	42.1052631578947	0.0300538128188946	0.179275920319267	1	1	1	1	1
down	LATS1; APOE; HSP90AA1; GFAP; HCFC1; TRAF2; DAB2IP; NCLN;	GO:0043254~regulation of protein-containing complex assembly	8	19	42.1052631578947	0.0300538128188946	0.179275920319267	1	1	1	1	1
down	WDR91; SOCS2; SOCS7; SOCS1; PIK3R1; WDR81; SOCS4; PIK3R3;	GO:0043551~regulation of phosphatidylinositol 3-kinase activity	8	19	42.1052631578947	0.0300538128188946	0.179275920319267	1	1	1	1	1
down	PKD2; ODF2; CEP78; NECTIN2; MARK4; FAM161B; FAM161A; KIFAP3;	GO:0044782~cilium organization	8	19	42.1052631578947	0.0300538128188946	0.179275920319267	1	1	1	1	1
down	FGFR4; ASPH; TRIM32; FADD; BAK1; HDAC2; CLN6; BTRC;	GO:0045862~positive regulation of proteolysis	8	19	42.1052631578947	0.0300538128188946	0.179275920319267	1	1	1	1	1
down	MEN1; FYN; SRC; APEX1; MAP1B; MDM2; CAV1; ZFP36L1;	GO:0071375~cellular response to peptide hormone stimulus	8	19	42.1052631578947	0.0300538128188946	0.179275920319267	1	1	1	1	1
down	NRP1; ABL1; HRAS; CSF3; NTF3; CDK5; BCAS3; BAIAP2L1;	GO:2000251~positive regulation of actin cytoskeleton reorganization	8	19	42.1052631578947	0.0300538128188946	0.179275920319267	1	1	1	1	1
down	CCDC22; ARL3; DNM2; LLGL1; STEAP2; OSBPL5; EXOC5; EXOC8; EXOC4;	GO:0006893~Golgi to plasma membrane transport	9	23	39.1304347826087	0.0305723543382818	0.181254833968917	1	1	1	1	1
down	TERT; HSP90AA1; TERF1; RAD50; WRAP53; TNKS1BP1; SMG6; SMG5; TELO2;	GO:0007004~telomere maintenance via telomerase	9	23	39.1304347826087	0.0305723543382818	0.181254833968917	1	1	1	1	1
down	PIP5K1C; ENTPD5; IER3; PIP4K2B; PPP2R5B; PIP4K2C; CRNN; FBXL2; LIME1;	GO:0014066~regulation of phosphatidylinositol 3-kinase signaling	9	23	39.1304347826087	0.0305723543382818	0.181254833968917	1	1	1	1	1
down	PSAP; CTSL; RAB3B; RAB4A; RELB; RAB35; HFE; RAB8B; RAB34;	GO:0019882~antigen processing and presentation	9	23	39.1304347826087	0.0305723543382818	0.181254833968917	1	1	1	1	1
down	PLA2G6; MMP7; AKR1B1; PAM; ITGA3; MTOR; DSG2; IHH; APOL2;	GO:0060135~maternal process involved in female pregnancy	9	23	39.1304347826087	0.0305723543382818	0.181254833968917	1	1	1	1	1
down	APOE; MTOR; FMR1; ITSN1; DLG5; LPAR1; SHANK3; ZMYND8; SHANK2;	GO:0060999~positive regulation of dendritic spine development	9	23	39.1304347826087	0.0305723543382818	0.181254833968917	1	1	1	1	1
up	EGFR; RPS17; RPSA; MRPL3; RPL17; RPL22; GGT5; RPL26; RPS21; MRPS36; MRPS15; MRPS21; MRPS6; RPL24; CPEB4; MRPL51; RPL39P5; LARP4; CPEB2; MRPL55; MRPL10; MRPL41; GUF1; CPEB3; GEMIN5; COPS5; RPL36AL; RPL39L; MRPL13; CPEB1; MRPL37; MRPL18; PDF; FARSB; MRPS18A; MRPL35; MRPL36; MRPS33; MRPL11; MRPS16; MRPS18C; MRPS18B; MRPL42; EEF1A2; HBS1L; RSL24D1; MRRF; MRPL24; RPS4Y2; GSPT1; MRPS12; MRPL57;	GO:0006412~translation	52	175	29.7142857142857	0.0308922411827268	0.846496022620262	1	1	0.999999980296178	0.999999980296178	1
up	EIF6; RRP15; WDR12; MRPL1; SNU13; NSA2; RPF1; RSL1D1; MAK16;	GO:0000470~maturation of LSU-rRNA	9	17	52.9411764705882	0.0308960869705602	0.846496022620262	1	1	0.999999980296178	0.999999980296178	1
up	ALOX15B; PF4; APOB; LPL; PLA2G2A; CD36; PRKCH; AGTR1; IL18;	GO:0010744~positive regulation of macrophage derived foam cell differentiation	9	17	52.9411764705882	0.0308960869705602	0.846496022620262	1	1	0.999999980296178	0.999999980296178	1
up	PSMD11; PSMD12; PSMD14; DDX3X; SCEL; EGFR; JUP; PSMB1; PSMA1; PSMA3; PSMA4; PSMA5; PSMB6; PSMB5; PSMC2; USP8; PSMC4; PSMD8; PSMB3; PSMB2; PSMD7; PSMD4; PSME3; PSMC1; PSMC5; PSMC6; UBE2B; BAMBI; PSMD6; PSMD5; SFRP4; RSPO2; NRARP; PSMA8; PSMF1; SFRP2; USP47; PSMB7; TBL1XR1; GID8; GSKIP; PSMD13; RUVBL1; GPC5;	GO:0090263~positive regulation of canonical Wnt signaling pathway	44	144	30.5555555555556	0.03184899899617	0.846496022620262	1	1	0.999999980296178	0.999999980296178	1
up	APOA1; APOA2; IL10; ANGPT1; LILRB1;	GO:0002740~negative regulation of cytokine secretion involved in immune response	5	6	83.3333333333333	0.0322082128726872	0.846496022620262	1	1	0.999999980296178	0.999999980296178	1
up	APOA1; APOA2; METAP2; METAP1D; PDF;	GO:0018206~peptidyl-methionine modification	5	6	83.3333333333333	0.0322082128726872	0.846496022620262	1	1	0.999999980296178	0.999999980296178	1
up	CDK6; METTL14; ANXA1; GCM1; GCM2;	GO:0042063~gliogenesis	5	6	83.3333333333333	0.0322082128726872	0.846496022620262	1	1	0.999999980296178	0.999999980296178	1
up	NPM1; DHX29; EIF2A; NIP7; MRPL22;	GO:0042255~ribosome assembly	5	6	83.3333333333333	0.0322082128726872	0.846496022620262	1	1	0.999999980296178	0.999999980296178	1
up	EXOSC10; EXOSC9; EXOSC8; EXOSC3; EXOSC7;	GO:0071035~nuclear polyadenylation-dependent rRNA catabolic process	5	6	83.3333333333333	0.0322082128726872	0.846496022620262	1	1	0.999999980296178	0.999999980296178	1
up	EXOSC7; EXOSC9; EXOSC8; EXOSC3; EXOSC10;	GO:0071038~nuclear polyadenylation-dependent tRNA catabolic process	5	6	83.3333333333333	0.0322082128726872	0.846496022620262	1	1	0.999999980296178	0.999999980296178	1
down	TLR3; MAP3K7; PRDX4; IKBKE; DAB2IP; ERC1;	GO:0007252~I-kappaB phosphorylation	6	12	50	0.0332876581522332	0.194059491751304	1	1	1	1	1
down	CUTA; MT2A; MT3; SNCB; NEDD4L; TESMIN;	GO:0010038~response to metal ion	6	12	50	0.0332876581522332	0.194059491751304	1	1	1	1	1
down	RAG1; ATXN7L3; RNF20; CDC73; PAF1; UHRF1;	GO:0010390~histone monoubiquitination	6	12	50	0.0332876581522332	0.194059491751304	1	1	1	1	1
down	MYH10; RPGRIP1L; KDM2B; DNAH5; TSKU; NUMBL;	GO:0021670~lateral ventricle development	6	12	50	0.0332876581522332	0.194059491751304	1	1	1	1	1
down	DHRS3; CSF1; ACVR1; SIX2; INTU; LRP6;	GO:0030278~regulation of ossification	6	12	50	0.0332876581522332	0.194059491751304	1	1	1	1	1
down	RARA; NES; WDR19; TRAF3IP1; PPP1R13L; IFT140;	GO:0031076~embryonic camera-type eye development	6	12	50	0.0332876581522332	0.194059491751304	1	1	1	1	1
down	TERF2; SMG6; UPF1; SMG1; SMG5; YLPM1;	GO:0032204~regulation of telomere maintenance	6	12	50	0.0332876581522332	0.194059491751304	1	1	1	1	1
down	ADGRB2; NFATC1; PPP3CB; PPP3CA; NFAT5; NFATC4;	GO:0033173~calcineurin-NFAT signaling cascade	6	12	50	0.0332876581522332	0.194059491751304	1	1	1	1	1
down	DLG4; CDK5; NLGN2; MPP4; BSN; PCLO;	GO:0035418~protein localization to synapse	6	12	50	0.0332876581522332	0.194059491751304	1	1	1	1	1
down	VAMP4; STXBP1; STX4; STX1A; VAMP3; UVRAG;	GO:0035493~SNARE complex assembly	6	12	50	0.0332876581522332	0.194059491751304	1	1	1	1	1
down	CYP27B1; CYP1A1; VDR; CYP24A1; PIAS4; LGMN;	GO:0042359~vitamin D metabolic process	6	12	50	0.0332876581522332	0.194059491751304	1	1	1	1	1
down	SOCS1; PPP2R1A; NF2; CAV1; SH2B3; INPP5F;	GO:0042532~negative regulation of tyrosine phosphorylation of STAT protein	6	12	50	0.0332876581522332	0.194059491751304	1	1	1	1	1
down	SNAI2; GLI1; PRKACA; FGFR2; PTK2; REST;	GO:0045667~regulation of osteoblast differentiation	6	12	50	0.0332876581522332	0.194059491751304	1	1	1	1	1
down	SESN2; TSC1; SLC2A13; SLC2A8; SLC2A6; SLC2A10;	GO:0046323~glucose import	6	12	50	0.0332876581522332	0.194059491751304	1	1	1	1	1
down	SPTLC2; ACER2; ACER1; ABCA2; SPHK2; SPHK1;	GO:0046512~sphingosine biosynthetic process	6	12	50	0.0332876581522332	0.194059491751304	1	1	1	1	1
down	SPINK1; NTF3; PRKCZ; PRKCD; LRRK1; SFRP1;	GO:0050732~negative regulation of peptidyl-tyrosine phosphorylation	6	12	50	0.0332876581522332	0.194059491751304	1	1	1	1	1
down	F3; VEGFA; ITGA2; F2RL1; CDH13; SMAD3;	GO:0050927~positive regulation of positive chemotaxis	6	12	50	0.0332876581522332	0.194059491751304	1	1	1	1	1
down	IL33; RBP4; GPI; TNFSF4; STX4; VAMP3;	GO:0051024~positive regulation of immunoglobulin secretion	6	12	50	0.0332876581522332	0.194059491751304	1	1	1	1	1
down	CALM3; SRI; FKBP1A; FKBP1B; GSTO1; PKD2;	GO:0060315~negative regulation of ryanodine-sensitive calcium-release channel activity	6	12	50	0.0332876581522332	0.194059491751304	1	1	1	1	1
down	SOCS2; GHR; PIK3R1; STAT3; PXN; PTK2;	GO:0060396~growth hormone receptor signaling pathway	6	12	50	0.0332876581522332	0.194059491751304	1	1	1	1	1
down	ARID1A; FOSL1; NR2F2; PKD1; PKD2; RBM15;	GO:0060674~placenta blood vessel development	6	12	50	0.0332876581522332	0.194059491751304	1	1	1	1	1
down	MTSS1; SRC; TFPI2; PKD2; PTK2B; HAS2;	GO:0071498~cellular response to fluid shear stress	6	12	50	0.0332876581522332	0.194059491751304	1	1	1	1	1
down	KDM6A; SLITRK5; ABL1; HSPG2; NXN; SPEG;	GO:0072358~cardiovascular system development	6	12	50	0.0332876581522332	0.194059491751304	1	1	1	1	1
down	SPINT2; FBLN1; CRK; PIN1; FRMD5; SPOCK3;	GO:2000146~negative regulation of cell motility	6	12	50	0.0332876581522332	0.194059491751304	1	1	1	1	1
down	MGST3; GSTZ1; APOE; GPX4; SESN2; GSTO1; PRDX4; NNT; TXNRD1; NXN; IYD; KDM3B; TXNRD3; GPX8; CYGB; PXDN; TP53INP1; TXNDC17; TXNRD2; DUOX2; SESN1;	GO:0098869~cellular oxidant detoxification	21	77	27.2727272727273	0.0340102064922473	0.198007422197864	1	1	1	1	1
up	GPR89A; CETN3; ZW10; SNAP91; TOM1; RAMP3; VPS4B; SEC22B; MTX2; KIF20A; SFT2D2; SNAP29; CD3G; XBP1; BTF3; CETN2; SLC15A1; RABIF; CENPF; PSEN1; GDI2; PPT1; RAB38; GABARAPL2; LRP2; ANK2; SPIRE1; SELENBP1; MTM1; MTX1; COG2; RABEP1; DUOXA1; HIKESHI; AP1AR; EIF5AL1; RINT1; DENND1B; AAGAB; AFTPH; RAB11FIP1; GOLT1A; CCDC91; ATG4D; UEVLD; VPS52; ARRDC1; COMMD1; NECAP1; EXOC6; BICD2; SCFD2; PDCD6IP; SCFD1; ATG4A; TESC; CHMP4C; ATG4C; SEC22A; VPS50; JAKMIP1; ANKRD27; TSG101; NDC1; AKTIP; COG4; LIN7B; SENP2; VTA1; EXOC1; ARL8B; UBAP1; CHMP5; CNIH4; HOOK1; MYO5B; COG5; EXOC6B; STXBP5L; SNX24; ARFGEF2; SERP1; CHMP2B; CHMP1B; CHMP2A;	GO:0015031~protein transport	85	310	27.4193548387097	0.0344762064043078	0.846496022620262	1	1	0.999999980296178	0.999999980296178	1
down	ATP2A1; SLC2A10; ATP6V1G2; ATP2A2; SLC9A1; SLC9A3; CLCN4; UCP3; ATP2C1; NNT; SLC9A5; ATP6AP1L; TMCO3; COX15; OTOP3; SLC9B2; SLC15A4; SLC4A11; MFSD3; SLC46A1; SLC9A7; ATP6V0A4; SLC17A5; SLC2A9; SLC2A8; SLC2A6; ATP6V1H; SLC36A1; ATP1A1;	GO:1902600~proton transmembrane transport	29	116	25	0.0349199622719342	0.203016350378953	1	1	1	1	1
down	IGF2; GSK3A; MECP2; ARID4B; ZFP57; PRMT7; DNMT3A;	GO:0006349~regulation of gene expression by genetic imprinting	7	16	43.75	0.0359991151227708	0.206150998273546	1	1	1	1	1
down	AP4M1; AP2A1; RAB14; VPS13C; GBF1; VPS13A; KLHL20;	GO:0006895~Golgi to endosome transport	7	16	43.75	0.0359991151227708	0.206150998273546	1	1	1	1	1
down	PLXNB2; ID4; SHH; ARTN; FRS2; HHIP; DAGLA;	GO:0007405~neuroblast proliferation	7	16	43.75	0.0359991151227708	0.206150998273546	1	1	1	1	1
down	TARBP2; DGCR8; DDX17; KHSRP; DROSHA; AGO2; AGO1;	GO:0010586~miRNA metabolic process	7	16	43.75	0.0359991151227708	0.206150998273546	1	1	1	1	1
down	ADAM10; S100A7; WNT5A; ADAM17; TMEM102; WNK1; STK39;	GO:0010820~positive regulation of T cell chemotaxis	7	16	43.75	0.0359991151227708	0.206150998273546	1	1	1	1	1
down	TGFB1; HEXA; FGF2; CD44; SLC9A1; HYAL2; STAB2;	GO:0030214~hyaluronan catabolic process	7	16	43.75	0.0359991151227708	0.206150998273546	1	1	1	1	1
down	HSP90B1; VCP; SYVN1; NPLOC4; FAF2; DERL1; OS9;	GO:0030970~retrograde protein transport, ER to cytosol	7	16	43.75	0.0359991151227708	0.206150998273546	1	1	1	1	1
down	HSP90AA1; HSPA1A; HSPA1B; DNAJB2; UBXN2A; DAXX; FBXO2;	GO:0031396~regulation of protein ubiquitination	7	16	43.75	0.0359991151227708	0.206150998273546	1	1	1	1	1
down	NRP1; CREB1; GCLM; BCAR1; RELA; SIRT2; LGMN;	GO:0035729~cellular response to hepatocyte growth factor stimulus	7	16	43.75	0.0359991151227708	0.206150998273546	1	1	1	1	1
down	PPM1D; PPP5C; PPP1CA; PPP2CB; DUSP4; DUSP18; DUSP10;	GO:0035970~peptidyl-threonine dephosphorylation	7	16	43.75	0.0359991151227708	0.206150998273546	1	1	1	1	1
down	INHA; INHBA; BMP4; CDKN1A; CDKN2A; ANKLE2; PRKRIP1;	GO:0042326~negative regulation of phosphorylation	7	16	43.75	0.0359991151227708	0.206150998273546	1	1	1	1	1
down	"NAA40; EP400; DMAP1; RUVBL2; TRRAP; MSL3P1; MSL3;"	GO:0043968~histone H2A acetylation	7	16	43.75	0.0359991151227708	0.206150998273546	1	1	1	1	1
down	CYP27B1; VDR; NME2; NOTCH1; NUMA1; IL20; H2AFY2;	GO:0045618~positive regulation of keratinocyte differentiation	7	16	43.75	0.0359991151227708	0.206150998273546	1	1	1	1	1
down	C3; WNT5A; FZD2; SLC39A14; KLK6; TMOD2; KLK5;	GO:0045745~positive regulation of G protein-coupled receptor signaling pathway	7	16	43.75	0.0359991151227708	0.206150998273546	1	1	1	1	1
down	SYT7; STXBP1; CDK5; CDK5R2; STX1A; SYT4; CACNA1G;	GO:0045956~positive regulation of calcium ion-dependent exocytosis	7	16	43.75	0.0359991151227708	0.206150998273546	1	1	1	1	1
down	SYT7; STX1B; SYT8; SYT1; SYT3; RIMS4; SYT12;	GO:0048791~calcium ion-regulated exocytosis of neurotransmitter	7	16	43.75	0.0359991151227708	0.206150998273546	1	1	1	1	1
down	DMD; PRKACA; NOS1; FKBP1A; FKBP1B; JPH3; JPH4;	GO:0060314~regulation of ryanodine-sensitive calcium-release channel activity	7	16	43.75	0.0359991151227708	0.206150998273546	1	1	1	1	1
down	SLC6A2; DNAJB2; HAAO; PRKAA1; DCTN1; TAOK1; FGGY;	GO:0070050~neuron cellular homeostasis	7	16	43.75	0.0359991151227708	0.206150998273546	1	1	1	1	1
down	DPEP1; CDK2; MT3; CRK; DNM2; TRAF2; MTR;	GO:0071732~cellular response to nitric oxide	7	16	43.75	0.0359991151227708	0.206150998273546	1	1	1	1	1
down	SLC9A1; SLC9A3; SLC12A2; TRPM4; HCN2; SLC9A5; SLC9A7;	GO:0098719~sodium ion import across plasma membrane	7	16	43.75	0.0359991151227708	0.206150998273546	1	1	1	1	1
down	TGFB1; RB1; PARP1; HMGA2; TWIST1; TRIM6; TRAF6;	GO:2000679~positive regulation of transcription regulatory region DNA binding	7	16	43.75	0.0359991151227708	0.206150998273546	1	1	1	1	1
up	NDC80; XRCC2; ENSA; OFD1; JTB; RRM1; CDC25B; CLIP1; CETN2; CENPF; KIF11; ARPP19; SRSF2; IK; NOLC1; KIF18B; SKA3; SKA2; SKA1; MASTL; PBK; NUP88; RAB6C; TTYH1; AZI2; KIF15; NUDT15; CDC23; SMC3; USP16; USP3; TUBD1; TUBB2A; PLK4; TUBA4B; PLK2; TUBA4A; TUBGCP4; TUBE1; TUBGCP5; TUBA1C;	GO:0000278~mitotic cell cycle	41	134	30.5970149253731	0.0365903490072385	0.846496022620262	1	1	0.999999980296178	0.999999980296178	1
down	ENTPD5; APP; PFKFB1; ARNT; PRKAA1; HIF1A; PFKFB4; MLXIPL; SLC4A4;	GO:0045821~positive regulation of glycolytic process	9	24	37.5	0.0368902335872499	0.209982755746725	1	1	1	1	1
down	PABPC1; MTOR; YBX1; HNRNPU; ELAVL1; LARP1; TAF15; RBM24; MEIOC;	GO:0048255~mRNA stabilization	9	24	37.5	0.0368902335872499	0.209982755746725	1	1	1	1	1
down	CLDN3; HRAS; ITGB1; ACTG1; PRKCE; PTK2; KANK1; DUOX2; ARFGEF1;	GO:0090303~positive regulation of wound healing	9	24	37.5	0.0368902335872499	0.209982755746725	1	1	1	1	1
down	PDGFA; RAC3; TSGA10; QRICH2; CYFIP1; RHOQ; PARVA; RAC2;	GO:0030031~cell projection assembly	8	20	40	0.0369808173981979	0.209982755746725	1	1	1	1	1
down	SYNGR3; RAB3A; MYH9; TMED10; RAB11B; RAB11FIP2; STEAP2; RAB11FIP5;	GO:0045055~regulated exocytosis	8	20	40	0.0369808173981979	0.209982755746725	1	1	1	1	1
down	BAG3; TP53; PRKACA; GSK3B; EMD; MDM2; GAS6; TCF7L2;	GO:0046827~positive regulation of protein export from nucleus	8	20	40	0.0369808173981979	0.209982755746725	1	1	1	1	1
down	CDH2; FANCC; BBS4; BBS2; SHANK3; SPEF2; ZNF335; SHANK2;	GO:0048854~brain morphogenesis	8	20	40	0.0369808173981979	0.209982755746725	1	1	1	1	1
down	LYPLA1; HSP90AA1; AKT1; SPR; DNM2; CAV1; NOSTRIN; CYGB;	GO:0050999~regulation of nitric-oxide synthase activity	8	20	40	0.0369808173981979	0.209982755746725	1	1	1	1	1
down	EPCAM; AKT2; TRIM32; TWIST1; DUOXA2; DUOX2; PHPT1; CFAP20;	GO:2000147~positive regulation of cell motility	8	20	40	0.0369808173981979	0.209982755746725	1	1	1	1	1
down	SCN2B; UTRN; YWHAH; SCN1B; SCN4B; FXYD3; FXYD5; FXYD7;	GO:2000649~regulation of sodium ion transmembrane transporter activity	8	20	40	0.0369808173981979	0.209982755746725	1	1	1	1	1
up	SNU13; TAF9; NUFIP1; RUVBL1; PIH1D2; ZNHIT3;	GO:0000492~box C/D snoRNP assembly	6	9	66.6666666666667	0.0371815376561911	0.846496022620262	1	1	0.999999980296178	0.999999980296178	1
up	SASH1; LY86; BMP6; SCIMP; CD180; LY96;	GO:0031666~positive regulation of lipopolysaccharide-mediated signaling pathway	6	9	66.6666666666667	0.0371815376561911	0.846496022620262	1	1	0.999999980296178	0.999999980296178	1
up	EXOSC3; EXOSC5; EXOSC7; EXOSC8; EXOSC6; EXOSC9;	GO:0034427~nuclear-transcribed mRNA catabolic process, exonucleolytic, 3'-5'	6	9	66.6666666666667	0.0371815376561911	0.846496022620262	1	1	0.999999980296178	0.999999980296178	1
up	EXOSC10; EXOSC9; EXOSC5; EXOSC6; EXOSC7; EXOSC8;	GO:0071028~nuclear mRNA surveillance	6	9	66.6666666666667	0.0371815376561911	0.846496022620262	1	1	0.999999980296178	0.999999980296178	1
up	YOD1; UBAC2; SVIP; DERL3; DERL2; UBE2J1;	GO:1904153~negative regulation of retrograde protein transport, ER to cytosol	6	9	66.6666666666667	0.0371815376561911	0.846496022620262	1	1	0.999999980296178	0.999999980296178	1
up	DKC1; TCP1; CCT6A; CCT8; CCT2; CCT7;	GO:1904871~positive regulation of protein localization to Cajal body	6	9	66.6666666666667	0.0371815376561911	0.846496022620262	1	1	0.999999980296178	0.999999980296178	1
down	PDE2A; TLR3; IL33; LDLR; TNF; S100A8; SERPINE1; ITGA2; TNFRSF1A; MDK; TGM2; TNFSF4; ABCC1; IL15; WNT5A; HYAL2; TRADD; NAPEPLD; CDK19; GPRC5B; CD47;	GO:0050729~positive regulation of inflammatory response	21	78	26.9230769230769	0.0375661409983911	0.211366599761594	1	1	1	1	1
down	BMP4; PKN1; RRM2B; LGMN; PRKRIP1;	GO:0003014~renal system process	5	9	55.5555555555556	0.0382410657990746	0.211366599761594	1	1	1	1	1
down	YAP1; ACVR1; HES1; TEAD2; MEGF8;	GO:0003143~embryonic heart tube morphogenesis	5	9	55.5555555555556	0.0382410657990746	0.211366599761594	1	1	1	1	1
down	KMO; IDO1; HAAO; TDO2; AADAT;	GO:0006569~tryptophan catabolic process	5	9	55.5555555555556	0.0382410657990746	0.211366599761594	1	1	1	1	1
down	TLR3; PDPK1; SLC12A2; SST; PKN1;	GO:0006972~hyperosmotic response	5	9	55.5555555555556	0.0382410657990746	0.211366599761594	1	1	1	1	1
down	MAP3K9; MAP3K10; ERCC6; MAP3K12; MAP3K11;	GO:0007256~activation of JNKK activity	5	9	55.5555555555556	0.0382410657990746	0.211366599761594	1	1	1	1	1
down	AK1; NME2; AK4; AK7; AK8;	GO:0009142~nucleoside triphosphate biosynthetic process	5	9	55.5555555555556	0.0382410657990746	0.211366599761594	1	1	1	1	1
down	ARSB; GJA1; PAM; CLCN7; ASIC1;	GO:0009268~response to pH	5	9	55.5555555555556	0.0382410657990746	0.211366599761594	1	1	1	1	1
down	HMGN1; IVL; XPC; ERCC6; RELA;	GO:0010224~response to UV-B	5	9	55.5555555555556	0.0382410657990746	0.211366599761594	1	1	1	1	1
down	HOXA5; HDAC1; HIF1A; HDAC2; HDAC6;	GO:0010870~positive regulation of receptor biosynthetic process	5	9	55.5555555555556	0.0382410657990746	0.211366599761594	1	1	1	1	1
down	TNNT1; ATP2A2; TNNI1; PPP3CA; GTF2IRD2;	GO:0014883~transition between fast and slow fiber	5	9	55.5555555555556	0.0382410657990746	0.211366599761594	1	1	1	1	1
down	NRP1; NRP2; HOXB2; PLXNA3; SEMA3F;	GO:0021612~facial nerve structural organization	5	9	55.5555555555556	0.0382410657990746	0.211366599761594	1	1	1	1	1
down	CFL1; F2RL1; SEMA5A; CFL2; WDR1;	GO:0030836~positive regulation of actin filament depolymerization	5	9	55.5555555555556	0.0382410657990746	0.211366599761594	1	1	1	1	1
down	NOTO; YAP1; SOX9; TEAD2; COL2A1;	GO:0030903~notochord development	5	9	55.5555555555556	0.0382410657990746	0.211366599761594	1	1	1	1	1
down	ADAMTS3; SERPINH1; TRAM2; P3H3; P3H4;	GO:0032964~collagen biosynthetic process	5	9	55.5555555555556	0.0382410657990746	0.211366599761594	1	1	1	1	1
down	PLTP; PLEKHA3; GLTPD2; PLEKHA8P1; PLEKHA8;	GO:0035627~ceramide transport	5	9	55.5555555555556	0.0382410657990746	0.211366599761594	1	1	1	1	1
