down	CCNT2; CCNK; CDK4; GADD45A; CDKN1A; ACTB; CDK5R2; CDC37; CCNL2; SERTAD1; CCND1; CCNG1; CCNJL; CCNG2; CCND3; CCNB3; CCNI2; CCNJ; CNTD2; CCND2; CCNO; CCNI;	GO:0000079~regulation of cyclin-dependent protein serine/threonine kinase activity	22	55	40	0.00082889377593575	0.0160503976613015	1	1	0.879847578299729	1	0.154920639543997
down	OGG1; CLDN3; SOD1; GOT2; RBP4; TYMS; S100A8; ICAM1; FYN; TH; SPARC; CSF3; RARA; G6PD; EEF2; NQO1; FGFR2; CBL; CCND1; TNC; MAOB; ADH6; STAT3; CLDN18; RHOA; ACTC1; GRIN2A; PTK2B; SETDB1; BAK1; AACS; SDF4; DMAP1;	GO:0045471~response to ethanol	33	100	33	0.00084345152695153	0.0162243660459642	1	1	0.881484964282919	1	0.15659980625258
down	DVL2; LATS1; CD63; DMD; GJA1; WNT5A; ID4; WNT3A; MYO7A; ITSN1; DUOXA2; AMOT; LAMTOR1; RRAGA; EXOC8; CRACR2B; AJUBA; SCYL1; FRMD6; SIN3A; ARMCX3; LAMTOR2; GAS8;	GO:0034613~cellular protein localization	23	59	38.9830508474576	0.00084644243193632	0.0162461137540657	1	1	0.881903142418324	1	0.156809718113881
down	TLR3; IRAK2; MAP3K7; ROCK2; TIAF1; TNF; TNFRSF1A; AKT1; TRAF2; ROCK1; TRADD; TAB1; IRAK1BP1; TNIP2; RNF31; CARD11; NKIRAS2; HACD3; TRAF6; RIPK3; IKBKG; NFKB2; BCL10; RELA; RELB;	GO:0007249~I-kappaB kinase/NF-kappaB signaling	25	67	37.3134328358209	0.00085898069291645	0.0164158668310231	1	1	0.883287499631892	1	0.158448198094362
down	SLC22A23; SLC26A4; SLC24A1; SLC9A1; SLC9A3; SLC26A2; SLC12A2; CLDN15; PLP2; LASP1; SLC9A5; FXN; SLC5A12; SLC36A1; SLC26A11; SLC15A4; SLC5A5; TOMM40L; FXYD5; SLC9A7; SLC26A6; SLC26A1; SLC12A5; WNK1; SLC25A22; SLC17A5; SLC17A7; STEAP1; SLC24A2; SLC12A4; PLLP; SLC12A7;	GO:0006811~ion transport	32	96	33.3333333333333	0.00087354435916398	0.0165840497577805	1	1	0.884934585030596	1	0.160071522769766
up	PSMD11; PSMD12; PSMD14; CHUK; SEC22B; HLA-H; CD36; NCF2; PSMB1; PSMA1; PSMA3; PSMA4; PSMA5; PSMB6; PSMB5; PSMC2; PSMC4; PSMD8; PSMB3; PSMB2; PSMD7; PSMD4; PSME3; PSMC1; PSMC5; PSMC6; PSMD6; PSMD5; PSMA8; PSMF1; FCGR1B; PSMB7; PSMD13;	GO:0002479~antigen processing and presentation of exogenous peptide antigen via MHC class I, TAP-dependent	33	75	44	0.00089288027557099	0.166874624134348	1	1	0.999999980296178	0.999999980296178	1
down	DCTN1; ODF2; CROCC; CEP135; CEP68; CEP250; CNTLN; KIF3A; RTTN;	GO:0010457~centriole-centriole cohesion	9	11	81.8181818181818	0.00089965975526296	0.0168238300700459	1	1	0.887964178444542	1	0.162385915229697
down	KDM6B; KDM6A; ITGB1; INHBA; ITGB4; ITGA2; FGFR2; ITGA3; HMGA2;	GO:0048333~mesodermal cell differentiation	9	11	81.8181818181818	0.00089965975526296	0.0168238300700459	1	1	0.887964178444542	1	0.162385915229697
down	PLXNA2; COL2A1; FGFR2; SOX9; WNT3; SOX4; SHH; SEMA3C; ZNF219;	GO:0060174~limb bud formation	9	11	81.8181818181818	0.00089965975526296	0.0168238300700459	1	1	0.887964178444542	1	0.162385915229697
down	DAPK3; HTRA2; RET; INHBA; NF1; PPP2R1A; PPP2R1B; PPP1CA; SRPX;	GO:2001241~positive regulation of extrinsic apoptotic signaling pathway in absence of ligand	9	11	81.8181818181818	0.00089965975526296	0.0168238300700459	1	1	0.887964178444542	1	0.162385915229697
down	KDM4A; MT3; AKT1; STAT3; MTOR; GATA4; DAP; FOXK1; FOXK2; EIF4G1; PTK2; HERC1; KLHL22; RRAGA; SIRT2; BMF; MTMR9; RNF5; ZKSCAN3; WDR6;	GO:0010507~negative regulation of autophagy	20	48	41.6666666666667	0.00094207766159681	0.0175794107237714	1	1	0.892886468151161	1	0.169678883327581
down	CACNA1G; SLC24A1; SCN2B; SLC3A2; SCNN1G; SCNN1D; ASIC1; SCN1B; PKD2; SHROOM2; SLC4A8; ANO6; SLC9B2; SLC41A1; SCN4B; NALCN; SLC4A11; SCN2A; PKD2L1; HCN3; SLC17A7; SLC24A2; HCN2; TPCN1; SLC4A7; SLC4A4; SCN8A; SLC12A2;	GO:0035725~sodium ion transmembrane transport	28	80	35	0.00097672563109974	0.0177811759514204	1	1	0.896793326752778	1	0.171626348977014
down	PINLYP; PPP1R12A; OAZ2; APBA3; SCG5; ANXA5; ANXA4; IL7; NQO1; UGT1A1; SERPINB3; NOTCH1; NES; PRPSAP1; SNCB; CAND1; WDTC1; FAF2; ANP32E; PPP1R12C; UGT1A7;	GO:0043086~negative regulation of catalytic activity	21	52	40.3846153846154	0.00097732330890665	0.0177811759514204	1	1	0.896933079113114	1	0.171626348977014
down	NR5A2; ABHD2; RARA; NR2F1; THRA; VDR; BMP4; NR2C1; NR1D1; NR2F2; RXRB; HNF4A; RXRG; NR2C2; NR1H2; PPARA; HNF4G; NR0B2; PAQR7; NR2E1; NR2E3;	GO:0043401~steroid hormone mediated signaling pathway	21	52	40.3846153846154	0.00097732330890665	0.0177811759514204	1	1	0.896933079113114	1	0.171626348977014
down	NR5A2; SOX1; ABCD4; MRAS; SMAD7; BCAT2; PLA2G10; SPRY2; SMARCA5; NRP2; MSC; ADAM23; TFRC; ICAM1; CREB1; PML; SSTR1; RFX2; GCLM; VEGFC; UBXN2A; HNRNPU; PFKP; TLE4; PCOLCE; JARID2; PMM1; PRDM5; WDR35; KDM5B; FZD4; SBNO2;	GO:1990830~cellular response to leukemia inhibitory factor	32	97	32.9896907216495	0.00100539922852849	0.0181740441767838	1	1	0.900098174823262	1	0.175418366970223
down	PPM1D; FADS1; LAMP2; KRT20; MTOR; PPARA; SREBF2; KLF10; BMPR2; GAS6; CLEC16A; CADPS2; SFRP1; MFSD2A; PCSK9; TNRC6A; FBXO22; FLCN; USP33; EHMT2; GAS2L1; AMBRA1; ZFYVE1; WIPI2; RRAGA; RPTOR;	GO:0009267~cellular response to starvation	26	72	36.1111111111111	0.00100932227478989	0.0181740441767838	1	1	0.900543647805603	1	0.175418366970223
down	SMAD7; AXIN1; WFS1; BCL10; MAPK9; GSK3A; PTTG1IP; FKBP1A; UBE2L3; XIAP; CAV1; AMER1; NHLRC1; RNF111; HUWE1; RNF180; CHFR; NSMCE3; RCHY1; NDFIP1; DERL1; SPHK1; TBC1D7; STUB1; TRAF6; BIRC7;	GO:0031398~positive regulation of protein ubiquitination	26	72	36.1111111111111	0.00100932227478989	0.0181740441767838	1	1	0.900543647805603	1	0.175418366970223
down	KRIT1; BCAR3; CHM; CHML; YWHAQ; ARL3; VAV2; NUCB1; TNK2; ARHGAP1; ABR; RASGRF1; DOCK1; ITSN1; CCDC88A; ARHGEF18; DOCK4; ARHGAP18; RASGEF1A; DOCK6; DOCK7; SH2D3A; DOCK9; DOCK5; RGL1; HACD3; ARHGAP33; TIAM2; ARHGAP31;	GO:0007264~small GTPase mediated signal transduction	29	85	34.1176470588235	0.00110863372259717	0.0196383332645865	1	1	0.910490278992322	1	0.189551886073406
down	ROS1; STK39; MAP2K7; MAP2K5; TAOK2; PAK4; PAK6; NEK1; MINK1; MAP2K2; TAOK1; MAP4K3; STK25; MAP4K4; STK10; MAP4K5; MAP4K2; STRADA; MAP3K4; PAK2;	GO:0023014~signal transduction by protein phosphorylation	20	49	40.8163265306122	0.00115130602158064	0.020352946328874	1	1	0.914136981135032	1	0.196449429379317
down	ZFC3H1; DUSP11; HNRNPL; RBMS1; ATXN1; RBM6; RBM3; HNRNPU; PABPC4; RBMS2; PABPN1; M1AP; DDX54; DDX17; RBPMS; BICD1; LARP6; HNRNPUL1; TFIP11; ADAR; DROSHA; ADARB1;	GO:0006396~RNA processing	22	57	38.5964912280702	0.00120362933322171	0.0211488727693703	1	1	0.918639202604086	1	0.20413182054455
down	INSIG1; TBX1; SPRY2; COL2A1; TFAP2A; FGFR2; EPHB2; OTX1; GBX2; PRRX1; FOXG1; DLX5; DLX6; WNT3A; ABR; POU4F3; SIX1; FZD3; ATP8A2; CELSR1; CHD7; SIX4;	GO:0042472~inner ear morphogenesis	22	57	38.5964912280702	0.00120362933322171	0.0211488727693703	1	1	0.918639202604086	1	0.20413182054455
down	NME4; APOL1; APOD; PSAP; PLTP; VLDLR; HDLBP; LRP10; PDZD8; SLCO2A1; PLEKHA8; APOL4; APOL2; ESYT1; SPNS1; STOML1; CLN8; PCTP; CAV2; ABCA1; ABCA2; ABCA13; ABCA10; CAV1;	GO:0006869~lipid transport	24	65	36.9230769230769	0.00121115112404768	0.0211539655326168	1	1	0.919263703152191	1	0.20418097659388
down	CYP27B1; CYP1A1; S100A8; TH; SPARC; CNP; ADH5; ACP5; IDO1; ATP2A2; GJA1; FGFR2; COMT; UGT1A1; F2R; MAOB; GJB2; S100A7; CPS1; PRDX2; NOTCH1; MAPKAPK2; IRAK1; TIRAP; ADAM17; NFKB2; AKAP12; LOXL1; ABR; HNRNPA0; HDAC2; OTUD5; TIMP4; TRIM6; SRR; WDR35; DUSP10; NOS1; GGT1; NOS2; JUN;	GO:0032496~response to lipopolysaccharide	41	138	29.7101449275362	0.00121708136743615	0.0211881797848558	1	1	0.919873913417932	1	0.204511217248986
down	DLL1; TBX3; CCND1; YAP1; SOX9; CAV1; OSR1; SMO;	GO:0030857~negative regulation of epithelial cell differentiation	8	9	88.8888888888889	0.00122038869023045	0.0211881797848558	1	1	0.920173072433756	1	0.204511217248986
down	NEDD4; PRKCE; PCSK9; OSR1; NEDD4L; STK39; HECW2; HECW1;	GO:2000650~negative regulation of sodium ion transmembrane transporter activity	8	9	88.8888888888889	0.00122038869023045	0.0211881797848558	1	1	0.920173072433756	1	0.204511217248986
down	TLR3; BCL2L11; SOX15; FSTL3; ESR1; INHA; ERCC1; INHBA; WT1; KITLG; CBL; HOXA10; HOXA11; WNT5A; GATA4; CRKL; SOX9; MMP14; TGFB2; PRDX4; MAMLD1; SFRP1; GATA6; ZFP42; NKX3-1; RNF38; PATZ1; SIX4; BOK; BIK;	GO:0008584~male gonad development	30	90	33.3333333333333	0.00124228110443081	0.0215254779464172	1	1	0.921944450159416	1	0.207766865364926
down	EEF2K; CHP2; JUN; DPEP1; SYT1; ITPKB; ADD1; WNT5A; IQGAP1; HPCA; ADCY1; PRKAA1; PKD2; LCE1D; SLC25A24; CARF; ACER1; NCSTN; LGMN; CPNE7; SYT13; SYT12; CPNE2; SYT3; SYT7; SYT8; SYT4; CPNE8;	GO:0071277~cellular response to calcium ion	28	82	34.1463414634146	0.00132264554259809	0.0225159133011873	1	1	0.928862588131212	1	0.21732668324769
down	SPINT2; PAPLN; C3; GAPDH; APP; SERPINE1; FURIN; C4A; C4B; ANOS1; SERPINB3; AKT1; TFPI2; USP14; SPINK7; COL7A1; APLP2; SPOCK1; ROCK1; WFDC2; COL28A1; ITIH6; CD109; WFDC3; SPOCK3; LXN; UBE2O; CSTL1; UBE2Z; BIRC6; PCSK1N; HMSD; RECK; SERPINA12; TIMP4; SERPINB7; SERPINB4; TIMP3; SERPINE2; SERPINF2; SERPINB11; SERPINA9; SERPINH1;	GO:0010951~negative regulation of endopeptidase activity	43	148	29.0540540540541	0.00135336215569459	0.0228594565252777	1	1	0.931500773581651	1	0.220642609563671
down	TRIM37; RING1; DDB1; BCOR; RNF168; RYBP; KDM2B; DDB2; RNF2;	GO:0035518~histone H2A monoubiquitination	9	12	75	0.00137655828780647	0.0228594565252777	1	1	0.93346145826356	1	0.220642609563671
down	NFIB; NRP1; VEGFA; EPHB2; RYK; PTCH1; DAG1; FZD3; SMO;	GO:0071679~commissural neuron axon guidance	9	12	75	0.00137655828780647	0.0228594565252777	1	1	0.93346145826356	1	0.220642609563671
down	TNF; CSF2; SRC; MSN; MAPK9; RHOA; ARHGEF5; FSCN1; ASAP1;	GO:0071803~positive regulation of podosome assembly	9	12	75	0.00137655828780647	0.0228594565252777	1	1	0.93346145826356	1	0.220642609563671
down	TERT; TBX3; KDM1A; EPCAM; GJA1; HMGA2; HNRNPU; SIRT6; NR2E1;	GO:2000648~positive regulation of stem cell proliferation	9	12	75	0.00137655828780647	0.0228594565252777	1	1	0.93346145826356	1	0.220642609563671
down	MBTPS2; CREB3; STC2; PTPN1; CCND1; VCP; MBTPS1; CREB3L2; CREB3L4; CREB3L1; DERL1; FGF21; STUB1; TBL2; RNF121; ERN2; SYVN1; RHBDD2; CALR; WFS1;	GO:0030968~endoplasmic reticulum unfolded protein response	20	50	40	0.00139899541739463	0.0228594565252777	1	1	0.935489404855654	1	0.220642609563671
down	DLL1; EPN2; STAT3; PRKCI; NOTCH1; TGFB2; TSPAN5; JAG1; EP300; HES1; AAK1; NEPRO; MAML2; TSPAN14; MAML1; CREBBP; TP63; ZMIZ1; JAG2; RFNG;	GO:0045747~positive regulation of Notch signaling pathway	20	50	40	0.00139899541739463	0.0228594565252777	1	1	0.935489404855654	1	0.220642609563671
down	FGF2; F2R; FKBP1B; PKD2; ITPR2; RASA3; CHERP; TRPV1; TPCN2; MCOLN3; TPCN1; PLCH1; PLCG1; PLCD4; PLCB3; PLCB1; ITPR3; PLCD3; PLCB4; PLCH2;	GO:0051209~release of sequestered calcium ion into cytosol	20	50	40	0.00139899541739463	0.0228594565252777	1	1	0.935489404855654	1	0.220642609563671
down	WNT7A; DVL1; CASK; DGKI; SYP; CALM3; ADORA2B; CHRNA5; PFN2; GSK3B; BACE1; NCS1; APBA1; ADCY1; CHRNA6; APBA2; RIMS4; VPS18; GIT1; SNAPIN;	GO:2000300~regulation of synaptic vesicle exocytosis	20	50	40	0.00139899541739463	0.0228594565252777	1	1	0.935489404855654	1	0.220642609563671
down	MEN1; TERT; APP; CSF3; BMP4; TAF1; ADD1; WNT5A; GSK3B; WNT3A; FKBP1A; PKD1; CDK5; CAV1; LRP1; EP300; PIN1; HFE; CAPRIN2; USP33; CTHRC1; DERL1; HIPK2; TCF7L2; RFNG;	GO:0032092~positive regulation of protein binding	25	70	35.7142857142857	0.00141386098144192	0.0228594565252777	1	1	0.936739913343465	1	0.220642609563671
up	NDUFA4; NDUFAB1; NDUFS4; NDUFB5; NDUFB3; NDUFC1; NDUFA2; COQ9; NDUFB1; NDUFS3; NDUFB4; NDUFC2; NDUFB10; MT-ND2; MT-ND3; MT-ND4; DLD; NDUFV3; NDUFA6; NDUFA5; NDUFA9; NDUFA12; NDUFAF1; NDUFB9;	GO:0006120~mitochondrial electron transport, NADH to ubiquinone	24	49	48.9795918367347	0.00141919573268812	0.258439181885923	1	1	0.999999980296178	0.999999980296178	1
down	TRABD2B; BCL2L11; TGFB1; TNF; TFRC; CCK; RHOC; VEGFA; CDH5; GSK3B; VCP; TIRAP; BAX; BIK; PPP2R5B; BAK1; DAB2IP; SLF2; AJUBA; BMF; ICE1;	GO:0031334~positive regulation of protein-containing complex assembly	21	54	38.8888888888889	0.00142671263018168	0.0228594565252777	1	1	0.9378020439501	1	0.220642609563671
down	SIPA1L3; FSTL3; KRT75; TGFB1; TP53; INHBA; BMP4; EEF2; HOXB3; ADAR; HYAL2; REST; DACT2; WDR78; SFRP1; ZNF784; BVES; STON2; SIN3A; SSBP3; ACP6; PYGO1; PRRC2C; ARMC6;	GO:0002244~hematopoietic progenitor cell differentiation	24	66	36.3636363636364	0.00143182442680945	0.0228594565252777	1	1	0.938232113676435	1	0.220642609563671
down	DNM1L; SUV39H1; ROCK2; NFYA; KDM5C; HNF4A; MTOR; NKX2-1; MAPK8; MAPK9; SIK1; PRKDC; CDK5; NFKB2; PRKAA1; TWIST1; DDB1; CRTC1; CREBBP; USP9X; SIN3A; HES7; KDM5B; BTRC;	GO:0048511~rhythmic process	24	66	36.3636363636364	0.00143182442680945	0.0228594565252777	1	1	0.938232113676435	1	0.220642609563671
down	APP; RPLP1; ACO1; RPL10; AKT1; AKT2; MTPN; RPS14; RBM3; TCOF1; TSC1; GCN1; PIWIL1; QKI; ATXN2; RBM4B; PCIF1; CNOT6; CYFIP1; PTBP2; HNRNPL; PTBP1; PTBP3;	GO:0006417~regulation of translation	23	62	37.0967741935484	0.00144113981880956	0.0229661934993866	1	1	0.939101371215177	1	0.22167284947678
up	PSMD11; PSMD12; PSMD14; WNT9B; WNT11; WNT1; PSMB1; PSMA1; PSMA3; PSMA4; PSMA5; PSMB6; PSMB5; PSMC2; PSMC4; PSMD8; PSMB3; PSMB2; PSMD7; AP2S1; PSMD4; CDC42; PSME3; PSMC1; PSMC5; PSMC6; RAC1; TIAM1; PSMD6; PSMD5; PSMA8; PSMF1; PRICKLE1; PSMB7; PSMD13; DAAM1;	GO:0060071~Wnt signaling pathway, planar cell polarity pathway	36	88	40.9090909090909	0.0014982319173289	0.266011076921746	1	1	0.999999980296178	0.999999980296178	1
up	PSMD11; PSMD12; PSMD14; PSMB1; PSMA1; PSMA3; PSMA4; PSMA5; PSMB6; PSMB5; PSMC2; PSMC4; PSMD8; PSMB3; PSMB2; PSMD7; PSMD4; PSME3; PSMC1; PSMC5; PSMC6; RBX1; SKP1; PSMD6; PSMD5; PSMA8; PSMF1; FBXW7; PSMB7; FBXL15; FBXO9; FBXL5; PSMD13; NCCRP1; FBXO48; CUL5; SKP2; AMN1;	GO:0031146~SCF-dependent proteasomal ubiquitin-dependent protein catabolic process	38	95	40	0.00155683999962253	0.269675065300468	1	1	0.999999980296178	0.999999980296178	1
down	VSTM5; RBMX; GSDMD; KCNC4; TP53BP1; TNFAIP1; MPP2; ELAVL1; KCTD21; BEND3; RNF213; KCTD11; ATL3; KCTD18; KCTD8; ARC; KCTD17; KCTD13; NACC2; KCNS1; KCTD7; ALS2; KCNA7; PRMT1; KCTD14; KCNS3; EHD4; IKZF4; KCTD10; KCNF1; EHD1; KCNS2; ZBTB1;	GO:0051260~protein homooligomerization	33	105	31.4285714285714	0.00164336200959136	0.0257656740211156	1	1	0.956436689582174	1	0.248693819422147
down	MEN1; PLPP3; CTDSP2; LRP6; TGFB1; FBLN1; EPHB2; MTOR; CRKL; PPP5C; SIRPA; PRKDC; NNT; ZC3H12A; PIP5KL1; DAB2IP; PRR5L; PAQR3; CD109; TRAF3IP1; MICAL1; CACTIN; MYADM; CIB1; CTDSP1;	GO:0001933~negative regulation of protein phosphorylation	25	71	35.2112676056338	0.00165706787397568	0.0258413816846958	1	1	0.957487676770238	1	0.249424560174353
down	MYO1C; BIN1; NCK2; FCHSD2; BAG4; ICAM1; PFN1; CSF3; PFN2; MTOR; VASP; RHOA; PRKCE; CTTN; PTK2B; CARMIL1; CDC42EP5; BAIAP2L1; CCL26; CDC42EP4;	GO:0030838~positive regulation of actin filament polymerization	20	51	39.2156862745098	0.00169063202236108	0.0262243151887732	1	1	0.95981616502686	1	0.25312068687516
down	SOCS1; TNF; COL4A1; COL5A2; MMP2; CAPN2; DNMT1; MTOR; SESN2; COL16A1; LAMTOR1; NSMF; RRAGA; RPTOR; SLC38A9; PDGFC; SH3BP4; LAMTOR2; DNMT3A; SESN1;	GO:0071230~cellular response to amino acid stimulus	20	51	39.2156862745098	0.00169063202236108	0.0262243151887732	1	1	0.95981616502686	1	0.25312068687516
down	WTIP; HOXC6; APEX1; YAP1; ZNF85; TOB2; NPAT; SF1; BEND6; CDYL2; DDX54; ZNF653; ZNF274; TONSL; TLE6; CENPJ; RCOR3; RERE; ZMYND8; RUVBL2;	GO:1903507~negative regulation of nucleic acid-templated transcription	20	51	39.2156862745098	0.00169063202236108	0.0262243151887732	1	1	0.95981616502686	1	0.25312068687516
down	TMEM189; LYPLA1; SGPL1; C3; CYP1A1; TH; GGT1; FASN; UCP3; MSMO1; ACSF3; GPAT4; AACS; ACOT11; ACSF2; CROT; CRYL1; MORC2; CPT1A; ACOT2; ACOT7; CPT1B; PPARA;	GO:0006631~fatty acid metabolic process	23	63	36.5079365079365	0.00170613014320153	0.0264177917386152	1	1	0.960773956147803	1	0.254988149069605
down	PDE2A; PPP1R12A; TLR3; TFRC; MT2A; TP53; QDPR; FBP1; PPP3CB; DPEP1; MT3; CERS1; CAD; PDE4A; NOS2; PPP3CA; REST; GAS6; ACER2; PPP1R14A; NKX3-1; FGF21;	GO:0035690~cellular response to drug	22	59	37.2881355932203	0.00171510138223741	0.0265096997718217	1	1	0.961502540635933	1	0.25587525801133
down	KDM6B; PRKAB2; KDM1A; CNOT3; IGF1R; THRA; VEGFA; GJA1; ACHE; CPT2; IL4R; G0S2; STAT6; GPR3; MFAP2; HSF1; CAV1; GRB10; DYNC1H1; HADH; GNAS; SIRT6; ALMS1; ZNF516; BSCL2; EHMT1; PRDM16; PDGFC; FGF21; YBX2; PRKAB1;	GO:0120162~positive regulation of cold-induced thermogenesis	31	97	31.9587628865979	0.00180131551523999	0.0275980498150716	1	1	0.967398678067656	1	0.26638016189633
down	FSTL3; COL5A2; SPARC; THRA; BMP1; NPR2; BMP5; SOX9; SLC26A2; STC1; CDH11; RUNX2; TWIST1; EXT1; BMP8A; EXT2; FOXC2; SOST; TWSG1; ATP6V0A4; PDLIM7; SUCO; MINPP1; TRAF6; ACP5; RUNX1;	GO:0001503~ossification	26	76	34.2105263157895	0.00188518070338961	0.028483188724397	1	1	0.973312020452491	1	0.27492364404622
down	NME4; NME2P1; NME6; NME2; NME3; NME9; NME7; CAD;	GO:0006228~UTP biosynthetic process	8	10	80	0.00192394886745229	0.0287702833209945	1	1	0.976019891524998	1	0.277694720467695
down	TNRC6A; AGO3; AGO2; AGO1; TNRC6B; MOV10; MOV10L1; HELZ;	GO:0035194~posttranscriptional gene silencing by RNA	8	10	80	0.00192394886745229	0.0287702833209945	1	1	0.976019891524998	1	0.277694720467695
down	MEN1; ROCK2; ENG; ROCK1; SMAD4; ZFHX3; FNDC4; MXRA5;	GO:0071559~response to transforming growth factor beta	8	10	80	0.00192394886745229	0.0287702833209945	1	1	0.976019891524998	1	0.277694720467695
down	NCOR1; TGFB1; TNF; ESR1; TP53; PPP3CA; ZC3H12A; NCOR2;	GO:1903799~negative regulation of production of miRNAs involved in gene silencing by miRNA	8	10	80	0.00192394886745229	0.0287702833209945	1	1	0.976019891524998	1	0.277694720467695
down	DVL1; SOCS1; PDPK1; LRP6; RB1; TRIM27; NF1; AKT1; NF2; TSC2; GMFB; PAK2; TARBP2; PKN1; SPRED1; SMCR8; PYDC1; TRIB2; AKT1S1; CAMK2N2; WNK1; SMYD3; PRKRIP1; PRKAG2; UBASH3B;	GO:0006469~negative regulation of protein kinase activity	25	72	34.7222222222222	0.00193525096250158	0.02888982334278	1	1	0.97694741517972	1	0.278848537152919
down	PDPK1; DGKI; F8; FYN; SRF; ACTN1; SRC; PRKCA; ADRA2C; FLNA; DGKA; F2R; CD40; PIK3R1; GNA11; DGKE; VAV2; DGKQ; RAP2B; GNB1; PRKCE; GNA12; PRKCQ; PRKCD; DGKZ; GNA13; ITPR2; ITPR3; ADAMTS13; DGKH; PDPN; AXL;	GO:0030168~platelet activation	32	102	31.3725490196078	0.00195833031954262	0.0289866079331622	1	1	0.97852204836099	1	0.279782715293326
down	MEIOC; APBB1; TP53; PARP1; RAD52; LIG3; VCP; PRKDC; MTA1; GGN; RNF168; RAD50; CIB1; BRIP1; TNKS1BP1; TDP1; BABAM1; MAD2L2; PARP3; PARP2; ACTR8; RAD21L1; EME2;	GO:0006302~double-strand break repair	23	64	35.9375	0.00201159443734455	0.029263781883219	1	1	0.98211852557931	1	0.282458036273769
down	SEC16A; PDCD6; SEC24D; SEC31A; SEC24A; F8; CD59; FOLR1; AREG; TRAPPC10; CSNK1D; LMAN1; TMED10; SEC24C; SEC13; COL7A1; SEC23A; MCFD2; GORASP1; RAB1B; CTSZ; PPP6R1; TRAPPC1;	GO:0048208~COPII vesicle coating	23	64	35.9375	0.00201159443734455	0.029263781883219	1	1	0.98211852557931	1	0.282458036273769
down	MEN1; ICAM1; TH; LGALS1; SRF; PRKACA; NME2; GATA4; GCLM; POLG; SOX4; PPP3CA; PRKAA1; GAS6; SLC39A14; AACS; CPB2; SIN3A; FGF21; WDR35; ZNF236; IGF1R;	GO:0071333~cellular response to glucose stimulus	22	60	36.6666666666667	0.0020336096639384	0.029263781883219	1	1	0.983816467173378	1	0.282458036273769
down	BMP4; BMPR1A; GATA4; ISL1; TGFB2; JAG1; SOX4; PPP1R13L; SEMA3C;	GO:0003215~cardiac right ventricle morphogenesis	9	13	69.2307692307692	0.00203737311175967	0.029263781883219	1	1	0.984051212979919	1	0.282458036273769
down	KRT6B; STX2; CTNNB1; NF2; BMPR1A; ZBTB17; SHH; SMURF1; VAX2;	GO:0007398~ectoderm development	9	13	69.2307692307692	0.00203737311175967	0.029263781883219	1	1	0.984051212979919	1	0.282458036273769
down	GIGYF1; IGF1R; GHR; IGF2R; PIK3R1; AKT1; IRS1; TSC2; PLCB1;	GO:0048009~insulin-like growth factor receptor signaling pathway	9	13	69.2307692307692	0.00203737311175967	0.029263781883219	1	1	0.984051212979919	1	0.282458036273769
down	NF1; CTNNB1; NOTCH1; ID4; DLX1; DLX2; HES1; TMEM98; DUSP10;	GO:0048715~negative regulation of oligodendrocyte differentiation	9	13	69.2307692307692	0.00203737311175967	0.029263781883219	1	1	0.984051212979919	1	0.282458036273769
down	EDNRA; LHX1; MMP14; DLX6; IL11RA; STRA6; MKS1; FLRT3; SSBP3;	GO:0060322~head development	9	13	69.2307692307692	0.00203737311175967	0.029263781883219	1	1	0.984051212979919	1	0.282458036273769
down	JUN; TFAP2A; INHBA; SRF; SOS1; HDAC1; TWIST1; HDAC2; STRA6;	GO:0061029~eyelid development in camera-type eye	9	13	69.2307692307692	0.00203737311175967	0.029263781883219	1	1	0.984051212979919	1	0.282458036273769
down	TERT; CHEK1; TP53; SERPINE1; CDKN1A; CDKN2A; PLA2R1; ATM; ATR;	GO:0090399~replicative senescence	9	13	69.2307692307692	0.00203737311175967	0.029263781883219	1	1	0.984051212979919	1	0.282458036273769
down	MEN1; PPP1R12A; TADA3; RECQL5; ABL1; CDK11B; CCNO; ERF; NEK3; PPP5C; CLTCL1; GEM; CDH13; CLTC; DCTN1; PPP2R2D; PBRM1; PHF13; DIS3L2; CENPT; RNF2; CEP250; PRDM5; FBXL7; DNMT3A; TUBA1B; TUBAL3; TUBB6; PLK3; TUBB8; TUBG2; TUBB3; TUBA1A; DYNC1H1; TUBG1; TUBGCP2; TUBB; TUBGCP6; CDC14B;	GO:0000278~mitotic cell cycle	39	134	29.1044776119403	0.00213710675196555	0.0304459270227	1	1	0.990797982646057	1	0.293868263291619
down	KRIT1; P4HB; PDIA4; RAC2; NQO1; APEX1; NOS1; PDIA3; NOS2; PDIA2; NNT; PDIA5; PDIA6; NXN; QSOX2; TXNRD3; NME9; ERO1B; NHLRC2; TXNDC15; EGLN2; TXNRD2; DNAJC16; PRDX4; PRDX2; TXNRD1;	GO:0045454~cell redox homeostasis	26	77	33.7662337662338	0.00218568138021158	0.0309918904331908	1	1	0.992701220899828	1	0.299137977008731
down	WNT7A; SOCS2; ARPC1B; OGG1; RGS9; MBD3; TGFB1; ESR1; TH; RARA; EEF2; AREG; NQO1; GJA1; PAM; CCND1; NR2F2; CALR; GJB2; CTNNB1; GPX4; STAT3; MAP1B; MMP15; STXBP1; PTCH1; IHH; POSTN; DNMT3B; NCOR2; DNMT3A; GGT1;	GO:0032355~response to estradiol	32	103	31.0679611650485	0.00222220131340756	0.0314529725607588	1	1	0.994135970445325	1	0.303588404941577
down	BCL10; ITSN1; DSTYK; MOB1B; PIFO; GCN1; RAD50; ERBB4; RET; VAC14; FLT4; ERBB2; ROS1; EPHA8; FGFR2; DDR1; RYK; ROR1; EPHA3; EPHB4; EPHA2; IGF1R; AXL; EPHB2; FGFR4;	GO:0033674~positive regulation of kinase activity	25	73	34.2465753424658	0.00225234982832523	0.0317766899043041	1	1	0.995316550635421	1	0.306712969139412
down	EME2; REV3L; DXO; RAG1; POLG; GEN1; SETMAR; ZRANB3; PGAP1; N4BP2; PLD3; REXO1; PLD6; MEIOB; EXD3; ANKLE1; EXD1; TATDN2; HMCES; PNKP; PELO; ZC3H12C; EXO5; TDP1; RAD50;	GO:0090305~nucleic acid phosphodiester bond hydrolysis	25	73	34.2465753424658	0.00225234982832523	0.0317766899043041	1	1	0.995316550635421	1	0.306712969139412
down	RBFOX2; HNRNPL; PTBP1; RBMX; RBM10; HNRNPU; FMR1; KHDRBS1; REST; DYRK1A; RNPS1; CELF5; RBM15B; DDX17; RBM15; RBM24; RBM4B; SRSF9; SRSF10; RBM19; FXR2; FXR1; CELF1; RBM7;	GO:0000381~regulation of alternative mRNA splicing, via spliceosome	24	69	34.7826086956522	0.00231195764499925	0.0324603313726342	1	1	0.997137156087469	1	0.313311570353378
down	TRIM37; UBE4B; CNOT4; RAG1; MDM2; TRAF2; RNFT1; RNF187; RNF213; TRIM68; KLHL24; LRSAM1; SH3RF1; SH3RF2; DDB2; TRIM52; RNF183; UHRF2; UHRF1; RNF122; BFAR; STUB1; TRAF6; RNF115;	GO:0051865~protein autoubiquitination	24	69	34.7826086956522	0.00231195764499925	0.0324603313726342	1	1	0.997137156087469	1	0.313311570353378
down	TYMS; FAM86B2; PNMT; COMT; NNMT; PRDM15; GSTO1; MAT1A; PRDM2; GAMT; GNMT; SPOUT1; SMYD5; SMYD4; CARNMT1; FAM86B1; LRTOMT; MTR; PRDM12; PRDM11; PRDM10; PRDM8; FAM86C1;	GO:0032259~methylation	23	65	35.3846153846154	0.00236232796992775	0.032850653123215	1	1	0.997953812234961	1	0.317079009422735
down	NGF; IGF1R; PIK3R1; IRS1; GPR143; RHOA; NCS1; PLCH1; PITPNM2; INPP5F; PIK3C2A; PI4KAP2; PLCB1; PLCB3; PLCB4; PLCD4; PIK3CD; PLCH2; PLCG1; PI4KA; PLCD3;	GO:0048015~phosphatidylinositol-mediated signaling	21	57	36.8421052631579	0.00242470446904208	0.0336110224256262	1	1	0.998978241245338	1	0.324418198214498
down	KRIT1; PSMD3; PRKAB2; BAG3; CAPN1; CTSB; PARP1; CALML3; SIRPA; RING1; RALGDS; PSMD2; RNF180; ANKLE2; CALML6; CBX8; CALML5; SH3BP4; ATP6V1H; PRKAB1;	GO:0050790~regulation of catalytic activity	20	53	37.7358490566038	0.00243029443900156	0.0336351209759122	1	1	0.999002358399641	1	0.324650800726983
down	BCL2L11; TNFRSF21; BCL10; CRKL; BAX; PKN1; BAK1;	GO:0001783~B cell apoptotic process	7	8	87.5	0.00264598533714877	0.0362184795443891	1	1	1	1	0.349585731938366
down	CCND1; RREB1; ZNF703; RTN4; KDM5B; MST1L; MST1;	GO:0033601~positive regulation of mammary gland epithelial cell proliferation	7	8	87.5	0.00264598533714877	0.0362184795443891	1	1	1	1	0.349585731938366
down	DLL1; PROM1; LRP5; MAN2A1; MFSD2A; PROX1; NECTIN3;	GO:0060042~retina morphogenesis in camera-type eye	7	8	87.5	0.00264598533714877	0.0362184795443891	1	1	1	1	0.349585731938366
down	DVL1; DVL2; WNT5A; DLG4; DVL3; FZD4; GRIP1;	GO:0150012~positive regulation of neuron projection arborization	7	8	87.5	0.00264598533714877	0.0362184795443891	1	1	1	1	0.349585731938366
down	SH3PXD2B; FOXE1; CTNNB1; CRKL; TGFB2; TP63; COLEC10;	GO:1904888~cranial skeletal system development	7	8	87.5	0.00264598533714877	0.0362184795443891	1	1	1	1	0.349585731938366
down	EEF2K; WNT7A; ADGRB1; ADGRB2; ADGRB3; SLITRK5; PTPRD; EPHB2; THBS2; TPBG; AMIGO2; NLGN2; DLG5; ADNP; SLITRK6; ADGRL3; IL1RAPL1; CLSTN1; FLRT1; CLSTN3; FLRT3; FLRT2;	GO:0051965~positive regulation of synapse assembly	22	62	35.4838709677419	0.00282270472513246	0.0378658684555788	1	1	1	1	0.365486555649079
down	NME4; NME2P1; NME6; NME2; NME3; NME9; NME7; IMPDH1;	GO:0006183~GTP biosynthetic process	8	11	72.7272727272727	0.00291148912639327	0.0383952208780295	1	1	1	1	0.370595937831426
down	NME4; NME2P1; NME6; NME2; NME3; NME9; NME7; CTPS2;	GO:0006241~CTP biosynthetic process	8	11	72.7272727272727	0.00291148912639327	0.0383952208780295	1	1	1	1	0.370595937831426
down	LAMA5; TGFB1I1; FGFR2; VEGFC; PDX1; KDF1; JAG2; TBX18;	GO:0016331~morphogenesis of embryonic epithelium	8	11	72.7272727272727	0.00291148912639327	0.0383952208780295	1	1	1	1	0.370595937831426
down	MICAL2; CFL1; MICAL3; MICAL1; PPP1R9B; CFL2; TWF2; WDR1;	GO:0030042~actin filament depolymerization	8	11	72.7272727272727	0.00291148912639327	0.0383952208780295	1	1	1	1	0.370595937831426
