down	PDGFA; NEFH; NCKAP1L; PARVG; RHOG; RAC2;	GO:0030031~cell projection assembly	6	20	30	0.0378787026881882	0.607390697723377	1	1	0.999993099670535	0.999993099670534	1
down	CETP; CEBPA; USF2; FBXW7; ABHD5; ACOX2; NR1I2; PNPLA2; NR1H2;	GO:0055088~lipid homeostasis	9	38	23.6842105263158	0.0384879198390113	0.607390697723377	1	1	0.999993099670535	0.999993099670534	1
down	TYROBP; MITF; FCER1G; MAPK14; OSTM1; DCSTAMP; GAB2; SNX10;	GO:0030316~osteoclast differentiation	8	32	25	0.0394112793479481	0.607390697723377	1	1	0.999993099670535	0.999993099670534	1
down	TOR2A; ERO1A; BAG1; DNAJB12; HSPA2; HSPA1L; HSPA1A; DNAJB13;	GO:0051085~chaperone cofactor-dependent protein refolding	8	32	25	0.0394112793479481	0.607390697723377	1	1	0.999993099670535	0.999993099670534	1
down	PFN1; CGNL1; PAK2; ARHGEF18; FRMD7; INPP5K; ARHGAP28;	GO:0051497~negative regulation of stress fiber assembly	7	26	26.9230769230769	0.0394255250905896	0.607390697723377	1	1	0.999993099670535	0.999993099670534	1
up	NDUFA4; COX7A2P2; ATP2C2; SLC2A10; SLC25A27; MT-CO2; MT-CO3; COX6C; COX6A1; COX7A2; COX7B; SLC15A1; SLC9A3; SLC9A4; OTOP1; OTOP3; SLC9B2; ATP6V0D2; SLC4A11; SLC2A12; COX4I2; ATP6V0A4; ASIC5; SLC9A2; ATP12A; ATP4A;	GO:1902600~proton transmembrane transport	26	116	22.4137931034483	0.0400445055046579	0.832876907466295	1	1	0.999999999962758	0.999999999962757	1
down	WNT7A; BNIP3L; PIAS1; MAP4K4; WNT11; CRYAB; LTF; RAF1; WNT1; HPN; HCK; CTSH; UBB; UBC; HSPA1A; PIM1; NQO1; GATA1; PRLR; AZU1; BCL3; CFL1; NFKBIA; LTK; CD40LG; DRD3; SNCA; CDKN1A; PTGFR; IER3; PPT1; STAT5B; HMGA2; AIF1; NCKAP1L; TCL1A; SOX8; UBE2B; BCL2L1; BNIP3; NAIP; PAK2; DNAJC3; DHRS2; PTK2B; ANGPT1; AMIGO2; PDPN; STK40; IL31RA; RXFP2; KIFAP3; SEMA4D; BIRC7; RNF157; MYD88; BAG1; NUAK2; HIPK3; PLK3; PROK2; SLC40A1; NAT8; NAT8B; SIX4; NR2E1; UBE2O; AXL;	GO:0043066~negative regulation of apoptotic process	68	489	13.9059304703476	0.0409184987262814	0.607390697723377	1	1	0.999993099670535	0.999993099670534	1
down	CYP3A4; AKR1C4; ADM; TIPARP; DHRS9;	GO:0008209~androgen metabolic process	5	15	33.3333333333333	0.0412918573345613	0.607390697723377	1	1	0.999993099670535	0.999993099670534	1
down	WDR1; EPB41L3; RAC2; PPP2R3C; RHOG;	GO:0030865~cortical cytoskeleton organization	5	15	33.3333333333333	0.0412918573345613	0.607390697723377	1	1	0.999993099670535	0.999993099670534	1
down	SYK; NCKAP1L; TGFB2; FERMT1; P2RY12;	GO:0033630~positive regulation of cell adhesion mediated by integrin	5	15	33.3333333333333	0.0412918573345613	0.607390697723377	1	1	0.999993099670535	0.999993099670534	1
down	LILRB2; PAIP2; SHANK3; SCGN; CALB2;	GO:1900271~regulation of long-term synaptic potentiation	5	15	33.3333333333333	0.0412918573345613	0.607390697723377	1	1	0.999993099670535	0.999993099670534	1
up	BMP4; ELN; EFNA1; NOS3; GATA4; GATA5; ROBO2; HEY2; ROBO1;	GO:0003180~aortic valve morphogenesis	9	28	32.1428571428571	0.0416185316513873	0.832876907466295	1	1	0.999999999962758	0.999999999962757	1
up	APOA4; NOS2; H2BFS; DEFB1; BPIFB1; DEFA5; DEFA6;	GO:0002227~innate immune response in mucosa	7	19	36.8421052631579	0.0418838327757185	0.832876907466295	1	1	0.999999999962758	0.999999999962757	1
up	APOL1; APOC1; APOC3; APOL4; APOL5; APOA4; APOA1;	GO:0042157~lipoprotein metabolic process	7	19	36.8421052631579	0.0418838327757185	0.832876907466295	1	1	0.999999999962758	0.999999999962757	1
down	CHMP6; NDFIP1; CHMP4B; ATP6V0D1;	GO:0007034~vacuolar transport	4	10	40	0.0424858736009489	0.607390697723377	1	1	0.999993099670535	0.999993099670534	1
down	ALDH1L1; ACCSL; AADAT; APMAP;	GO:0009058~biosynthetic process	4	10	40	0.0424858736009489	0.607390697723377	1	1	0.999993099670535	0.999993099670534	1
down	CDH13; PTPN12; MVB12B; WDR54;	GO:0042058~regulation of epidermal growth factor receptor signaling pathway	4	10	40	0.0424858736009489	0.607390697723377	1	1	0.999993099670535	0.999993099670534	1
down	HLA-E; CLEC12B; LILRB1; KIR2DL4;	GO:0045953~negative regulation of natural killer cell mediated cytotoxicity	4	10	40	0.0424858736009489	0.607390697723377	1	1	0.999993099670535	0.999993099670534	1
down	SLC17A3; GCKR; SLC17A1; ABCG2;	GO:0046415~urate metabolic process	4	10	40	0.0424858736009489	0.607390697723377	1	1	0.999993099670535	0.999993099670534	1
down	ALOX12; TSPO; MLLT11; P2RX7;	GO:0051901~positive regulation of mitochondrial depolarization	4	10	40	0.0424858736009489	0.607390697723377	1	1	0.999993099670535	0.999993099670534	1
down	G6PD; RGS2; GSK3A; PI16;	GO:0061052~negative regulation of cell growth involved in cardiac muscle cell development	4	10	40	0.0424858736009489	0.607390697723377	1	1	0.999993099670535	0.999993099670534	1
down	FOXO3; PTAFR; CPS1; GHSR;	GO:0071548~response to dexamethasone	4	10	40	0.0424858736009489	0.607390697723377	1	1	0.999993099670535	0.999993099670534	1
down	HSPA1A; DNAJB2; HSPA2; DNAJB8;	GO:0090084~negative regulation of inclusion body assembly	4	10	40	0.0424858736009489	0.607390697723377	1	1	0.999993099670535	0.999993099670534	1
up	PTGES; CXCL13; S100A8; CCL11;	GO:0002544~chronic inflammatory response	4	7	57.1428571428571	0.0429236995339646	0.832876907466295	1	1	0.999999999962758	0.999999999962757	1
up	CYP1A1; CYP2E1; CYP2C8; CYP4A22;	GO:0002933~lipid hydroxylation	4	7	57.1428571428571	0.0429236995339646	0.832876907466295	1	1	0.999999999962758	0.999999999962757	1
up	BMP4; GDNF; SIX2; SALL1;	GO:0003337~mesenchymal to epithelial transition involved in metanephros morphogenesis	4	7	57.1428571428571	0.0429236995339646	0.832876907466295	1	1	0.999999999962758	0.999999999962757	1
up	GRM8; GRM6; GRIK3; GRM7;	GO:0007196~adenylate cyclase-inhibiting G protein-coupled glutamate receptor signaling pathway	4	7	57.1428571428571	0.0429236995339646	0.832876907466295	1	1	0.999999999962758	0.999999999962757	1
up	AQP1; SCTR; AQP4; AQP11;	GO:0009992~cellular water homeostasis	4	7	57.1428571428571	0.0429236995339646	0.832876907466295	1	1	0.999999999962758	0.999999999962757	1
up	HAS3; ABCC5; HYAL1; HAS2;	GO:0030213~hyaluronan biosynthetic process	4	7	57.1428571428571	0.0429236995339646	0.832876907466295	1	1	0.999999999962758	0.999999999962757	1
up	PLS1; CDHR2; CDHR5; USH1C;	GO:0032532~regulation of microvillus length	4	7	57.1428571428571	0.0429236995339646	0.832876907466295	1	1	0.999999999962758	0.999999999962757	1
up	BMP2; BMP4; APCDD1; DMRT3;	GO:0042487~regulation of odontogenesis of dentin-containing tooth	4	7	57.1428571428571	0.0429236995339646	0.832876907466295	1	1	0.999999999962758	0.999999999962757	1
up	EDN1; NMB; EDN3; P2RY1;	GO:0046887~positive regulation of hormone secretion	4	7	57.1428571428571	0.0429236995339646	0.832876907466295	1	1	0.999999999962758	0.999999999962757	1
up	CA2; TPD52; CA9; RIMS1;	GO:0046903~secretion	4	7	57.1428571428571	0.0429236995339646	0.832876907466295	1	1	0.999999999962758	0.999999999962757	1
up	FGF10; SPRY2; BMP4; RDH10;	GO:0060449~bud elongation involved in lung branching	4	7	57.1428571428571	0.0429236995339646	0.832876907466295	1	1	0.999999999962758	0.999999999962757	1
up	LIF; FOXF1; SHH; GRHL2;	GO:0060463~lung lobe morphogenesis	4	7	57.1428571428571	0.0429236995339646	0.832876907466295	1	1	0.999999999962758	0.999999999962757	1
up	CLCA1; SGK1; CASQ2; GRID2; ATP8B1; ATP2C2; S100A6; ATP4A; CHRNA7; SCNN1A; GRIA3; SCNN1G; CLCNKB; ATP12A; GRIK2; GRIK3; FXYD3; RYR3; ASIC2; ANO4; ATP13A5; ATP13A4; ANO1; TMC5; SLC9B2; ATP6V0D2; ATP6V0A4; SGK2; ANO2; ASIC5; GABRA5; GABRG3; GLRA1; GABRP; GABRA2; HTR3C; GABRD; GABRE; GABRA4; HTR3B; HTR3E; GABRB2;	GO:0034220~ion transmembrane transport	42	208	20.1923076923077	0.0430032851640523	0.832876907466295	1	1	0.999999999962758	0.999999999962757	1
down	LAMB1; MEGF9; LAMB3; LAMC2; NTNG1; LAMB4; LAMA3; LAMA1; NR5A1;	GO:0009888~tissue development	9	39	23.0769230769231	0.0433680182134487	0.607390697723377	1	1	0.999993099670535	0.999993099670534	1
up	BMP4; NOS3; STRA6; ROBO2; HEY2; ROBO1;	GO:0003184~pulmonary valve morphogenesis	6	15	40	0.0444457781909353	0.832876907466295	1	1	0.999999999962758	0.999999999962757	1
up	NRP2; CTSV; SEMA3A; BDNF; NTF4; NTF3;	GO:0021675~nerve development	6	15	40	0.0444457781909353	0.832876907466295	1	1	0.999999999962758	0.999999999962757	1
up	MUC6; MUC4; MUC13; TFF2; VSIG1; TFF1;	GO:0030277~maintenance of gastrointestinal epithelium	6	15	40	0.0444457781909353	0.832876907466295	1	1	0.999999999962758	0.999999999962757	1
up	ADCYAP1; ADCYAP1R1; SCTR; GIPR; FFAR4; GPR62;	GO:0043950~positive regulation of cAMP-mediated signaling	6	15	40	0.0444457781909353	0.832876907466295	1	1	0.999999999962758	0.999999999962757	1
down	LYN; NCKAP1L; SPNS2; PPP2R3C; TNFRSF13B; GAPT;	GO:0001782~B cell homeostasis	6	21	28.5714285714286	0.044764908959113	0.607390697723377	1	1	0.999993099670535	0.999993099670534	1
down	HLA-E; CEBPB; TNFSF4; CD40LG; FCER1G; SYK;	GO:0032753~positive regulation of interleukin-4 production	6	21	28.5714285714286	0.044764908959113	0.607390697723377	1	1	0.999993099670535	0.999993099670534	1
down	ARRDC4; FBXW7; ARRDC3; TRIB3; PINK1; DCUN1D1;	GO:0051443~positive regulation of ubiquitin-protein transferase activity	6	21	28.5714285714286	0.044764908959113	0.607390697723377	1	1	0.999993099670535	0.999993099670534	1
up	THY1; PDE6C; RP1; RORB; USH1C;	GO:0046549~retinal cone cell development	5	11	45.4545454545455	0.0454839439034456	0.832876907466295	1	1	0.999999999962758	0.999999999962757	1
down	IFNG; SYK; CLEC6A; CLEC9A; RGCC; IL26; CD14;	GO:0050715~positive regulation of cytokine secretion	7	27	25.9259259259259	0.045562065852439	0.607390697723377	1	1	0.999993099670535	0.999993099670534	1
down	OXT; TH; CD14; NQO1; AIF1; EEF1A2; P2RX7;	GO:0051602~response to electrical stimulus	7	27	25.9259259259259	0.045562065852439	0.607390697723377	1	1	0.999993099670535	0.999993099670534	1
up	CYP1A1; CYP2E1; LTA4H; CYP2C8; CYP2C9; HPGD; ALOX15; LTC4S;	GO:0042759~long-chain fatty acid biosynthetic process	8	24	33.3333333333333	0.0459987365947914	0.832876907466295	1	1	0.999999999962758	0.999999999962757	1
up	CLDN4; CLDN3; CLDN1; ADRA2A; REG3A; OCLN; DUOX2; DUOX1;	GO:0090303~positive regulation of wound healing	8	24	33.3333333333333	0.0459987365947914	0.832876907466295	1	1	0.999999999962758	0.999999999962757	1
down	FN1; PDGFA; APP; SERPINE1; LAMB1; FURIN; ITGB4; PDGFRA; ITGA2; ITGB6; BCL3; COL9A1; LAMA1; ITGA3; COL4A5; ICAM3; MFAP2; COL7A1; COL16A1; ITGAD; LAMB3; LAMC2; COL4A6; COL19A1; LAMA3; MPZL3; PXDN; ERO1A; NR2E1; COL17A1; MMP23B; COL22A1; MMP8; MMP16; MMP17;	GO:0030198~extracellular matrix organization	35	230	15.2173913043478	0.047520455841907	0.607390697723377	1	1	0.999993099670535	0.999993099670534	1
down	TH; CRHBP; RASD2; DRD3; OR56A1;	GO:0001963~synaptic transmission, dopaminergic	5	16	31.25	0.0499283893192859	0.607390697723377	1	1	0.999993099670535	0.999993099670534	1
down	UNC13B; SNCA; NAPA; SV2A; SNAP23;	GO:0016082~synaptic vesicle priming	5	16	31.25	0.0499283893192859	0.607390697723377	1	1	0.999993099670535	0.999993099670534	1
down	HSPA1A; DNAJB2; HERPUD1; PINK1; FBXO2;	GO:0031396~regulation of protein ubiquitination	5	16	31.25	0.0499283893192859	0.607390697723377	1	1	0.999993099670535	0.999993099670534	1
