down	PROS1; LYN; ANXA8; CD59; PRKACB; CAPZB; LMAN1; CAPZA1; CDC42; CYP4F2; JMJD1C; CD177; P2RX7; DOCK9; LNPK; EHD1; GP6; SERPINA10; RCOR1; MAFF; HPS5;	GO:0007596~blood coagulation	21	171	12.280701754386	0.0111354210917486	0.115740471794589	1	1	0.999999944778075	0.999999944778075	1
down	NFASC; MAL; EPB41L3;	GO:0002175~protein localization to paranode region of axon	3	5	60	0.011331092228964	0.115740471794589	1	1	0.999999944778075	0.999999944778075	1
down	HPRT1; APRT; ADK;	GO:0006166~purine ribonucleoside salvage	3	5	60	0.011331092228964	0.115740471794589	1	1	0.999999944778075	0.999999944778075	1
down	HMOX1; ALOX12; PTK2B;	GO:0010656~negative regulation of muscle cell apoptotic process	3	5	60	0.011331092228964	0.115740471794589	1	1	0.999999944778075	0.999999944778075	1
down	AQP1; RHBG; RHCG;	GO:0015696~ammonium transport	3	5	60	0.011331092228964	0.115740471794589	1	1	0.999999944778075	0.999999944778075	1
down	PUS7; PUS3; PUSL1;	GO:0031119~tRNA pseudouridine synthesis	3	5	60	0.011331092228964	0.115740471794589	1	1	0.999999944778075	0.999999944778075	1
down	SCGB1A1; CD83; NDFIP1;	GO:0032713~negative regulation of interleukin-4 production	3	5	60	0.011331092228964	0.115740471794589	1	1	0.999999944778075	0.999999944778075	1
down	ALOX5; CDC42; EPS8;	GO:0036336~dendritic cell migration	3	5	60	0.011331092228964	0.115740471794589	1	1	0.999999944778075	0.999999944778075	1
down	ACER3; BNIP3L; BNIP3;	GO:0043067~regulation of programmed cell death	3	5	60	0.011331092228964	0.115740471794589	1	1	0.999999944778075	0.999999944778075	1
down	TNF; GBA; BNIP3;	GO:0043243~positive regulation of protein-containing complex disassembly	3	5	60	0.011331092228964	0.115740471794589	1	1	0.999999944778075	0.999999944778075	1
down	BBOX1; ACADM; SHMT1;	GO:0045329~carnitine biosynthetic process	3	5	60	0.011331092228964	0.115740471794589	1	1	0.999999944778075	0.999999944778075	1
down	ABHD12; MGLL; ABHD6;	GO:0046464~acylglycerol catabolic process	3	5	60	0.011331092228964	0.115740471794589	1	1	0.999999944778075	0.999999944778075	1
down	P2RX7; KATNBL1; PFDN2;	GO:0051495~positive regulation of cytoskeleton organization	3	5	60	0.011331092228964	0.115740471794589	1	1	0.999999944778075	0.999999944778075	1
down	ABHD12; MGLL; ABHD6;	GO:0052651~monoacylglycerol catabolic process	3	5	60	0.011331092228964	0.115740471794589	1	1	0.999999944778075	0.999999944778075	1
down	TMCC1; CHMP4B; CORO1C;	GO:0090148~membrane fission	3	5	60	0.011331092228964	0.115740471794589	1	1	0.999999944778075	0.999999944778075	1
down	PDCD6IP; CHMP4C; CHMP4B;	GO:0090611~ubiquitin-independent protein catabolic process via the multivesicular body sorting pathway	3	5	60	0.011331092228964	0.115740471794589	1	1	0.999999944778075	0.999999944778075	1
down	SPTLC1; ADRB2; SESN2;	GO:1904504~positive regulation of lipophagy	3	5	60	0.011331092228964	0.115740471794589	1	1	0.999999944778075	0.999999944778075	1
down	GJB5; GJA1; GJB2;	GO:1905867~epididymis development	3	5	60	0.011331092228964	0.115740471794589	1	1	0.999999944778075	0.999999944778075	1
down	TRIAP1; DBI; PRELID1;	GO:2001140~positive regulation of phospholipid transport	3	5	60	0.011331092228964	0.115740471794589	1	1	0.999999944778075	0.999999944778075	1
up	KIT; LOX; EPHB1; SAA2; CCR1; CCR3;	GO:0060326~cell chemotaxis	6	74	8.10810810810811	0.0116160483380512	0.119183246888555	1	1	0.997267179759554	0.997267179759554	1
down	XK; SLC7A2; SLC38A4; SLC38A2; SLC38A3; SLC38A1; SLC6A15; SLC7A8;	GO:0006865~amino acid transport	8	41	19.5121951219512	0.0116224888740917	0.118503398250406	1	1	0.999999944778075	0.999999944778075	1
up	NPPA; NPR1; SLC8A3; ATP1A4; ATP2A3;	GO:1903779~regulation of cardiac conduction	5	53	9.43396226415094	0.0117969829441611	0.12059138120698	1	1	0.997267179759554	0.997267179759554	1
down	PIK3C2A; TGFA; AREG; ARF4; PIK3R1; FAM83B; EPGN; FAM83A; PTK2B;	GO:0007173~epidermal growth factor receptor signaling pathway	9	50	18	0.0118826530017002	0.120721791875696	1	1	0.999999944778075	0.999999944778075	1
down	MAPT; PTN; YWHAG; CX3CL1; EIF4EBP2; PTK2B; CPEB3; PLK2; RIMS2;	GO:0048167~regulation of synaptic plasticity	9	50	18	0.0118826530017002	0.120721791875696	1	1	0.999999944778075	0.999999944778075	1
down	RNMT; RNGTT; GTF2F2; CDK7; POLR2K; POLR2G; GTF2H4;	GO:0006370~7-methylguanosine mRNA capping	7	33	21.2121212121212	0.0122939712105409	0.123782189711303	1	1	0.999999944778075	0.999999944778075	1
down	ENTPD5; CLPX; ATP1B1; HSPA8; AK4; SLC25A25; OLA1;	GO:0046034~ATP metabolic process	7	33	21.2121212121212	0.0122939712105409	0.123782189711303	1	1	0.999999944778075	0.999999944778075	1
down	IL1A; LCN2; MKNK2; BCL2L1; BCL2L10; BCL2L2; BOK;	GO:0097192~extrinsic apoptotic signaling pathway in absence of ligand	7	33	21.2121212121212	0.0122939712105409	0.123782189711303	1	1	0.999999944778075	0.999999944778075	1
down	SOD1; TNF; TMIGD2; PELI1; HILPDA; IL33;	GO:0001819~positive regulation of cytokine production	6	25	24	0.0123148976886884	0.123782189711303	1	1	0.999999944778075	0.999999944778075	1
down	ARPC2; CDC42; ACTR3; ATP7A; BRK1; AKIRIN1;	GO:0010592~positive regulation of lamellipodium assembly	6	25	24	0.0123148976886884	0.123782189711303	1	1	0.999999944778075	0.999999944778075	1
down	CD24; CDKN1A; CASP4; PMAIP1; SGPP1; HIPK2;	GO:0097193~intrinsic apoptotic signaling pathway	6	25	24	0.0123148976886884	0.123782189711303	1	1	0.999999944778075	0.999999944778075	1
up	TMPRSS3; ATP1A4; ATP4A;	GO:0006883~cellular sodium ion homeostasis	3	18	16.6666666666667	0.0126526000238107	0.12791639584512	1	1	0.997267179759554	0.997267179759554	1
up	COL8A2; EPHB1; TENM3;	GO:0048593~camera-type eye morphogenesis	3	18	16.6666666666667	0.0126526000238107	0.12791639584512	1	1	0.997267179759554	0.997267179759554	1
up	KCNE1; KCNH2; PKP2;	GO:0086005~ventricular cardiac muscle cell action potential	3	18	16.6666666666667	0.0126526000238107	0.12791639584512	1	1	0.997267179759554	0.997267179759554	1
down	OTC; ARG1; ARG2; SLC25A15;	GO:0000050~urea cycle	4	11	36.3636363636364	0.0126978440763436	0.124324832588587	1	1	0.999999944778075	0.999999944778075	1
down	RHOF; RHOB; RHOD; RND3;	GO:0000910~cytokinesis	4	11	36.3636363636364	0.0126978440763436	0.124324832588587	1	1	0.999999944778075	0.999999944778075	1
down	PSMD14; AKIRIN2; PSENEN; PRELID1;	GO:0010950~positive regulation of endopeptidase activity	4	11	36.3636363636364	0.0126978440763436	0.124324832588587	1	1	0.999999944778075	0.999999944778075	1
down	ALOX5; PLA2G5; PLA2G4A; MGST2;	GO:0019370~leukotriene biosynthetic process	4	11	36.3636363636364	0.0126978440763436	0.124324832588587	1	1	0.999999944778075	0.999999944778075	1
down	EFNA5; WNT4; FUT7; ZDHHC2;	GO:0022407~regulation of cell-cell adhesion	4	11	36.3636363636364	0.0126978440763436	0.124324832588587	1	1	0.999999944778075	0.999999944778075	1
down	RAP2A; RAP2B; RAP1A; PLK2;	GO:0032486~Rap protein signal transduction	4	11	36.3636363636364	0.0126978440763436	0.124324832588587	1	1	0.999999944778075	0.999999944778075	1
down	FUT3; FUT11; FUT7; FUT6;	GO:0036065~fucosylation	4	11	36.3636363636364	0.0126978440763436	0.124324832588587	1	1	0.999999944778075	0.999999944778075	1
down	SOCS2; ADRB2; FXN; LGMN;	GO:0040015~negative regulation of multicellular organism growth	4	11	36.3636363636364	0.0126978440763436	0.124324832588587	1	1	0.999999944778075	0.999999944778075	1
down	TH; ACHE; SLC6A4; DAGLA;	GO:0042136~neurotransmitter biosynthetic process	4	11	36.3636363636364	0.0126978440763436	0.124324832588587	1	1	0.999999944778075	0.999999944778075	1
down	ACHE; NSG1; DLG1; PSENEN;	GO:0042982~amyloid precursor protein metabolic process	4	11	36.3636363636364	0.0126978440763436	0.124324832588587	1	1	0.999999944778075	0.999999944778075	1
down	TNF; IFNG; HMOX1; TICAM1;	GO:0045080~positive regulation of chemokine biosynthetic process	4	11	36.3636363636364	0.0126978440763436	0.124324832588587	1	1	0.999999944778075	0.999999944778075	1
down	EDF1; PTN; MESP1; KDR;	GO:0045446~endothelial cell differentiation	4	11	36.3636363636364	0.0126978440763436	0.124324832588587	1	1	0.999999944778075	0.999999944778075	1
down	AFDN; PDZD11; TSPAN33; P2RX7;	GO:0046931~pore complex assembly	4	11	36.3636363636364	0.0126978440763436	0.124324832588587	1	1	0.999999944778075	0.999999944778075	1
down	DSP; DSC2; DLG1; CTNNA3;	GO:0098911~regulation of ventricular cardiac muscle cell action potential	4	11	36.3636363636364	0.0126978440763436	0.124324832588587	1	1	0.999999944778075	0.999999944778075	1
down	CTNND1; EPS8; CPT1C; PORCN;	GO:0099072~regulation of postsynaptic membrane neurotransmitter receptor levels	4	11	36.3636363636364	0.0126978440763436	0.124324832588587	1	1	0.999999944778075	0.999999944778075	1
down	MB; LYN; ACAT1; ME1; OXCT1; PTK2B; DHCR24; TIMP2;	GO:0009725~response to hormone	8	42	19.047619047619	0.0130834040863438	0.127439549425228	1	1	0.999999944778075	0.999999944778075	1
down	BIN1; FER; PFN2; PRKCE; DLG1; PTK2B; SNX9; C15orf62; BAIAP2L2;	GO:0030838~positive regulation of actin filament polymerization	9	51	17.6470588235294	0.0132104498970045	0.128236370661162	1	1	0.999999944778075	0.999999944778075	1
down	SAP18; PRMT5; CREG1; TOB1; COPS2; ZNF274; RBBP8; TBL1Y; CDYL;	GO:1903507~negative regulation of nucleic acid-templated transcription	9	51	17.6470588235294	0.0132104498970045	0.128236370661162	1	1	0.999999944778075	0.999999944778075	1
down	AKR1C3; AKR1C2; PTGR1; PLAA; AKR1C1;	GO:0006693~prostaglandin metabolic process	5	18	27.7777777777778	0.0133739828242655	0.128286139815163	1	1	0.999999944778075	0.999999944778075	1
down	CLIC2; CALM1; AKAP6; CAMK2D; CHD7;	GO:0010880~regulation of release of sequestered calcium ion into cytosol by sarcoplasmic reticulum	5	18	27.7777777777778	0.0133739828242655	0.128286139815163	1	1	0.999999944778075	0.999999944778075	1
down	LPL; LPIN1; GPAT3; LPIN2; DGAT2;	GO:0019432~triglyceride biosynthetic process	5	18	27.7777777777778	0.0133739828242655	0.128286139815163	1	1	0.999999944778075	0.999999944778075	1
down	ELN; ARRB1; PTK2B; SORBS1; FHDC1;	GO:0043149~stress fiber assembly	5	18	27.7777777777778	0.0133739828242655	0.128286139815163	1	1	0.999999944778075	0.999999944778075	1
down	PIK3C2A; CLTA; EPS15; AP2S1; NSG1;	GO:0048268~clathrin coat assembly	5	18	27.7777777777778	0.0133739828242655	0.128286139815163	1	1	0.999999944778075	0.999999944778075	1
down	S100A7; CXCL17; MOSPD2; LGMN; S100A14;	GO:0090026~positive regulation of monocyte chemotaxis	5	18	27.7777777777778	0.0133739828242655	0.128286139815163	1	1	0.999999944778075	0.999999944778075	1
down	SOD2; GSTP1; HMOX1; CDKN1A; APLN;	GO:1904706~negative regulation of vascular smooth muscle cell proliferation	5	18	27.7777777777778	0.0133739828242655	0.128286139815163	1	1	0.999999944778075	0.999999944778075	1
up	SGK1; ATP1A4; SLC5A8; SLC5A5; SCN2A; SLC22A4;	GO:0006814~sodium ion transport	6	77	7.79220779220779	0.0137579415712195	0.136087415846759	1	1	0.997267179759554	0.997267179759554	1
down	MAPT; PDGFRA; FER; MAPK3; PRDX5; AKR1C3; MAPK8;	GO:0034614~cellular response to reactive oxygen species	7	34	20.5882352941176	0.0140300825918224	0.13389989598155	1	1	0.999999944778075	0.999999944778075	1
down	BAIAP3; CFTR; ARRB1; OXCT1; GPLD1; HIF1A; GPR27;	GO:0035774~positive regulation of insulin secretion involved in cellular response to glucose stimulus	7	34	20.5882352941176	0.0140300825918224	0.13389989598155	1	1	0.999999944778075	0.999999944778075	1
down	DUSP14; DUSP1; DUSP3; PPP2CA; DUSP16; DUSP5;	GO:0000188~inactivation of MAPK activity	6	26	23.0769230769231	0.0143586640244682	0.136347179823635	1	1	0.999999944778075	0.999999944778075	1
down	TRIAP1; TNFAIP8L3; SCARB1; OSBPL8; PRELID1; PRELID3B;	GO:0015914~phospholipid transport	6	26	23.0769230769231	0.0143586640244682	0.136347179823635	1	1	0.999999944778075	0.999999944778075	1
up	CYP19A1; AMHR2; SFRP1;	GO:0008585~female gonad development	3	19	15.7894736842105	0.0143976541403092	0.136087415846759	1	1	0.997267179759554	0.997267179759554	1
up	CALCA; MDK; SFRP1;	GO:0030279~negative regulation of ossification	3	19	15.7894736842105	0.0143976541403092	0.136087415846759	1	1	0.997267179759554	0.997267179759554	1
up	IRGM; HRG; CD36;	GO:0043254~regulation of protein-containing complex assembly	3	19	15.7894736842105	0.0143976541403092	0.136087415846759	1	1	0.997267179759554	0.997267179759554	1
up	MDK; GATA3; PIK3R6;	GO:0045582~positive regulation of T cell differentiation	3	19	15.7894736842105	0.0143976541403092	0.136087415846759	1	1	0.997267179759554	0.997267179759554	1
up	TNFSF11; CA2; ADAM8;	GO:0045780~positive regulation of bone resorption	3	19	15.7894736842105	0.0143976541403092	0.136087415846759	1	1	0.997267179759554	0.997267179759554	1
up	NPR1; P2RY1; UTS2;	GO:0097746~regulation of blood vessel diameter	3	19	15.7894736842105	0.0143976541403092	0.136087415846759	1	1	0.997267179759554	0.997267179759554	1
up	FES; CSF3; STAP1;	GO:2000251~positive regulation of actin cytoskeleton reorganization	3	19	15.7894736842105	0.0143976541403092	0.136087415846759	1	1	0.997267179759554	0.997267179759554	1
up	BMPR1B; RET; RD3; RORB; RP1;	GO:0060041~retina development in camera-type eye	5	56	8.92857142857143	0.0144636370971055	0.136244499617786	1	1	0.997267179759554	0.997267179759554	1
down	SAP18; CLOCK; TSC22D2; CREG1; TGFA; TNF; SOD2; MYCN; NPM1; CDKN1A; MNX1; CEBPG; PSMC5; IRX6; DBP; CAMK2D; ECM1; LRRFIP1; KLF17; DMRTA1; ZNF704; PKNOX2; TRERF1; TSC22D3; RBBP8; SOX7; SRA1; UBN1; BRD7; KDM5B; ABT1; MYRF; USP16; HIF3A; PIAS1; ZNF823; CCNC; NHLH2; SP6; ETV2; MED8; HIF1A; ZNF625; NFKBIZ; ZNF14; RLF; FOXC1; IFRD1; ZNF433; KLF9; DBX2; FOXI2; ZNF844; TFAP2B; GRHL1; ZNF101; HOPX; KLF15; TBL1Y; MED31; ATF4; ASCL2; ELF5; ETV1; ZNF57; ELF3; BARX2; DEAF1;	GO:0006357~regulation of transcription by RNA polymerase II	68	747	9.10307898259705	0.0146164410826553	0.137956090077128	1	1	0.999999944778075	0.999999944778075	1
down	MPZL2; DSG3; DSG1; DSC2; DSC1; TRO; IGSF11; CADM3; ESAM; CDHR1; PCDH11X; CDH20; CDH22; PCDHGA2; PCDHGA10; PCDHGA1; VSTM2L; CDH19; PALLD; CDH12;	GO:0007156~homophilic cell adhesion via plasma membrane adhesion molecules	20	165	12.1212121212121	0.0146243062424615	0.137956090077128	1	1	0.999999944778075	0.999999944778075	1
down	DSG1; TJP1; PARD6B; HEG1; CDH19; PKP3; CTNND1; CDH12;	GO:0007043~cell-cell junction assembly	8	43	18.6046511627907	0.0146741087169709	0.137956090077128	1	1	0.999999944778075	0.999999944778075	1
down	CTNND1; DSP; AFDN; CDH12; CDC42; CADM3; CDH19; CSK;	GO:0034332~adherens junction organization	8	43	18.6046511627907	0.0146741087169709	0.137956090077128	1	1	0.999999944778075	0.999999944778075	1
down	PLEK; PDGFRA; MYL12A; ACTB; RAP2B; ACTG1; TYRO3; GNAS;	GO:0070527~platelet aggregation	8	43	18.6046511627907	0.0146741087169709	0.137956090077128	1	1	0.999999944778075	0.999999944778075	1
down	ZPR1; GSTP1; ZFP36; ID1; DUSP3; PTPN12; FOXC1; SYAP1;	GO:0071364~cellular response to epidermal growth factor stimulus	8	43	18.6046511627907	0.0146741087169709	0.137956090077128	1	1	0.999999944778075	0.999999944778075	1
up	KCNH2; ATP1A4; SLC4A8; KCNH3; KCNH1; GABRR2; GABRA2;	GO:0042391~regulation of membrane potential	7	102	6.86274509803922	0.0148759109545723	0.139344515373138	1	1	0.997267179759554	0.997267179759554	1
up	NTRK1; FES; RET; KIT; INSRR; EPHB1; BTK; NTRK2;	GO:0018108~peptidyl-tyrosine phosphorylation	8	127	6.2992125984252	0.014996474615579	0.139831993037155	1	1	0.997267179759554	0.997267179759554	1
down	TRPA1; TSPAN12; IFNG; ADRB2; CD59; EDN3; EDN2; EDNRB; CXCR1; CXCR2; VIPR1; CDA; IL13RA1; MERTK; PTK2B; CASP8; DTX1; ADGRF4; ADGRF2; CASP10; P2RX7; MYD88; ADGRL3; MKNK2; MARCO; CYSLTR1; TRBV7-3; MAPK3; ANXA1;	GO:0007166~cell surface receptor signaling pathway	29	268	10.8208955223881	0.0151113600999375	0.139777863778532	1	1	0.999999944778075	0.999999944778075	1
up	NTN1; GATA2; GATA3; PRRX1; FOXI1;	GO:0042472~inner ear morphogenesis	5	57	8.7719298245614	0.0154352026236572	0.143416710534916	1	1	0.997267179759554	0.997267179759554	1
up	RET; RARB; BDNF; SFRP1;	GO:0001657~ureteric bud development	4	37	10.8108108108108	0.015576273008084	0.143780981613083	1	1	0.997267179759554	0.997267179759554	1
down	UBB; EDN2; NMU; PRKAA2; FOXO1; NR1D2; METRNL;	GO:0097009~energy homeostasis	7	35	20	0.0159344612958077	0.139777863778532	1	1	0.999999944778075	0.999999944778075	1
down	NR1D1; PGM1; GYS2; UGP2; PPP1R3C;	GO:0005978~glycogen biosynthetic process	5	19	26.3157894736842	0.0160262156701108	0.139777863778532	1	1	0.999999944778075	0.999999944778075	1
down	MAPK13; TSC22D2; PTK2B; TSC22D3; PLK3;	GO:0006970~response to osmotic stress	5	19	26.3157894736842	0.0160262156701108	0.139777863778532	1	1	0.999999944778075	0.999999944778075	1
down	MAPT; SLC6A1; PPP2CB; PPP2CA; MAP1LC3A;	GO:0010288~response to lead ion	5	19	26.3157894736842	0.0160262156701108	0.139777863778532	1	1	0.999999944778075	0.999999944778075	1
down	ZPR1; PTN; PTPRZ1; DLG1; NKX6-2;	GO:0031641~regulation of myelination	5	19	26.3157894736842	0.0160262156701108	0.139777863778532	1	1	0.999999944778075	0.999999944778075	1
down	RPS6; EIF4EBP1; EIF4EBP2; RPS6KB2; TIPRL;	GO:0031929~TOR signaling	5	19	26.3157894736842	0.0160262156701108	0.139777863778532	1	1	0.999999944778075	0.999999944778075	1
down	SOD1; GNAI3; GSTP1; MAPT; CD177;	GO:0032930~positive regulation of superoxide anion generation	5	19	26.3157894736842	0.0160262156701108	0.139777863778532	1	1	0.999999944778075	0.999999944778075	1
down	TF; ATP6AP1; DEF8; PLEKHM1; TNFRSF11A;	GO:0045780~positive regulation of bone resorption	5	19	26.3157894736842	0.0160262156701108	0.139777863778532	1	1	0.999999944778075	0.999999944778075	1
down	ALDH1L1; MTHFD2; SHMT1; MTHFD2L; MTRR;	GO:0046655~folic acid metabolic process	5	19	26.3157894736842	0.0160262156701108	0.139777863778532	1	1	0.999999944778075	0.999999944778075	1
down	RHOD; PDGFRA; ARHGDIB; PTK2B; ESAM;	GO:2000249~regulation of actin cytoskeleton reorganization	5	19	26.3157894736842	0.0160262156701108	0.139777863778532	1	1	0.999999944778075	0.999999944778075	1
down	DKK1; SOX7; DUSP5; DUSP1;	GO:0001706~endoderm formation	4	12	33.3333333333333	0.016091131638299	0.139777863778532	1	1	0.999999944778075	0.999999944778075	1
down	SULT1B1; ADH7; ALDH3B1; ALDH3B2;	GO:0006068~ethanol catabolic process	4	12	33.3333333333333	0.016091131638299	0.139777863778532	1	1	0.999999944778075	0.999999944778075	1
down	HYKK; CRYM; AADAT; SLC25A21;	GO:0006554~lysine catabolic process	4	12	33.3333333333333	0.016091131638299	0.139777863778532	1	1	0.999999944778075	0.999999944778075	1
down	EDNRB; CLCN3; ATP6V0A4; RHCG;	GO:0006885~regulation of pH	4	12	33.3333333333333	0.016091131638299	0.139777863778532	1	1	0.999999944778075	0.999999944778075	1
down	EIF2S1; HSPA5; ATF4; HERPUD1;	GO:0036499~PERK-mediated unfolded protein response	4	12	33.3333333333333	0.016091131638299	0.139777863778532	1	1	0.999999944778075	0.999999944778075	1
down	EDN3; EDN2; ITPR2; INPP5A;	GO:0048016~inositol phosphate-mediated signaling	4	12	33.3333333333333	0.016091131638299	0.139777863778532	1	1	0.999999944778075	0.999999944778075	1
down	MAPT; BST1; PTK2B; TMEM100;	GO:0050848~regulation of calcium-mediated signaling	4	12	33.3333333333333	0.016091131638299	0.139777863778532	1	1	0.999999944778075	0.999999944778075	1
down	ALOX15B; IL33; TNF; LPL;	GO:0090197~positive regulation of chemokine secretion	4	12	33.3333333333333	0.016091131638299	0.139777863778532	1	1	0.999999944778075	0.999999944778075	1
down	ADM; KDR; RAP1A; TMEM100;	GO:2001214~positive regulation of vasculogenesis	4	12	33.3333333333333	0.016091131638299	0.139777863778532	1	1	0.999999944778075	0.999999944778075	1
down	TRPA1; PENK; EDNRB; NPY1R; MAPK3; BDKRB1; NMU; MRGPRX2; P2RX7;	GO:0019233~sensory perception of pain	9	53	16.9811320754717	0.0161912921861597	0.139777863778532	1	1	0.999999944778075	0.999999944778075	1
down	PDCD5; TNF; ALOX12; ARRB1; PMAIP1; MAP3K5; SOX7; MALT1; FIS1;	GO:0043280~positive regulation of cysteine-type endopeptidase activity involved in apoptotic process	9	53	16.9811320754717	0.0161912921861597	0.139777863778532	1	1	0.999999944778075	0.999999944778075	1
down	EIF6; RAN; ABCE1;	GO:0000054~ribosomal subunit export from nucleus	3	6	50	0.0161993396547002	0.139777863778532	1	1	0.999999944778075	0.999999944778075	1
down	HLA-DQB1; BCL3; ZP3;	GO:0002455~humoral immune response mediated by circulating immunoglobulin	3	6	50	0.0161993396547002	0.139777863778532	1	1	0.999999944778075	0.999999944778075	1
down	ALDH3B1; ALDH3B2; DHRS4;	GO:0006066~alcohol metabolic process	3	6	50	0.0161993396547002	0.139777863778532	1	1	0.999999944778075	0.999999944778075	1
down	ACOT4; SUCLG1; SUCLA2;	GO:0006104~succinyl-CoA metabolic process	3	6	50	0.0161993396547002	0.139777863778532	1	1	0.999999944778075	0.999999944778075	1
down	MOCS2; MOCOS; MOCS1;	GO:0006777~Mo-molybdopterin cofactor biosynthetic process	3	6	50	0.0161993396547002	0.139777863778532	1	1	0.999999944778075	0.999999944778075	1
down	TALDO1; RPIA; RPE;	GO:0009052~pentose-phosphate shunt, non-oxidative branch	3	6	50	0.0161993396547002	0.139777863778532	1	1	0.999999944778075	0.999999944778075	1
down	GJA1; GJB2; DBN1;	GO:0010644~cell communication by electrical coupling	3	6	50	0.0161993396547002	0.139777863778532	1	1	0.999999944778075	0.999999944778075	1
down	PIM1; GJA1; ACTB;	GO:0022898~regulation of transmembrane transporter activity	3	6	50	0.0161993396547002	0.139777863778532	1	1	0.999999944778075	0.999999944778075	1
down	LPL; HMOX1; CDKN2B;	GO:0031670~cellular response to nutrient	3	6	50	0.0161993396547002	0.139777863778532	1	1	0.999999944778075	0.999999944778075	1
down	MOCS2; MOCOS; MOCS1;	GO:0032324~molybdopterin cofactor biosynthetic process	3	6	50	0.0161993396547002	0.139777863778532	1	1	0.999999944778075	0.999999944778075	1
down	ALOX12; ALOX15B; ALOX5;	GO:0034440~lipid oxidation	3	6	50	0.0161993396547002	0.139777863778532	1	1	0.999999944778075	0.999999944778075	1
down	EIF6; C1QBP; SBDS;	GO:0042256~mature ribosome assembly	3	6	50	0.0161993396547002	0.139777863778532	1	1	0.999999944778075	0.999999944778075	1
down	GHR; PRLR; PTK2B;	GO:0042976~activation of Janus kinase activity	3	6	50	0.0161993396547002	0.139777863778532	1	1	0.999999944778075	0.999999944778075	1
down	ASAH1; ACER1; ACER3;	GO:0046514~ceramide catabolic process	3	6	50	0.0161993396547002	0.139777863778532	1	1	0.999999944778075	0.999999944778075	1
down	FBL; ZNHIT6; PIH1D1;	GO:0048254~snoRNA localization	3	6	50	0.0161993396547002	0.139777863778532	1	1	0.999999944778075	0.999999944778075	1
down	KRT76; ZDHHC21; ACER1;	GO:0048733~sebaceous gland development	3	6	50	0.0161993396547002	0.139777863778532	1	1	0.999999944778075	0.999999944778075	1
down	CHMP2A; CHMP4C; CHMP4B;	GO:0050792~regulation of viral process	3	6	50	0.0161993396547002	0.139777863778532	1	1	0.999999944778075	0.999999944778075	1
down	ALOX15B; ALOX12; ALOX5;	GO:0051122~hepoxilin biosynthetic process	3	6	50	0.0161993396547002	0.139777863778532	1	1	0.999999944778075	0.999999944778075	1
down	YWHAB; DBN1; GET4;	GO:0051220~cytoplasmic sequestering of protein	3	6	50	0.0161993396547002	0.139777863778532	1	1	0.999999944778075	0.999999944778075	1
down	UGT1A1; UGT1A7; UGT1A10;	GO:0051552~flavone metabolic process	3	6	50	0.0161993396547002	0.139777863778532	1	1	0.999999944778075	0.999999944778075	1
down	FOXP2; FGF7; CDC42;	GO:0060501~positive regulation of epithelial cell proliferation involved in lung morphogenesis	3	6	50	0.0161993396547002	0.139777863778532	1	1	0.999999944778075	0.999999944778075	1
down	LRRK2; RINT1; SCFD1;	GO:0060628~regulation of ER to Golgi vesicle-mediated transport	3	6	50	0.0161993396547002	0.139777863778532	1	1	0.999999944778075	0.999999944778075	1
down	DSP; DSC2; CTNNA3;	GO:0086073~bundle of His cell-Purkinje myocyte adhesion involved in cell communication	3	6	50	0.0161993396547002	0.139777863778532	1	1	0.999999944778075	0.999999944778075	1
down	GOLGA2; STX5; PLK3;	GO:0090166~Golgi disassembly	3	6	50	0.0161993396547002	0.139777863778532	1	1	0.999999944778075	0.999999944778075	1
down	GJA1; ABCC1; ABCG2;	GO:0140115~export across plasma membrane	3	6	50	0.0161993396547002	0.139777863778532	1	1	0.999999944778075	0.999999944778075	1
down	DSP; TJP1; CGNL1;	GO:0150105~protein localization to cell-cell junction	3	6	50	0.0161993396547002	0.139777863778532	1	1	0.999999944778075	0.999999944778075	1
down	EZR; DUSP1; DLG1;	GO:1903753~negative regulation of p38MAPK cascade	3	6	50	0.0161993396547002	0.139777863778532	1	1	0.999999944778075	0.999999944778075	1
up	RARB; NKX3-2; ADAMTS7;	GO:0032331~negative regulation of chondrocyte differentiation	3	20	15	0.016272053384364	0.148220684293217	1	1	0.997267179759554	0.997267179759554	1
up	PRRX1; NKX3-2; SIX2;	GO:0042474~middle ear morphogenesis	3	20	15	0.016272053384364	0.148220684293217	1	1	0.997267179759554	0.997267179759554	1
up	NTRK1; BDNF; NTRK2;	GO:0048011~neurotrophin TRK receptor signaling pathway	3	20	15	0.016272053384364	0.148220684293217	1	1	0.997267179759554	0.997267179759554	1
up	TLR4; CD14; LY96;	GO:0070266~necroptotic process	3	20	15	0.016272053384364	0.148220684293217	1	1	0.997267179759554	0.997267179759554	1
down	EDN3; EDNRB; HIF1A; PHACTR4; NRTN; CORO1C; SEMA4D; SEMA4A;	GO:0001755~neural crest cell migration	8	44	18.1818181818182	0.0164006206093437	0.140658272669242	1	1	0.999999944778075	0.999999944778075	1
down	WNT9B; LYN; FER; SESN2; PPP2CA; PIN1; FNIP2; CORO1C;	GO:0001932~regulation of protein phosphorylation	8	44	18.1818181818182	0.0164006206093437	0.140658272669242	1	1	0.999999944778075	0.999999944778075	1
down	PER1; REN; AREG; DUSP1; ALDH3A1; PLA2G5; PTK2B; PNPT1;	GO:0051591~response to cAMP	8	44	18.1818181818182	0.0164006206093437	0.140658272669242	1	1	0.999999944778075	0.999999944778075	1
up	ST6GAL1; GATA3; POU2AF1; TREM2; JCHAIN;	GO:0006959~humoral immune response	5	58	8.62068965517241	0.0164493566106704	0.149342842912665	1	1	0.997267179759554	0.997267179759554	1
down	AKAP6; EIF4EBP2; KSR1; RAPGEF4; RIMS2; PCLO;	GO:0019933~cAMP-mediated signaling	6	27	22.2222222222222	0.0166268272798487	0.141527753527721	1	1	0.999999944778075	0.999999944778075	1
down	ERN1; ANXA1; MT1G; FLT4; KDR; MAP2K3;	GO:0035924~cellular response to vascular endothelial growth factor stimulus	6	27	22.2222222222222	0.0166268272798487	0.141527753527721	1	1	0.999999944778075	0.999999944778075	1
