DGE	Genes	Process~name	num_of_Genes	gene_group	percentage%	P-value	Benjamini and Hochberg (FDR)	 Hommel singlewise process	Bonferroni single-step process	Hommel singlewise process	Hochberg step-up process	Benjamini and Yekutieli
up	KRTAP5-8; KRT33A; KRT34; KRT37; KRT38; KRT75; KRT14; KRT6A; KRT6B; KRT18; KRT8; KRT16; KRT10; JUP; KRT4; CDH3; CASP14; KRT9; KRT20; KRT6C; KRT76; KRT17; KRTAP1-1; TGM3; PKP1; KRT33B; KRT32; DSC3; KRT31; KRT24; LCE3C; LCE3E; LCE1C; LCE3A; LCE5A; KRT40; KRT80; KRTAP5-10; KRTAP5-7; KRT27; DSG4; ABCA12; HRNR; KRT35; SPRR4; PKP2; KRTAP17-1; KRTAP9-4; KRTAP3-2; KRT84;	GO:0031424~keratinization	50	181	27.6243093922652	0.00014698601692475	0.11290625900063	0.789461896902859	0.790343813004408	0.78916792486901	0.789461896902859	1
up	PCDH17; PCDH7; CDH16; CEACAM5; CDH1; CEACAM6; PCDH1; CDH17; DSC3; DCHS2; SDK1; DSG4; CADM3; CDHR2; CDHR5; ROBO2; CDH22; PCDHB8; PCDHB10; PCDHGB4; PCDHA7; PCDHA6; PCDHA4; PCDHB7; PCDHB5; PCDHGC4; PCDHA9; PCDHA8; PCDHA5; PCDHA3; PCDHA2; PCDHA11; PCDHA10; PCDHAC2; ROBO1; CDH5; NECTIN4; CNTN4; CDH19; IGSF9; ROBO4; IGSF21; CDH26; CDH3; CDH8; CDH12;	GO:0007156~homophilic cell adhesion via plasma membrane adhesion molecules	46	165	27.8787878787879	0.00022186372541654	0.132551250173865	1	1	0.967291123318815	0.999999999962757	1
down	LILRA5; IFNG; SERPINE1; LPL; OSM; PLA2G2A; ITGA2; CEBPB; TNFRSF1A; TNFSF4; NFKBIA; AGTR1; SNCA; CCR2; CEBPA; STAT5B; NLRP12; S100A12; IL18; TNIP1; TLR9; TLR7;	GO:0050729~positive regulation of inflammatory response	22	78	28.2051282051282	0.0002610288346132	0.0554686273553068	1	1	0.851106774020959	0.999993099670534	0.509997679180346
down	PLAU; RNASE2; CXCL2; FPR1; CXCR2; PTAFR; L1CAM; OR1D2; CCR6; NCKAP1L; CCL23; CCL7; MAP2K1; MAPK14; CMTM8; MOSPD2; CMTM2; CMTM5; CMTM7; CMTM3; PROK2; CXCR3; CCR10; CCR8; CXCR5; CXCR1; XCR1; CCR2; CCR5;	GO:0006935~chemotaxis	29	122	23.7704918032787	0.00037313360467083	0.0713519488782719	1	1	0.914185839368517	0.999993099670534	0.656034412025737
down	MAFG; F8; F13A1; PLAU; SERPINA1; IFNA5; IFNB1; HBD; GP1BA; LYN; PRKAR1A; IRF2; GP9; GATA1; ITGA2; PRKACA; FCER1G; PRKAR2B; GP5; CAPZB; TFPI2; GNAQ; RAB27A; P2RX1; HBG1; HBG2; GNA12; JMJD1C; NFE2; CD177; F2RL3; P2RX7; VKORC1; EHD1; GP6; SERPINA10;	GO:0007596~blood coagulation	36	171	21.0526315789474	0.00059255600080554	0.109129063481688	1	1	0.971791841321092	0.999993099670534	1
up	DEFB4A; KRT6A; HRG; S100A9; S100A7; H2BFS; DEFB1; CXCL6; DEFA5; PGLYRP4; PGLYRP3; CCL13; CXCL9; CXCL1; DEFA6; CXCL10; SPAG11A; CXCL11; CXCL13; SPAG11B; REG1A; REG3A;	GO:0061844~antimicrobial humoral immune response mediated by antimicrobial peptide	22	62	35.4838709677419	0.00076807564262604	0.344161894200019	1	1	0.999999999962758	0.999999999962757	1
down	MT2A; MT1E; MT1F; MT1G; MT1H; MT1X; HIF1A; MT1L; ING4;	GO:0045926~negative regulation of growth	9	18	50	0.00079790070152741	0.138891122051825	1	1	0.999993099670535	0.999993099670534	1
down	HBZ; HBD; HBQ1; HBG1; HBG2; HBA1; HBM; CYGB;	GO:0015671~oxygen transport	8	14	57.1428571428571	0.00080978791112662	0.138891122051825	1	1	0.999993099670535	0.999993099670534	1
down	TMEM150B; ULK1; ITGB4; TFEB; DRD3; RGS19; DAP; GABARAPL2; RAB8A; SRPX; IRF8; USP10; RAB39A; TBC1D25; MAP1S; USP13; RAB24; OPTN; NRBF2; PHF23; MAP1LC3B; CHMP4B; EVA1A; TIGAR; TBC1D14; CD84; WDR45; PLEKHM1;	GO:0006914~autophagy	28	123	22.7642276422764	0.00082957593261723	0.138891122051825	1	1	0.999993099670535	0.999993099670534	1
up	UGT1A9; UGT1A1; UGT1A3; UGT1A7; UGT1A8; UGT1A6; UGT1A10;	GO:0052696~flavonoid glucuronidation	7	7	100	0.00087759663147402	0.362987468264293	1	1	0.999999999962758	0.999999999962757	1
down	SLIT2; PFN1; PFN2; PRKCD; FHOD3; TWF2; MYADM; FAM49B; KANK4;	GO:0030837~negative regulation of actin filament polymerization	9	19	47.3684210526316	0.00107347600261976	0.163265928818216	1	1	0.999993099670535	0.999993099670534	1
down	HP; HBZ; HBD; GPX1; HBQ1; ALOX5AP; GPX3; PTGS1; PRDX6; SESN2; HBG1; HBG2; HBA1; HBM; LOXHD1; GPX8; CYGB; PXDN; GSTK1; SESN1;	GO:0098869~cellular oxidant detoxification	20	77	25.974025974026	0.00115438029192139	0.167840818759623	1	1	0.999993099670535	0.999993099670534	1
down	ARVCF; SUSD5; NUAK1; MPDZ; CLSTN1; BMP10; FN1; APP; GP1BA; LAMB1; HCK; GP9; ITGB4; ITGA2; ITGB6; ACHE; LAMA1; L1CAM; THBS2; GP5; MCAM; PXN; CXCR3; CCR8; EPHB4; CDH11; RHOB; SRPX; COL7A1; ROM1; COL16A1; SPOCK1; MYBPH; SLAMF1; LAMC2; COL4A6; SELPLG; ADGRE1; FLOT2; FAT1; MYBPC3; COL19A1; MPZL3; CADM2; CD177; CD99L2; SEMA4D; FEZ1; FERMT1; BOC; STAB1; NTM; SIRPG; CTNNAL1; CD300A; CLEC4A; CTNND2; CLCA2; NINJ2; SIGLEC5; SIGLEC11; PCDHB13; PCDHB2; SIGLEC10; SIGLEC14; SIGLEC9; PCDHGC5; SIGLEC8; PCDHB16; SIGLEC7; ICAM3; SIGLECL1; NINJ1; PCDH8;	GO:0007155~cell adhesion	74	454	16.2995594713656	0.00144497628942497	0.204704974335204	1	1	0.999993099670535	0.999993099670534	1
down	TRPM2; LYN; GATA1; AXL; FLT3; LILRB1; BATF3;	GO:0097028~dendritic cell differentiation	7	12	58.3333333333333	0.00157908036937604	0.217809107794699	1	1	0.999993099670535	0.999993099670534	1
up	S100A8; EDN1; S100A9; SAA1; EDN3; CXADR; CXCL6; ITGA9; CCL1; CXCL9; CXCL1; CX3CL1; CCL13; CCL16; CCL14; CXCL10; CCL11; CCL26; CCL18; CCL19; CXCL13; CXCL11; CCL24; CCL2;	GO:0030593~neutrophil chemotaxis	24	76	31.5789473684211	0.00170774804808249	0.540150662031739	1	1	0.999999999962758	0.999999999962757	1
up	UGT1A9; UGT1A1; UGT1A7; UGT1A10; UGT1A8; PPARGC1A;	GO:0051552~flavone metabolic process	6	6	100	0.0020993644455044	0.627126812415399	1	1	0.999999999962758	0.999999999962757	1
up	UGT1A9; UGT1A1; UGT1A3; UGT1A7; UGT1A8; UGT1A10; UGT1A6;	GO:0052697~xenobiotic glucuronidation	7	9	77.7777777777778	0.00231292283452134	0.641857229311019	1	1	0.999999999962758	0.999999999962757	1
up	GXYLT2; GCNT3; MUC1; MUC5AC; MUC3A; MUC21; MUC17; MUC6; B3GNT6; GALNT5; MUC20; MUC15; GALNT4; MUC16; MUCL1; MUC4; MUC13; MUC12; A4GNT; B3GNT3;	GO:0016266~O-glycan processing	20	60	33.3333333333333	0.00238741762808636	0.641857229311019	1	1	0.999999999962758	0.999999999962757	1
up	ACKR2; CXCL11; CXCL10; CX3CL1; GPR17; ACKR1; ACKR4; CCL26; CCL2; CCL16; CCL11; CCL13; CXCL9; CCL1; CCL24; CCL14; TFF2; CXCL1; CXCL13; CXCL6; CCL18; CCL19;	GO:0070098~chemokine-mediated signaling pathway	22	70	31.4285714285714	0.00272681614549031	0.675965074183423	1	1	0.999999999962758	0.999999999962757	1
down	APOA2; ELANE; SYK; TLR8; TLR7; PRG3; TLR9;	GO:0045416~positive regulation of interleukin-8 biosynthetic process	7	15	46.6666666666667	0.00410042783638065	0.435670457615444	1	1	0.999993099670535	0.999993099670534	1
down	ARPC2; WNT1; RAC2; CLRN1; ACTR2; FSCN1; TWF2; FRMD7; AKIRIN1;	GO:0010592~positive regulation of lamellipodium assembly	9	25	36	0.00473203529107191	0.475354454239497	1	1	0.999993099670535	0.999993099670534	1
down	MT2A; MT1E; MT1F; MT1G; GLRA2; TSPO; MT1H; MT1X; MT1L;	GO:0071294~cellular response to zinc ion	9	25	36	0.00473203529107191	0.475354454239497	1	1	0.999993099670535	0.999993099670534	1
down	ANXA2P2; GRIN3B; TRPA1; TRPM2; OPRM1; TRPC1; FKBP1A; ASIC1; CACNG1; TRPC3; CACNA2D3; MCOLN3; ORAI2; P2RX7; ORAI3; CACNG6; MCOLN1; P2RY12; TRPV5; PKD2L2; TRPM5; CACNG4; TRPC5; SLC24A5;	GO:0070588~calcium ion transmembrane transport	24	115	20.8695652173913	0.00487417871685158	0.480889953760804	1	1	0.999993099670535	0.999993099670534	1
up	CES2; UGT1A9; AKR7A3; CYP2E1; SULT1A3; CYP2C8; CYP2C9; UGT1A6; AOC1; AADAC; CYP2F1; FMO3; CYP2C18; CYP2C19; HNF4A; RORC; UGT2B15; FMO1; CES3; AKR7L; ACY3; GSTA1; CYP2S1; GSTA3; CYP2R1; GSTA2;	GO:0006805~xenobiotic metabolic process	26	94	27.6595744680851	0.00507462082572296	0.832876907466295	1	1	0.999999999962758	0.999999999962757	1
up	CES2; PTGES; HPGDS; GSTA1; HPGD; AKR1C3; CYP4F8; PTGR2; CYP2S1;	GO:0006693~prostaglandin metabolic process	9	18	50	0.00511780611019697	0.832876907466295	1	1	0.999999999962758	0.999999999962757	1
down	MT1X; MT1E; MT2A; MT1H; MT1F; MT1L; MT1G;	GO:0010273~detoxification of copper ion	7	16	43.75	0.00539792003362805	0.497058469763249	1	1	0.999993099670535	0.999993099670534	1
down	TYROBP; CTLA4; FCGR2B; MNDA; CD300A; LYN; TNFRSF13B;	GO:0030889~negative regulation of B cell proliferation	7	16	43.75	0.00539792003362805	0.497058469763249	1	1	0.999993099670535	0.999993099670534	1
down	WNT1; GADD45A; GRB2; MAPK14; CEP63; STK33;	GO:0042770~signal transduction in response to DNA damage	6	12	50	0.00604434500686379	0.53862913166004	1	1	0.999993099670535	0.999993099670534	1
down	PCDH8; POMC; TSHB; PDGFA; WNT1; INHBA; AR; PTHLH; GATA1; GJA1; SSTR3; CD70; NAMPT; XCL1; FASLG; LHX1; INSL3; CCR5; CCL23; GRB2; CCL7; CRB1; KLF10; GRAP; IL18; FAT1; EFNB3; ZYX; LILRB2; FCRL2; IL26; STAB1; SIRPG; TRHDE; HCN2; ADRA1D; OR56A1; FGFBP2; DRD3; PANX2;	GO:0007267~cell-cell signaling	40	230	17.3913043478261	0.00640367671099584	0.561592282988127	1	1	0.999993099670535	0.999993099670534	1
up	SPINK4; CST8; PTTG1; C3; CST1; SLPI; C4B; SPINK8; TFPI; PI3; SERPINB3; RARRES1; SPINK7; WFDC2; CST9; SPINT4; C3P1; ITIH5; WFDC5; WFDC12; CSTL1; WFDC1; FETUB; SERPINB13; AGT; SERPINI2; TIMP4; SERPINB7; SERPINB4; HRG; AHSG; SERPINB2; KNG1; SERPINB12; SERPINB5; SERPINB11;	GO:0010951~negative regulation of endopeptidase activity	36	148	24.3243243243243	0.00669045334404272	0.832876907466295	1	1	0.999999999962758	0.999999999962757	1
up	COL6A6; COL6A5; CHL1; ISLR; NCAN; RS1; EFS; NRP2; NPHS1; CNTN5; ITGBL1; SPP1; HAPLN1; COL6A1; COL6A2; CCL2; VCAM1; MAG; KITLG; CD9; CDH3; NME2; AZGP1; ITGB8; DPP4; ITGAE; COL15A1; CCL11; EMP2; SLURP1; MFAP4; CDH8; LGALS4; CLDN10; CX3CL1; TNFAIP6; DPT; LGALS3BP; TROAP; CNTN1; CDH17; FAP; MSLN; LSAMP; MADCAM1; ITGA9; PKP1; NID2; LY6D; HABP2; DSC3; POSTN; CDSN; FLG2; HES5; GRHL2; AMTN; EGFL6; IZUMO1; SPACA4; MUC16; AMELX; OMD; CDHR5; ROBO1; PCDHB8; PCDH17; PCDHA3; PCDH1; CDH16; PCDHA7; PCDHA10; PCDHAC2; PCDHA11; SIGLEC6; PCDH7; PCDHA5; PCDHB5; PARD3B; PCDHA9; PCDHB10; PCDHGB4; PCDHB7; SPON1; PCDHA4; PCDHA2; PCDHGC4; GPNMB; PCDHA8; PCDHA6;	GO:0007155~cell adhesion	90	454	19.8237885462555	0.00766706884966062	0.832876907466295	1	1	0.999999999962758	0.999999999962757	1
down	PCMT1; MSRB3; MSRB1; MSRA;	GO:0030091~protein repair	4	5	80	0.00798008885631796	0.583981590538653	1	1	0.999993099670535	0.999993099670534	1
down	CCS; FOXO3; SOD2; GPX1; HSPA1A; G6PD; GPX3; PRDX6; SNCA; ETV5; ALDH3B1; AIF1; RBM11; SESN2; DHRS2; NCF4; GPX8; ERO1A; PINK1; MSRA;	GO:0034599~cellular response to oxidative stress	20	94	21.2765957446809	0.00803171877368902	0.583981590538653	1	1	0.999993099670535	0.999993099670534	1
down	MAP1LC3A; GABARAP; NPRL2; MAP1LC3B; GABARAPL2; MAP1LC3B2;	GO:0006995~cellular response to nitrogen starvation	6	13	46.1538461538462	0.00810523637801319	0.583981590538653	1	1	0.999993099670535	0.999993099670534	1
up	AURKA; TTK; KIF11; ASPM; AURKB; SPAG5; CEP72; KNSTRN;	GO:0007051~spindle organization	8	16	50	0.0081742635252483	0.832876907466295	1	1	0.999999999962758	0.999999999962757	1
up	EDN1; HTR1A; EDN3; EDNRB; EDNRA; HTR1D; HTR2B; TRPM4;	GO:0042310~vasoconstriction	8	16	50	0.0081742635252483	0.832876907466295	1	1	0.999999999962758	0.999999999962757	1
up	TCF21; LIF; ID1; FOXF1; STRA6;	GO:0060426~lung vasculature development	5	6	83.3333333333333	0.00833479422939365	0.832876907466295	1	1	0.999999999962758	0.999999999962757	1
down	PPP1R3D; PYGL; PPP1R2; GSK3A; PPP1CA; PPP1R1A; PPP1R3B; STK40; PPP1R2P1;	GO:0005977~glycogen metabolic process	9	28	32.1428571428571	0.00856626894482337	0.583981590538653	1	1	0.999993099670535	0.999993099670534	1
down	FN1; LAMB1; INHBA; MMP8; HMGA2; COL7A1; LAMB3; LAMA3; MIXL1;	GO:0035987~endodermal cell differentiation	9	28	32.1428571428571	0.00856626894482337	0.583981590538653	1	1	0.999993099670535	0.999993099670534	1
down	STAT5B; NCKAP1L; PMAIP1; SPNS2; P2RX7; GPR174; SLC46A2; SIT1; PPP2R3C;	GO:0043029~T cell homeostasis	9	28	32.1428571428571	0.00856626894482337	0.583981590538653	1	1	0.999993099670535	0.999993099670534	1
down	GRIN3B; GNAI2; GJA1; RCVRN; OPRD1; P2RX1; RHOA; CAMK2B; P2RY12;	GO:0051924~regulation of calcium ion transport	9	28	32.1428571428571	0.00856626894482337	0.583981590538653	1	1	0.999993099670535	0.999993099670534	1
up	NPPA; EDN1; EDN3; HRC; SLC1A1; NMU; RGS4; TRPM4; HEY2;	GO:0010460~positive regulation of heart rate	9	20	45	0.00861417607166093	0.832876907466295	1	1	0.999999999962758	0.999999999962757	1
down	PLEK; VIL1; CFL1; PDXP; WDR1;	GO:0030836~positive regulation of actin filament depolymerization	5	9	55.5555555555556	0.0087729361112594	0.583981590538653	1	1	0.999993099670535	0.999993099670534	1
down	SASH1; LY86; SCIMP; CD180; LY96;	GO:0031666~positive regulation of lipopolysaccharide-mediated signaling pathway	5	9	55.5555555555556	0.0087729361112594	0.583981590538653	1	1	0.999993099670535	0.999993099670534	1
down	PXDN; MEGF9; LAMB4; LAMB3; LAMB1;	GO:0070831~basement membrane assembly	5	9	55.5555555555556	0.0087729361112594	0.583981590538653	1	1	0.999993099670535	0.999993099670534	1
down	GJA1; KCNA5; GJC1; KCNQ1; KCNE5;	GO:0086014~atrial cardiac muscle cell action potential	5	9	55.5555555555556	0.0087729361112594	0.583981590538653	1	1	0.999993099670535	0.999993099670534	1
down	ARPC2; VIL1; AIF1; CORO7; ARPC4; LMOD2; CATIP; MSRB1; WASF3;	GO:0030041~actin filament polymerization	9	29	31.0344827586207	0.0102609288453409	0.607390697723377	1	1	0.999993099670535	0.999993099670534	1
up	TNFRSF11B; NCAN; ITGA10; COL3A1; DCN; SPP1; HAPLN1; COL6A1; COL6A2; CDH1; ELN; VCAM1; FBLN1; COL8A2; ITGB8; LOX; SERPINB5; ITGAE; LUM; COL4A4; ITGA8; WNT3A; FOXF1; FOXF2; MFAP5; MADCAM1; ITGA9; NID2; COL13A1; EGFLAM; OLFML2A; VWA1; NPNT; ADAMTSL2; EGFL6; KAZALD1; SMOC2; ADAMTS9; MMP11; MMP27; COL23A1; COL15A1; MMP12; ECM2; MMP7; MMP1; MMP28; MMP3; MMP19; POSTN;	GO:0030198~extracellular matrix organization	50	230	21.7391304347826	0.010365543148433	0.832876907466295	1	1	0.999999999962758	0.999999999962757	1
down	SLIT3; SLIT2; BMP10; WNT11; TGFB1; CRYAB; INHBA; HSPA1A; GJA1; DNAJB2; CDA; CDKN1A; PPT1; CDKN2D; SESN2; TGFB2; CCDC85B; CRLF3; ADIPOR1; SIPA1; DCBLD2; DCSTAMP; SERTAD3; GDF2;	GO:0030308~negative regulation of cell growth	24	124	19.3548387096774	0.0106090023671327	0.607390697723377	1	1	0.999993099670535	0.999993099670534	1
up	CA2; KRT6A; KRT16; SERPINB5; RIPK4; TBX4; CA9; TBX5;	GO:0002009~morphogenesis of an epithelium	8	17	47.0588235294118	0.0106869485794717	0.832876907466295	1	1	0.999999999962758	0.999999999962757	1
up	AQP7; AQP1; AQP2; AQP5; AQP4; PDZD3; AQP11; AQP3;	GO:0006833~water transport	8	17	47.0588235294118	0.0106869485794717	0.832876907466295	1	1	0.999999999962758	0.999999999962757	1
down	PF4; ARG1; BCL3; IRF8; IRF4; BATF; MYD88; GBP7;	GO:0042832~defense response to protozoan	8	24	33.3333333333333	0.0108945521663256	0.607390697723377	1	1	0.999993099670535	0.999993099670534	1
up	CYP2C8; FMO1; CYP2F1; CYP2C19; CYP2E1; CYP2S1; CYP2C9; CYP2C18; CYP2R1;	GO:0006082~organic acid metabolic process	9	21	42.8571428571429	0.0109258272227682	0.832876907466295	1	1	0.999999999962758	0.999999999962757	1
up	CYP1A1; CYP2C8; CYP2C9; CYP2C19; CYP4A11; CYP2E1; CYP2S1; CYP2F1; CYP2C18;	GO:0019373~epoxygenase P450 pathway	9	21	42.8571428571429	0.0109258272227682	0.832876907466295	1	1	0.999999999962758	0.999999999962757	1
down	TERT; FOXO3; BNIP3L; HMOX1; PTN; AK4; MPL; OPRD1; ACAA2; BNIP3; PMAIP1; HIF1A; CARD16; VASN; ERO1A; SCN2A; PINK1; HIPK2; RGCC; TIGAR; B3GAT1; HILPDA;	GO:0071456~cellular response to hypoxia	22	111	19.8198198198198	0.0111965510695873	0.607390697723377	1	1	0.999993099670535	0.999993099670534	1
up	FGF10; SPRY2; RAMP3; APOE; NTRK1; BMP2; BMP4; MIF; DRD2; ALOX15; ADCYAP1; FGFR3; FSHR; S100A7; CHRNA7; THPO; CASR; HTR2B; GATA4; P2RY1; CX3CL1; GPNMB; P2RY6; SYT14P1; FFAR4; NPNT; SLC30A10; GCNT2; CCL19; GAREM1; FGF20; NOX4; FGF21; TREM2; CCL11; CCL1; HMGB1P1; CCL24; CCL14; ROR2; CCL2; CCL13; CCL26; NTRK2; CCL18; CCL16;	GO:0070374~positive regulation of ERK1 and ERK2 cascade	46	209	22.0095693779904	0.0112906687436657	0.832876907466295	1	1	0.999999999962758	0.999999999962757	1
up	CYP1A1; CYP2C8; CYP2C9; CYP2C19; CYP4A11; CYP4A22;	GO:0097267~omega-hydroxylase P450 pathway	6	10	60	0.0115162904183659	0.832876907466295	1	1	0.999999999962758	0.999999999962757	1
down	AFP; CYP17A1; STAT5B; DHRS9; AKR1C4;	GO:0042448~progesterone metabolic process	5	10	50	0.0121031226353436	0.607390697723377	1	1	0.999993099670535	0.999993099670534	1
down	CHMP2A; FURIN; UBB; UBC; CHMP6; CHMP4B; MVB12B; UBAP1; VPS28;	GO:0019058~viral life cycle	9	30	30	0.012195542463934	0.607390697723377	1	1	0.999993099670535	0.999993099670534	1
down	PIM1; GJA1; SNCA; ACTB;	GO:0022898~regulation of transmembrane transporter activity	4	6	66.6666666666667	0.0122686611089526	0.607390697723377	1	1	0.999993099670535	0.999993099670534	1
down	YWHAB; DBN1; GET4; DZIP1;	GO:0051220~cytoplasmic sequestering of protein	4	6	66.6666666666667	0.0122686611089526	0.607390697723377	1	1	0.999993099670535	0.999993099670534	1
down	WWP2; SNX3; PPM1F; NDFIP1;	GO:0051224~negative regulation of protein transport	4	6	66.6666666666667	0.0122686611089526	0.607390697723377	1	1	0.999993099670535	0.999993099670534	1
down	ACOD1; CD14; FCGR2B; FAM49B;	GO:0071219~cellular response to molecule of bacterial origin	4	6	66.6666666666667	0.0122686611089526	0.607390697723377	1	1	0.999993099670535	0.999993099670534	1
down	PFN1; CTNNA2; PFN2; WASF3;	GO:0098885~modification of postsynaptic actin cytoskeleton	4	6	66.6666666666667	0.0122686611089526	0.607390697723377	1	1	0.999993099670535	0.999993099670534	1
up	MESP1; GATA5; ROBO2; ROBO1;	GO:0035481~positive regulation of Notch signaling pathway involved in heart induction	4	4	100	0.0125073815495166	0.832876907466295	1	1	0.999999999962758	0.999999999962757	1
up	KRT14; PKP1; PKP2; EPPK1;	GO:0045110~intermediate filament bundle assembly	4	4	100	0.0125073815495166	0.832876907466295	1	1	0.999999999962758	0.999999999962757	1
up	AQP7; AQP1; AQP2; AQP11; AQP3;	GO:0015793~glycerol transport	5	7	71.4285714285714	0.0127886726464593	0.832876907466295	1	1	0.999999999962758	0.999999999962757	1
up	KIF4A; KIF23; KIF4B; AURKB; RACGAP1;	GO:0051256~mitotic spindle midzone assembly	5	7	71.4285714285714	0.0127886726464593	0.832876907466295	1	1	0.999999999962758	0.999999999962757	1
up	NEK2; SPAG5; RACGAP1; ECT2; KNSTRN;	GO:0051988~regulation of attachment of spindle microtubules to kinetochore	5	7	71.4285714285714	0.0127886726464593	0.832876907466295	1	1	0.999999999962758	0.999999999962757	1
up	EDN1; DRD2; NPR1; EDNRB; BTC; TFAP2B; HAS2;	GO:0035810~positive regulation of urine volume	7	14	50	0.0131383277520842	0.832876907466295	1	1	0.999999999962758	0.999999999962757	1
down	DBH; CRHBP; OPRM1; UNC79; DRD3; OR56A1;	GO:0048149~behavioral response to ethanol	6	15	40	0.0136549549835103	0.607390697723377	1	1	0.999993099670535	0.999993099670534	1
up	FGF10; MET; GLI2; BMP4; BMP7; HNF1B; CASR; SHH; RASIP1;	GO:0048754~branching morphogenesis of an epithelial tube	9	22	40.9090909090909	0.0136722913864521	0.832876907466295	1	1	0.999999999962758	0.999999999962757	1
up	FGF10; TCF21; HNF1B; FOXF1; IHH; SHH; OVOL2; SIX2;	GO:0048557~embryonic digestive tract morphogenesis	8	18	44.4444444444444	0.0137275260501424	0.832876907466295	1	1	0.999999999962758	0.999999999962757	1
down	YBX3; ZFP36; MAPK14; MYD88; DAZL; RBM38; RBM24;	GO:0070935~3'-UTR-mediated mRNA stabilization	7	20	35	0.0137769807396372	0.607390697723377	1	1	0.999993099670535	0.999993099670534	1
up	NDC80; BIRC5; SLC25A5; TOP2A; CENPF; NEK2; CENPE; CENPW; SGO1; CDCA2; HJURP; SKA2; SKA1; SPAG5; NUF2; SPC25; KNSTRN; BANF2; OIP5; TTK;	GO:0007059~chromosome segregation	20	73	27.3972602739726	0.0139204458780623	0.832876907466295	1	1	0.999999999962758	0.999999999962757	1
down	FCER1G; SYK; P2RX1;	GO:0002554~serotonin secretion by platelet	3	3	100	0.0153339525892733	0.607390697723377	1	1	0.999993099670535	0.999993099670534	1
down	LYN; LILRB2; LILRB1;	GO:0002774~Fc receptor mediated inhibitory signaling pathway	3	3	100	0.0153339525892733	0.607390697723377	1	1	0.999993099670535	0.999993099670534	1
down	GRN; FCGR2B; CD300A;	GO:1902564~negative regulation of neutrophil activation	3	3	100	0.0153339525892733	0.607390697723377	1	1	0.999993099670535	0.999993099670534	1
down	LILRA5; LILRB1; TLR8;	GO:2001183~negative regulation of interleukin-12 secretion	3	3	100	0.0153339525892733	0.607390697723377	1	1	0.999993099670535	0.999993099670534	1
down	FFAR1; HCRT; S1PR4; OXT; PDGFRA; GJA1; AGTR1; ADM; AVPR1A; PTK2B; PROK2; TRPC5; FIS1; PTGDR; ADRA1D; CCR10; CXCR2; CXCR3; CCR8; CCR6; XCR1; CCR5; FPR1; CXCR5; CCR2; PTGFR; CXCR1;	GO:0007204~positive regulation of cytosolic calcium ion concentration	27	150	18	0.0153921289046094	0.607390697723377	1	1	0.999993099670535	0.999993099670534	1
down	IFNG; TNFSF4; CD40LG; IRF8; IRF5; IL23R; SCIMP; TLR9;	GO:0032735~positive regulation of interleukin-12 production	8	26	30.7692307692308	0.01575601072366	0.607390697723377	1	1	0.999993099670535	0.999993099670534	1
up	FSHR; IRX5; RDH10; WDR19; OSR1; SALL1;	GO:0008406~gonad development	6	11	54.5454545454545	0.015889998744121	0.832876907466295	1	1	0.999999999962758	0.999999999962757	1
down	NRG2; TGFB1; PDGFA; GPX1; CSF3; OSM; RAC2; CD19; PDGFRA; CD80; CHI3L1; FGF8; GRB2; RHOG; IL18; ANGPT1; TNFAIP8L3; TRAT1; EPGN; PIK3R5; RASD2; MEIS3; PINK1; OSBPL8; P2RY12; IL26; HPSE; ICOS; AXL;	GO:0051897~positive regulation of protein kinase B signaling	29	165	17.5757575757576	0.0160855116698113	0.607390697723377	1	1	0.999993099670535	0.999993099670534	1
down	SDCBP; LRPAP1; ANKRD13D; ANKRD13A; WDR54;	GO:0002091~negative regulation of receptor internalization	5	11	45.4545454545455	0.0161957677709503	0.607390697723377	1	1	0.999993099670535	0.999993099670534	1
down	INHBA; ITGB4; ITGA2; ITGA3; HMGA2;	GO:0048333~mesodermal cell differentiation	5	11	45.4545454545455	0.0161957677709503	0.607390697723377	1	1	0.999993099670535	0.999993099670534	1
down	DHRS12; ASPDH; MOXD2P; SDR42E2; QSOX1; CYB561D2; CCS; ALDH1L1; KDM4B; FADS2; F8; FTH1; SOD2; CYP17A1; TH; CYP3A4; DBH; G6PD; BCKDHA; CYP11B1; NQO1; NQO2; IMPDH1; GPX3; CYP7A1; PTGS1; TBXAS1; ACADL; PRDX6; BLVRB; GMPR; SNCA; DCT; ALDH3B1; ALDH5A1; PGD; BLVRA; CYP27A1; AOX1; CYP4F3; SELENBP1; DHRS2; KCNAB1; LBR; CRYM; NCF4; JMJD1C; CYP27C1; TP53I3; DHRS13; CYP26C1; HSDL2; CYB5R4; LOXHD1; MSRB3; FADS6; GPX8; PXDN; DIO2; ERO1A; HSD17B10; DHRS9; VKORC1; PECR; EGLN1; TMX4; SMOX; STAB1; MSRB1; MSRA; GSTK1; DHRS7; SESN1; CYP2A7; CYP2U1; CYP2A6;	GO:0055114~oxidation-reduction process	76	526	14.4486692015209	0.0163581747172767	0.607390697723377	1	1	0.999993099670535	0.999993099670534	1
down	TYROBP; IFNG; APP; AZU1; TNFRSF8; CCR2; SYK;	GO:0042535~positive regulation of tumor necrosis factor biosynthetic process	7	21	33.3333333333333	0.0168376591058362	0.607390697723377	1	1	0.999993099670535	0.999993099670534	1
down	WNT7A; TGFB1; INHBA; NFKBIA; AGTR1; NR1H2;	GO:0032270~positive regulation of cellular protein metabolic process	6	16	37.5	0.0172379026637005	0.607390697723377	1	1	0.999993099670535	0.999993099670534	1
up	AGT; KNG1; APOE; DRD1; EDNRB; NOS3; NOS1; CASR;	GO:0042311~vasodilation	8	19	42.1052631578947	0.0173526712879103	0.832876907466295	1	1	0.999999999962758	0.999999999962757	1
down	ZFP36; MAP2K3; MAPK14; MAP3K5;	GO:0038066~p38MAPK cascade	4	7	57.1428571428571	0.017790045982556	0.607390697723377	1	1	0.999993099670535	0.999993099670534	1
down	SYK; STAT5B; NCKAP1L; SOX4;	GO:0045588~positive regulation of gamma-delta T cell differentiation	4	7	57.1428571428571	0.017790045982556	0.607390697723377	1	1	0.999993099670535	0.999993099670534	1
down	FCGR2B; GPS2; FCRL3; CD300A;	GO:0050859~negative regulation of B cell receptor signaling pathway	4	7	57.1428571428571	0.017790045982556	0.607390697723377	1	1	0.999993099670535	0.999993099670534	1
down	OPRD1; ABTB2; PINK1; FIS1;	GO:0097237~cellular response to toxic substance	4	7	57.1428571428571	0.017790045982556	0.607390697723377	1	1	0.999993099670535	0.999993099670534	1
down	BNIP3; HIF1A; CAMKK2; FBXO7;	GO:1903599~positive regulation of autophagy of mitochondrion	4	7	57.1428571428571	0.017790045982556	0.607390697723377	1	1	0.999993099670535	0.999993099670534	1
up	SULT1C2; INMT; CYP1A1; VCAM1; AOC1;	GO:0009308~amine metabolic process	5	8	62.5	0.0186093111142458	0.832876907466295	1	1	0.999999999962758	0.999999999962757	1
up	IGFBP2; IGFBP4; IGFBP3; IGFBP6; IGFBP5;	GO:0043567~regulation of insulin-like growth factor receptor signaling pathway	5	8	62.5	0.0186093111142458	0.832876907466295	1	1	0.999999999962758	0.999999999962757	1
up	IL17A; IL17RE; IL17F; IL25; IL17RB;	GO:0097400~interleukin-17-mediated signaling pathway	5	8	62.5	0.0186093111142458	0.832876907466295	1	1	0.999999999962758	0.999999999962757	1
down	IFNG; APP; AZU1; SNCA; NAMPT; AIF1; TLR8; TLR7;	GO:0001774~microglial cell activation	8	27	29.6296296296296	0.0186998186375237	0.607390697723377	1	1	0.999993099670535	0.999993099670534	1
down	ACOD1; NQO2; GADD45A; TSPO; AGTR1; CDKN1A; GRB2; MAPK14;	GO:2000379~positive regulation of reactive oxygen species metabolic process	8	27	29.6296296296296	0.0186998186375237	0.607390697723377	1	1	0.999993099670535	0.999993099670534	1
up	ODAM; APOL1; SLC34A2; TSPAN15; PLG; C3; KNG1; NPPA; PENK; APOA1; APOE; AHSG; MMP1; IGF1; APOA4; CTSG; LTA4H; PGA3; PGA5; SAA1; SPP1; SFTPC; BMP4; IGFBP3; IGFBP2; IGFBP4; HRC; IGFBP6; IGFBP5; MSLN; SPARCL1; NOTUM; VWA1; AMTN; HIST2H3A; SFTPA2; SFTPA1; GOLM1; GATA6; AMELX; LMCD1; DMBT1; SNCAIP;	GO:0044267~cellular protein metabolic process	43	200	21.5	0.0189336994745997	0.832876907466295	1	1	0.999999999962758	0.999999999962757	1
up	EDN1; TFPI; CCL2; CD40; PCK1; HYAL1; IL17A; PTGIS; ZC3H12A; SFRP1; HAS2; CCL16; CCL13; CCL14; CCL26; CX3CL1; CCL11; CCL24; CCL18; CCL1; CCL19;	GO:0071347~cellular response to interleukin-1	21	81	25.9259259259259	0.0192037655465863	0.832876907466295	1	1	0.999999999962758	0.999999999962757	1
up	ANG; MOGAT2; MOGAT1; PLCE1;	GO:0006651~diacylglycerol biosynthetic process	4	5	80	0.0202402140783775	0.832876907466295	1	1	0.999999999962758	0.999999999962757	1
up	APOE; EDN1; MIF; EDNRB;	GO:0032269~negative regulation of cellular protein metabolic process	4	5	80	0.0202402140783775	0.832876907466295	1	1	0.999999999962758	0.999999999962757	1
