down	ACAA1; CYP4F2; ACOT4; SLC27A6;	GO:0000038~very long-chain fatty acid metabolic process	4	14	28.5714285714286	0.0244482554886489	0.164409442900535	1	1	0.999999944778075	0.999999944778075	1
down	ZFAND5; FLT4; YWHAZ; STK40;	GO:0003016~respiratory system process	4	14	28.5714285714286	0.0244482554886489	0.164409442900535	1	1	0.999999944778075	0.999999944778075	1
down	GLUD2; ALDH5A1; ALDH18A1; AADAT;	GO:0006536~glutamate metabolic process	4	14	28.5714285714286	0.0244482554886489	0.164409442900535	1	1	0.999999944778075	0.999999944778075	1
down	MT2A; ATP7A; SLC31A1; ATOX1;	GO:0006878~cellular copper ion homeostasis	4	14	28.5714285714286	0.0244482554886489	0.164409442900535	1	1	0.999999944778075	0.999999944778075	1
down	SLITRK5; HPRT1; APRT; AVPR1A;	GO:0007625~grooming behavior	4	14	28.5714285714286	0.0244482554886489	0.164409442900535	1	1	0.999999944778075	0.999999944778075	1
down	PDK1; MAP3K5; GSKIP; STK24;	GO:0008631~intrinsic apoptotic signaling pathway in response to oxidative stress	4	14	28.5714285714286	0.0244482554886489	0.164409442900535	1	1	0.999999944778075	0.999999944778075	1
down	FUT3; ST3GAL4; ST6GALNAC1; B3GALNT1;	GO:0009312~oligosaccharide biosynthetic process	4	14	28.5714285714286	0.0244482554886489	0.164409442900535	1	1	0.999999944778075	0.999999944778075	1
down	QSOX1; HMOX1; LRRK2; PINK1;	GO:0016242~negative regulation of macroautophagy	4	14	28.5714285714286	0.0244482554886489	0.164409442900535	1	1	0.999999944778075	0.999999944778075	1
down	B4GALT5; NKX6-2; B4GALT6; MYRF;	GO:0022010~central nervous system myelination	4	14	28.5714285714286	0.0244482554886489	0.164409442900535	1	1	0.999999944778075	0.999999944778075	1
down	ZPR1; ERN1; PIK3R1; SLC38A2;	GO:0033120~positive regulation of RNA splicing	4	14	28.5714285714286	0.0244482554886489	0.164409442900535	1	1	0.999999944778075	0.999999944778075	1
down	TNF; ALOX5; NR1D1; RORC;	GO:0045598~regulation of fat cell differentiation	4	14	28.5714285714286	0.0244482554886489	0.164409442900535	1	1	0.999999944778075	0.999999944778075	1
down	FOXP2; ZFAND5; DLG1; TIPARP;	GO:0048745~smooth muscle tissue development	4	14	28.5714285714286	0.0244482554886489	0.164409442900535	1	1	0.999999944778075	0.999999944778075	1
down	UGT2B7; UGT1A1; UGT1A7; UGT1A10;	GO:0052695~cellular glucuronidation	4	14	28.5714285714286	0.0244482554886489	0.164409442900535	1	1	0.999999944778075	0.999999944778075	1
down	SCNN1B; SCNN1G; CYP4F2; TFAP2B;	GO:0055078~sodium ion homeostasis	4	14	28.5714285714286	0.0244482554886489	0.164409442900535	1	1	0.999999944778075	0.999999944778075	1
down	AFDN; RAP2B; TJP1; RAB1B;	GO:0090557~establishment of endothelial intestinal barrier	4	14	28.5714285714286	0.0244482554886489	0.164409442900535	1	1	0.999999944778075	0.999999944778075	1
down	ATF4; MAPK3; ID1; LRRK2;	GO:1903351~cellular response to dopamine	4	14	28.5714285714286	0.0244482554886489	0.164409442900535	1	1	0.999999944778075	0.999999944778075	1
down	TRA2B; TUBB2B; TBC1D23; CC2D2A;	GO:1990403~embryonic brain development	4	14	28.5714285714286	0.0244482554886489	0.164409442900535	1	1	0.999999944778075	0.999999944778075	1
up	GRK5; FRMPD1; RASGRP4; RGS18;	GO:0008277~regulation of G protein-coupled receptor signaling pathway	4	43	9.30232558139535	0.024575807855103	0.188414526889123	1	1	0.997267179759554	0.997267179759554	1
up	CLEC4G; VTCN1; MAD1L1; PDCD1LG2;	GO:0042130~negative regulation of T cell proliferation	4	43	9.30232558139535	0.024575807855103	0.188414526889123	1	1	0.997267179759554	0.997267179759554	1
down	NUPR1; EIF4E; NAMPT; EIF4G2; GOLGA2; TAB3; TAB2; DAPL1;	GO:0010507~negative regulation of autophagy	8	48	16.6666666666667	0.024779610494705	0.165935782963042	1	1	0.999999944778075	0.999999944778075	1
up	TLR4; CD14; ITGAM; BTK; LY96;	GO:0097190~apoptotic signaling pathway	5	65	7.69230769230769	0.024796913727029	0.189583052317451	1	1	0.997267179759554	0.997267179759554	1
down	BPGM; ELN; SFTPD; HNMT; CYSLTR1; MAFB;	GO:0007585~respiratory gaseous exchange by respiratory system	6	30	20	0.0248801226880554	0.165935782963042	1	1	0.999999944778075	0.999999944778075	1
down	PGA3; PGA5; AKR1C2; AKR1C1; ADM2; CYP39A1;	GO:0007586~digestion	6	30	20	0.0248801226880554	0.165935782963042	1	1	0.999999944778075	0.999999944778075	1
down	UNC13B; PPFIA4; GJA1; SLC1A3; VAMP2; SLC38A2;	GO:0014047~glutamate secretion	6	30	20	0.0248801226880554	0.165935782963042	1	1	0.999999944778075	0.999999944778075	1
down	LMAN1; MGAT5; MCFD2; STT3B; OSTC; UBE2J1;	GO:0018279~protein N-linked glycosylation via asparagine	6	30	20	0.0248801226880554	0.165935782963042	1	1	0.999999944778075	0.999999944778075	1
down	ACAT1; NAMPT; RORC; OXCT1; AMER1; SLC25A25;	GO:0060612~adipose tissue development	6	30	20	0.0248801226880554	0.165935782963042	1	1	0.999999944778075	0.999999944778075	1
down	TF; CTSH; MAPK3; KDR; YWHAZ; MAP2K1;	GO:0070371~ERK1 and ERK2 cascade	6	30	20	0.0248801226880554	0.165935782963042	1	1	0.999999944778075	0.999999944778075	1
up	ALDH1A2; NKX3-2; MSLN;	GO:0031016~pancreas development	3	24	12.5	0.0250761351014817	0.190661523085646	1	1	0.997267179759554	0.997267179759554	1
up	LTA4H; ALOX15; LTC4S;	GO:0042759~long-chain fatty acid biosynthetic process	3	24	12.5	0.0250761351014817	0.190661523085646	1	1	0.997267179759554	0.997267179759554	1
down	ABLIM1; ABLIM3; SNAP29; ACTR3; KIF27; TMEM17; NUDCD3; SPAG16; FOXJ1; FOPNL; FHDC1; WWTR1; ARL6; RAB17; EHD1; CC2D2A; ATXN10; RABL2B; CEP83; ATP6V1D; TEKT4;	GO:0060271~cilium assembly	21	187	11.2299465240642	0.0251046184733555	0.167236289219098	1	1	0.999999944778075	0.999999944778075	1
down	SOCS6; RGS10; RGS11; PTK6; RGS7BP; PAK1IP1; RGS17;	GO:0009968~negative regulation of signal transduction	7	39	17.9487179487179	0.0253860280258815	0.167926946182873	1	1	0.999999944778075	0.999999944778075	1
down	EPS15; ARL4C; SNX17; DENND1B; RAB17; EHD1; SNX3;	GO:0032456~endocytic recycling	7	39	17.9487179487179	0.0253860280258815	0.167926946182873	1	1	0.999999944778075	0.999999944778075	1
down	RGS14; HMGCR; GBA; LYN; GSTP1; DUSP1; SPRY1;	GO:0043407~negative regulation of MAP kinase activity	7	39	17.9487179487179	0.0253860280258815	0.167926946182873	1	1	0.999999944778075	0.999999944778075	1
down	SYNCRIP; HSPA8; PABPC1; GTF2F2; GCFC2; CSTF2; BUD31; HNRNPA3; POLR2K; SNU13; SNRPD1; SNRPD3; POLR2G; TRA2B; IK; FRG1; PCBP1; ZCRB1; SNRNP27; ZMAT2; CWC15; ZMAT5; SF3B6; PPIL1; RBM8A; UBL5;	GO:0000398~mRNA splicing, via spliceosome	26	246	10.5691056910569	0.0259266433728451	0.170233504885326	1	1	0.999999944778075	0.999999944778075	1
down	UBB; UBC; CETN2; RAD23B; GTF2H4;	GO:0000717~nucleotide-excision repair, DNA duplex unwinding	5	22	22.7272727272727	0.0260049771089597	0.170233504885326	1	1	0.999999944778075	0.999999944778075	1
down	EEF1B2; EIF5AL1; EEF1A1P5; EEF1A2; GTPBP2;	GO:0006414~translational elongation	5	22	22.7272727272727	0.0260049771089597	0.170233504885326	1	1	0.999999944778075	0.999999944778075	1
down	ALDH1L1; AHCY; MTHFD2L; SHMT1; MTHFD2;	GO:0006730~one-carbon metabolic process	5	22	22.7272727272727	0.0260049771089597	0.170233504885326	1	1	0.999999944778075	0.999999944778075	1
down	EZR; VAV1; XK; MTPN; VAV3;	GO:0008361~regulation of cell size	5	22	22.7272727272727	0.0260049771089597	0.170233504885326	1	1	0.999999944778075	0.999999944778075	1
down	ZDHHC20; ZDHHC21; ZDHHC2; GOLGA7B; ZDHHC15;	GO:0018230~peptidyl-L-cysteine S-palmitoylation	5	22	22.7272727272727	0.0260049771089597	0.170233504885326	1	1	0.999999944778075	0.999999944778075	1
down	PRDX1; IL18; CASP8; ULBP3; SLAMF7;	GO:0030101~natural killer cell activation	5	22	22.7272727272727	0.0260049771089597	0.170233504885326	1	1	0.999999944778075	0.999999944778075	1
down	KRT3; KRT6C; EVPLL; PPL; DSP;	GO:0045104~intermediate filament cytoskeleton organization	5	22	22.7272727272727	0.0260049771089597	0.170233504885326	1	1	0.999999944778075	0.999999944778075	1
down	SSBP1; BCL2L1; PNPT1; PANK2; FIS1;	GO:0070584~mitochondrion morphogenesis	5	22	22.7272727272727	0.0260049771089597	0.170233504885326	1	1	0.999999944778075	0.999999944778075	1
up	RET; KITLG; HTR2B; SEMA3B;	GO:0001755~neural crest cell migration	4	44	9.09090909090909	0.0263244418834643	0.191008537994725	1	1	0.997267179759554	0.997267179759554	1
up	RASGRP1; CD44; DPP4; TREML2;	GO:0042110~T cell activation	4	44	9.09090909090909	0.0263244418834643	0.191008537994725	1	1	0.997267179759554	0.997267179759554	1
down	DVL1; UNC13B; PPFIA4; HSPA8; VAMP2; NAAA; LIN7B; PDZD11;	GO:0007269~neurotransmitter secretion	8	49	16.3265306122449	0.0272695772522592	0.177487064802592	1	1	0.999999944778075	0.999999944778075	1
down	C2CD4B; PRLR; PPP1CB; PPP2CA; IL18; PTK2B; LMO7; SPINK5;	GO:0030155~regulation of cell adhesion	8	49	16.3265306122449	0.0272695772522592	0.177487064802592	1	1	0.999999944778075	0.999999944778075	1
down	DVL1; KLK8; SNCG; NFASC; MAPT; CBLN1; PIN1; PPFIA4;	GO:0050808~synapse organization	8	49	16.3265306122449	0.0272695772522592	0.177487064802592	1	1	0.999999944778075	0.999999944778075	1
up	TLR4; CD14; BTK; MAP3K14; LY96;	GO:0007249~I-kappaB kinase/NF-kappaB signaling	5	67	7.46268656716418	0.0276008446148606	0.19687003034251	1	1	0.997267179759554	0.997267179759554	1
up	RASGRP1; IL5RA; IL37;	GO:0002437~inflammatory response to antigenic stimulus	3	25	12	0.0276046020806345	0.19687003034251	1	1	0.997267179759554	0.997267179759554	1
up	GALR2; AKAP5; DRD2;	GO:0007194~negative regulation of adenylate cyclase activity	3	25	12	0.0276046020806345	0.19687003034251	1	1	0.997267179759554	0.997267179759554	1
up	NTNG2; NRXN1; NTNG1;	GO:0099560~synaptic membrane adhesion	3	25	12	0.0276046020806345	0.19687003034251	1	1	0.997267179759554	0.997267179759554	1
down	ATG9B; TP53INP2; MAP1LC3A; ATG3; UBQLN1; GABARAPL2; RAB1B; MAP1LC3B; NSFL1C;	GO:0000045~autophagosome assembly	9	59	15.2542372881356	0.0280626197581233	0.180361076862278	1	1	0.999999944778075	0.999999944778075	1
down	GPR37; ADCY9; GNAI3; NPR3; GNAZ; NPY1R; LPAR1; MARCO; PSAPL1;	GO:0007193~adenylate cyclase-inhibiting G protein-coupled receptor signaling pathway	9	59	15.2542372881356	0.0280626197581233	0.180361076862278	1	1	0.999999944778075	0.999999944778075	1
down	TNF; ALOX5; GJA1; XDH; AIMP1; RGCC;	GO:0001937~negative regulation of endothelial cell proliferation	6	31	19.3548387096774	0.0281446596887905	0.180361076862278	1	1	0.999999944778075	0.999999944778075	1
down	SOCS2; SOCS6; PIAS1; IFNG; GHR; PRLR;	GO:0007259~receptor signaling pathway via JAK-STAT	6	31	19.3548387096774	0.0281446596887905	0.180361076862278	1	1	0.999999944778075	0.999999944778075	1
down	OTC; ARG1; S100A8; TH; ATP7A; P2RX7;	GO:0010043~response to zinc ion	6	31	19.3548387096774	0.0281446596887905	0.180361076862278	1	1	0.999999944778075	0.999999944778075	1
down	ARG1; EIF4E; GJB2; AQP1; FOXO1; EIF4EBP1;	GO:0071549~cellular response to dexamethasone stimulus	6	31	19.3548387096774	0.0281446596887905	0.180361076862278	1	1	0.999999944778075	0.999999944778075	1
up	TLR4; CD14; CD36; LY96;	GO:0002224~toll-like receptor signaling pathway	4	45	8.88888888888889	0.0281457815616467	0.198005281340972	1	1	0.997267179759554	0.997267179759554	1
up	SELL; SELP; CDH26; CDH3;	GO:0016339~calcium-dependent cell-cell adhesion via plasma membrane cell adhesion molecules	4	45	8.88888888888889	0.0281457815616467	0.198005281340972	1	1	0.997267179759554	0.997267179759554	1
up	ITGA2B; GATA1; LOX; L3MBTL1;	GO:0045652~regulation of megakaryocyte differentiation	4	45	8.88888888888889	0.0281457815616467	0.198005281340972	1	1	0.997267179759554	0.997267179759554	1
up	GATA2; IL15; SLC11A1; FCER1G;	GO:0050766~positive regulation of phagocytosis	4	45	8.88888888888889	0.0281457815616467	0.198005281340972	1	1	0.997267179759554	0.997267179759554	1
down	LPL; PRKAG1; PRKAA2; FADS6; ACOT4; HSD17B8; MGLL;	GO:0006633~fatty acid biosynthetic process	7	40	17.5	0.0282421346944439	0.180361076862278	1	1	0.999999944778075	0.999999944778075	1
down	POLB; HSPA5; BCL2L1; BNIP3; OXR1; FAM162A; BOK;	GO:0051402~neuron apoptotic process	7	40	17.5	0.0282421346944439	0.180361076862278	1	1	0.999999944778075	0.999999944778075	1
down	RAN; RRS1; NPM1;	GO:0000055~ribosomal large subunit export from nucleus	3	8	37.5	0.0289201303347699	0.180361076862278	1	1	0.999999944778075	0.999999944778075	1
down	CRTAM; CCL19; CYP26B1;	GO:0001768~establishment of T cell polarity	3	8	37.5	0.0289201303347699	0.180361076862278	1	1	0.999999944778075	0.999999944778075	1
down	ETF1; N6AMT1; ABCE1;	GO:0006415~translational termination	3	8	37.5	0.0289201303347699	0.180361076862278	1	1	0.999999944778075	0.999999944778075	1
down	YKT6; SNAP29; LRMP;	GO:0006903~vesicle targeting	3	8	37.5	0.0289201303347699	0.180361076862278	1	1	0.999999944778075	0.999999944778075	1
down	AKR1C1; AKR1C3; AKR1C2;	GO:0008207~C21-steroid hormone metabolic process	3	8	37.5	0.0289201303347699	0.180361076862278	1	1	0.999999944778075	0.999999944778075	1
down	MVK; COQ2; HMGCR;	GO:0008299~isoprenoid biosynthetic process	3	8	37.5	0.0289201303347699	0.180361076862278	1	1	0.999999944778075	0.999999944778075	1
down	GSTZ1; PDK1; PDP1;	GO:0010510~regulation of acetyl-CoA biosynthetic process from pyruvate	3	8	37.5	0.0289201303347699	0.180361076862278	1	1	0.999999944778075	0.999999944778075	1
down	PENK; AREG; PTK2B;	GO:0014009~glial cell proliferation	3	8	37.5	0.0289201303347699	0.180361076862278	1	1	0.999999944778075	0.999999944778075	1
down	GJA1; GJB2; GJD3;	GO:0016264~gap junction assembly	3	8	37.5	0.0289201303347699	0.180361076862278	1	1	0.999999944778075	0.999999944778075	1
down	SETD3; EEF2KMT; VCPKMT;	GO:0018023~peptidyl-lysine trimethylation	3	8	37.5	0.0289201303347699	0.180361076862278	1	1	0.999999944778075	0.999999944778075	1
down	CHMP2A; CHMP4B; NSFL1C;	GO:0031468~nuclear envelope reassembly	3	8	37.5	0.0289201303347699	0.180361076862278	1	1	0.999999944778075	0.999999944778075	1
down	ERN1; MARK3; PINK1;	GO:0036289~peptidyl-serine autophosphorylation	3	8	37.5	0.0289201303347699	0.180361076862278	1	1	0.999999944778075	0.999999944778075	1
down	RORA; RORC; FBXW11;	GO:0042753~positive regulation of circadian rhythm	3	8	37.5	0.0289201303347699	0.180361076862278	1	1	0.999999944778075	0.999999944778075	1
down	SOD1; FOXC1; LATS2;	GO:0046620~regulation of organ growth	3	8	37.5	0.0289201303347699	0.180361076862278	1	1	0.999999944778075	0.999999944778075	1
down	RAB5B; COMMD1; USP6NL;	GO:0048227~plasma membrane to endosome transport	3	8	37.5	0.0289201303347699	0.180361076862278	1	1	0.999999944778075	0.999999944778075	1
down	MAPT; LRRK2; BHLHA15;	GO:0048312~intracellular distribution of mitochondria	3	8	37.5	0.0289201303347699	0.180361076862278	1	1	0.999999944778075	0.999999944778075	1
down	WNK4; STK39; WNK1;	GO:0050801~ion homeostasis	3	8	37.5	0.0289201303347699	0.180361076862278	1	1	0.999999944778075	0.999999944778075	1
down	COBL; PLS3; PLS1;	GO:0051639~actin filament network formation	3	8	37.5	0.0289201303347699	0.180361076862278	1	1	0.999999944778075	0.999999944778075	1
down	AR; PRLR; PSAPL1;	GO:0060736~prostate gland growth	3	8	37.5	0.0289201303347699	0.180361076862278	1	1	0.999999944778075	0.999999944778075	1
down	KDR; ADIPOR2; HPSE;	GO:0061042~vascular wound healing	3	8	37.5	0.0289201303347699	0.180361076862278	1	1	0.999999944778075	0.999999944778075	1
down	BNIP3; BLOC1S2; BNIP3L;	GO:0097345~mitochondrial outer membrane permeabilization	3	8	37.5	0.0289201303347699	0.180361076862278	1	1	0.999999944778075	0.999999944778075	1
down	TP53BP2; PTGIS; BOK;	GO:1900119~positive regulation of execution phase of apoptosis	3	8	37.5	0.0289201303347699	0.180361076862278	1	1	0.999999944778075	0.999999944778075	1
down	SUMO3; PIN1; RASSF5;	GO:1900180~regulation of protein localization to nucleus	3	8	37.5	0.0289201303347699	0.180361076862278	1	1	0.999999944778075	0.999999944778075	1
down	TNF; IFNG; HMGCR;	GO:1900222~negative regulation of amyloid-beta clearance	3	8	37.5	0.0289201303347699	0.180361076862278	1	1	0.999999944778075	0.999999944778075	1
down	IDE; BNIP3; HIF1A;	GO:1903715~regulation of aerobic respiration	3	8	37.5	0.0289201303347699	0.180361076862278	1	1	0.999999944778075	0.999999944778075	1
down	ARG2; LGALS9B; LGALS9C;	GO:2000562~negative regulation of CD4-positive, alpha-beta T cell proliferation	3	8	37.5	0.0289201303347699	0.180361076862278	1	1	0.999999944778075	0.999999944778075	1
down	CNKSR3; WNK1; WNK4;	GO:2000651~positive regulation of sodium ion transmembrane transporter activity	3	8	37.5	0.0289201303347699	0.180361076862278	1	1	0.999999944778075	0.999999944778075	1
down	SCD; ELOVL1; ELOVL6; DECR2;	GO:0006636~unsaturated fatty acid biosynthetic process	4	15	26.6666666666667	0.0294445439964512	0.181435999908567	1	1	0.999999944778075	0.999999944778075	1
down	GGCT; CHAC2; MGST2; CHAC1;	GO:0006750~glutathione biosynthetic process	4	15	26.6666666666667	0.0294445439964512	0.181435999908567	1	1	0.999999944778075	0.999999944778075	1
down	ACAA1; ACOX2; DECR2; AMACR;	GO:0033540~fatty acid beta-oxidation using acyl-CoA oxidase	4	15	26.6666666666667	0.0294445439964512	0.181435999908567	1	1	0.999999944778075	0.999999944778075	1
down	CIDEA; TNF; APOC3; HCAR2;	GO:0050995~negative regulation of lipid catabolic process	4	15	26.6666666666667	0.0294445439964512	0.181435999908567	1	1	0.999999944778075	0.999999944778075	1
down	EPS8; TWF1; CAPZB; CAPZA1;	GO:0051016~barbed-end actin filament capping	4	15	26.6666666666667	0.0294445439964512	0.181435999908567	1	1	0.999999944778075	0.999999944778075	1
down	LTA; TNF; LYN; PRKCH;	GO:0060252~positive regulation of glial cell proliferation	4	15	26.6666666666667	0.0294445439964512	0.181435999908567	1	1	0.999999944778075	0.999999944778075	1
down	TBC1D10C; CHP1; MYOZ1; HOMER2;	GO:0070885~negative regulation of calcineurin-NFAT signaling cascade	4	15	26.6666666666667	0.0294445439964512	0.181435999908567	1	1	0.999999944778075	0.999999944778075	1
down	PABPC1; ZFP36; TOB1; CPEB3;	GO:1900153~positive regulation of nuclear-transcribed mRNA catabolic process, deadenylation-dependent decay	4	15	26.6666666666667	0.0294445439964512	0.181435999908567	1	1	0.999999944778075	0.999999944778075	1
down	NSG1; ARC; PAIP2; CALB2;	GO:1900271~regulation of long-term synaptic potentiation	4	15	26.6666666666667	0.0294445439964512	0.181435999908567	1	1	0.999999944778075	0.999999944778075	1
down	TPT1; ACKR3; BCL2L1; USP47;	GO:1902230~negative regulation of intrinsic apoptotic signaling pathway in response to DNA damage	4	15	26.6666666666667	0.0294445439964512	0.181435999908567	1	1	0.999999944778075	0.999999944778075	1
down	CHMP2A; IFNG; PDCD6IP; TSG101;	GO:1903543~positive regulation of exosomal secretion	4	15	26.6666666666667	0.0294445439964512	0.181435999908567	1	1	0.999999944778075	0.999999944778075	1
down	TRPA1; XCR1; ITPR2; MCOLN2; ERO1A; P2RX7; CCL19; IBTK;	GO:0051209~release of sequestered calcium ion into cytosol	8	50	16	0.0299275969406726	0.18315247589902	1	1	0.999999944778075	0.999999944778075	1
down	UBB; UBC; NUP214; RAN; SEH1L; TSG101; VPS37B; UBAP1;	GO:0075733~intracellular transport of virus	8	50	16	0.0299275969406726	0.18315247589902	1	1	0.999999944778075	0.999999944778075	1
up	KIT; GATA1; GATA3; MFHAS1;	GO:0030218~erythrocyte differentiation	4	46	8.69565217391304	0.0300402716105705	0.198005281340972	1	1	0.997267179759554	0.997267179759554	1
down	TSPAN12; RDH13; TFAP2B; ARL6; HIPK2;	GO:0010842~retina layer formation	5	23	21.7391304347826	0.0300461814404813	0.18315247589902	1	1	0.999999944778075	0.999999944778075	1
down	PIP5K1C; ENTPD5; MAPK3; IER3; CRNN;	GO:0014066~regulation of phosphatidylinositol 3-kinase signaling	5	23	21.7391304347826	0.0300461814404813	0.18315247589902	1	1	0.999999944778075	0.999999944778075	1
down	FABP12; APOC3; LPL; FABP5; MGLL;	GO:0019433~triglyceride catabolic process	5	23	21.7391304347826	0.0300461814404813	0.18315247589902	1	1	0.999999944778075	0.999999944778075	1
down	KDR; CCL20; DMTN; HOMER2; FIS1;	GO:0035584~calcium-mediated signaling using intracellular calcium source	5	23	21.7391304347826	0.0300461814404813	0.18315247589902	1	1	0.999999944778075	0.999999944778075	1
down	ATMIN; DNAAF3; BBOF1; FOXJ1; CC2D2A;	GO:0044458~motile cilium assembly	5	23	21.7391304347826	0.0300461814404813	0.18315247589902	1	1	0.999999944778075	0.999999944778075	1
down	PRMT5; PTN; PTPRZ1; IL34; ZNF365;	GO:0048714~positive regulation of oligodendrocyte differentiation	5	23	21.7391304347826	0.0300461814404813	0.18315247589902	1	1	0.999999944778075	0.999999944778075	1
down	RHOD; DUSP3; EFNA5; ACTG1; CORO1C;	GO:0051893~regulation of focal adhesion assembly	5	23	21.7391304347826	0.0300461814404813	0.18315247589902	1	1	0.999999944778075	0.999999944778075	1
down	FAM107A; ANXA1; GSTP1; UGT1A1; ZFP36;	GO:0071385~cellular response to glucocorticoid stimulus	5	23	21.7391304347826	0.0300461814404813	0.18315247589902	1	1	0.999999944778075	0.999999944778075	1
up	KIT; DRD2; EDAR;	GO:0043473~pigmentation	3	26	11.5384615384615	0.0302634988332267	0.198005281340972	1	1	0.997267179759554	0.997267179759554	1
up	MDK; C3AR1; DAPK2;	GO:0090023~positive regulation of neutrophil chemotaxis	3	26	11.5384615384615	0.0302634988332267	0.198005281340972	1	1	0.997267179759554	0.997267179759554	1
down	ACKR3; EPHA2; ADM; KDR; FOXF1; TIPARP; FBXW7; TMEM100; HEG1;	GO:0001570~vasculogenesis	9	60	15	0.0305128680596916	0.185200694893353	1	1	0.999999944778075	0.999999944778075	1
down	DIRAS1; TNF; EDN3; CD24; CSK; S100A12; TPD52L1; LRRK2; EPGN;	GO:0043406~positive regulation of MAP kinase activity	9	60	15	0.0305128680596916	0.185200694893353	1	1	0.999999944778075	0.999999944778075	1
down	NKX2-8; NUPR1; AR; KRT4; PTN; CDKN2B; DLG1; TINF2; STRAP;	GO:0050680~negative regulation of epithelial cell proliferation	9	60	15	0.0305128680596916	0.185200694893353	1	1	0.999999944778075	0.999999944778075	1
down	CALM1; CETN2; BCL2L1; PIN1; PLK3; AURKC; PLK2;	GO:0032465~regulation of cytokinesis	7	41	17.0731707317073	0.0313079473191253	0.189620462983036	1	1	0.999999944778075	0.999999944778075	1
down	ADRB2; GJA1; ABCC1; NAMPT; CASP4; BCL2L2; LGMN;	GO:1904646~cellular response to amyloid-beta	7	41	17.0731707317073	0.0313079473191253	0.189620462983036	1	1	0.999999944778075	0.999999944778075	1
down	RPA2; POLD2; TDG; POLD4; PMS1; PMS2P1;	GO:0006298~mismatch repair	6	32	18.75	0.031679159121361	0.190646659298297	1	1	0.999999944778075	0.999999944778075	1
down	TJP1; CNN3; EPB41L3; EPB41; EPB41L4A; FRMD3;	GO:0031032~actomyosin structure organization	6	32	18.75	0.031679159121361	0.190646659298297	1	1	0.999999944778075	0.999999944778075	1
down	TSPAN12; KRT1; HMOX1; EPHA2; ID1; GPNMB;	GO:0045765~regulation of angiogenesis	6	32	18.75	0.031679159121361	0.190646659298297	1	1	0.999999944778075	0.999999944778075	1
down	CLPX; IDE; CASP8; LGMN; CPVL; CTSH;	GO:0051603~proteolysis involved in cellular protein catabolic process	6	32	18.75	0.031679159121361	0.190646659298297	1	1	0.999999944778075	0.999999944778075	1
down	DKK1; KREMEN2; KAT2B; LNPK; CHD7; MED31;	GO:0060173~limb development	6	32	18.75	0.031679159121361	0.190646659298297	1	1	0.999999944778075	0.999999944778075	1
up	TLR4; IL15; IL18R1; DOCK7;	GO:0120163~negative regulation of cold-induced thermogenesis	4	47	8.51063829787234	0.032008282229335	0.198005281340972	1	1	0.997267179759554	0.997267179759554	1
down	DVL1; KALRN; TH; SLC6A4; AVPR1A; MAPK8IP2; EIF4EBP2; PTCHD1;	GO:0035176~social behavior	8	51	15.6862745098039	0.0327581763820608	0.194129960373518	1	1	0.999999944778075	0.999999944778075	1
down	TNF; PDGFRA; SESN2; ATP7A; BCL2L1; CPEB4; CPEB3; RRAGD;	GO:0071230~cellular response to amino acid stimulus	8	51	15.6862745098039	0.0327581763820608	0.194129960373518	1	1	0.999999944778075	0.999999944778075	1
up	ITGAM; IL13; TREM2;	GO:0001774~microglial cell activation	3	27	11.1111111111111	0.0330521554644736	0.198005281340972	1	1	0.997267179759554	0.997267179759554	1
up	SLC27A2; CYP7B1; CH25H;	GO:0006699~bile acid biosynthetic process	3	27	11.1111111111111	0.0330521554644736	0.198005281340972	1	1	0.997267179759554	0.997267179759554	1
up	BDNF; GABRR2; GABRA2;	GO:0007214~gamma-aminobutyric acid signaling pathway	3	27	11.1111111111111	0.0330521554644736	0.198005281340972	1	1	0.997267179759554	0.997267179759554	1
up	CD44; POSTN; SFRP1;	GO:0044344~cellular response to fibroblast growth factor stimulus	3	27	11.1111111111111	0.0330521554644736	0.198005281340972	1	1	0.997267179759554	0.997267179759554	1
up	HTR2B; CADM1; CD14;	GO:0050715~positive regulation of cytokine secretion	3	27	11.1111111111111	0.0330521554644736	0.198005281340972	1	1	0.997267179759554	0.997267179759554	1
down	PNP; ANXA1; CD46; ZP3; IL12A; CD40LG; IL6ST; IL23R; CCL19;	GO:0042102~positive regulation of T cell proliferation	9	61	14.7540983606557	0.0331081876424294	0.194129960373518	1	1	0.999999944778075	0.999999944778075	1
up	TLR4; RET; KIT; MAPK10; SHC2; GRM4; PDE6G;	GO:0000187~activation of MAPK activity	7	122	5.73770491803279	0.0335732708581483	0.198005281340972	1	1	0.997267179759554	0.997267179759554	1
up	ITGA2B; CD44; COL13A1; SIGLEC1; MSLN; MSLNL;	GO:0007160~cell-matrix adhesion	6	96	6.25	0.0339136052603924	0.198005281340972	1	1	0.997267179759554	0.997267179759554	1
up	ITGA2B; ITGAM; FCER1G; ITGA9; PRKD1; TSPAN32;	GO:0007229~integrin-mediated signaling pathway	6	96	6.25	0.0339136052603924	0.198005281340972	1	1	0.997267179759554	0.997267179759554	1
down	PPP2CA; VASN; ADIPOR1; TBX5; STRAP;	GO:0010719~negative regulation of epithelial to mesenchymal transition	5	24	20.8333333333333	0.0344609618920872	0.194129960373518	1	1	0.999999944778075	0.999999944778075	1
down	PF4; CX3CL1; SBDS; CXCL11; CXCL2;	GO:0030595~leukocyte chemotaxis	5	24	20.8333333333333	0.0344609618920872	0.194129960373518	1	1	0.999999944778075	0.999999944778075	1
down	CYP3A4; ALOX5; CYP2C9; ALOX12; ELOVL6;	GO:0042759~long-chain fatty acid biosynthetic process	5	24	20.8333333333333	0.0344609618920872	0.194129960373518	1	1	0.999999944778075	0.999999944778075	1
down	REN; CD24; ID1; STK40; ROR1;	GO:0043408~regulation of MAPK cascade	5	24	20.8333333333333	0.0344609618920872	0.194129960373518	1	1	0.999999944778075	0.999999944778075	1
down	TNF; IL18; SOSTDC1; CCL17; SRA1;	GO:0045662~negative regulation of myoblast differentiation	5	24	20.8333333333333	0.0344609618920872	0.194129960373518	1	1	0.999999944778075	0.999999944778075	1
