DGE	Genes	Process~name	num_of_Genes	gene_group	percentage%	P-value	Benjamini and Hochberg (FDR)	 Hommel singlewise process	Bonferroni single-step process	Hommel singlewise process	Hochberg step-up process	Benjamini and Yekutieli
up	N4BP3; MSI1; KCNQ2; KALRN; DSCAM; FGF19; FGF5; NTF3; PTN; MDK; GAL; PAX3; NBL1; LHX1; EFNA5; GBX2; DLX5; DLX6; VLDLR; PCDH1; SIM2; HES1; ADGRV1; RAPGEF5; NDN; NRTN; DPYSL5; SDCBP2; RAPGEFL1; INTU; GDA; NR2E1; PCDHA11; PCDHAC2; ERBB3; NAV2; ROR2; NTRK2; TYRO3; ROR1; RBFOX2;	GO:0007399~nervous system development	41	294	13.9455782312925	0	0	0	0	0	0	0
up	LCE2B; AGPAT2; FOXN1; TGM5; KRT34; SCEL; GJB5; KRT14; KRT5; DSP; KRT15; SPRR1B; SPRR2E; SPRR2D; CRABP2; S100A7; CASP14; NTF4; SPRR1A; SPRR2B; SPRR2A; KLK7; ALDH3A2; EMP1; ELF3; BNC1; KRT31; CST6; ZNF750; GRHL2; CERS3; ACER1; GRHL3; EVPL; SPRR2F; SPRR2G; GRHL1; CALML5; SPRR3; POU2F3; KLK5;	GO:0008544~epidermis development	41	82	50	0	0	0	0	0	0	0
up	HOXC11; GLI2; RARG; HOXB8; HOXD10; HOXA11; HOXC8; HOXC13; HOXD13; MSX2; LHX1; EMX2; CYP26C1; ALX4; BARX1; CTNNBIP1; HOXC10; HOXC6; HOXC5; HES4; HOXA6; HOXD9; HES1; HOXC9; HES2; HES7;	GO:0009952~anterior/posterior pattern specification	26	99	26.2626262626263	0	0	0	0	0	0	0
down	IGLC7; HP; JCHAIN; IGKV1-5; IGKV3-20; IGKV3-15; IGLV1-44; IGLV1-47; IGLV1-51; IGLV1-40; IGLV2-14; IGLV2-23; IGLV2-11; IGLV2-8; IGLV3-19; IGLV3-1; IGLV3-25; IGLV6-57; IGHV1-46; IGHV3-11; IGHV3-48; IGHV3-23; IGHV3-13; IGHV3-53; IGHV3-30; IGHV3-33; IGHV3-7; IGHV2-5; IGHV4-39; IGHV4-59; IGKC; IGHA2; IGLV7-43; IGKV1-16; IGKV3-11; IGKV2-30; IGKV4-1; IGHV4-34; IGLC6; IGLC2; IGLC3; FOLR2; IGHV1-2; FCGR2B; HBA1; IGLV3-21; CLEC9A; FCGR1B; STAB1;	GO:0006898~receptor-mediated endocytosis	49	160	30.625	0	0	0	0	0	0	0
down	TNFRSF13B; LILRA1; IFNG; IL2RA; CD3D; CD3G; CXCR1; LAMA1; KLRC1; CXCR3; CCR5; ADGRE1; LILRB2; CLEC1A; ADGRE3; CLEC1B; CLEC4A; TRBV24-1; TRBV6-4; TRBV19; TRBV6-6; TRBV5-1; TRBV6-1; TRBV27; TRBV5-5; TRBV3-1; TRBV2; TRBV13; TRBV28; TRBV6-2; TRBV11-1; TRBV25-1; TRBV7-2; TRBV4-1; TRBV7-6; TRBV29-1; TRBV10-1; TRBV7-7; TRBV14; TRBV15; TRBV30; TRBV4-2; TRBV20-1; TRBV7-4; TRBV12-5; TRBV6-5; TRBV12-4; TRBV5-6; TRBV23-1; TRBV5-4; TRBV9; TRBV12-3; TRBV18; TRBV7-9; TRBV11-2; TRBV10-3;	GO:0007166~cell surface receptor signaling pathway	56	268	20.8955223880597	0	0	0	0	0	0	0
down	IGLC7; IGKV1-5; IGKV3-20; IGKV3-15; IGLV1-44; IGLV1-47; IGLV1-51; IGLV1-40; IGLV2-14; IGLV2-23; IGLV2-11; IGLV2-8; IGLV3-19; IGLV3-1; IGLV3-25; IGLV6-57; IGHV1-46; IGHV3-11; IGHV3-48; IGHV3-23; IGHV3-13; IGHV3-53; IGHV3-30; IGHV3-33; IGHV3-7; IGHV2-5; IGHV4-39; IGHV4-59; IGKC; IGLV7-43; IGKV1-16; IGKV3-11; IGKV2-30; IGKV4-1; IGHV4-34; IGLC6; IGLC2; IGLC3; FCER1A; IGHV1-2; LILRA4; IGLV3-21; MS4A2; PSMA8;	GO:0038095~Fc-epsilon receptor signaling pathway	44	171	25.7309941520468	0	0	0	0	0	0	0
down	TRGV2; TRGV5; TRGV8; TRGV4; TRDV1; TRDV2; LILRA5; CD300LB; TYROBP; LY86; JCHAIN; C1QA; C1QB; TRGV3; C4BPA; S100B; RNASE3; DEFA4; KLRC2; KIR2DS4; NLRP6; LILRA4; SIGLEC14; NAIP; SLAMF1; CD300E; CLEC6A; CLEC10A; ZNF683; LILRA2; IL27; CLEC4C; RNASE6; PLD4; SIGLEC10; CD180; TRGV9; TLR8; TLR7; TRIM10; CD84; CLEC4A; TRDC; IGHV3-15; IGHV3-66; IGHV3-48; IGHV1-69-2; IGHV2-26; IGHV4-59; IGHV3-23; IGHV4-39; TRBC1; IGHV3-53; IGHV1-3; TRBC2; IGHV4-4; IGHV3-30; IGLC3; IGHV3-13; IGHV3-49; IGLC7; IGHV1-2; IGHV3-21; IGHV6-1; IGHV5-51; IGLC6; IGHV3-7; IGHV3-33; IGHV3-72; IGHV1-18; IGHV1-46; IGHG4; IGHA2; IGLL5; IGHV3-64; IGLC2; IGHV3-74; IGHV1-24; IGHV3-73; IGHV4-31; IGHG3; BPI; IGHV3-11; IGHV4-34; IGKC; IGHV2-5; IGHD; IGHG2; IGHV3-43; IGHV3-20;	GO:0045087~innate immune response	90	505	17.8217821782178	0	0	0	0	0	0	0
down	TRAV19; IGLC7; CD300LB; NCR3; TYROBP; LILRA1; NCR1; IGKV1-5; IGKV3-20; IGKV3-15; IGLV1-44; IGLV1-47; IGLV1-51; IGLV1-40; IGLV2-14; IGLV2-23; IGLV2-11; IGLV2-8; IGLV3-19; IGLV3-1; IGLV3-25; IGLV6-57; TRBV12-3; TRAV8-4; IGHV1-46; IGHV3-11; IGHV3-48; IGHV3-23; IGHV3-13; IGHV3-53; IGHV3-30; IGHV3-33; IGHV3-7; IGHV2-5; IGHV4-39; IGHV4-59; IGKC; TRBC1; IGLV7-43; CD3D; IGKV1-16; IGKV3-11; TRBV7-9; TRAV29DV5; CD1A; IGKV2-30; IGKV4-1; IGHV4-34; CD3G; IGLC6; IGLC2; IGLC3; CD8B; CD19; IGHV1-2; KLRC1; CD1C; CD40LG; FCGR2B; ICAM3; KIR2DL1; KIR2DL3; KIR3DL1; KIR3DL2; IGLV3-21; CD300E; TREML2; LAIR2; CLEC4G; LILRB2; LILRB1; CD300LF; KIR2DL4; CD300A; SIGLEC7; BTNL8; BTNL3;	GO:0050776~regulation of immune response	77	216	35.6481481481481	0	0	0	0	0	0	0
up	EGFR; BTC; SOX9; BCAR1; GRB7; FAM83B; FAM83A; HBEGF; GAREM1;	GO:0007173~epidermal growth factor receptor signaling pathway	9	50	18	0.00010075856583446	0.0026719451391104	0.421775356583087	0.438199002814106	0.307817418624303	0.421775356583087	0.0239273538009485
up	RARB; BMP4; RARG; MSX2; PITX1; ALX4; TP63;	GO:0035116~embryonic hindlimb morphogenesis	7	28	25	0.00010255594041064	0.00270312596876293	0.429196610618539	0.446015784845884	0.310641943503836	0.429196610618539	0.0242065791233485
up	JUP; DSP; DSC2; DSG2; PKP2;	GO:0098911~regulation of ventricular cardiac muscle cell action potential	5	11	45.4545454545455	0.00010735529062011	0.00279573747848431	0.44906718066394	0.466888158906879	0.31820108139802	0.44906718066394	0.0250359181418439
up	DLX2; DLX3; DLX5; DLX6; DLG2; LRRC1;	GO:0009790~embryo development	6	19	31.5789473684211	0.00011035223557065	0.00283977439347205	0.461493049156476	0.479921872496776	0.322890641279735	0.461382696920906	0.0254302701177848
up	WT1; BMP5; HOXD13; ROR2; DHCR24; LGR4;	GO:0030539~male genitalia development	6	19	31.5789473684211	0.00011035223557065	0.00283977439347205	0.461493049156476	0.479921872496776	0.322890641279735	0.461382696920906	0.0254302701177848
down	HBA1; PXDN; HBG2; HBM; HBG1;	GO:0042744~hydrogen peroxide catabolic process	5	28	17.8571428571429	0.00011430003307288	0.00354520711014151	0.169735549113241	0.175221950700739	0.164820647691106	0.169735549113241	0.0280515351604834
up	KIF20A; KIF4A; CENPA; PLK1; KIF23; ESPL1; CEP55; ANLN; RTKN;	GO:0000281~mitotic cytokinesis	9	51	17.6470588235294	0.00011520234885831	0.00291287799526046	0.481315413530028	0.501015015184799	0.330515538874497	0.481315413530028	0.0260849151995687
down	VIL1; MS4A1; GZMA; FCGR2B; CD79B; RGS1; IL27; NLRP6;	GO:0009617~response to bacterium	8	92	8.69565217391304	0.0001193208009389	0.00354520711014151	0.177072068593334	0.182918787839341	0.171941274152962	0.177072068593334	0.0280515351604834
down	HBG1; HBG2; HBA1; HBM;	GO:0015671~oxygen transport	4	14	28.5714285714286	0.00012025490523637	0.00354520711014151	0.17833802446554	0.184350769727359	0.173167063540376	0.178217769560304	0.0280515351604834
down	P2RY10; GPR171; P2RY13; P2RY12;	GO:0035589~G protein-coupled purinergic nucleotide receptor signaling pathway	4	14	28.5714285714286	0.00012025490523637	0.00354520711014151	0.17833802446554	0.184350769727359	0.173167063540376	0.178217769560304	0.0280515351604834
up	EDNRA; KDR; GBX2; NOTCH4; FOXC2; DLL4; NRARP;	GO:0001569~branching involved in blood vessel morphogenesis	7	29	24.1379310344828	0.0001238134252377	0.00309462405953325	0.517044863792663	0.538464586358786	0.343829881885111	0.517044863792663	0.0277124569922992
up	ZW10; CCNB1; CEP55; CDCA8; CHMP4C; CDCA5; KIF2C; KIFC1;	GO:0007080~mitotic metaphase plate congression	8	40	20	0.0001286466580922	0.00319705323453135	0.537099797534943	0.559484316042986	0.350304849985066	0.537099797534943	0.0286297135159622
up	FOXN1; LOX; FLT4; ID1; SLC1A1; EFNB2;	GO:0048514~blood vessel morphogenesis	6	20	30	0.00013958825393756	0.00344925747940031	0.582641371935382	0.607069316374455	0.364779046603843	0.582641371935382	0.0308882105594643
down	POMC; ORM1; BPI; LILRA4; SLAMF1; CLEC4A;	GO:0032720~negative regulation of tumor necrosis factor production	6	49	12.2448979591837	0.00015549894022925	0.00449773349757462	0.230293930479533	0.238379875371455	0.218009514201422	0.230293930479533	0.0355884227437032
down	CNR2; CD300LF; CD84;	GO:0033004~negative regulation of mast cell activation	3	5	60	0.00016759159624923	0.00467200231226597	0.248035562448874	0.256917917050084	0.230606036438953	0.247908694123467	0.0369673288642246
up	CLDN1; CXADR; TJP1; OCLN; MARVELD2; MARVELD3;	GO:0045216~cell-cell junction organization	6	21	28.5714285714286	0.0001746326395986	0.00407400468090367	0.727694209207384	0.75947734961433	0.40532235650836	0.727519576567785	0.0364828416421595
up	SRPX2; ANXA1; KDR; FGFBP1; FOXC2; PLK2;	GO:0090050~positive regulation of cell migration involved in sprouting angiogenesis	6	21	28.5714285714286	0.0001746326395986	0.00407400468090367	0.727694209207384	0.75947734961433	0.40532235650836	0.727519576567785	0.0364828416421595
up	ZW10; BUB1; BUB1B; ZWINT; CDKN2B; TICRR; PLK2;	GO:0007093~mitotic cell cycle checkpoint	7	31	22.5806451612903	0.00017704918020022	0.00407400468090367	0.737232786353751	0.769986884690793	0.408134295970665	0.73670163881315	0.0364828416421595
up	EGFR; ERBB2; ERBB3; BTC; PTK6; GRB7; HBEGF;	GO:0038128~ERBB2 signaling pathway	7	31	22.5806451612903	0.00017704918020022	0.00407400468090367	0.737232786353751	0.769986884690793	0.408134295970665	0.73670163881315	0.0364828416421595
up	FGFR2; WNT7B; RARB; TEAD4; RARG; TEAD1; TEAD3;	GO:0048568~embryonic organ development	7	31	22.5806451612903	0.00017704918020022	0.00407400468090367	0.737232786353751	0.769986884690793	0.408134295970665	0.73670163881315	0.0364828416421595
up	NEK2; KIF11; CDC20; MISP; KIFC1; TPX2; BIRC5;	GO:0090307~mitotic spindle assembly	7	31	22.5806451612903	0.00017704918020022	0.00407400468090367	0.737232786353751	0.769986884690793	0.408134295970665	0.73670163881315	0.0364828416421595
up	OVOL1; FBLN1; KDF1; OVOL2;	GO:2000647~negative regulation of stem cell proliferation	4	6	66.6666666666667	0.00018636669038274	0.00426583545512924	0.775285431992216	0.810508736474555	0.417745189034625	0.775285431992216	0.0382006923336349
up	MMP1; MMP10; MMP12; MMP13; ADAM15; ADAMTS14; KLK6; MMP28;	GO:0030574~collagen catabolic process	8	43	18.6046511627907	0.00019946769062784	0.00445272950863666	0.829386657630565	0.867484986540482	0.431049679446765	0.829187189939937	0.0398743345338839
up	EGFR; ERBB2; GSTP1; ID1; SOX9; GAREM1; ERRFI1; BAIAP2;	GO:0071364~cellular response to epidermal growth factor stimulus	8	43	18.6046511627907	0.00019946769062784	0.00445272950863666	0.829386657630565	0.867484986540482	0.431049679446765	0.829187189939937	0.0398743345338839
up	MDK; CDH3; TGM1; HAS2; TP63;	GO:0010838~positive regulation of keratinocyte proliferation	5	13	38.4615384615385	0.00019965101268892	0.00445272950863666	0.829749608735186	0.86828225418415	0.431246187408085	0.829549957722497	0.0398743345338839
up	TACSTD2; FBLN1; EFNA5; KANK1; POSTN;	GO:1900025~negative regulation of substrate adhesion-dependent cell spreading	5	13	38.4615384615385	0.00019965101268892	0.00445272950863666	0.829749608735186	0.86828225418415	0.431246187408085	0.829549957722497	0.0398743345338839
up	TSPAN12; ERBB2; EFNA1; EPHA2; ID1; EMP2; GPNMB;	GO:0045765~regulation of angiogenesis	7	32	21.875	0.00020986016464563	0.00463290282255773	0.871549263773329	0.912681856043874	0.44062143214862	0.871549263773329	0.0414877922971351
up	CCNB1; PTN; MDK; SOX2; ADAM15; KLK6;	GO:0042246~tissue regeneration	6	22	27.2727272727273	0.00021627213709218	0.00472646997092426	0.897961913206766	0.940567524213927	0.446381709404817	0.897745641069674	0.0423256890901272
up	CKS2; CCND1; CCNB1; CCNA2; CCNO; CCNB2;	GO:0044772~mitotic cell cycle phase transition	6	22	27.2727272727273	0.00021627213709218	0.00472646997092426	0.897961913206766	0.940567524213927	0.446381709404817	0.897745641069674	0.0423256890901272
down	GPR55; GPR174; GPR65; F2RL3; P2RY10;	GO:0035025~positive regulation of Rho protein signal transduction	5	33	15.1515151515152	0.00022751560183798	0.0062282396003147	0.336268059516534	0.348781417617623	0.285532080306665	0.336268059516534	0.0492810932360928
up	AGPAT2; PLPP2; NKX2-1; PLA2G4E; TNFAIP8L3; PLA2G4F; PLA2G4D; PLA2G3; PLPPR5;	GO:0006644~phospholipid metabolic process	9	57	15.7894736842105	0.00024307964283476	0.00520765205265218	1	1	0.470291190360821	0.99999931674547	0.0466346899538254
up	DLX3; GLI2; BMP4; BMP7; DLX2; SCN5A; AMTN; SOSTDC1; TP63;	GO:0042475~odontogenesis of dentin-containing tooth	9	57	15.7894736842105	0.00024307964283476	0.00520765205265218	1	1	0.470291190360821	0.99999931674547	0.0466346899538254
down	HP; HBG1; HBG2; HBA1; HBM; LOXHD1; PXDN;	GO:0098869~cellular oxidant detoxification	7	77	9.09090909090909	0.00024546903483602	0.00646032449931066	0.362557764452803	0.37630403040362	0.300699567674126	0.362557764452803	0.05111747049196
up	BMPR1B; SPINT1; BMP4; BMP7; SOX9; DLX5; GATA5;	GO:0071773~cellular response to BMP stimulus	7	33	21.2121212121212	0.00024740241485199	0.00526577237615339	1	1	0.47402302685642	0.99999931674547	0.0471551593014491
down	CD19; CD180; GAPT;	GO:0002322~B cell proliferation involved in immune response	3	6	50	0.00024863610271319	0.00646032449931066	0.366986887604677	0.381159145459329	0.303271401209431	0.366738251501963	0.05111747049196
down	FCGR2B; TMEM176B; LILRB1;	GO:2001199~negative regulation of dendritic cell differentiation	3	6	50	0.00024863610271319	0.00646032449931066	0.366986887604677	0.381159145459329	0.303271401209431	0.366738251501963	0.05111747049196
up	CDH16; AJUBA; PCDHB10; PCDHB14; CDH1; CDH26; CDH8; CDH3;	GO:0016339~calcium-dependent cell-cell adhesion via plasma membrane cell adhesion molecules	8	45	17.7777777777778	0.00026242580952862	0.00551081484929769	1	1	0.485952167556617	0.99999931674547	0.0493495224511114
up	GLI2; CCNB1; IGFBP5; SLC16A1; FOXF1; KLF5; IL18; PLA2G4F;	GO:0071407~cellular response to organic cyclic compound	8	45	17.7777777777778	0.00026242580952862	0.00551081484929769	1	1	0.485952167556617	0.99999931674547	0.0493495224511114
up	COBL; BMP7; PTN; BMP5; VLDLR;	GO:1900006~positive regulation of dendrite development	5	14	35.7142857142857	0.00026383790901607	0.00551081484929769	1	1	0.48693164578553	0.99999931674547	0.0493495224511114
up	TLCD2; BAIAP2L2; TLCD1; A4GALT; BAIAP2L1; BAIAP2;	GO:0007009~plasma membrane organization	6	23	26.0869565217391	0.0002653495194077	0.00551081484929769	1	1	0.487977766190777	0.99999931674547	0.0493495224511114
up	HOXD10; ISL1; HOXC10; LHX3;	GO:0021520~spinal cord motor neuron cell fate specification	4	7	57.1428571428571	0.00028544570990152	0.00577396926679869	1	1	0.501965196697519	0.99999931674547	0.0517060786392094
up	YAP1; SOX9; FOXA1; GRHL2;	GO:0060487~lung epithelial cell differentiation	4	7	57.1428571428571	0.00028544570990152	0.00577396926679869	1	1	0.501965196697519	0.99999931674547	0.0517060786392094
up	CYP7B1; RARG; ID4; FOXA1;	GO:0060740~prostate gland epithelium morphogenesis	4	7	57.1428571428571	0.00028544570990152	0.00577396926679869	1	1	0.501965196697519	0.99999931674547	0.0517060786392094
up	DEFB4A; MET; SAA1; BMP4; MIF; NTF3; CX3CL1; GPNMB;	GO:0050918~positive chemotaxis	8	46	17.3913043478261	0.00029950952963453	0.00602220239812856	1	1	0.509765219437977	0.99999931674547	0.0539290142345205
up	CXCL14; BMP4; SOX9; IL18; SOSTDC1; CCL17;	GO:0045662~negative regulation of myoblast differentiation	6	24	25	0.00032276296800626	0.0064389731553176	1	1	0.522553245202139	0.99999931674547	0.0576612096359843
down	LTF; RNASE3; DEFA3; DEFA4;	GO:0002227~innate immune response in mucosa	4	19	21.0526315789474	0.0003282512797762	0.00838682019828201	0.483842386390124	0.50320921189692	0.366000176950467	0.483842386390124	0.0663609133028534
up	FGF1; FGF5; PTN; MDK; FGFR2; BTC; MACC1; GAREM1;	GO:0051781~positive regulation of cell division	8	47	17.0212765957447	0.00034076041893982	0.00669411232218392	1	1	0.53152930924538	0.99999931674547	0.0599459889994267
up	WT1; ITGB8; EPHA2; KDR; YAP1; FOXF1; MYO1E; NTRK2; HAS2;	GO:0001570~vasculogenesis	9	60	15	0.00034170911371	0.00669411232218392	1	1	0.531990382056468	0.99999931674547	0.0599459889994267
up	EGFR; ERBB2; FGF1; MIF; KITLG; CD24; MST1R; TPD52L1; AJUBA;	GO:0043406~positive regulation of MAP kinase activity	9	60	15	0.00034170911371	0.00669411232218392	1	1	0.531990382056468	0.99999931674547	0.0599459889994267
up	CTSV; TYMS; IGFBP2; IL1RN; SDC1; MDK; ALDH3A1; WNT7B; HSD11B2;	GO:0051384~response to glucocorticoid	9	60	15	0.00034170911371	0.00669411232218392	1	1	0.531990382056468	0.99999931674547	0.0599459889994267
down	FCGR2B; FCRL3; CD300A;	GO:0050859~negative regulation of B cell receptor signaling pathway	3	7	42.8571428571429	0.00035130990676957	0.00868642075931857	0.517479492671577	0.538558087077751	0.381926509944954	0.517128182764807	0.0687315098324542
down	HP; GZMA; GZMK;	GO:0051354~negative regulation of oxidoreductase activity	3	7	42.8571428571429	0.00035130990676957	0.00868642075931857	0.517479492671577	0.538558087077751	0.381926509944954	0.517128182764807	0.0687315098324542
down	LTF; MS4A1; CCR2; CCR6; JCHAIN; IFNG;	GO:0006959~humoral immune response	6	58	10.3448275862069	0.00035965147621475	0.00875151925455893	0.529047321511898	0.551345713037213	0.387704291359501	0.529047321511898	0.0692466032166759
down	LILRA5; IFNG; AIF1; LILRA2; TLR8;	GO:2000778~positive regulation of interleukin-6 secretion	5	37	13.5135135135135	0.00036736102812695	0.00879944462685349	0.540020711346625	0.563164456118623	0.393076300095843	0.540020711346625	0.0696258138591668
up	EGFR; ANXA2; NGFR; MIF; CCNB1; CCNA2; BTC; CDC6;	GO:0048146~positive regulation of fibroblast proliferation	8	48	16.6666666666667	0.00038652280508677	0.00750440928268922	1	1	0.553598453270599	0.99999931674547	0.0672022240822693
up	FGFR2; FGFR3; MSX2; ECM1;	GO:0003416~endochondral bone growth	4	8	50	0.00041733807693922	0.00789131868090729	1	1	0.566413246776882	0.99999931674547	0.0706670100633012
up	GJB6; GJA1; GJB2; GJA5;	GO:0016264~gap junction assembly	4	8	50	0.00041733807693922	0.00789131868090729	1	1	0.566413246776882	0.99999931674547	0.0706670100633012
up	BMPR1B; EGFR; NHLH2; TYRO3;	GO:0042698~ovulation cycle	4	8	50	0.00041733807693922	0.00789131868090729	1	1	0.566413246776882	0.99999931674547	0.0706670100633012
up	IGFBP2; IGFBP4; IGFBP6; IGFBP5;	GO:0043567~regulation of insulin-like growth factor receptor signaling pathway	4	8	50	0.00041733807693922	0.00789131868090729	1	1	0.566413246776882	0.99999931674547	0.0706670100633012
up	BMP7; FGFR2; ISL1; WWTR1;	GO:0048762~mesenchymal cell differentiation	4	8	50	0.00041733807693922	0.00789131868090729	1	1	0.566413246776882	0.99999931674547	0.0706670100633012
up	SCNN1A; SCNN1B; SCNN1G; TRPV4;	GO:0050891~multicellular organismal water homeostasis	4	8	50	0.00041733807693922	0.00789131868090729	1	1	0.566413246776882	0.99999931674547	0.0706670100633012
up	CSTA; CSTB; SERPINB3; SERPINB4; ECM1;	GO:0010466~negative regulation of peptidase activity	5	16	31.25	0.00043780904315893	0.00806793020634829	1	1	0.574405464624519	0.99999931674547	0.0722485718972986
up	CNTN1; SCN5A; CNKSR3; PKP2; PRSS8;	GO:0010765~positive regulation of sodium ion transport	5	16	31.25	0.00043780904315893	0.00806793020634829	1	1	0.574405464624519	0.99999931674547	0.0722485718972986
up	SQLE; CYB5R2; MSMO1; TM7SF2; CYP51A1;	GO:0016126~sterol biosynthetic process	5	16	31.25	0.00043780904315893	0.00806793020634829	1	1	0.574405464624519	0.99999931674547	0.0722485718972986
up	INHA; BMP4; BMP7; CDKN2B; DYNLL1;	GO:0042326~negative regulation of phosphorylation	5	16	31.25	0.00043780904315893	0.00806793020634829	1	1	0.574405464624519	0.99999931674547	0.0722485718972986
up	ALOX15B; TRIM16; NME2; OVOL2; IL20;	GO:0045618~positive regulation of keratinocyte differentiation	5	16	31.25	0.00043780904315893	0.00806793020634829	1	1	0.574405464624519	0.99999931674547	0.0722485718972986
up	CDC20; KNDC1; CSMD3; MFSD2A; MARK1;	GO:0050773~regulation of dendrite development	5	16	31.25	0.00043780904315893	0.00806793020634829	1	1	0.574405464624519	0.99999931674547	0.0722485718972986
up	E2F8; DLX3; GJB3; DCN; ETNK2; LHX3; PHLDA2;	GO:0001890~placenta development	7	37	18.9189189189189	0.00045507535214106	0.00828084814419035	1	1	0.58110384932087	0.99999931674547	0.0741552588104182
up	GLI2; BMP4; FGFR3; SOX9; WNT2B; WNT5B; SIX2;	GO:0002062~chondrocyte differentiation	7	37	18.9189189189189	0.00045507535214106	0.00828084814419035	1	1	0.58110384932087	0.99999931674547	0.0741552588104182
up	CLIC3; FXYD3; ANO4; ANO1; WNK4; TTYH1; CLCN1;	GO:0006821~chloride transport	7	37	18.9189189189189	0.00045507535214106	0.00828084814419035	1	1	0.58110384932087	0.99999931674547	0.0741552588104182
down	GPR65; P2RY10; F2RL3; GPR174; GPR55;	GO:0051482~positive regulation of cytosolic calcium ion concentration involved in phospholipase C-activating G protein-coupled signaling pathway	5	39	12.8205128205128	0.00045778925548312	0.0104632118778232	0.672492416304705	0.701790928655624	0.44451336707411	0.672492416304705	0.0827904116074697
down	TYROBP; IFNG; AZU1; CCR2;	GO:0042535~positive regulation of tumor necrosis factor biosynthetic process	4	21	19.047619047619	0.0004581219012747	0.0104632118778232	0.672522951071259	0.702300874654114	0.444524791625194	0.672522951071259	0.0827904116074697
down	HLA-DMB; CD40LG; AIF1; NCKAP1L; CLECL1; LILRB2;	GO:0042102~positive regulation of T cell proliferation	6	61	9.83606557377049	0.00046125128973151	0.0104632118778232	0.676655642036129	0.707098227158409	0.446228828759814	0.676655642036129	0.0827904116074697
down	IL18RAP; LILRA2; WDR83;	GO:0032635~interleukin-6 production	3	8	37.5	0.00047777223186407	0.0104632118778232	0.700414091912728	0.732424831447621	0.454361392502731	0.699458547449	0.0827904116074697
down	LTF; DEFA4; DEFA3;	GO:0051673~membrane disruption in other organism	3	8	37.5	0.00047777223186407	0.0104632118778232	0.700414091912728	0.732424831447621	0.454361392502731	0.699458547449	0.0827904116074697
down	ELANE; CCR2; FUT7;	GO:1903238~positive regulation of leukocyte tethering or rolling	3	8	37.5	0.00047777223186407	0.0104632118778232	0.700414091912728	0.732424831447621	0.454361392502731	0.699458547449	0.0827904116074697
down	JCHAIN; IGKC; IGHG3; IGHA2; LTF;	GO:0001895~retina homeostasis	5	40	12.5	0.00050882788928896	0.0109863824546477	0.744415202029756	0.780033154279984	0.468016251649394	0.744415202029756	0.0869300111780395
up	HS3ST1; SDC1; SDC4; GPC1; GALNT5; HS6ST2; HS3ST6;	GO:0006024~glycosaminoglycan biosynthetic process	7	38	18.4210526315789	0.00052417060856169	0.00934269662555244	1	1	0.607758941445746	0.99999931674547	0.0836641457724499
up	JUP; DSP; GJA5; DSC2; DSG2; SCN5A; PKP2;	GO:0086091~regulation of heart rate by cardiac conduction	7	38	18.4210526315789	0.00052417060856169	0.00934269662555244	1	1	0.607758941445746	0.99999931674547	0.0836641457724499
up	KRT6A; KRT16; SERPINB5; RIPK4; SOX9;	GO:0002009~morphogenesis of an epithelium	5	17	29.4117647058824	0.00055173173292466	0.00969026545421529	1	1	0.617939540875625	0.99999931674547	0.0867766357004302
up	FOXE1; DIO3; DIO2; DUOX2; DUOX1;	GO:0006590~thyroid hormone generation	5	17	29.4117647058824	0.00055173173292466	0.00969026545421529	1	1	0.617939540875625	0.99999931674547	0.0867766357004302
up	CTSV; AQP3; GRHL1; SERPINB13; ERRFI1;	GO:0045616~regulation of keratinocyte differentiation	5	17	29.4117647058824	0.00055173173292466	0.00969026545421529	1	1	0.617939540875625	0.99999931674547	0.0867766357004302
up	ANXA1; HSPB1; MT1G; FLT4; KDR; DLL4;	GO:0035924~cellular response to vascular endothelial growth factor stimulus	6	27	22.2222222222222	0.00055481170340299	0.00969026545421529	1	1	0.618772862974105	0.99999931674547	0.0867766357004302
up	CTNND1; PLEKHA7; CDH26; CDH3; CDH1; CDH8;	GO:0044331~cell-cell adhesion mediated by cadherin	6	27	22.2222222222222	0.00055481170340299	0.00969026545421529	1	1	0.618772862974105	0.99999931674547	0.0867766357004302
down	CLDN5; PF4; THBS2; CCR2; FASLG; HHEX; STAB1;	GO:0016525~negative regulation of angiogenesis	7	89	7.86516853932584	0.00055520836518663	0.0118213114420987	0.811714629902857	0.851134423831107	0.488180634712785	0.811714629902857	0.0935364065508208
up	BMP4; ERBB3; GATA4; FOXF1;	GO:0003197~endocardial cushion development	4	9	44.4444444444444	0.00058759055228174	0.0101406004439417	1	1	0.627186237184597	0.99999931674547	0.0908093998730205
up	MATN2; CD9; P2RY1; NDN;	GO:0008347~glial cell migration	4	9	44.4444444444444	0.00058759055228174	0.0101406004439417	1	1	0.627186237184597	0.99999931674547	0.0908093998730205
up	RARB; RARG; ALDH1A3; FOXL2;	GO:0048048~embryonic eye morphogenesis	4	9	44.4444444444444	0.00058759055228174	0.0101406004439417	1	1	0.627186237184597	0.99999931674547	0.0908093998730205
up	BMPR1B; TFAP2A; BMP4; BMP7; PTN; WNT4; ADGRV1;	GO:0030501~positive regulation of bone mineralization	7	39	17.9487179487179	0.00060135778304548	0.0102374137990622	1	1	0.630769664055557	0.99999931674547	0.09167636655086
up	SFN; KDF1; TP63;	GO:0010482~regulation of epidermal cell division	3	3	100	0.00060437183006134	0.0102374137990622	1	1	0.631546033421604	0.99999931674547	0.09167636655086
up	TMEM79; DUOX2; DUOX1;	GO:0042335~cuticle development	3	3	100	0.00060437183006134	0.0102374137990622	1	1	0.631546033421604	0.99999931674547	0.09167636655086
up	NR2F6; RARB; BMP4; RARG; BMP7; RXRG; HNF4G; NR2E1;	GO:0043401~steroid hormone mediated signaling pathway	8	52	15.3846153846154	0.00062217728821656	0.0104472935384318	1	1	0.635960623293383	0.99999931674547	0.0935558462999163
down	CSF3; SPI1; CEBPE;	GO:0030851~granulocyte differentiation	3	9	33.3333333333333	0.00063007322299346	0.0127092401427498	0.920536978793454	0.965902250848983	0.521070555415596	0.918646759124473	0.100562163408598
down	LY86; SCIMP; CD180;	GO:0031666~positive regulation of lipopolysaccharide-mediated signaling pathway	3	9	33.3333333333333	0.00063007322299346	0.0127092401427498	0.920536978793454	0.965902250848983	0.521070555415596	0.918646759124473	0.100562163408598
down	IGHD; ORM1; ORM2;	GO:0050716~positive regulation of interleukin-1 secretion	3	9	33.3333333333333	0.00063007322299346	0.0127092401427498	0.920536978793454	0.965902250848983	0.521070555415596	0.918646759124473	0.100562163408598
down	TYROBP; IFNG; AZU1;	GO:0050725~positive regulation of interleukin-1 beta biosynthetic process	3	9	33.3333333333333	0.00063007322299346	0.0127092401427498	0.920536978793454	0.965902250848983	0.521070555415596	0.918646759124473	0.100562163408598
