down	POLR1C; POLR2K; ACTB; TAF1B; KAT2B; MYBBP1A; TAF1D; POLR1B;	GO:0045815~positive regulation of gene expression, epigenetic	8	32	25	0.00328867327985827	0.0582678927712778	1	1	0.947137904599181	0.999999944778075	0.537234159391499
down	RPS6; RPS24; EMG1; RRP36; LTV1; NPM1;	GO:0042274~ribosomal small subunit biogenesis	6	18	33.3333333333333	0.0032954980099642	0.0582678927712778	1	1	0.947321258517891	0.999999944778075	0.537234159391499
down	ARF4; EIF6; FOXO1; PINK1; BCO2; STK17A;	GO:2000377~regulation of reactive oxygen species metabolic process	6	18	33.3333333333333	0.0032954980099642	0.0582678927712778	1	1	0.947321258517891	0.999999944778075	0.537234159391499
up	SLC9A3; LRRC8D; SLC22A9; SLC24A4; SLC9A2;	GO:0098656~anion transmembrane transport	5	38	13.1578947368421	0.00330636408250906	0.0620786725695579	1	1	0.964950530298474	0.997267179759554	0.527692478824699
down	TALDO1; RPIA; PGD; RPE; RBKS;	GO:0006098~pentose-phosphate shunt	5	12	41.6666666666667	0.00338157289147123	0.0582678927712778	1	1	0.949180983744949	0.999999944778075	0.537234159391499
down	PCSK5; SEC11C; HM13; SPCS1; SPCS3;	GO:0006465~signal peptide processing	5	12	41.6666666666667	0.00338157289147123	0.0582678927712778	1	1	0.949180983744949	0.999999944778075	0.537234159391499
down	SCARF1; SNX17; SCARB1; TRERF1; CYP39A1;	GO:0006707~cholesterol catabolic process	5	12	41.6666666666667	0.00338157289147123	0.0582678927712778	1	1	0.949180983744949	0.999999944778075	0.537234159391499
down	CUTA; MT2A; MT1A; MT1X; NEDD4L;	GO:0010038~response to metal ion	5	12	41.6666666666667	0.00338157289147123	0.0582678927712778	1	1	0.949180983744949	0.999999944778075	0.537234159391499
down	SPTLC1; GBA; ASAH1; ACER1; ACER3;	GO:0046512~sphingosine biosynthetic process	5	12	41.6666666666667	0.00338157289147123	0.0582678927712778	1	1	0.949180983744949	0.999999944778075	0.537234159391499
down	PABPC1; ZFP36; TOB1; CPEB3; POLR2G;	GO:0060213~positive regulation of nuclear-transcribed mRNA poly(A) tail shortening	5	12	41.6666666666667	0.00338157289147123	0.0582678927712778	1	1	0.949180983744949	0.999999944778075	0.537234159391499
down	CHMP2A; RRS1; PDCD6IP; PINX1; CHMP4C; SEH1L; CHMP4B; CHMP5; CHMP2B;	GO:0007080~mitotic metaphase plate congression	9	40	22.5	0.00343179162277263	0.0587759115090575	1	1	0.950289346770897	0.999999944778075	0.541918128667984
down	SOD1; SCGB1A1; PRLR; FKBP4; FUT7; TRO; PTGIS; PCSK5; POLR1B;	GO:0007566~embryo implantation	9	40	22.5	0.00343179162277263	0.0587759115090575	1	1	0.950289346770897	0.999999944778075	0.541918128667984
down	BIN1; CHMP2A; PDCD6IP; CHMP4C; CHMP4B; CHMP5; CHMP2B;	GO:0006997~nucleus organization	7	25	28	0.00345857690037654	0.0590562423139597	1	1	0.950856619185752	0.999999944778075	0.54450279883813
up	TNFSF11; CA2; CCR1; TREM2;	GO:0045672~positive regulation of osteoclast differentiation	4	23	17.3913043478261	0.00349787778679855	0.065230693861919	1	1	0.968808069330103	0.997267179759554	0.554485866315556
down	TRIM24; ERN1; CDKL5; OXSR1; EIF2S1; LYN; PIM1; PDGFRA; FER; FLT4; KDR; CSK; TYRO3; CAMK2B; CAMK2D; PTK6; PTK2B; LRRK2; ULK3; STK33; STK39; STK24; MKNK2;	GO:0046777~protein autophosphorylation	23	173	13.2947976878613	0.00351024799859023	0.0597585462582824	1	1	0.951724478178996	0.999999944778075	0.550978091683309
down	LDOC1; ARG1; GSTP1; NR1D1; EDNRB; ZFP36; IL12A; MAPK8; LCN2; TICAM1; MYD88; CHMP5; HDAC5; PLAA; PF4; CXCL2; IL36B; IL1F10; CXCL11; IL36RN; IL1A; IL36A;	GO:0071222~cellular response to lipopolysaccharide	22	163	13.4969325153374	0.00360757639861753	0.0612315886340203	1	1	0.953832474476795	0.999999944778075	0.564559648263432
down	EML2; SOD1; TH; GJB2; SLC1A3; ROR1; CRYM; CEACAM16; USH1G; TPRN; LRIG1; SPTBN4; EPS8L2; ATP6V0A4; SLC52A3; HOMER2; CHD7; MYO6; TIMM8B; TMIE;	GO:0007605~sensory perception of sound	20	143	13.986013986014	0.00375169106429885	0.0624440466690738	1	1	0.95672728519821	0.999999944778075	0.575738598492786
down	ALDH5A1; SUCLA2; SDHAF3; SUCLG1;	GO:0006105~succinate metabolic process	4	7	57.1428571428571	0.00376713070397305	0.0624440466690738	1	1	0.957062676373911	0.999999944778075	0.575738598492786
down	IFNG; IL12A; MAP2K4; ARRB1;	GO:0034393~positive regulation of smooth muscle cell apoptotic process	4	7	57.1428571428571	0.00376713070397305	0.0624440466690738	1	1	0.957062676373911	0.999999944778075	0.575738598492786
down	SULT1B1; DIO2; CRYM; DIO1;	GO:0042403~thyroid hormone metabolic process	4	7	57.1428571428571	0.00376713070397305	0.0624440466690738	1	1	0.957062676373911	0.999999944778075	0.575738598492786
down	AQP1; RHCG; RHBG; RHCE;	GO:0072488~ammonium transmembrane transport	4	7	57.1428571428571	0.00376713070397305	0.0624440466690738	1	1	0.957062676373911	0.999999944778075	0.575738598492786
down	NUPR1; IL33; TNF; IL18;	GO:0150078~positive regulation of neuroinflammatory response	4	7	57.1428571428571	0.00376713070397305	0.0624440466690738	1	1	0.957062676373911	0.999999944778075	0.575738598492786
down	POLR1C; MAPK3; CDK7; POLR2K; TAF1B; GTF2H4; TAF1D; POLR1B;	GO:0006361~transcription initiation from RNA polymerase I promoter	8	33	24.2424242424242	0.00386143021555496	0.0634505735999452	1	1	0.959136806013111	0.999999944778075	0.585018849140156
down	YKT6; PLEK; CFTR; STX1B; SCFD2; SCFD1; EXOC6B; RAB10;	GO:0006904~vesicle docking involved in exocytosis	8	33	24.2424242424242	0.00386143021555496	0.0634505735999452	1	1	0.959136806013111	0.999999944778075	0.585018849140156
up	LTA4H; ALOX5AP; LTC4S;	GO:0019370~leukotriene biosynthetic process	3	11	27.2727272727273	0.00391384492690494	0.0710671841990634	1	1	0.977019595894822	0.997267179759554	0.604098268226909
up	RP1; CABP4; RORB;	GO:0046549~retinal cone cell development	3	11	27.2727272727273	0.00391384492690494	0.0710671841990634	1	1	0.977019595894822	0.997267179759554	0.604098268226909
up	CD200R1; IL37; C5AR2;	GO:1900165~negative regulation of interleukin-6 secretion	3	11	27.2727272727273	0.00391384492690494	0.0710671841990634	1	1	0.977019595894822	0.997267179759554	0.604098268226909
up	KCNE1; KCNJ2; KCNH2;	GO:1901381~positive regulation of potassium ion transmembrane transport	3	11	27.2727272727273	0.00391384492690494	0.0710671841990634	1	1	0.977019595894822	0.997267179759554	0.604098268226909
down	PLA2G4B; PLA2G2A; PLA2G5; PLA2G4A; PLD1; GPAT3; PLA2G4D; ABHD5; PLA2G12A;	GO:0006654~phosphatidic acid biosynthetic process	9	41	21.9512195121951	0.00395268400934767	0.0647623284652947	1	1	0.96095050681869	0.999999944778075	0.59711332328186
up	CCL24; TLR4; MDK; IL15; IL1RL1; IL17RB; GPRC5B;	GO:0050729~positive regulation of inflammatory response	7	78	8.97435897435897	0.0039849629299753	0.0714344577828485	1	1	0.97840298647308	0.997267179759554	0.607220234271161
up	LBH; HRH4; NTRK1; NTRK2;	GO:0043408~regulation of MAPK cascade	4	24	16.6666666666667	0.00400557694204662	0.0714344577828485	1	1	0.978756519620858	0.997267179759554	0.607220234271161
up	CST1; AZGP1; TAS2R60; RTP4; TAS2R3;	GO:0001580~detection of chemical stimulus involved in sensory perception of bitter taste	5	40	12.5	0.00403759978772622	0.0714344577828485	1	1	0.979473098019042	0.997267179759554	0.607220234271161
up	CALCA; ADORA3; TMIGD3; VIPR2; TSHR;	GO:0007190~activation of adenylate cyclase activity	5	40	12.5	0.00403759978772622	0.0714344577828485	1	1	0.979473098019042	0.997267179759554	0.607220234271161
down	KPNA7; ETV2; PSMC4; ELF3; HORMAD1; EMG1;	GO:0001824~blastocyst development	6	19	31.5789473684211	0.00410539315959979	0.0670705297457384	1	1	0.964428744251445	0.999999944778075	0.618395104990925
down	ERN1; PACRG; HSPB8; HSPA6; HSPA8; HSPA5; HSPA2;	GO:0034620~cellular response to unfolded protein	7	26	26.9230769230769	0.00415192937545938	0.0674420848982213	1	1	0.965241791366229	0.999999944778075	0.621820870202571
down	GBA; CALM1; PIN1; PPP2R5A; PPP1R7; CNEP1R1; PINK1;	GO:0035307~positive regulation of protein dephosphorylation	7	26	26.9230769230769	0.00415192937545938	0.0674420848982213	1	1	0.965241791366229	0.999999944778075	0.621820870202571
up	TLR4; NPPA; MMP7; TNFRSF8; IL13; KCNJ2; MAP3K14;	GO:0071260~cellular response to mechanical stimulus	7	79	8.86075949367089	0.00425159422212873	0.0747414016119445	1	1	0.983655955414108	0.997267179759554	0.635330522624289
up	GRM8; FFAR3; AKAP5; OPRD1; P2RY1; PTGDR2;	GO:0007193~adenylate cyclase-inhibiting G protein-coupled receptor signaling pathway	6	59	10.1694915254237	0.0042896486486903	0.0749331029771217	1	1	0.984463554720688	0.997267179759554	0.636960057606228
down	WDR12; ZNHIT6; RPL7; RPL7L1; DDX18;	GO:0000463~maturation of LSU-rRNA from tricistronic rRNA transcript (SSU-rRNA, 5.8S rRNA, LSU-rRNA)	5	13	38.4615384615385	0.00443904873446876	0.067970542161902	1	1	0.971393026608386	0.999999944778075	0.626693284156895
down	HMGCR; CXCR2; BNIP3; CAMK2D; MAP3K5;	GO:0010666~positive regulation of cardiac muscle cell apoptotic process	5	13	38.4615384615385	0.00443904873446876	0.067970542161902	1	1	0.971393026608386	0.999999944778075	0.626693284156895
down	EPS15; PLEKHF1; SNX11; SAR1B; SAR1A;	GO:0016050~vesicle organization	5	13	38.4615384615385	0.00443904873446876	0.067970542161902	1	1	0.971393026608386	0.999999944778075	0.626693284156895
down	SOD1; SOD2; NQO1; ATP7A; PRDX1;	GO:0019430~removal of superoxide radicals	5	13	38.4615384615385	0.00443904873446876	0.067970542161902	1	1	0.971393026608386	0.999999944778075	0.626693284156895
down	STX1B; STX3; STX19; SNAP29; STX11;	GO:0031629~synaptic vesicle fusion to presynaptic active zone membrane	5	13	38.4615384615385	0.00443904873446876	0.067970542161902	1	1	0.971393026608386	0.999999944778075	0.626693284156895
down	PLEK; PFN2; ID1; CX3CL1; SYNPO2L;	GO:0032233~positive regulation of actin filament bundle assembly	5	13	38.4615384615385	0.00443904873446876	0.067970542161902	1	1	0.971393026608386	0.999999944778075	0.626693284156895
down	PNP; HPRT1; APRT; ADK; ADAL;	GO:0043101~purine-containing compound salvage	5	13	38.4615384615385	0.00443904873446876	0.067970542161902	1	1	0.971393026608386	0.999999944778075	0.626693284156895
down	UBE2M; UBE2F; DCUN1D5; DCUN1D1; DCUN1D3;	GO:0045116~protein neddylation	5	13	38.4615384615385	0.00443904873446876	0.067970542161902	1	1	0.971393026608386	0.999999944778075	0.626693284156895
down	ARF4; MAL; NAPA; ACTB; SHROOM3;	GO:0045176~apical protein localization	5	13	38.4615384615385	0.00443904873446876	0.067970542161902	1	1	0.971393026608386	0.999999944778075	0.626693284156895
down	CRTAM; SLC46A2; SPINK5; CYP26B1; PRELID1;	GO:0045580~regulation of T cell differentiation	5	13	38.4615384615385	0.00443904873446876	0.067970542161902	1	1	0.971393026608386	0.999999944778075	0.626693284156895
down	YBX3; CASP8; PELI1; RBCK1; BOK;	GO:0060546~negative regulation of necroptotic process	5	13	38.4615384615385	0.00443904873446876	0.067970542161902	1	1	0.971393026608386	0.999999944778075	0.626693284156895
down	SEC24A; SEC24C; TBC1D20; SAR1A; SEC23B;	GO:0090110~COPII-coated vesicle cargo loading	5	13	38.4615384615385	0.00443904873446876	0.067970542161902	1	1	0.971393026608386	0.999999944778075	0.626693284156895
down	IDE; PLAA; FBXW7;	GO:0010992~ubiquitin recycling	3	3	100	0.00445729153691232	0.067970542161902	1	1	0.971689555046886	0.999999944778075	0.626693284156895
down	OXSR1; WNK1; STK39;	GO:0023016~signal transduction by trans-phosphorylation	3	3	100	0.00445729153691232	0.067970542161902	1	1	0.971689555046886	0.999999944778075	0.626693284156895
down	HK2; DYNLT1; BCL2L2;	GO:0035795~negative regulation of mitochondrial membrane permeability	3	3	100	0.00445729153691232	0.067970542161902	1	1	0.971689555046886	0.999999944778075	0.626693284156895
down	TST; PNPT1; MRPL18;	GO:0035928~rRNA import into mitochondrion	3	3	100	0.00445729153691232	0.067970542161902	1	1	0.971689555046886	0.999999944778075	0.626693284156895
down	TGM1; TGM3; HRNR;	GO:0043163~cell envelope organization	3	3	100	0.00445729153691232	0.067970542161902	1	1	0.971689555046886	0.999999944778075	0.626693284156895
down	ANXA2; SFTPD; RAB9A;	GO:0052405~negative regulation by host of symbiont molecular function	3	3	100	0.00445729153691232	0.067970542161902	1	1	0.971689555046886	0.999999944778075	0.626693284156895
down	CAMK2D; COMMD1; NEDD4L;	GO:1902306~negative regulation of sodium ion transmembrane transport	3	3	100	0.00445729153691232	0.067970542161902	1	1	0.971689555046886	0.999999944778075	0.626693284156895
down	KIFAP3; TUBA1C; TUBB2B; TUBA4A; TUBB4B; TUBB6; SRRD; TUBB2A;	GO:0007017~microtubule-based process	8	34	23.5294117647059	0.00450818907265393	0.067970542161902	1	1	0.972826061631834	0.999999944778075	0.626693284156895
down	MAPK3; CCT6A; CCT5; CCT4; CCT2; CCT7; PKIB; MAP3K4;	GO:0032212~positive regulation of telomere maintenance via telomerase	8	34	23.5294117647059	0.00450818907265393	0.067970542161902	1	1	0.972826061631834	0.999999944778075	0.626693284156895
down	SASH1; DKK1; TNF; TIAM1; PTK2B; MAP3K5; TNFRSF11A; MAP3K4;	GO:0043507~positive regulation of JUN kinase activity	8	34	23.5294117647059	0.00450818907265393	0.067970542161902	1	1	0.972826061631834	0.999999944778075	0.626693284156895
down	FOXP2; EDN2; SFTPD; FLT4; ATP7A; FOXF1; STK40; TMEM38B;	GO:0048286~lung alveolus development	8	34	23.5294117647059	0.00450818907265393	0.067970542161902	1	1	0.972826061631834	0.999999944778075	0.626693284156895
down	SNAP29; LAMP2; STX17; GABARAPL2; TSG101; MAP1LC3B; MAP1LC3A; UBQLN1;	GO:0097352~autophagosome maturation	8	34	23.5294117647059	0.00450818907265393	0.067970542161902	1	1	0.972826061631834	0.999999944778075	0.626693284156895
up	SLC8A3; ATP1A4; SLC4A8; SLC24A4; ASIC4; SCN2A; SLC28A3;	GO:0035725~sodium ion transmembrane transport	7	80	8.75	0.00453149105939155	0.0776827038752836	1	1	0.989195518496929	0.997267179759554	0.660332717711096
up	IRGM; TLR4; CD160; IGHM; CTSG; SELP; SLC11A1;	GO:0050829~defense response to Gram-negative bacterium	7	80	8.75	0.00453149105939155	0.0776827038752836	1	1	0.989195518496929	0.997267179759554	0.660332717711096
up	TLR4; SASH3; FCER1G; TREM2;	GO:0032733~positive regulation of interleukin-10 production	4	25	16	0.00456083022481246	0.0777030334597679	1	1	0.989700158784304	0.997267179759554	0.66050552696081
up	CTSG; CPA3; CMA1;	GO:0002003~angiotensin maturation	3	12	25	0.00480715589542879	0.0804106077053544	1	1	0.99499257669631	0.997267179759554	0.683520944432157
up	GUCY1B2; NPPA; NPR1;	GO:0006182~cGMP biosynthetic process	3	12	25	0.00480715589542879	0.0804106077053544	1	1	0.99499257669631	0.997267179759554	0.683520944432157
up	FES; IL15; SFRP1;	GO:0071305~cellular response to vitamin D	3	12	25	0.00480715589542879	0.0804106077053544	1	1	0.99499257669631	0.997267179759554	0.683520944432157
up	GALR2; CALCA; TSHR; PTGER2; CALCB; ADGRE1; ADGRE2; ADGRE4P;	GO:0007189~adenylate cyclase-activating G protein-coupled receptor signaling pathway	8	103	7.76699029126214	0.00486562154308734	0.0806107631522447	1	1	0.996031869112235	0.997267179759554	0.685222342344644
up	SLC26A4; CA1; CA2; CA9; SLC4A8;	GO:0015701~bicarbonate transport	5	42	11.9047619047619	0.00487753530667567	0.0806107631522447	1	1	0.996031869112235	0.997267179759554	0.685222342344644
down	EFNB3; FXN; ABHD12; OXR1; SPTBN4; HIPK2; CHD7;	GO:0007628~adult walking behavior	7	27	25.9259259259259	0.00494546752917369	0.0730100401637647	1	1	0.980985104236387	0.999999944778075	0.67315781795106
down	TEAD1; YWHAB; TJP1; WWC1; WWTR1; LATS2; AMOTL2;	GO:0035329~hippo signaling	7	27	25.9259259259259	0.00494546752917369	0.0730100401637647	1	1	0.980985104236387	0.999999944778075	0.67315781795106
down	GSTP1; DUSP1; DUSP3; RNF149; P2RX7; PEBP1;	GO:0043409~negative regulation of MAPK cascade	6	20	30	0.00505337246618398	0.0740247248341007	1	1	0.982628295365761	0.999999944778075	0.682513283542638
down	CDKL5; HSPA8; ARF4; ABHD17C; LRFN2; CHMP2B;	GO:0099175~regulation of postsynapse organization	6	20	30	0.00505337246618398	0.0740247248341007	1	1	0.982628295365761	0.999999944778075	0.682513283542638
down	DCLK1; MAPK13; MAPK3; MARK3; MAPK8; CSNK1E; PRKCE; CAMK2D; LRRK2; PINK1; HIPK2; HIPK3; WNK1; PLK2; STK39; CAB39; DMPK; PRKCH; LATS2; MKNK2; CSNK2A3;	GO:0018105~peptidyl-serine phosphorylation	21	158	13.2911392405063	0.00512920566609365	0.0747492722907067	1	1	0.983909427432731	0.999999944778075	0.689193663169835
up	CHST15; CHST13; CHST7; DSE;	GO:0030206~chondroitin sulfate biosynthetic process	4	26	15.3846153846154	0.00516558915159315	0.082540679791438	1	1	0.997267179759554	0.997267179759554	0.70162737249602
down	KLK8; CIDEA; HMOX1; PTGER3; EMP1; EIF4G2; BNIP3; VAPA;	GO:0008219~cell death	8	35	22.8571428571429	0.00523494781257883	0.0757064264018096	1	1	0.985234736467527	0.999999944778075	0.698018692870239
down	HSPA5; SLC6A1; HTR3A; HNMT; TIAM1; PTK2B; ADGRL3; HDAC5;	GO:0042220~response to cocaine	8	35	22.8571428571429	0.00523494781257883	0.0757064264018096	1	1	0.985234736467527	0.999999944778075	0.698018692870239
down	TNF; IL1A; PF4; CX3CL1; BCL2L1; UNC5B; STRADB; EYA3;	GO:2001240~negative regulation of extrinsic apoptotic signaling pathway in absence of ligand	8	35	22.8571428571429	0.00523494781257883	0.0757064264018096	1	1	0.985234736467527	0.999999944778075	0.698018692870239
up	GRK5; CCR3; ADRA1D; DRD2; CYSLTR2; GALR2;	GO:0007188~adenylate cyclase-modulating G protein-coupled receptor signaling pathway	6	62	9.67741935483871	0.00535728182883111	0.0826038985897981	1	1	0.997267179759554	0.997267179759554	0.702164756480472
up	LRRTM2; NTRK1; BDNF; EPHB1; NTRK2; NRXN1;	GO:0051965~positive regulation of synapse assembly	6	62	9.67741935483871	0.00535728182883111	0.0826038985897981	1	1	0.997267179759554	0.997267179759554	0.702164756480472
down	CFTR; AQP1; SCNN1B; SCNN1G;	GO:0050891~multicellular organismal water homeostasis	4	8	50	0.00536775493891839	0.0768429362341625	1	1	0.98752906597999	0.999999944778075	0.70849739521187
down	HSPA5; PLA2G4A; ATP7A; PLA2G4F;	GO:0071236~cellular response to antibiotic	4	8	50	0.00536775493891839	0.0768429362341625	1	1	0.98752906597999	0.999999944778075	0.70849739521187
down	OXSR1; NEDD4L; STK39; CAB39;	GO:1901017~negative regulation of potassium ion transmembrane transporter activity	4	8	50	0.00536775493891839	0.0768429362341625	1	1	0.98752906597999	0.999999944778075	0.70849739521187
down	CPEB2; UNK; CPEB4; CPEB3;	GO:2000766~negative regulation of cytoplasmic translation	4	8	50	0.00536775493891839	0.0768429362341625	1	1	0.98752906597999	0.999999944778075	0.70849739521187
down	CFAP69; OVOL1; CLOCK; PIAS1; SOD1; AR; ZNF35; YBX3; GJA1; FSHR; CETN2; PRKAG1; HSPA2; RAD23B; UBE2B; TYRO3; BCL2L1; MERTK; PRDX4; CCNI; MEA1; ODF4; MORN2; LRRK2; HORMAD1; CCNYL1; TDRD7; GTSF1; BCL2L2; FOXJ1; MYCBP; PAIP2; DPCD; BCL2L10; PARP11; CYP26B1; RAI14; SFMBT1; DUSP13; AURKC; CDYL; RNF114; PRSS21;	GO:0007283~spermatogenesis	43	407	10.5651105651106	0.00552264291040794	0.0784987259951168	1	1	0.989339622151247	0.999999944778075	0.723763895818767
up	TNFSF13; ALDH1A2; NTN1; KIT; TSHR; KITLG; ADRA1D; DPP4; GRK5; IL15; HTR2B; LAMC2; RUNX2; NTRK2; SHC4; GCNT2; SFRP1; AQP11; IL31RA; MZB1; OSMR; CSF3;	GO:0008284~positive regulation of cell population proliferation	22	490	4.48979591836735	0.00564218471087707	0.0845684867500909	1	1	0.997267179759554	0.997267179759554	0.718864507832483
down	AKR1C3; AKR1C1; SDR16C5; RDH13; BCO2;	GO:0042574~retinal metabolic process	5	14	35.7142857142857	0.00571217358442855	0.0801542377478352	1	1	0.992225196049188	0.999999944778075	0.739027833169748
down	PTPN2; GPT; FOXO1; KAT2B; DGAT2;	GO:0045722~positive regulation of gluconeogenesis	5	14	35.7142857142857	0.00571217358442855	0.0801542377478352	1	1	0.992225196049188	0.999999944778075	0.739027833169748
down	GNAI3; AK4; RAN; LRRK2; MFN1;	GO:0046039~GTP metabolic process	5	14	35.7142857142857	0.00571217358442855	0.0801542377478352	1	1	0.992225196049188	0.999999944778075	0.739027833169748
down	PTPN2; PTK6; SRCIN1; IBTK; SH3BP5;	GO:0061099~negative regulation of protein tyrosine kinase activity	5	14	35.7142857142857	0.00571217358442855	0.0801542377478352	1	1	0.992225196049188	0.999999944778075	0.739027833169748
up	SGK1; HRK; STK17B; NTN1; CD14; CAPN3; GRK5; CTSC; BIK; ARHGEF6; PRKD1; BCL2L15; SHC4; UNC5A; SHF; SULF1; TNS4; SLC5A8; MZB1; CADM1; NEK6; IL19; DAPK2; EDAR;	GO:0006915~apoptotic process	24	552	4.34782608695652	0.00575702968455205	0.0845684867500909	1	1	0.997267179759554	0.997267179759554	0.718864507832483
up	DRD2; HTR2B; SAG;	GO:0002031~G protein-coupled receptor internalization	3	13	23.0769230769231	0.0058136523956428	0.0845684867500909	1	1	0.997267179759554	0.997267179759554	0.718864507832483
up	TLR4; MDK; CDH3;	GO:0010838~positive regulation of keratinocyte proliferation	3	13	23.0769230769231	0.0058136523956428	0.0845684867500909	1	1	0.997267179759554	0.997267179759554	0.718864507832483
up	TLR4; IL13; SLC11A1;	GO:0042116~macrophage activation	3	13	23.0769230769231	0.0058136523956428	0.0845684867500909	1	1	0.997267179759554	0.997267179759554	0.718864507832483
up	DRD2; NPR1; SNCAIP;	GO:0042417~dopamine metabolic process	3	13	23.0769230769231	0.0058136523956428	0.0845684867500909	1	1	0.997267179759554	0.997267179759554	0.718864507832483
up	NCF2; CD52; SLC11A1;	GO:0045730~respiratory burst	3	13	23.0769230769231	0.0058136523956428	0.0845684867500909	1	1	0.997267179759554	0.997267179759554	0.718864507832483
up	KIT; GATA1; PPARGC1A;	GO:0097067~cellular response to thyroid hormone stimulus	3	13	23.0769230769231	0.0058136523956428	0.0845684867500909	1	1	0.997267179759554	0.997267179759554	0.718864507832483
up	CD36; GATA2; VDR; RARB;	GO:0033993~response to lipid	4	27	14.8148148148148	0.00582174365308596	0.0845684867500909	1	1	0.997267179759554	0.997267179759554	0.718864507832483
up	HRH2; HRH1; HTR2B; HRH4;	GO:0098664~G protein-coupled serotonin receptor signaling pathway	4	27	14.8148148148148	0.00582174365308596	0.0845684867500909	1	1	0.997267179759554	0.997267179759554	0.718864507832483
down	IL6ST; PPP1R2; PPP1CB; PPP1R3B; STK40; PPP1R3C; UGP2;	GO:0005977~glycogen metabolic process	7	28	25	0.00584776929926578	0.0814520986671688	1	1	0.994120780875183	0.999999944778075	0.750994204130548
down	CAPZB; ZNF135; EFNA5; SH3D19; LARP4; ARC; PDZD8;	GO:0022604~regulation of cell morphogenesis	7	28	25	0.00584776929926578	0.0814520986671688	1	1	0.994120780875183	0.999999944778075	0.750994204130548
down	ATP6V1G1; ATP6V1E1; RAB38; ATP6V1F; ATP6V1C2; ATP6V0A4; ATP6V1D;	GO:0090383~phagosome acidification	7	28	25	0.00584776929926578	0.0814520986671688	1	1	0.994120780875183	0.999999944778075	0.750994204130548
down	TMCC1; LRRK2; TOR1AIP2; LNPK; TMEM38B; VAPA; LMAN2L; LMAN1;	GO:0007029~endoplasmic reticulum organization	8	36	22.2222222222222	0.00604782024371153	0.0830147529336578	1	1	0.996983526516654	0.999999944778075	0.765401988784305
down	ACR; ZP3; VDAC2; CCT5; CCT4; CCT2; CCT7; TEX101;	GO:0007339~binding of sperm to zona pellucida	8	36	22.2222222222222	0.00604782024371153	0.0830147529336578	1	1	0.996983526516654	0.999999944778075	0.765401988784305
down	ATP6V1G1; TF; ATP6V1E1; ATP6AP1; ATP6V1F; ATP6V1C2; ATP6V0A4; ATP6V1D;	GO:0033572~transferrin transport	8	36	22.2222222222222	0.00604782024371153	0.0830147529336578	1	1	0.996983526516654	0.999999944778075	0.765401988784305
up	CCL24; TERT; GATA2; CMA1; CCR3; HMGA2; PRKD1; C3AR1; PIK3R6;	GO:0045766~positive regulation of angiogenesis	9	131	6.87022900763359	0.00614063083612337	0.0883803923658279	1	1	0.997267179759554	0.997267179759554	0.751267164657341
down	FUT3; FUT6; PPP2CA; FUT7; ORMDL2; CLN8;	GO:0006672~ceramide metabolic process	6	21	28.5714285714286	0.00615240993994459	0.0841162039109108	1	1	0.998118996874289	0.999999944778075	0.775557445962037
up	HTR2B; ADRA1D; DRD2; PMCH;	GO:0007610~behavior	4	28	14.2857142857143	0.00653111875443102	0.0929169472279877	1	1	0.997267179759554	0.997267179759554	0.789829617452301
up	CA2; SLC4A8; SLC9A2; SLC9A3;	GO:0051453~regulation of intracellular pH	4	28	14.2857142857143	0.00653111875443102	0.0929169472279877	1	1	0.997267179759554	0.997267179759554	0.789829617452301
down	UBB; UBC; RPA2; CETN2; CDK7; RAD23B; GTF2H4;	GO:0006294~nucleotide-excision repair, preincision complex assembly	7	29	24.1379310344828	0.0068674976901294	0.0899118808437496	1	1	0.999999944778075	0.999999944778075	0.828994003850624
down	POLR1C; CDK7; POLR2K; TAF1B; GTF2H4; TAF1D; POLR1B;	GO:0006362~transcription elongation from RNA polymerase I promoter	7	29	24.1379310344828	0.0068674976901294	0.0899118808437496	1	1	0.999999944778075	0.999999944778075	0.828994003850624
down	VAMP2; RAPGEF4; CHP1; RIMS2; SYT17; SYT7; SYT8;	GO:0017156~calcium-ion regulated exocytosis	7	29	24.1379310344828	0.0068674976901294	0.0899118808437496	1	1	0.999999944778075	0.999999944778075	0.828994003850624
down	UBB; UBC; UBE2D1; UBE2D3; CASP8; TICAM1; IRF7;	GO:0035666~TRIF-dependent toll-like receptor signaling pathway	7	29	24.1379310344828	0.0068674976901294	0.0899118808437496	1	1	0.999999944778075	0.999999944778075	0.828994003850624
down	PRMT5; LYN; GSTP1; EPHA2; YWHAZ; TIAM1; APIP;	GO:0070372~regulation of ERK1 and ERK2 cascade	7	29	24.1379310344828	0.0068674976901294	0.0899118808437496	1	1	0.999999944778075	0.999999944778075	0.828994003850624
up	MCF2; BDNF; TMEFF2; LAMC2; NTN1;	GO:0016358~dendrite development	5	46	10.8695652173913	0.00691614684116626	0.0962099213400297	1	1	0.997267179759554	0.997267179759554	0.817821157863252
up	TLR4; SASH3; CD14; SLC11A1; IL18R1;	GO:0032729~positive regulation of interferon-gamma production	5	46	10.8695652173913	0.00691614684116626	0.0962099213400297	1	1	0.997267179759554	0.997267179759554	0.817821157863252
up	KCNJ2; ATP4A; ATP1A4;	GO:0030007~cellular potassium ion homeostasis	3	14	21.4285714285714	0.00693687476328475	0.0962099213400297	1	1	0.997267179759554	0.997267179759554	0.817821157863252
up	NPPA; SFRP1; DUSP10;	GO:0043508~negative regulation of JUN kinase activity	3	14	21.4285714285714	0.00693687476328475	0.0962099213400297	1	1	0.997267179759554	0.997267179759554	0.817821157863252
up	GCNT3; VDR; CD36;	GO:0050892~intestinal absorption	3	14	21.4285714285714	0.00693687476328475	0.0962099213400297	1	1	0.997267179759554	0.997267179759554	0.817821157863252
