down	LGALS9; CHUK; IFI6; ADAR; FMR1; RRP1B; MAPK14; GBF1;	GO:0098586~cellular response to virus	8	23	34.7826086956522	0.001312604052496	0.0121122958686339	1	1	0.819138514800337	0.999999999999832	0.114458445768248
down	TYMS; DTYMK; TBPL1; CMPK2;	GO:0006235~dTTP biosynthetic process	4	4	100	0.00151914496376393	0.0134776878439404	1	1	0.838024543967603	0.999999999999832	0.127361089912099
down	POLA1; POLE3; POLE; PCNA;	GO:0006272~leading strand elongation	4	4	100	0.00151914496376393	0.0134776878439404	1	1	0.838024543967603	0.999999999999832	0.127361089912099
down	CENPE; KPNB1; DLGAP5; KATNB1;	GO:0007079~mitotic chromosome movement towards spindle pole	4	4	100	0.00151914496376393	0.0134776878439404	1	1	0.838024543967603	0.999999999999832	0.127361089912099
down	CD22; AHR; MZB1; IKZF3;	GO:0030888~regulation of B cell proliferation	4	4	100	0.00151914496376393	0.0134776878439404	1	1	0.838024543967603	0.999999999999832	0.127361089912099
down	HMGB3; HMGB1; HMGB2; MTERF1;	GO:0032392~DNA geometric change	4	4	100	0.00151914496376393	0.0134776878439404	1	1	0.838024543967603	0.999999999999832	0.127361089912099
down	CTU2; CTU1; URM1; MOCS3;	GO:0032447~protein urmylation	4	4	100	0.00151914496376393	0.0134776878439404	1	1	0.838024543967603	0.999999999999832	0.127361089912099
down	CD247; FCER1G; SLC11A1; STOML2;	GO:0032623~interleukin-2 production	4	4	100	0.00151914496376393	0.0134776878439404	1	1	0.838024543967603	0.999999999999832	0.127361089912099
down	TCF3; XRCC4; LIG4; PRKDC;	GO:0033152~immunoglobulin V(D)J recombination	4	4	100	0.00151914496376393	0.0134776878439404	1	1	0.838024543967603	0.999999999999832	0.127361089912099
down	M6PR; GNPTAB; BLOC1S3; NAGPA;	GO:0033299~secretion of lysosomal enzymes	4	4	100	0.00151914496376393	0.0134776878439404	1	1	0.838024543967603	0.999999999999832	0.127361089912099
down	MOCS3; CTU2; CTU1; URM1;	GO:0034227~tRNA thio-modification	4	4	100	0.00151914496376393	0.0134776878439404	1	1	0.838024543967603	0.999999999999832	0.127361089912099
down	MYSM1; ASXL1; BAP1; USP16;	GO:0035522~monoubiquitinated histone H2A deubiquitination	4	4	100	0.00151914496376393	0.0134776878439404	1	1	0.838024543967603	0.999999999999832	0.127361089912099
down	MAPK1; NRG1; PTPN11; MVP;	GO:0038127~ERBB signaling pathway	4	4	100	0.00151914496376393	0.0134776878439404	1	1	0.838024543967603	0.999999999999832	0.127361089912099
down	FASTKD3; FASTKD1; PDE12; TBRG4;	GO:0044528~regulation of mitochondrial mRNA stability	4	4	100	0.00151914496376393	0.0134776878439404	1	1	0.838024543967603	0.999999999999832	0.127361089912099
down	EXOSC10; EXOSC3; DIS3; EXOSC2;	GO:0071034~CUT catabolic process	4	4	100	0.00151914496376393	0.0134776878439404	1	1	0.838024543967603	0.999999999999832	0.127361089912099
down	DKC1; PARN; NAF1; DHX36;	GO:0090669~telomerase RNA stabilization	4	4	100	0.00151914496376393	0.0134776878439404	1	1	0.838024543967603	0.999999999999832	0.127361089912099
down	MCIDAS; NUP62; E2F4; RBM14;	GO:0098534~centriole assembly	4	4	100	0.00151914496376393	0.0134776878439404	1	1	0.838024543967603	0.999999999999832	0.127361089912099
down	ROCK2; USP19; AJUBA; CHCHD2;	GO:1900037~regulation of cellular response to hypoxia	4	4	100	0.00151914496376393	0.0134776878439404	1	1	0.838024543967603	0.999999999999832	0.127361089912099
down	SNRPA; NCBP2; NCBP1; ZC3H3;	GO:1900363~regulation of mRNA polyadenylation	4	4	100	0.00151914496376393	0.0134776878439404	1	1	0.838024543967603	0.999999999999832	0.127361089912099
down	POLA1; MCM3; MCM4; MCM2;	GO:1902975~mitotic DNA replication initiation	4	4	100	0.00151914496376393	0.0134776878439404	1	1	0.838024543967603	0.999999999999832	0.127361089912099
down	DKC1; PARN; EXOSC10; DCP2;	GO:1904872~regulation of telomerase RNA localization to Cajal body	4	4	100	0.00151914496376393	0.0134776878439404	1	1	0.838024543967603	0.999999999999832	0.127361089912099
down	MFNG; MFN2; ACTL6A; FURIN; GABPA; WDR74; PTPN18;	GO:0001825~blastocyst formation	7	18	38.8888888888889	0.00156424266984478	0.0135254771341447	1	1	0.842033436289006	0.999999999999832	0.127812687853602
down	MELTF; IREB2; SLC11A1; B2M; NECTIN1; SFXN1; TFR2;	GO:0006826~iron ion transport	7	18	38.8888888888889	0.00156424266984478	0.0135254771341447	1	1	0.842033436289006	0.999999999999832	0.127812687853602
down	OPA1; MTX1; IMMT; MTX3; DNAJC11; CHCHD3; SAMM50;	GO:0007007~inner mitochondrial membrane organization	7	18	38.8888888888889	0.00156424266984478	0.0135254771341447	1	1	0.842033436289006	0.999999999999832	0.127812687853602
down	STAT1; RBPJ; EP300; DLGAP5; MAML1; CREBBP; RBM15;	GO:0007221~positive regulation of transcription of Notch receptor target	7	18	38.8888888888889	0.00156424266984478	0.0135254771341447	1	1	0.842033436289006	0.999999999999832	0.127812687853602
down	HMGB3; HOXB8; HOXA9; CDK6; CDC73; CTR9; RBM15;	GO:0045638~negative regulation of myeloid cell differentiation	7	18	38.8888888888889	0.00156424266984478	0.0135254771341447	1	1	0.842033436289006	0.999999999999832	0.127812687853602
down	UBB; USP14; PSME3; NFE2L1; NUDT15; PSME1; PSME2;	GO:0061136~regulation of proteasomal protein catabolic process	7	18	38.8888888888889	0.00156424266984478	0.0135254771341447	1	1	0.842033436289006	0.999999999999832	0.127812687853602
down	SOD1; P2RY2; P2RY1; TRPM4; SSH1; P2RY11; PDXP;	GO:0071318~cellular response to ATP	7	18	38.8888888888889	0.00156424266984478	0.0135254771341447	1	1	0.842033436289006	0.999999999999832	0.127812687853602
down	XPO1; RAN; SDAD1; NUP88; RRS1;	GO:0000055~ribosomal large subunit export from nucleus	5	8	62.5	0.00156435141394495	0.0135254771341447	1	1	0.842033436289006	0.999999999999832	0.127812687853602
down	TPR; NUP62; NOLC1; NUP54; NUP58;	GO:0042306~regulation of protein import into nucleus	5	8	62.5	0.00156435141394495	0.0135254771341447	1	1	0.842033436289006	0.999999999999832	0.127812687853602
down	GATA3; NKX2-1; LHX1; DLX6; GRB2;	GO:0048646~anatomical structure formation involved in morphogenesis	5	8	62.5	0.00156435141394495	0.0135254771341447	1	1	0.842033436289006	0.999999999999832	0.127812687853602
down	PRKCB; CD81; NFAM1; CMTM3; STAP1;	GO:0050861~positive regulation of B cell receptor signaling pathway	5	8	62.5	0.00156435141394495	0.0135254771341447	1	1	0.842033436289006	0.999999999999832	0.127812687853602
down	SMAD7; ABL1; DTX3L; FBXO5; BAG5;	GO:0051444~negative regulation of ubiquitin-protein transferase activity	5	8	62.5	0.00156435141394495	0.0135254771341447	1	1	0.842033436289006	0.999999999999832	0.127812687853602
down	LRPPRC; ALKBH1; TACO1; MTG2; NSUN3;	GO:0070129~regulation of mitochondrial translation	5	8	62.5	0.00156435141394495	0.0135254771341447	1	1	0.842033436289006	0.999999999999832	0.127812687853602
down	ROCK2; SRD5A1; ELK1; MSN; RWDD1;	GO:0071394~cellular response to testosterone stimulus	5	8	62.5	0.00156435141394495	0.0135254771341447	1	1	0.842033436289006	0.999999999999832	0.127812687853602
down	WT1; BASP1; PKD2; SIX1; SIX4;	GO:0072075~metanephric mesenchyme development	5	8	62.5	0.00156435141394495	0.0135254771341447	1	1	0.842033436289006	0.999999999999832	0.127812687853602
down	PSIP1; XRCC6; XRCC5; LIG4; XRCC4;	GO:0075713~establishment of integrated proviral latency	5	8	62.5	0.00156435141394495	0.0135254771341447	1	1	0.842033436289006	0.999999999999832	0.127812687853602
down	CLASP2; MELTF; CARMIL2; CLASP1; PDPN;	GO:0090091~positive regulation of extracellular matrix disassembly	5	8	62.5	0.00156435141394495	0.0135254771341447	1	1	0.842033436289006	0.999999999999832	0.127812687853602
down	ROCK2; MSN; RDX; MGAT3; DTX3L;	GO:1902966~positive regulation of protein localization to early endosome	5	8	62.5	0.00156435141394495	0.0135254771341447	1	1	0.842033436289006	0.999999999999832	0.127812687853602
down	SFXN5; UCP3; UCP2; SFXN4; SFXN1;	GO:1990542~mitochondrial transmembrane transport	5	8	62.5	0.00156435141394495	0.0135254771341447	1	1	0.842033436289006	0.999999999999832	0.127812687853602
down	STK17B; BID; BTG1; SFRP1; PRDM11;	GO:2000271~positive regulation of fibroblast apoptotic process	5	8	62.5	0.00156435141394495	0.0135254771341447	1	1	0.842033436289006	0.999999999999832	0.127812687853602
down	GATA3; BRCA1; SMARCB1; SMAD4; SPHK2;	GO:2000617~positive regulation of histone H3-K9 acetylation	5	8	62.5	0.00156435141394495	0.0135254771341447	1	1	0.842033436289006	0.999999999999832	0.127812687853602
down	RAD21; REC8; TRIP13; RAD50; RAD54B; RAD51; MND1; RAD54L; RAD51D;	GO:0007131~reciprocal meiotic recombination	9	30	30	0.00157297112183008	0.0135835387554648	1	1	0.842991828351323	0.999999999999832	0.128361356991738
down	CYP27B1; MEFV; IFITM1; TRIM21; SNCA; SLC11A1; BST2; CXCL16;	GO:0034341~response to interferon-gamma	8	24	33.3333333333333	0.00164007832821189	0.0140947936326933	1	1	0.849024984940331	0.999999999999832	0.133192599497177
down	TLR4; LILRB3; NF1; SFRP1; LILRB4; UBASH3B; INPP5D; PIAS3;	GO:0045671~negative regulation of osteoclast differentiation	8	24	33.3333333333333	0.00164007832821189	0.0140947936326933	1	1	0.849024984940331	0.999999999999832	0.133192599497177
down	HIP1; FCHO1; FCHSD2; AP2S1; AP2B1; AP2M1; INPP5F; DNAJC6;	GO:0072583~clathrin-dependent endocytosis	8	24	33.3333333333333	0.00164007832821189	0.0140947936326933	1	1	0.849024984940331	0.999999999999832	0.133192599497177
down	PES1; BOP1; GTPBP4; URB1; FTSJ3; DDX18;	GO:0000463~maturation of LSU-rRNA from tricistronic rRNA transcript (SSU-rRNA, 5.8S rRNA, LSU-rRNA)	6	13	46.1538461538462	0.00171483945268491	0.0144928315355468	1	1	0.855704886889772	0.999999999999832	0.136953967301562
down	ADA; IMPDH1; GART; PAICS; GMPS; PPAT;	GO:0009168~purine ribonucleoside monophosphate biosynthetic process	6	13	46.1538461538462	0.00171483945268491	0.0144928315355468	1	1	0.855704886889772	0.999999999999832	0.136953967301562
down	SMAD7; CLASP2; TGFBR1; DAG1; CLASP1; PHLDB2;	GO:0010717~regulation of epithelial to mesenchymal transition	6	13	46.1538461538462	0.00171483945268491	0.0144928315355468	1	1	0.855704886889772	0.999999999999832	0.136953967301562
down	RPS6KA4; CDK1; CCNA2; CDK2; NEK11; BAZ1B;	GO:0016572~histone phosphorylation	6	13	46.1538461538462	0.00171483945268491	0.0144928315355468	1	1	0.855704886889772	0.999999999999832	0.136953967301562
down	TOX; EOMES; HPRT1; SIN3A; ZNF335; NR2E1;	GO:0021895~cerebral cortex neuron differentiation	6	13	46.1538461538462	0.00171483945268491	0.0144928315355468	1	1	0.855704886889772	0.999999999999832	0.136953967301562
down	ITGB1BP1; EPHA8; CRK; PIK3CG; PTK2; PTPN11;	GO:0033628~regulation of cell adhesion mediated by integrin	6	13	46.1538461538462	0.00171483945268491	0.0144928315355468	1	1	0.855704886889772	0.999999999999832	0.136953967301562
down	HPRT1; ADA; DCK; GMPR; AMPD2; DGUOK;	GO:0043101~purine-containing compound salvage	6	13	46.1538461538462	0.00171483945268491	0.0144928315355468	1	1	0.855704886889772	0.999999999999832	0.136953967301562
down	CYBB; CYBA; NCF2; CD52; SLC11A1; NCF4;	GO:0045730~respiratory burst	6	13	46.1538461538462	0.00171483945268491	0.0144928315355468	1	1	0.855704886889772	0.999999999999832	0.136953967301562
down	EXOSC6; RIF1; PAXIP1; HMCES; EXOSC3; MAD2L2;	GO:0045830~positive regulation of isotype switching	6	13	46.1538461538462	0.00171483945268491	0.0144928315355468	1	1	0.855704886889772	0.999999999999832	0.136953967301562
down	DHX9; IWS1; SAFB; NCBP1; SAFB2; SRPK2;	GO:0050684~regulation of mRNA processing	6	13	46.1538461538462	0.00171483945268491	0.0144928315355468	1	1	0.855704886889772	0.999999999999832	0.136953967301562
down	SOCS1; HSP90AB1; IFNGR1; IFNGR2; STAT1; CDC37;	GO:0060334~regulation of interferon-gamma-mediated signaling pathway	6	13	46.1538461538462	0.00171483945268491	0.0144928315355468	1	1	0.855704886889772	0.999999999999832	0.136953967301562
down	FADD; IRF3; NLRC5; IRF7; TBK1; ZBP1;	GO:0060340~positive regulation of type I interferon-mediated signaling pathway	6	13	46.1538461538462	0.00171483945268491	0.0144928315355468	1	1	0.855704886889772	0.999999999999832	0.136953967301562
down	PXN; NMI; FHL3; TRIP13; SGF29; RALY;	GO:1903506~regulation of nucleic acid-templated transcription	6	13	46.1538461538462	0.00171483945268491	0.0144928315355468	1	1	0.855704886889772	0.999999999999832	0.136953967301562
down	MYC; HMGA2; FMR1; PAXIP1; NSMCE1; BCLAF1;	GO:2001022~positive regulation of response to DNA damage stimulus	6	13	46.1538461538462	0.00171483945268491	0.0144928315355468	1	1	0.855704886889772	0.999999999999832	0.136953967301562
down	PTP4A3; ABL1; ITGB2; TGFBR1; STAT1; PIK3CA; PXN; PTK2; PAXIP1;	GO:0043542~endothelial cell migration	9	31	29.0322580645161	0.00190072168275279	0.0160069040886372	1	1	0.866729087335274	0.999999999999832	0.151261609146397
down	AURKA; EGFR; TYMS; PCNA; CSNK2A2; CSNK2B; PTCH1; EZH2; PNPT1;	GO:0097421~liver regeneration	9	31	29.0322580645161	0.00190072168275279	0.0160069040886372	1	1	0.866729087335274	0.999999999999832	0.151261609146397
down	DNM1L; OPA1; COX10; MTFR2; GDAP1; MFF; MIEF1;	GO:0000266~mitochondrial fission	7	19	36.8421052631579	0.00200788156230847	0.0166537432371469	1	1	0.872093509915486	0.999999999999832	0.157374092229988
down	MCM3AP; GLE1; PABPN1; NXF1; PCID2; DDX19A; NUP93;	GO:0016973~poly(A)+ mRNA export from nucleus	7	19	36.8421052631579	0.00200788156230847	0.0166537432371469	1	1	0.872093509915486	0.999999999999832	0.157374092229988
down	MYO1B; MYO1E; MYO9B; MYO5A; WIPF1; TIGD5; WAS;	GO:0030048~actin filament-based movement	7	19	36.8421052631579	0.00200788156230847	0.0166537432371469	1	1	0.872093509915486	0.999999999999832	0.157374092229988
down	RPS6KB1; GATA3; AKT1; MTOR; LARP1; RPTOR; MLST8;	GO:0031929~TOR signaling	7	19	36.8421052631579	0.00200788156230847	0.0166537432371469	1	1	0.872093509915486	0.999999999999832	0.157374092229988
down	SOD1; FGR; RAC2; CSNK2B; CAMKK2; ECT2; ELP3;	GO:0045859~regulation of protein kinase activity	7	19	36.8421052631579	0.00200788156230847	0.0166537432371469	1	1	0.872093509915486	0.999999999999832	0.157374092229988
down	ITGA4; SELL; ITGB7; ADD2; CX3CR1; ROCK1; SELPLG;	GO:0050901~leukocyte tethering or rolling	7	19	36.8421052631579	0.00200788156230847	0.0166537432371469	1	1	0.872093509915486	0.999999999999832	0.157374092229988
down	AURKA; STIL; C2CD3; MCPH1; SPAG5; SNX10; NEDD1;	GO:0071539~protein localization to centrosome	7	19	36.8421052631579	0.00200788156230847	0.0166537432371469	1	1	0.872093509915486	0.999999999999832	0.157374092229988
down	SMCHD1; POLQ; RIF1; MAGEF1; PARPBP; MAD2L2; FANCB;	GO:2000042~negative regulation of double-strand break repair via homologous recombination	7	19	36.8421052631579	0.00200788156230847	0.0166537432371469	1	1	0.872093509915486	0.999999999999832	0.157374092229988
down	SHTN1; ROCK2; GATA3; ROCK1; KIF20B; FAM49B; ARFGEF1;	GO:2000114~regulation of establishment of cell polarity	7	19	36.8421052631579	0.00200788156230847	0.0166537432371469	1	1	0.872093509915486	0.999999999999832	0.157374092229988
down	ITGB1BP1; ABL1; LIMS1; PPM1F; PTPRJ; ROCK1; SFRP1; EPB41L5;	GO:0051894~positive regulation of focal adhesion assembly	8	25	32	0.00202891161754293	0.016692302846521	1	1	0.873075032783447	0.999999999999832	0.157738471783317
down	HSP90AB1; CDK4; GATA3; PML; TCF7; MCM2; TUBA1B; KEAP1;	GO:0071353~cellular response to interleukin-4	8	25	32	0.00202891161754293	0.016692302846521	1	1	0.873075032783447	0.999999999999832	0.157738471783317
down	PTPRC; PML; LTBR; BID; TRAF2; FADD; PAK2; RIPK1;	GO:2001238~positive regulation of extrinsic apoptotic signaling pathway	8	25	32	0.00202891161754293	0.016692302846521	1	1	0.873075032783447	0.999999999999832	0.157738471783317
down	FCER1G; GPR183; IREB2; GLO1; TCIRG1; MAPK14; OSTM1; OSCAR; SNX10;	GO:0030316~osteoclast differentiation	9	32	28.125	0.00228076469727312	0.0185644627677161	1	1	0.88493670254197	0.999999999999832	0.175429957950238
down	TOR1A; CD74; TOR2A; DNAJB14; HSPH1; DNAJB12; HSPA6; HSPA14; HSPE1;	GO:0051085~chaperone cofactor-dependent protein refolding	9	32	28.125	0.00228076469727312	0.0185644627677161	1	1	0.88493670254197	0.999999999999832	0.175429957950238
down	SMARCB1; TAF1C; RRN3; BAZ2A; POLR1E;	GO:0001188~RNA polymerase I preinitiation complex assembly	5	9	55.5555555555556	0.00228888896174473	0.0185644627677161	1	1	0.885396031608315	0.999999999999832	0.175429957950238
down	RNF40; RNF8; CDC73; CTR9; DTX3L;	GO:0033523~histone H2B ubiquitination	5	9	55.5555555555556	0.00228888896174473	0.0185644627677161	1	1	0.885396031608315	0.999999999999832	0.175429957950238
down	SNCA; SET; CTBP1; NOC2L; BRCA1;	GO:0035067~negative regulation of histone acetylation	5	9	55.5555555555556	0.00228888896174473	0.0185644627677161	1	1	0.885396031608315	0.999999999999832	0.175429957950238
down	DNM1L; BAX; CCAR2; MFF; ATG3;	GO:0043653~mitochondrial fragmentation involved in apoptotic process	5	9	55.5555555555556	0.00228888896174473	0.0185644627677161	1	1	0.885396031608315	0.999999999999832	0.175429957950238
down	MYC; BLM; PTCH1; SUSD2; ORC6;	GO:0051782~negative regulation of cell division	5	9	55.5555555555556	0.00228888896174473	0.0185644627677161	1	1	0.885396031608315	0.999999999999832	0.175429957950238
down	BUB1; MKI67; PUM1; AURKB; KIF2C;	GO:0051983~regulation of chromosome segregation	5	9	55.5555555555556	0.00228888896174473	0.0185644627677161	1	1	0.885396031608315	0.999999999999832	0.175429957950238
down	EXOSC10; EXOSC9; EXOSC4; EXOSC6; EXOSC8;	GO:0071028~nuclear mRNA surveillance	5	9	55.5555555555556	0.00228888896174473	0.0185644627677161	1	1	0.885396031608315	0.999999999999832	0.175429957950238
down	CD4; MAPK1; AKT1; ETV3; ZFP36L2;	GO:0097011~cellular response to granulocyte macrophage colony-stimulating factor stimulus	5	9	55.5555555555556	0.00228888896174473	0.0185644627677161	1	1	0.885396031608315	0.999999999999832	0.175429957950238
down	ADAR; TARBP2; AGO1; DICER1; MRPL44; DROSHA;	GO:0031054~pre-miRNA processing	6	14	42.8571428571429	0.00230071289592892	0.0185644627677161	1	1	0.885774464932636	0.999999999999832	0.175429957950238
down	CD4; CD3E; PTPRC; CD86; STAT5B; CARD11;	GO:0045086~positive regulation of interleukin-2 biosynthetic process	6	14	42.8571428571429	0.00230071289592892	0.0185644627677161	1	1	0.885774464932636	0.999999999999832	0.175429957950238
down	TPPP; PIN1; CKAP5; MAPRE1; CENPJ; FBXO5;	GO:0046785~microtubule polymerization	6	14	42.8571428571429	0.00230071289592892	0.0185644627677161	1	1	0.885774464932636	0.999999999999832	0.175429957950238
down	ADAR; METTL3; NLRC5; CACTIN; CNOT7; YTHDF2;	GO:0060339~negative regulation of type I interferon-mediated signaling pathway	6	14	42.8571428571429	0.00230071289592892	0.0185644627677161	1	1	0.885774464932636	0.999999999999832	0.175429957950238
down	CNOT3; HMGA2; WDR43; ELAVL1; SAV1; CNOT2;	GO:2000036~regulation of stem cell population maintenance	6	14	42.8571428571429	0.00230071289592892	0.0185644627677161	1	1	0.885774464932636	0.999999999999832	0.175429957950238
down	ERI2; KPNA2; POLG; RAN; WRN; TOPBP1; TATDN2; ERI1;	GO:0006259~DNA metabolic process	8	26	30.7692307692308	0.00248671583747051	0.0198408770343145	1	1	0.894671671734384	0.999999999999832	0.187491782949874
down	VCAN; CHPF; B3GALT6; CHST11; CHST7; SLC35D1; CHPF2; DSE;	GO:0030206~chondroitin sulfate biosynthetic process	8	26	30.7692307692308	0.00248671583747051	0.0198408770343145	1	1	0.894671671734384	0.999999999999832	0.187491782949874
down	TLR4; RIPK2; HMGB1; HSPD1; HLA-G; CCR7; ISL1; AGER;	GO:0032735~positive regulation of interleukin-12 production	8	26	30.7692307692308	0.00248671583747051	0.0198408770343145	1	1	0.894671671734384	0.999999999999832	0.187491782949874
down	BAG3; HSF1; BAX; BAK1; DAB2IP; DAXX; HSPA6; HSPA14;	GO:0034620~cellular response to unfolded protein	8	26	30.7692307692308	0.00248671583747051	0.0198408770343145	1	1	0.894671671734384	0.999999999999832	0.187491782949874
down	MFN2; EPHB2; NUP62; TNK1; DAB2IP; RASAL3; LZTR1; MAPKAP1;	GO:0046580~negative regulation of Ras protein signal transduction	8	26	30.7692307692308	0.00248671583747051	0.0198408770343145	1	1	0.894671671734384	0.999999999999832	0.187491782949874
down	PARP1; UBB; ERCC3; RAD23B; RBX1; CUL4A; GTF2H3; RNF111;	GO:0070911~global genome nucleotide-excision repair	8	26	30.7692307692308	0.00248671583747051	0.0198408770343145	1	1	0.894671671734384	0.999999999999832	0.187491782949874
down	GZMB; YWHAQ; NMT1; BID; PPP3R1; E2F1; YWHAH; TFDP1;	GO:1900740~positive regulation of protein insertion into mitochondrial membrane involved in apoptotic signaling pathway	8	26	30.7692307692308	0.00248671583747051	0.0198408770343145	1	1	0.894671671734384	0.999999999999832	0.187491782949874
down	REC8; CCNB1; CDC25B; BRCA2; TRIP13; FBXO5; YTHDF2;	GO:0001556~oocyte maturation	7	20	35	0.00254287097667705	0.0201170414805642	1	1	0.897343666832429	0.999999999999832	0.190101474261662
down	ROCK2; PARP1; PRKCA; SLC9A1; CDK9; PTK2; ROCK1;	GO:0010613~positive regulation of cardiac muscle hypertrophy	7	20	35	0.00254287097667705	0.0201170414805642	1	1	0.897343666832429	0.999999999999832	0.190101474261662
down	TLR4; DNM1L; CD14; BIRC2; RIPK1; ITPK1; PGAM5;	GO:0070266~necroptotic process	7	20	35	0.00254287097667705	0.0201170414805642	1	1	0.897343666832429	0.999999999999832	0.190101474261662
down	HNRNPC; TARDBP; HNRNPA0; ELAVL1; MAPK14; ANGEL2; RBM38;	GO:0070935~3'-UTR-mediated mRNA stabilization	7	20	35	0.00254287097667705	0.0201170414805642	1	1	0.897343666832429	0.999999999999832	0.190101474261662
down	KIF23; RACGAP1; ANLN; RTKN;	GO:0000915~actomyosin contractile ring assembly	4	5	80	0.00257773390063587	0.0201170414805642	1	1	0.898926135074034	0.999999999999832	0.190101474261662
down	NBN; CTR9; RTF1; ZNF830;	GO:0001832~blastocyst growth	4	5	80	0.00257773390063587	0.0201170414805642	1	1	0.898926135074034	0.999999999999832	0.190101474261662
down	LSM11; SLBP; CPSF2; CPSF3;	GO:0006398~mRNA 3'-end processing by stem-loop binding and cleavage	4	5	80	0.00257773390063587	0.0201170414805642	1	1	0.898926135074034	0.999999999999832	0.190101474261662
down	SLC6A6; LRRC8D; LRRC8A; LRRC8C;	GO:0015734~taurine transport	4	5	80	0.00257773390063587	0.0201170414805642	1	1	0.898926135074034	0.999999999999832	0.190101474261662
down	AIFM1; TFAM; CHCHD4; SAMM50;	GO:0033108~mitochondrial respiratory chain complex assembly	4	5	80	0.00257773390063587	0.0201170414805642	1	1	0.898926135074034	0.999999999999832	0.190101474261662
down	TCF7; LIG4; PRKDC; BCL11B;	GO:0033153~T cell receptor V(D)J recombination	4	5	80	0.00257773390063587	0.0201170414805642	1	1	0.898926135074034	0.999999999999832	0.190101474261662
down	SUV39H1; ARID4B; BEND3; SUV39H2;	GO:0036124~histone H3-K9 trimethylation	4	5	80	0.00257773390063587	0.0201170414805642	1	1	0.898926135074034	0.999999999999832	0.190101474261662
down	PTCD1; SSB; TRNT1; ELAC2;	GO:0042780~tRNA 3'-end processing	4	5	80	0.00257773390063587	0.0201170414805642	1	1	0.898926135074034	0.999999999999832	0.190101474261662
down	SMC2; SGO1; NUF2; WAPL;	GO:0045132~meiotic chromosome segregation	4	5	80	0.00257773390063587	0.0201170414805642	1	1	0.898926135074034	0.999999999999832	0.190101474261662
down	SMC5; SMC6; CDC6; RAD18;	GO:0051984~positive regulation of chromosome segregation	4	5	80	0.00257773390063587	0.0201170414805642	1	1	0.898926135074034	0.999999999999832	0.190101474261662
down	TERT; BRCA2; ACD; NABP2;	GO:0070200~establishment of protein localization to telomere	4	5	80	0.00257773390063587	0.0201170414805642	1	1	0.898926135074034	0.999999999999832	0.190101474261662
down	E2F3; GATA2; E2F1; TFDP1;	GO:0070345~negative regulation of fat cell proliferation	4	5	80	0.00257773390063587	0.0201170414805642	1	1	0.898926135074034	0.999999999999832	0.190101474261662
down	SYNCRIP; HNRNPU; DHX9; IGF2BP1;	GO:0070934~CRD-mediated mRNA stabilization	4	5	80	0.00257773390063587	0.0201170414805642	1	1	0.898926135074034	0.999999999999832	0.190101474261662
down	DKC1; CCT4; CCT2; WRAP53;	GO:0090666~scaRNA localization to Cajal body	4	5	80	0.00257773390063587	0.0201170414805642	1	1	0.898926135074034	0.999999999999832	0.190101474261662
down	CLASP2; DAG1; CLASP1; PHLDB2;	GO:1904261~positive regulation of basement membrane assembly involved in embryonic body morphogenesis	4	5	80	0.00257773390063587	0.0201170414805642	1	1	0.898926135074034	0.999999999999832	0.190101474261662
down	LGALS9; MDK; IL16; MAPK14;	GO:2001184~positive regulation of interleukin-12 secretion	4	5	80	0.00257773390063587	0.0201170414805642	1	1	0.898926135074034	0.999999999999832	0.190101474261662
up	CD5L; F2; IGKV1-5; IGKV3-20; IGKV3-15; IGLV1-47; IGLV1-51; IGLV2-14; IGLV3-1; IGHV3-23; IGHV4-59; IGKC; IGHG2; IGHG4; C1QA; C1QB; C1QC; C9; IGKV3-11; IGKV4-1; IGHV4-34; IGLC2; IGLC3; CD19; CPN2;	GO:0030449~regulation of complement activation	25	113	22.1238938053097	0.00271694752432072	1	1	1	1	1	1
down	VAV2; ARHGEF7; ARHGEF6; PTPRO; WHAMM; AJUBA; SPATA13; NUP85; PARVB;	GO:0030032~lamellipodium assembly	9	33	27.2727272727273	0.00271877209936466	0.0211252738396167	1	1	0.905351109088433	0.999999999999832	0.199629041127763
down	APP; ITGB2; ITGAM; IFNGR1; C5AR1; SNCA; AGER; TLR6;	GO:0001774~microglial cell activation	8	27	29.6296296296296	0.00302148971668714	0.0229571322727848	1	1	0.91617574406551	0.999999999999832	0.216939687383593
down	PIK3CD; CD4; PTAFR; LIPA; PIK3CG; NFATC2IP; NFATC1; NFATC3;	GO:0001816~cytokine production	8	27	29.6296296296296	0.00302148971668714	0.0229571322727848	1	1	0.91617574406551	0.999999999999832	0.216939687383593
down	GSR; TYMS; DTYMK; RRM1; RRM2; DCTD; DUT; GLRX;	GO:0015949~nucleobase-containing small molecule interconversion	8	27	29.6296296296296	0.00302148971668714	0.0229571322727848	1	1	0.91617574406551	0.999999999999832	0.216939687383593
down	ZMPSTE24; SOD1; APP; CDK4; STAT5A; PIK3CA; STAT5B; MFSD2A;	GO:0040014~regulation of multicellular organism growth	8	27	29.6296296296296	0.00302148971668714	0.0229571322727848	1	1	0.91617574406551	0.999999999999832	0.216939687383593
down	CPSF1; FAM98B; TSEN54; TSEN15; TSEN34; RTCB;	GO:0006388~tRNA splicing, via endonucleolytic cleavage and ligation	6	15	40	0.00302533356742152	0.0229571322727848	1	1	0.91651922133024	0.999999999999832	0.216939687383593
down	CCL5; C5AR1; MDK; MAPK14; C3AR1; CMKLR1;	GO:0010759~positive regulation of macrophage chemotaxis	6	15	40	0.00302533356742152	0.0229571322727848	1	1	0.91651922133024	0.999999999999832	0.216939687383593
