DGE	Genes	Process~name	num_of_Genes	gene_group	percentage%	P-value	Benjamini and Hochberg (FDR)	 Hommel singlewise process	Bonferroni single-step process	Hommel singlewise process	Hochberg step-up process	Benjamini and Yekutieli
down	DDX39A; U2SURP; RNF113A; DHX15; PRPF4; PPIH; PLRG1; HTATSF1; NUDT21; AQR; SYNCRIP; PQBP1; PRPF40A; WBP4; BCAS2; DNAJC8; SLU7; SYF2; HNRNPC; SNRPB2; SNRPA1; GTF2F2; GCFC2; POLR2C; POLR2B; CSTF2; POLR2I; EIF4A3; BUD31; POLR2H; HNRNPF; POLR2K; MFAP1; SNU13; HNRNPH2; SNRPF; SNRPG; LSM3; SNRPD1; SNRPD3; POLR2G; TXNL4A; SRSF3; SRSF2; SF3A3; ELAVL2; IK; SRSF5; PRPF4B; SNW1; FRG1; SRSF7; SMU1; USP39; ZCCHC8; CWC27; DDX46; PHF5A; ZCRB1; GEMIN5; GEMIN6; CTNNBL1; SNRNP40; ZMAT2; GPATCH1; DDX23; SNRNP25; SF3B5; UPF3B; CRNKL1; METTL14; CWC22; CWC15; CPSF2; ZMAT5; CPSF3; NOVA2; SF3B6; PPIL1; LSM5; RBM8A; UBL5; CWF19L1;	GO:0000398~mRNA splicing, via spliceosome	83	246	33.739837398374	0	0	0	0	0	0	0
down	EVPLL; LCE2B; FOXN1; TGM5; KRT34; SCEL; GJB5; KRT14; STS; KRT5; DSP; KRT15; SPRR1B; SPRR2E; SPRR2D; CRABP2; S100A7; CASP14; NTF4; SPRR1A; SPRR2B; SPRR2A; KRT9; KRT2; KLK7; EMP1; ELF3; FABP5; BNC1; KRT32; KRT31; CST6; UGCG; ZNF750; GRHL2; CERS3; ACER1; GRHL3; EVPL; SPRR2F; SPRR2G; GRHL1; CALML5; SPRR3; POU2F3; KLK5; KRTDAP;	GO:0008544~epidermis development	47	82	57.3170731707317	0	0	0	0	0	0	0
down	ACKR2; CHUK; RIPK2; LIAS; CD5L; ANXA1; S100A8; S100A9; KRT16; PLA2G4B; BMP2; MIF; DPEP1; GAL; BDKRB2; FCGR2B; ADM; XCR1; BDKRB1; CASP4; CARD18; RAC1; ELF3; MS4A2; HYAL1; AIMP1; IL18; ECM1; TRIL; NLRP10; IL17RE; BLNK; IL17F; MGLL; CCL19; MYD88; RARRES2; NFKBIZ; IL1RL2; CYP4F11; PLGRKT; IL23A; IL1RAP; NOX4; HDAC9; HDAC5; PTGER3; CCL11; LTB4R; IL36A; ACKR1; CXCL1; CXCL13; CCL24; CCL17; PTGER1; CCL14; GPR33; AGTR1; CXCL9; IL36G; IL1A; IL36RN; CCL22; CCL18; IL1F10; IL1RN; LTB4R2; IL36B; CX3CL1; CXCL11; GGT5; CCL20; CXCL10;	GO:0006954~inflammatory response	74	381	19.4225721784777	0.00010249004278895	0.00515380028095864	0.689143047712898	0.702979203489406	0.545573281889528	0.689143047712898	0.0485003812572808
down	ENSA; PFKFB2; CTSV; LDHA; GLUL; HNF1B; SREBF1; HNF4A; EIF2B2; GYS2; GPLD1; PPARD; EIF2B5; EIF2B1; NR0B2; NDUFA9; GJD3; ACVR1C; MAFA; GPAM; EIF2B3; EIF2B4;	GO:0009749~response to glucose	22	67	32.8358208955224	0.00010294075499217	0.00515380028095864	0.692070695812397	0.706070638491333	0.546718349763445	0.692070695812397	0.0485003812572808
up	ULK1; TP53; ARSB; ITGB4; DRD3; DAP; SRPX; IRF8; RAB39A; STK11; CLEC16A; TBC1D25; FNBP1L; MAP1S; LRSAM1; SBF2; SIRT2; ULK2; DRAM1; SUPT20H; TBC1D5; GRAMD1A; GPR137; WDR24; ZKSCAN3; EVA1A; TBC1D17; WDR41; C19orf12; VPS18; HDAC6; CD84; AMBRA1; LIX1L;	GO:0006914~autophagy	34	123	27.6422764227642	0.00010414825961802	0.0291252872114393	0.667590344151507	0.669881605863104	0.618432365611802	0.667590344151507	0.272214668242226
down	CCL22; EREG; BIRC5; MYC; POMC; IL1A; CXCL10; MMP1; ANXA1; MMP3; CXCL1; UBC; SAA1; PIM1; MUC1; FER; IL1RN; EDN2; PTPRZ1; CNTF; IL12B; CASP1; NOS2; STAT1; TEC; SOX2; CEBPA; CCL11; YWHAZ; CX3CL1; CCL20; LCN2; PTPN11; BCL2L1; IL18; IL13RA2; IL20RB; IL17REL; IL22RA1; ZNF675; ZC3H15; IL1F10; IL22RA2; IL17F; OSMR; CCL19; IL1RL2; IL23A; IL1RAP; DUOX2; DUOX1; IL36B; IL36G; IFNK; IL36RN; IL36A; IL20RA; IFNGR1;	GO:0019221~cytokine-mediated signaling pathway	58	278	20.863309352518	0.00010964354940368	0.00544960221275256	0.737023939091549	0.752045105359854	0.563896774583136	0.737023939091549	0.0512840565428076
down	DCLK1; S100B; GSTP1; TIMP2; PTPRZ1; COX7B; GABRA4; EIF2B2; LIG4; ALDH5A1; RCAN1; RELN; ID3; PTS; STK3; UGT8; DMBX1; GRHL3; KLK6; SERPINI1; NPAS2; SH3GL3; CHST8; ARNT2; ROBO2; NCKAP1; HAPLN1; SPINK5; ZIC2; MTF1; EMX2; ZIC5; VAX1; SPINK6;	GO:0007417~central nervous system development	34	133	25.5639097744361	0.00012146129336454	0.00592980957900724	0.816219891409737	0.833103011187409	0.58719000988617	0.816219891409737	0.0558030986236494
down	ACKR2; TMPRSS2; CD5L; SNX2; TOM1; NME1; RAB5A; ENDOU; ENPP1; RAB1A; TMPRSS15; ANK2; BCL2L1; MYO1E; ENPP2; BECN1; CLINT1; EEA1; RABEP1; TRIP10; FKBP15; ILDR1; CLEC10A; NOSTRIN; NECAP1; SH3KBP1; SORT1; SH3GL3; TMPRSS13; TMPRSS4; ITSN2; RABGEF1; MYO6; MTMR6; EPN1; WASL; RHOJ; RALBP1; RHOV; CDC42; DENND1B;	GO:0006897~endocytosis	41	174	23.5632183908046	0.00012189869523837	0.00592980957900724	0.819037333306649	0.836103150640021	0.588013033429255	0.819037333306649	0.0558030986236494
down	SLC9A3R1; DIAPH1; ABLIM3; ADRA2A; CXCL1; ITPKA; PAFAH1B1; ARFIP2; CDC42; RND3; RAC1; SPIRE1; PRKG1; TRIP10; ABLIM2; MOB2; GAS2L3; PHACTR4; POF1B; FOXJ1; PDCL3; RHOJ; DIAPH3; DAAM1; SMTNL2; SSH3; SDAD1; ARFGEF3; OPHN1; SPECC1L; PDLIM3; PRICKLE4; AMOTL2; CSRP1; CAPZA1; SHROOM3; RHOV; ARHGEF10L;	GO:0030036~actin cytoskeleton organization	38	157	24.203821656051	0.00013280651666136	0.0064149288576078	0.892194178931055	0.910919897780307	0.608056687745623	0.892194178931055	0.0603683647738169
up	DCTN1; ODF2; CROCC; CEP135; CEP68; CEP250; CNTLN; KIF3A; RTTN;	GO:0010457~centriole-centriole cohesion	9	11	81.8181818181818	0.00013722671662486	0.0339477785127348	0.879211573415484	0.882642241331105	0.69680413942827	0.879211573415484	0.317287283669263
up	WNT7A; TBX3; LRP4; GLI3; CTNNB1; WNT5A; ECE1; GNA12; SHH; TWIST1; C2CD3; FREM2; OSR1; TRAF3IP1; LMBR1; HDAC2; IFT140; TMEM231; CHST11; IMPAD1;	GO:0042733~embryonic digit morphogenesis	20	55	36.3636363636364	0.00014867355500092	0.0354173446579975	0.952402793335907	0.956268305765931	0.717795923544452	0.952402793335907	0.331022340006683
up	PCDH7; RET; CDH13; DSG2; FAT1; SDK2; PCDH15; PCDHB18P; PCDHAC1; PCDHB16; CELSR3; FAT2; TENM3; PCDH10; CD84; PLXNB3; PCDHGC3; IGSF9B; PCDHB9; PCDHB7; PCDHB6; PCDHB4; PCDHB3; PCDHB2; PCDHB14; PCDHB13; PCDHB12; PCDHGC5; PCDHGB5; PCDHGB3; PCDHGB2; PCDHGB1; PCDHGA9; PCDHGA6; PCDHGA5; PCDHGA4; PCDHA10; MYOT; L1CAM; CDH11; CDH3;	GO:0007156~homophilic cell adhesion via plasma membrane adhesion molecules	41	165	24.8484848484848	0.00015964592386552	0.0366729493679665	1	1	0.733946206291708	0.999998886847137	0.342757641261785
up	MATN3; ITGA10; MATN4; COL2A1; COL4A1; FN1; PDGFA; SERPINE1; LAMB1; COL4A2; FURIN; ATXN1L; ITGB4; ITGA2; ITGB6; NF1; TNC; LAMA1; ITGA3; COL8A1; COL4A5; ICAM3; FBN1; SOX9; MFAP2; WNT3A; HSPG2; NFKB2; COL7A1; COL16A1; LOXL1; LAMB3; LAMC2; COL4A6; COL19A1; LAMA3; OLFML2A; ERO1B; PXDN; ICAM5; COL27A1; MMP2; COL17A1; COL22A1; MMP10; MMP8; MMP16; MMP14; MMP17; MMP19; COL11A2; POSTN;	GO:0030198~extracellular matrix organization	52	230	22.6086956521739	0.00018245056845911	0.0403204449965916	1	1	0.765877427171687	0.999998886847137	0.376848354436664
down	KIF4A; KIF11; KIF23; KTN1; KIF18A; KIF2C; RACGAP1; DYNLRB1; KIF13B; KIF15; DNAH3; KIF20A; KIF5B; KIF20B; WDR34; DNAH9; KIF9; BICD2; KIF18B; KIFC1; KIF13A; ACTR10; KIF16B; KIF21A;	GO:0007018~microtubule-based movement	24	81	29.6296296296296	0.00018963269722449	0.00869047040853913	1	1	0.681843845325854	0.999999999999987	0.0817825886029221
down	NUPR2; IRF6; LAMTOR5; HBP1; BRINP1; CDC123; MYC; PRNP; INHA; IL12B; DDIT3; CDKN2B; CDKN2C; SOX2; CDK7; PRKAG1; MLF1; EIF4G2; CDK6; DHCR24; CDKN3; ERN2; KAT2B; TBRG4; MTBP; KIF20B; CGREF1; TSG101; CAB39L; RRAGC; RPRM; LAMTOR3; PRR11;	GO:0007050~cell cycle arrest	33	131	25.1908396946565	0.00019067159505359	0.00869047040853913	1	1	0.682919626062471	0.999999999999987	0.0817825886029221
down	PRMT5; AURKA; RAD1; RAD17; CHEK2; RPA2; RFC4; RFC2; BRCA1; RFC3; PRKAG1; CSNK2B; CSNK2A1; SSRP1; RRS1; CDK5R1; TAF13; TAF11; TAF12; TAF9; MAPKAPK5; SETD9; ATRIP; TAF4B; AURKB; TP53RK; RBBP8; RPF2; TAF9B; PAK1IP1; TPX2; EXO1; NOC2L;	GO:1901796~regulation of signal transduction by p53 class mediator	33	131	25.1908396946565	0.00019067159505359	0.00869047040853913	1	1	0.682919626062471	0.999999999999987	0.0817825886029221
down	S100A8; EDN1; S100A9; SAA1; EDN3; DPEP1; LGALS3; EDN2; CXADR; CXCL9; CXCL1; CCL22; CX3CL1; CCL14; CCL17; CXCL10; CCL11; CCL18; CCL19; CXCL13; CXCL11; CCL20; CCL24;	GO:0030593~neutrophil chemotaxis	23	76	30.2631578947368	0.0001977895508739	0.00886691849309882	1	1	0.690285532549931	0.999999999999987	0.0834430719175123
down	ATP6V0E1; LAMTOR5; ATP6V1G1; VPS26A; GBA; ATP6V1B2; ATP6V1C1; ATP6V1E1; ATP6V1A; PRKAG1; CDK5R1; ATP6V0D2; ATP6V1C2; RB1CC1; ATG101; RRAGC; EXOC1; LAMTOR3; SNX6; ATP6V1D; SNX5; UBQLN1;	GO:0016241~regulation of macroautophagy	22	71	30.9859154929577	0.00020454941471603	0.00911041841257988	1	1	0.697259455993787	0.999999999999987	0.0857345535984345
down	MMGT1; MAGT1; NIPAL1; CNNM4; NIPAL4; NIPA1; NIPA2; MRS2; NIPAL2;	GO:0015693~magnesium ion transport	9	13	69.2307692307692	0.00021327352831546	0.00937719955587016	1	1	0.705848601521358	0.999999999999987	0.0882451256921256
down	PTGES; CHUK; LIAS; GJB6; CLDN1; REN; SLPI; S100A8; EDN1; THBD; MGST1; HSPD1; SCGB1A1; IDO1; HPGD; FER; UGT1A1; GJB2; S100A7; PTGER1; ADM; PCK1; BDKRB1; MAPKAPK3; PELI1; MGST2; S100A14; TAB2; GNG12; NOCT; TNFRSF11A; GGT5; NOS3; NOS2;	GO:0032496~response to lipopolysaccharide	34	138	24.6376811594203	0.00021928221074629	0.00957997887585254	1	1	0.710496405899492	0.999999999999987	0.0901534018755418
up	DLL1; TBX3; IFNG; CCND1; SOX9; CAV1; OSR1; SMO;	GO:0030857~negative regulation of epithelial cell differentiation	8	9	88.8888888888889	0.00022311117498241	0.0448453461714655	1	1	0.8010919879707	0.999998886847137	0.419139593084549
down	UGT1A9; UGT1A1; UGT1A3; UGT1A7; UGT1A8; UGT1A6; UGT1A10;	GO:0052696~flavonoid glucuronidation	7	7	100	0.00024604234597336	0.0106138644718949	1	1	0.731320337124587	0.999999999999987	0.0998828913494996
up	ROCK2; ULK1; TNKS; PRKACA; AKT1; TGFBR2; MTOR; MAPK9; CSNK1D; PRKX; MAPK12; CSNK1G2; PRKDC; CDK5; MAP3K10; PRKCZ; MAP3K12; MAPK7; PAK2; ROCK1; PDK3; PRKD1; TTBK2; UHMK1; BRSK1; SMG1; TSSK6; PRKD2; NEK6; CSNK1G1; MARK1; PDPK2P; MAST1; LATS1; STK32B; DYRK1B; AKT3; LATS2; STK32A;	GO:0018105~peptidyl-serine phosphorylation	39	158	24.6835443037975	0.00025444591075951	0.0481351793530942	1	1	0.827843203040086	0.999998886847137	0.44988747349541
down	NUPR2; ATMIN; RAD1; POLQ; RAD17; RNF8; CHEK2; MYC; FBXO45; TOP2A; XRCC5; DDIT3; BRCA1; PSEN1; WDR4; UBE2B; RAD51; PMAIP1; TRIP12; TAF9; RFWD3; MCM10; APTX; PARG; MAPK15; SETD7; TANK; MASTL; USP47; UBE2E2; NPAS2; MACROD1; WAC; SPRTN; EGLN3; WDR76; UBE2T; SIRT7; FANCL; HPF1; CDKN2AIP; AATF; DTL; MCM8; MCTS1; TIMELESS; USP16; AKTIP; WDHD1; BCCIP; POLE3;	GO:0006974~cellular response to DNA damage stimulus	51	245	20.8163265306122	0.00028584669875064	0.011810978956209	1	1	0.758314784866503	0.999999999999987	0.111148463496786
down	EML1; ZPR1; CDK1; MAP2; FER; WEE1; PAFAH1B1; CAMSAP2; CDK5R1; PHLDB2; GAS2L3; MAP6D1; BCCIP; TUBB2A; PARD3B; TACC2; TUBB4B; EML2; TUBB2B; CALM2; CALML6; TUBD1; TUBE1; TUBAL3; MAP7; CALM1; CALML3; CALML5; TUBA4A; TUBA1C;	GO:0000226~microtubule cytoskeleton organization	30	118	25.4237288135593	0.00031837382774613	0.0129430938359635	1	1	0.777640989206169	0.999999999999987	0.121802350008066
down	DDX39A; SLU7; EIF4E; EIF4A3; RAE1; SRSF3; SRSF2; SRSF5; SRSF7; THOC7; NUP54; NUP37; NUP35; NUP133; SEH1L; FYTTD1; NUP88; NDC1; NUP58; UPF3B; UPF2; CPSF2; CPSF3; NXT1; NUP50; DDX19B; RBM8A;	GO:0006406~mRNA export from nucleus	27	101	26.7326732673267	0.00031890696286307	0.0129430938359635	1	1	0.777948951486704	0.999999999999987	0.121802350008066
up	FOXE1; PLXNB1; NCK2; CD63; PTPRF; PLCG1; L1CAM; BCAR1; TGFB2; SIRPA; PRKCZ; FAT1; PTPRK; ERBB4; FSCN1; CCDC88A; CARMIL1; BRAT1; SYDE1; SKAP1; FMNL3; RASGEF1A; USP33; KCTD13; RHBDF1; LURAP1; PPP1R9B; FUT8; ARHGAP35; ABI2; LIMA1; TAOK2; GPC6; LAMB3; GPC4; NEDD9; AXL; GPC1; ITGB4; ITGB6; USP9X; NCKAP1L; LAMB1; PIK3CD; CORO6; RHOQ; GPC3; LAMA3; APC2; PIK3C2A;	GO:0016477~cell migration	50	225	22.2222222222222	0.00033738258125948	0.0602790211850275	1	1	0.877616717837458	0.999998886847137	0.563387877850819
up	DVL2; TBX1; SHOX2; HEXIM1; MBD3; OXT; TH; GLI3; PSKH1; PPP3CB; EPOR; TNNI3; NF1; EDNRA; ITGA3; SRI; FBN1; TGFBR2; ECE1; RIPPLY3; TGFB2; PRKDC; SOX4; ZFP36L1; EP300; ACVR2B; NFATC4; ERBB4; SHH; FREM2; BVES; OSR1; DNAH5; MED12; ZDHHC16; IFT140; TCF25; SMG9; BICC1; SMYD2; FLRT3; POPDC2; ZFPM1; SOX9;	GO:0007507~heart development	44	190	23.1578947368421	0.00035277197017968	0.0613251165458312	1	1	0.884511749146752	0.999998886847137	0.573165034708489
down	TRAPPC3; USO1; SEC22B; CNIH1; TGFA; FOLR1; NSF; CTSC; RAB1A; STX5; TMED2; KLHL12; PPP6R3; TRAPPC6B; SCFD1; TFG; SEC16B; TRAPPC4; SAR1B; SEC23IP;	GO:0048208~COPII vesicle coating	20	64	31.25	0.00035578350097076	0.0140852087152438	1	1	0.797514723976764	0.999999999999987	0.132550342569858
down	PLK4; AURKA; DCLK1; CHUK; BIRC5; MAP3K13; BUB1; KALRN; BUB1B; CPNE3; CCNB2; OXSR1; CHEK2; CCNE2; CDK1; ROS1; SBK3; PIM1; BMP2; FER; ERCC3; ITPKA; CCNE1; CDC25B; MAPK4; MAP3K8; TEC; CSNK1A1; STK19; CCL11; MNAT1; NEK2; PLK1; PRKAG1; COPS2; YWHAZ; CSNK2A1; SRPK2; CCNA1; CDK6; LIPE; STK3; PRKG2; CAMK2B; CAMK2D; PTK6; PRKG1; MAPK6; PLK5; FASTKD1; SCYL2; ERN2; FASTKD5; ADCK2; PIM3; VRK2; LMTK2; PDIK1L; ACVR1C; NEK7; PPP4R1; MYO3B; TBRG4; AURKB; TRIB3; TP53RK; SRPK1; PKMYT1; RIOK1; EIF2A; SGK2; PICK1; PLK2; FASTKD2; FNIP2; HSPB8; STK38L; STK24; RPS6KL1; RPS6KB2; PRPF4B; MELK; RPS6KB1; CDK7; NRBP1; PHKA1;	GO:0006468~protein phosphorylation	86	482	17.8423236514523	0.00035969018123882	0.0140852087152438	1	1	0.798881099947711	0.999999999999987	0.132550342569858
down	LIAS; NDUFS2; IDH1; NDUFB4; OXSR1; MT-ND3; PRNP; KRT1; ERCC3; PSMB5; PRDX6; GCLC; PSEN1; NDUFA6; MTF1; DHCR24; ETFDH; NAPRT; OXR1; SRXN1; SGK2; DUOX2; DUOX1; NDUFA12; HMOX2; ATOX1; PRDX1;	GO:0006979~response to oxidative stress	27	102	26.4705882352941	0.00036347600854325	0.0140852087152438	1	1	0.800277115310653	0.999999999999987	0.132550342569858
down	ZW10; CDK1; IK; KNL1; MTBP; AURKB; MIS12; TTK;	GO:0034501~protein localization to kinetochore	8	11	72.7272727272727	0.00038154091803588	0.0146486635328086	1	1	0.806719603056172	0.999999999999987	0.137852793573656
down	GRXCR2; SRRM4; SLC9A3R1; BIRC5; ATP8B1; DIAPH1; CNTN5; GJB6; EML2; THRB; PAX3; GJB2; SERPINB6; SLC1A3; GABRB2; TIMM10; CRYM; CEACAM16; USH1G; TPRN; MYH14; CCDC50; MARVELD2; MYO3A; CEMIP; MYO3B; ATP6V0A4; HOMER2; MYO1A; MYO6; TIMM9; TIMM8B; NDUFB9; USP53;	GO:0007605~sensory perception of sound	34	143	23.7762237762238	0.00038228761807446	0.0146486635328086	1	1	0.807009161755189	0.999999999999987	0.137852793573656
down	MIF4GD; DDX3X; EIF3D; NPM1; RPS6KB1; EIF4A3; EIF6; EIF3E; RPL26; KRT17; PLD1; LARP4; GUF1; CPEB3; LARP4B; EIF3C; PYM1; UPF3B; PAIP1; NAT10; SERP1;	GO:0045727~positive regulation of translation	21	70	30	0.00040426749217592	0.0154048373824148	1	1	0.814873137940126	0.999999999999987	0.144968847359867
down	NKX2-8; ABLIM3; THRB; POLR2C; HOXD9; POLR2B; HOXD3; HOXC9; POLR2I; CEBPA; POLR2H; POLR2K; MLF1; POLR2G; E2F1; ILF2; PWP1; MTF1; NFKBIB; LIN52; LIN9; ABLIM2; SLC39A8; RRAGC; GPBP1L1; POLR3B; DRG1;	GO:0006351~transcription, DNA-templated	27	103	26.2135922330097	0.00041344665976217	0.015667572592866	1	1	0.818176081934487	0.999999999999987	0.147441344775739
down	UGT1A9; EDF1; PEX11A; ZMPSTE24; APOA1; HMGCR; FABP1; ALAS1; HNF4A; ME1; HMGCS2; HMGCS1; CYP4A11; MED1; TNFAIP8L3; PPP4R3B; ACER1; ADIPOR1; TRIB3; NPAS2; TBL1XR1; GRHL1; DNAJC15; PPARD; PSAPL1;	GO:0019216~regulation of lipid metabolic process	25	92	27.1739130434783	0.00042477949854469	0.0159211069973663	1	1	0.822209242095038	0.999999999999987	0.149827257036549
up	MEN1; DLL1; WNT9A; HGS; INPPL1; CYP27B1; NCK2; FKTN; SLIT3; GDF11; TP53; TFAP2A; BCHE; INHBA; HSPA1A; GLI3; PTHLH; OSM; GATA1; IL10; SSTR3; CTNNB1; NF2; OPRM1; MSX2; NUP62; VHL; FRK; RARRES1; NUDT6; CDH13; RIPPLY3; TGFB2; ADARB1; HSF1; SOX4; TMEM115; IL24; ZBTB17; REST; DHRS2; CTBP1; TOB2; MXD4; PTPRK; ERBB4; PTPN14; SPEG; STK11; BAK1; AGBL4; PBRM1; PDPN; SIRT2; DIS3L2; SFRP1; SIRT6; RXFP2; BAP1; TSC1; PTPRU; PROX1; KIFAP3; TP53INP1; E2F7; NACC2; TESC; MNT; AMBRA1; WDR6; SMYD2; PDS5B; SIRPG; TES; FBXO2; SH2B3; NR2E3;	GO:0008285~negative regulation of cell population proliferation	77	396	19.4444444444444	0.0004293774207158	0.0708142453857449	1	1	0.913630890454571	0.999998886847137	0.661853604208683
down	SMIM22; PES1; CCNB2; INHA; MYBL2; CCNB1; CDC25A; CENPF; PLK1; ID3; FOXM1; SRSF5; MED1; LIN52; LIN9; LIN54; FIGNL1; PHACTR4; COPS5; MASTL; PRR11; BEX2; WDR12; TXLNG; DTL; USP16; CSNK2A1; SKP2; E2F8; E2F1;	GO:0051726~regulation of cell cycle	30	121	24.7933884297521	0.00045464726530086	0.01694796517771	1	1	0.832913790031188	0.999999999999987	0.159490614273699
down	COQ9; COQ5; PDSS1; PDSS2; COQ2; COQ7; COQ3; COQ10B; FDXR;	GO:0006744~ubiquinone biosynthetic process	9	15	60	0.0004612686776918	0.0170099024746672	1	1	0.835289142181974	0.999999999999987	0.160073481740948
up	MEN1; PITPNM1; SNPH; MBD3; COL4A1; APOD; ATXN1L; EPOR; NF1; SYT1; PTPRG; SMARCA1; TGFBR2; MTOR; BAG6; PRKDC; HSPG2; FPGS; PPP3CA; ADCY1; BPTF; ABR; ITSN1; DPYSL2; BAK1; TBR1; C2CD3; MAP1S; PROX1; CIC; NODAL; ROGDI; SRR; SMG9; SLC6A17; SYT4; ZNF335; POMK; CHD8; SPHK2; STK36; MAST1; KLHL17; PAFAH1B3; PAFAH1B2; SCT; ADGRL3; THRA;	GO:0007420~brain development	48	217	22.1198156682028	0.00047708926295231	0.0748448326660799	1	1	0.925432726645416	0.999998886847137	0.699524819993528
down	CBX4; EREG; NKRF; BIRC5; FOXP2; CLOCK; KLF4; ATP8B1; HR; ZIC2; CRYAB; BMP2; XRCC6; XRCC5; FABP4; GCFC2; BMP7; WT1; ZP3; DDIT3; SOX18; AHR; BRCA1; ID1; HNF4A; ID4; GCLC; LHX1; CENPF; CEBPA; FOXG1; PAX9; WNT4; FOXL2; PSMC5; PITX1; ELF3; E2F1; SET; ID3; PPARD; TLE1; FOXM1; FOXF2; STRN3; NAB1; SNW1; CDK5R1; NR0B2; EZH2; NFIL3; LRRFIP1; NKAPL; DEPDC1; KCTD1; ERN2; CIR1; NOSTRIN; CIART; NKAP; ZC3H8; DMBX1; TFAP2B; USP47; PRICKLE1; TRIB3; ATOH8; TSG101; CITED2; MESP1; MTA3; NKX6-2; CIPC; HMX1; HEYL; BCLAF1; MBD2; MLX; MBD1; HDAC9; ZHX1; SNX6; TIMELESS; PA2G4; HDAC5; HEY1; ZNF706; ZNF165; SIX2; COPS2; OVOL1; OVOL2;	GO:0045892~negative regulation of transcription, DNA-templated	92	530	17.3584905660377	0.00050707532992444	0.0180208792121853	1	1	0.851651325456839	0.999999999999987	0.169587384984934
up	WNT7A; WNT9A; AXIN1; LRP4; GPC4; CDK14; TNKS; APC2; WNT1; CCND1; RYK; GRK5; CTNNB1; WNT5A; CSNK1D; WNT3; WNT3A; WNT7B; RAC3; HHEX; TLE4; PRKAA1; FZD2; DDB1; WLS; TMEM198; NXN; LMBR1L; NPHP3; PIAS4; RTF1; WNT8B; PORCN; CXXC4; CHD8; MARK1; DKK3; CTNND2; INVS; SPIN1; CSNK1G1; TCF7L2; TCF7L1; CSNK1G2;	GO:0016055~Wnt signaling pathway	44	194	22.680412371134	0.00051311458680491	0.0785798338649819	1	1	0.932088667902394	0.999998886847137	0.734433389473458
down	SRRM4; SAP18; GEMIN2; LSM1; DHX15; NUDT21; ZPR1; TRUB2; ECD; LGALS3; LSM3; SRSF2; C1QBP; SF3A3; PPP1R8; SRSF5; SRSF7; USP39; RBM20; ESRP1; ERN2; FASTKD5; CIR1; SREK1IP1; TSEN2; PTCD2; TSEN15; SREK1; RBMXL1; IWS1; PRPF18; NSRP1; RBM28; TTF2; LSM5;	GO:0006397~mRNA processing	35	152	23.0263157894737	0.00052342261459503	0.0183419562606006	1	1	0.857459909782261	0.999999999999987	0.172608914421889
down	ATP6V0E1; ATP6V1G1; IDE; PTPN2; ATP6V1B2; ATP6V1C1; ATP6V1E1; SREBF1; ATP6V1A; GPLD1; GAB1; EIF4EBP1; ATP6V1F; ATP6V0D2; ATP6V1C2; FOXC2; RARRES2; NDEL1; ATP6V0A4; BAIAP2; ATP6V1D; GRB14; GRB7; FOXO6;	GO:0008286~insulin receptor signaling pathway	24	88	27.2727272727273	0.00052413229728498	0.0183419562606006	1	1	0.857752781441836	0.999999999999987	0.172608914421889
up	WNT7A; KMT2D; ARPC1B; CYP27B1; DHH; TSHB; APOA2; ESR1; KRT19; GLI3; ARSB; COMT; CCND1; IL4R; TGFBR2; MMP14; CAV1; EP300; TPH2; GATA6;	GO:0043627~response to estrogen	20	62	32.258064516129	0.00053502459078991	0.0800297248362957	1	1	0.935649482003764	0.999998886847137	0.747984555059511
down	PANO1; FZD9; SAP18; DDX3X; PDCD5; UNC13B; ARHGEF9; EEF1E1; RIPK2; KALRN; SPDEF; LDHA; S100B; UBC; HSPD1; TOP2A; BMP2; RARG; HPGD; BMP7; ATF6; ERCC3; GAL; ADM; ALDH1A3; PSEN1; PSEN2; FOXA1; FOXL2; CRADD; GPLD1; E2F1; ID3; EEF1A2; C1QBP; TIAM1; EIF2B5; STK3; ITGB3BP; PMAIP1; MELK; PDCD2; PLEKHN1; PHLDA2; SHQ1; ADAMTSL4; DCUN1D3; NGEF; ACVR1C; CTNNBL1; NSMAF; FAM162A; ECT2; NOX4; ARHGEF4; TOMM22; BCLAF1; PSENEN; OSGIN1; FAF1; UTP11; PHLDA3; MTCH2;	GO:0043065~positive regulation of apoptotic process	63	332	18.9759036144578	0.00053817131460975	0.0186947819948984	1	1	0.862437744663056	0.999999999999987	0.175929218216751
down	GPR89A; CHUK; RIPK2; LAMTOR5; TSPAN6; TRAF3IP2; S100B; CASP1; CTH; CX3CL1; BST2; ECM1; CXXC5; ZDHHC13; LURAP1L; UNC5CL; SLC44A2; TAB3; DDX1; TFG; MUL1; PELI1; JMJD8; CCL19; MYD88; RBCK1; ECT2; NOD2; TMEM9B; DDX21; NDFIP2; TAB2; PLK2; VAPA; MALT1; IL36A; IL1F10; IL1A; IL36G; IL36B;	GO:0043123~positive regulation of I-kappaB kinase/NF-kappaB signaling	40	183	21.8579234972678	0.00053966567065022	0.0186947819948984	1	1	0.862920557343313	0.999999999999987	0.175929218216751
down	PSMD11; PSMD12; PSMD14; PSMA7; CHUK; CALM1; FER; PSMC3; PSMB1; PSMA1; PSMA3; PSMA4; PSMA5; PSMB6; PSMB5; PSMC2; TEC; PSMC4; MAP2K4; PSMD8; PSMB2; PSMD7; PSMD4; PSMA6; PSME3; PSMC1; PSMC5; PSMC6; RAC1; SKP1; MS4A2; PSMD6; PSMD5; TAB3; PSMB7; TAB2; MALT1; PSMD13;	GO:0038095~Fc-epsilon receptor signaling pathway	38	171	22.2222222222222	0.00055928089065226	0.0192769227587131	1	1	0.868563263033463	0.999999999999987	0.181407515289055
down	DSCAM; MPZL2; CDH16; CEACAM5; DSG3; CEACAM6; DSG1; DSC2; PCDH1; DSC1; DSC3; NECTIN1; IGSF11; CADM3; CLSTN2; ROBO2; PCDH12; CDH22; PCDHB8; PCDHB10; PCDHGB4; PCDHA4; PCDHA12; PCDHB5; PCDHGC4; PCDHGA10; PCDHGA1; PCDHA11; PCDHAC2; NECTIN4; CNTN4; VSTM2L; CDH19; ROBO4; IGSF21; CDH10; CDH12;	GO:0007156~homophilic cell adhesion via plasma membrane adhesion molecules	37	165	22.4242424242424	0.00056737572998955	0.0194581506599916	1	1	0.870181385141352	0.999999999999987	0.183112979573136
down	POLA1; RFC4; RFC3; GINS1; GINS4; GINS3; GINS2; MCM4;	GO:0006271~DNA strand elongation involved in DNA replication	8	12	66.6666666666667	0.00057752242885067	0.0197075937287899	1	1	0.872058867564518	0.999999999999987	0.185460389887696
down	WNT9B; XRCC2; EIF4E2; LMX1B; CCNB2; SYF2; MT-ND4; EDN1; GLI2; BMP2; CCNB1; EIF2S2; BTF3; NOS3; SOX18; HSD17B2; LIG4; UBE2B; PSPH; BCL2L1; NSUN2; FOXF1; FOXC1; MYO1E; ALKBH1; ENDOG; DSC3; ANGPT1; CIR1; RDH10; HM13; BRK1; EGFL8; NSRP1; ARNT2; EPB41L5; TMEM100; RRN3; FOXD3; MAFF; COPS3; RTCB; EPN1;	GO:0001701~in utero embryonic development	43	203	21.1822660098522	0.00060010080865458	0.0202405829303983	1	1	0.876296952229578	0.999999999999987	0.190476140998488
down	ANXA1; SCGB1A1; AGTR1; SLC7A2; PSMA6; DUOXA1; DUOXA2; ABHD12; MCPH1; SETD6; MGLL; MYD88; FANCD2; ACE2; NOD2; TBC1D23; USP18; CASP4; BCL6B; CASP1; CASP12; IL1RL2;	GO:0050727~regulation of inflammatory response	22	78	28.2051282051282	0.00060199430205587	0.0202405829303983	1	1	0.876652384866677	0.999999999999987	0.190476140998488
down	SRRM4; FZD9; N4BP3; DCLK1; MSI1; KCNQ2; TIMM8A; KALRN; DSCAM; MAFK; OPHN1; CSPG5; BPNT1; LGI1; GJB1; CXCL1; FGF5; NTF3; GAL; CBLN1; PAX3; EDNRB; CHRNA3; GDNF; GLRB; LHX1; EFNA5; GBX2; DLX5; DLX6; HSD17B7; FGF12; PCDH1; SMN1; TRAPPC6B; CNTN4; PLPPR1; RAPGEF5; FGF14; ATOH8; NRTN; DPYSL5; SDCBP2; NRN1; SCN3B; RAPGEFL1; PCDHA4; GDA; UTP11; NR2E1; PCDHA11; PCDHAC2; BZW2; ERBB3; GFRA3; TYRO3; ACVR1C;	GO:0007399~nervous system development	57	294	19.3877551020408	0.00061446826915978	0.0205592090642291	1	1	0.879018456753791	0.999999999999987	0.193474605845181
up	SHISA3; HACD1; WNT9A; AXIN1; HMGB3; GNRH2; PRICKLE3; VENTX; F2; HOXB7; HOXC6; CSF3; ZGLP1; BMP1; OSM; GPX4; CUX1; HMGA2; TCL1A; DCAF7; FGD1; TNFRSF17; ZNF45; CLC; TNP2; MN1; ZMYM3; DIP2A; PSME4; TGIF1; ZNF74; SPRED3; TSNAXIP1; ZNF260; ODF2; ACSBG2; HHAT; ZMYM4; ANO1; GGNBP1; TSHZ3; TMEM198; CCSAP; SHISA2; H1FNT; G2E3; ZSCAN2; LDB1; GGN; NLRP14; DZIP1; GPR65; NME8; GPR161; ZFP41; MYCBPAP; CACTIN; TWIST2; EDARADD; TRERF1; MNT; TSSK6; MOV10L1; NXF5; EDA2R; SPATA6; BTBD7; POGK; TBX21; TCFL5; SPATA2; SUFU; CEP131; INVS; ZNF256; CHST2; RBM19; TESMIN; SPIN1; TLL2; ERBB4; MEF2D; CDH11; RET; CDH3; RYK; CDH13; THRA; NR1I2; MEF2B; AXL; FLT3; FSTL1; NR1H2;	GO:0007275~multicellular organism development	94	513	18.3235867446394	0.00062350145780154	0.0903457971916178	1	1	0.949966210765505	0.999998886847137	0.844402015027558
up	NOTO; DLL1; TGFBR2; WNT5A; WNT3A; SHH; C2CD3; CCDC40; NPHP3; MIB1; BBS5; BBS4; NODAL; SMO; VANGL2; SUFU; TBX1; TBX21; TBX3; TBR1;	GO:0001947~heart looping	20	63	31.7460317460317	0.00063208346915777	0.0903457971916178	1	1	0.951318630321748	0.999998886847137	0.844402015027558
down	AURKA; TTK; KIF11; KIZ; ASPM; AURKB; SPAG5; AUNIP; KNSTRN;	GO:0007051~spindle organization	9	16	56.25	0.00065389752047706	0.0214597277174746	1	1	0.886433857565698	0.999999999999987	0.201949031634062
down	ARHGAP32; CCL24; RGS16; RGS5; KALRN; OPHN1; RGS20; ARHGEF15; RASAL1; ADCYAP1; RANBP1; RAP1GAP; RGS4; GDI2; CCL11; AFDN; WNT4; S100A10; RAB3GAP1; RABEP1; RALBP1; RSU1; SEC23B; MAPRE2; EZH2; ARHGAP11B; DEPDC1; ARHGAP40; ALS2CL; LLGL2; DENND1B; ARHGAP11A; PREX2; SMAP1; ELMOD1; GRHL3; AGAP11; ZC3H15; DEPDC1B; ARAP2; USP6NL; PGAM5; ANKRD27; CCL19; ARHGDIG; NDEL1; RACGAP1; ECT2; ARHGEF10L; ADAP2; SIPA1L2; ARHGAP28; ERRFI1; FZD10; STXBP5L; CCL18; CX3CL1; CCL20; CCL17; CCL14; CCL22;	GO:0043547~positive regulation of GTPase activity	61	322	18.944099378882	0.00067534637073962	0.0217384351308981	1	1	0.890454390412623	0.999999999999987	0.204571837151035
down	LYRM7; TTC19; UQCC3; UQCC2; SLC25A33; UQCC1; BCS1L;	GO:0034551~mitochondrial respiratory chain complex III assembly	7	9	77.7777777777778	0.00067823664061994	0.0217384351308981	1	1	0.891017971417521	0.999999999999987	0.204571837151035
down	UGT1A9; UGT1A1; UGT1A3; UGT1A7; UGT1A8; UGT1A10; UGT1A6;	GO:0052697~xenobiotic glucuronidation	7	9	77.7777777777778	0.00067823664061994	0.0217384351308981	1	1	0.891017971417521	0.999999999999987	0.204571837151035
down	DKC1; TCP1; CCT6A; CCT3; CCT8; CCT2; CCT7;	GO:1904871~positive regulation of protein localization to Cajal body	7	9	77.7777777777778	0.00067823664061994	0.0217384351308981	1	1	0.891017971417521	0.999999999999987	0.204571837151035
down	EXOSC10; EXOSC9; EXOSC2; EXOSC8; EXOSC3; EXOSC7;	GO:0071035~nuclear polyadenylation-dependent rRNA catabolic process	6	6	100	0.00070361938015861	0.0223431728171664	1	1	0.895713441889264	0.999999999999987	0.210262784946008
down	EXOSC7; EXOSC9; EXOSC8; EXOSC3; EXOSC10; EXOSC2;	GO:0071038~nuclear polyadenylation-dependent tRNA catabolic process	6	6	100	0.00070361938015861	0.0223431728171664	1	1	0.895713441889264	0.999999999999987	0.210262784946008
