down	RAMP2; ADM; AKAP12; PDE3A; ARHGAP35;	GO:0043116~negative regulation of vascular permeability	5	13	38.4615384615385	0.00162982437595316	0.0221291451228161	1	1	0.796662746600044	0.999999999865279	0.205091631477638
down	CDK4; PIK3R1; TSC2; SESN3; SIK2;	GO:0046626~regulation of insulin receptor signaling pathway	5	13	38.4615384615385	0.00162982437595316	0.0221291451228161	1	1	0.796662746600044	0.999999999865279	0.205091631477638
down	TCAP; ANO3; PIEZO2; PKD1L2; PKD1L1;	GO:0050982~detection of mechanical stimulus	5	13	38.4615384615385	0.00162982437595316	0.0221291451228161	1	1	0.796662746600044	0.999999999865279	0.205091631477638
down	SOCS3; SOCS1; IFNGR1; PTPN2; JAK1;	GO:0060334~regulation of interferon-gamma-mediated signaling pathway	5	13	38.4615384615385	0.00162982437595316	0.0221291451228161	1	1	0.796662746600044	0.999999999865279	0.205091631477638
down	TBX3; CSF1; PML; CCL11; LRP5L;	GO:0060444~branching involved in mammary gland duct morphogenesis	5	13	38.4615384615385	0.00162982437595316	0.0221291451228161	1	1	0.796662746600044	0.999999999865279	0.205091631477638
up	SOCS6; IGFBP3; ACVR1; PRR5L; HHIP; UBASH3B;	GO:0009968~negative regulation of signal transduction	6	39	15.3846153846154	0.00163861023027745	0.0175722210783598	1	1	0.716072670631245	0.982335934257411	0.157998498850101
up	AGT; DUSP1; STK38; SH2B3; SPRY4; SPRY2;	GO:0043407~negative regulation of MAP kinase activity	6	39	15.3846153846154	0.00163861023027745	0.0175722210783598	1	1	0.716072670631245	0.982335934257411	0.157998498850101
down	DVL2; TBX3; DHRS3; TGFBR2; TGFBR3; FZD2; SIX1; EYA1; CITED2;	GO:0003151~outflow tract morphogenesis	9	46	19.5652173913043	0.0016586910894929	0.0223678818803045	1	1	0.798315132305508	0.999999999865279	0.207304229877407
down	DCLK1; CNP; ATRX; PRKG1; DYNC2H1; TWSG1; CHRD; ARHGAP35; PPARGC1A;	GO:0030900~forebrain development	9	46	19.5652173913043	0.0016586910894929	0.0223678818803045	1	1	0.798315132305508	0.999999999865279	0.207304229877407
down	LRP3; MMP11; ZFP36L2; SMAD3; RUNX1T1; CCDC85B; SIRT2; ZADH2; ZFPM2;	GO:0045599~negative regulation of fat cell differentiation	9	46	19.5652173913043	0.0016586910894929	0.0223678818803045	1	1	0.798315132305508	0.999999999865279	0.207304229877407
up	TGFB1; MMP3; GSK3B; PPP2R5B; AJUBA; FNIP2; SH3GLB1;	GO:0031334~positive regulation of protein-containing complex assembly	7	54	12.962962962963	0.00168126062772744	0.0175722210783598	1	1	0.719593552245581	0.982335934257411	0.157998498850101
up	EFR3A; PIP5KL1; PIP4K2C; PIP5K1A; IMPAD1; EFR3B; SOCS6;	GO:0046854~phosphatidylinositol phosphorylation	7	54	12.962962962963	0.00168126062772744	0.0175722210783598	1	1	0.719593552245581	0.982335934257411	0.157998498850101
up	HSPA5; AQP1; SLC8A1; STC1; RAP1A; NOX4; HCN4;	GO:0071320~cellular response to cAMP	7	54	12.962962962963	0.00168126062772744	0.0175722210783598	1	1	0.719593552245581	0.982335934257411	0.157998498850101
up	ERN1; BAG3; HSPA9; HSPA5; HSPA13;	GO:0034620~cellular response to unfolded protein	5	26	19.2307692307692	0.00168365589599584	0.0175722210783598	1	1	0.720003143631638	0.982335934257411	0.157998498850101
up	TGFB1; CALM2; ANKLE2; CNEP1R1; DLC1;	GO:0035307~positive regulation of protein dephosphorylation	5	26	19.2307692307692	0.00168365589599584	0.0175722210783598	1	1	0.720003143631638	0.982335934257411	0.157998498850101
up	GNE; SLC35A3; GFPT1;	GO:0006047~UDP-N-acetylglucosamine metabolic process	3	6	50	0.00168708907470727	0.0175722210783598	1	1	0.720387034900005	0.982335934257411	0.157998498850101
up	SERPINE2; NEDD4; WNK1;	GO:0010766~negative regulation of sodium ion transport	3	6	50	0.00168708907470727	0.0175722210783598	1	1	0.720387034900005	0.982335934257411	0.157998498850101
up	RORA; RERE; ATF5;	GO:0021930~cerebellar granule cell precursor proliferation	3	6	50	0.00168708907470727	0.0175722210783598	1	1	0.720387034900005	0.982335934257411	0.157998498850101
up	ANXA2; KIF5B; DOC2B;	GO:0031340~positive regulation of vesicle fusion	3	6	50	0.00168708907470727	0.0175722210783598	1	1	0.720387034900005	0.982335934257411	0.157998498850101
up	MT2A; GSK3B; SH2B3;	GO:0036016~cellular response to interleukin-3	3	6	50	0.00168708907470727	0.0175722210783598	1	1	0.720387034900005	0.982335934257411	0.157998498850101
up	INHBA; INHBB; LEP;	GO:0046881~positive regulation of follicle-stimulating hormone secretion	3	6	50	0.00168708907470727	0.0175722210783598	1	1	0.720387034900005	0.982335934257411	0.157998498850101
up	ITGA4; COL25A1; NPTX1;	GO:0060385~axonogenesis involved in innervation	3	6	50	0.00168708907470727	0.0175722210783598	1	1	0.720387034900005	0.982335934257411	0.157998498850101
up	WNT11; LEP; NOG;	GO:0061037~negative regulation of cartilage development	3	6	50	0.00168708907470727	0.0175722210783598	1	1	0.720387034900005	0.982335934257411	0.157998498850101
down	PARP1; RPA1; POLD1; RFC1; NTHL1; CUL4B; POLD3; DDB2;	GO:0006296~nucleotide-excision repair, DNA incision, 5'-to lesion	8	37	21.6216216216216	0.0017180964926512	0.0229092373134455	1	1	0.801903598214723	0.999999999865279	0.212321480583476
down	NID1; PTN; ARL2; PPM1F; PRKCE; CCDC80; ABI3BP; ECM2;	GO:0010811~positive regulation of cell-substrate adhesion	8	37	21.6216216216216	0.0017180964926512	0.0229092373134455	1	1	0.801903598214723	0.999999999865279	0.212321480583476
down	PARP1; RPA1; POLD1; RFC1; CUL4B; POLD3; WDR48; MRPS26;	GO:0042769~DNA damage response, detection of DNA damage	8	37	21.6216216216216	0.0017180964926512	0.0229092373134455	1	1	0.801903598214723	0.999999999865279	0.212321480583476
up	GFPT1; MRAP2; KL; LEP;	GO:0006112~energy reserve metabolic process	4	15	26.6666666666667	0.00178295381451532	0.0182338360622769	1	1	0.728264286818094	0.982335934257411	0.163947329894821
up	CHST3; ARSG; CHST6; CHST8;	GO:0006790~sulfur compound metabolic process	4	15	26.6666666666667	0.00178295381451532	0.0182338360622769	1	1	0.728264286818094	0.982335934257411	0.163947329894821
up	FGF18; VTN; ITGB3; HIF1A;	GO:0030949~positive regulation of vascular endothelial growth factor receptor signaling pathway	4	15	26.6666666666667	0.00178295381451532	0.0182338360622769	1	1	0.728264286818094	0.982335934257411	0.163947329894821
up	EDN1; DMD; SLC9A1; SLC8A1;	GO:0035994~response to muscle stretch	4	15	26.6666666666667	0.00178295381451532	0.0182338360622769	1	1	0.728264286818094	0.982335934257411	0.163947329894821
up	IL6; TSPO; ETV5; PRKCI;	GO:0060252~positive regulation of glial cell proliferation	4	15	26.6666666666667	0.00178295381451532	0.0182338360622769	1	1	0.728264286818094	0.982335934257411	0.163947329894821
up	WNT11; MEOX1; NOG; IHH;	GO:0061053~somite development	4	15	26.6666666666667	0.00178295381451532	0.0182338360622769	1	1	0.728264286818094	0.982335934257411	0.163947329894821
up	NIPA1; ZDHHC17; NIPA2; MAGT1;	GO:1903830~magnesium ion transmembrane transport	4	15	26.6666666666667	0.00178295381451532	0.0182338360622769	1	1	0.728264286818094	0.982335934257411	0.163947329894821
up	PSMD10; WNT11; WNT5A; PSMD8; RHOA; PSME4; PRICKLE2; AP2M1; PRICKLE1;	GO:0060071~Wnt signaling pathway, planar cell polarity pathway	9	88	10.2272727272727	0.00178902197039077	0.0182545001956162	1	1	0.728725923149501	0.982335934257411	0.164133128948515
up	ATP6V1G1; ERN1; GAPDH; NEDD4; ATP6V0B; ATP13A2; SH3GLB1; ATP6V0A2;	GO:0016241~regulation of macroautophagy	8	71	11.2676056338028	0.00181830118496973	0.0185113732375022	1	1	0.731077518881589	0.982335934257411	0.166442771812218
down	CXCL12; GNAI1; HHEX; TRPV1; TIMP4; STAT6; STAT3; STAT2; STAT5A;	GO:0043434~response to peptide hormone	9	47	19.1489361702128	0.00188879989959845	0.024906192911113	1	1	0.810643741439886	0.999999999865279	0.230829149056027
down	IMPA2; PLCG1; ITPKB; PLCD1; PLCD3; NUDT11; PLCD4; PLCB1; PLCE1;	GO:0043647~inositol phosphate metabolic process	9	47	19.1489361702128	0.00188879989959845	0.024906192911113	1	1	0.810643741439886	0.999999999865279	0.230829149056027
down	TFE3; NOVA1; NR1H3; STK11; LAMA4; ZNF423; FLCN; ADAMTS5; PLCL2;	GO:0120163~negative regulation of cold-induced thermogenesis	9	47	19.1489361702128	0.00188879989959845	0.024906192911113	1	1	0.810643741439886	0.999999999865279	0.230829149056027
down	IKBKB; EPB41L2; ROCK2; FMNL1; RAB13; LLGL1; EPB41L3;	GO:0030866~cortical actin cytoskeleton organization	7	29	24.1379310344828	0.00193223026895395	0.0250056391886716	1	1	0.813034749639255	0.999999999865279	0.231750811379432
down	CAPN3; SQSTM1; PIDD1; CARD8; LIME1; TRAF2; TRAF1;	GO:0043122~regulation of I-kappaB kinase/NF-kappaB signaling	7	29	24.1379310344828	0.00193223026895395	0.0250056391886716	1	1	0.813034749639255	0.999999999865279	0.231750811379432
down	THY1; PLCG1; CAPN3; BDKRB1; TRPC1; CX3CL1; CEMIP;	GO:0051281~positive regulation of release of sequestered calcium ion into cytosol	7	29	24.1379310344828	0.00193223026895395	0.0250056391886716	1	1	0.813034749639255	0.999999999865279	0.231750811379432
up	OSBP; OSBPL9; OSBPL6; OSBPL3; AMACR;	GO:0006699~bile acid biosynthetic process	5	27	18.5185185185185	0.00194925109803756	0.0197110368882274	1	1	0.738378613221958	0.982335934257411	0.177229402318081
up	NDST1; PTK7; LTBP1; PRICKLE1; ADAMTS6;	GO:0060976~coronary vasculature development	5	27	18.5185185185185	0.00194925109803756	0.0197110368882274	1	1	0.738378613221958	0.982335934257411	0.177229402318081
up	TGFB1; NGFR; LIF; SESN2; EIF2AK3;	GO:1900182~positive regulation of protein localization to nucleus	5	27	18.5185185185185	0.00194925109803756	0.0197110368882274	1	1	0.738378613221958	0.982335934257411	0.177229402318081
up	FZD9; ITGB1; ITGA4; IL11; CEBPG; CLCF1; DNAJB9; IFNE;	GO:0030183~B cell differentiation	8	72	11.1111111111111	0.0019708768114246	0.0198851329295861	1	1	0.739337648319226	0.982335934257411	0.178794765801033
down	MITF; GLI3; BCL2; EDNRB; USP13; HPS4;	GO:0030318~melanocyte differentiation	6	21	28.5714285714286	0.00197481613234618	0.0253655108835048	1	1	0.81526017555335	0.999999999865279	0.235086081341572
down	INSR; PDGFRA; MDK; PBX1; SMAD3; SALL1;	GO:0030325~adrenal gland development	6	21	28.5714285714286	0.00197481613234618	0.0253655108835048	1	1	0.81526017555335	0.999999999865279	0.235086081341572
down	CTSK; SQSTM1; USP30; AMBRA1; MAP1LC3A; PPARGC1A; WDR45; ATG2A;	GO:0000422~autophagy of mitochondrion	8	38	21.0526315789474	0.00198872298220254	0.0253796900754474	1	1	0.815832029426818	0.999999999865279	0.235217493268802
down	PARP1; RPA1; POLD1; RFC1; CUL4B; POLD3; DDB2; FAN1;	GO:0033683~nucleotide-excision repair, DNA incision	8	38	21.0526315789474	0.00198872298220254	0.0253796900754474	1	1	0.815832029426818	0.999999999865279	0.235217493268802
down	CREBL2; INSR; PIK3R1; AKT2; SLC1A2; RNASEL; C2CD5; KLF15;	GO:0046326~positive regulation of glucose import	8	38	21.0526315789474	0.00198872298220254	0.0253796900754474	1	1	0.815832029426818	0.999999999865279	0.235217493268802
up	NGFR; ITGA4; GJA1; GSK3B; CACNA2D1; LGMN;	GO:1904646~cellular response to amyloid-beta	6	41	14.6341463414634	0.00205889678941129	0.0206559120623922	1	1	0.744059370200491	0.982335934257411	0.185725133077047
up	FSTL3; INHBA; EIF2S2; TGFBR1; WNT5A; TGFB2; PRDX4; GATA6; NKX3-1;	GO:0008584~male gonad development	9	90	10	0.00206101118139168	0.0206559120623922	1	1	0.744059370200491	0.982335934257411	0.185725133077047
down	ARL6IP5; BCL2; PML; CYP1B1; MAP3K5;	GO:0008631~intrinsic apoptotic signaling pathway in response to oxidative stress	5	14	35.7142857142857	0.00212032469262169	0.0265464651516235	1	1	0.822685980737215	0.999999999865279	0.246031096894804
down	PTN; MDK; UCN; XPC; ABHD12;	GO:0010996~response to auditory stimulus	5	14	35.7142857142857	0.00212032469262169	0.0265464651516235	1	1	0.822685980737215	0.999999999865279	0.246031096894804
down	KLF4; TSC2; TWIST1; PIK3IP1; INPP5E;	GO:0014067~negative regulation of phosphatidylinositol 3-kinase signaling	5	14	35.7142857142857	0.00212032469262169	0.0265464651516235	1	1	0.822685980737215	0.999999999865279	0.246031096894804
down	BCL3; PML; ARL2; TAF8; BBS4;	GO:0051457~maintenance of protein location in nucleus	5	14	35.7142857142857	0.00212032469262169	0.0265464651516235	1	1	0.822685980737215	0.999999999865279	0.246031096894804
down	THY1; PTPN2; HYAL2; MVP; SH3BP5;	GO:0061099~negative regulation of protein tyrosine kinase activity	5	14	35.7142857142857	0.00212032469262169	0.0265464651516235	1	1	0.822685980737215	0.999999999865279	0.246031096894804
down	NFIB; BMP4; YY1; HDAC4; NFATC4;	GO:1902894~negative regulation of pri-miRNA transcription by RNA polymerase II	5	14	35.7142857142857	0.00212032469262169	0.0265464651516235	1	1	0.822685980737215	0.999999999865279	0.246031096894804
up	MRAS; RASGRP1; NRAS; FGF2; CDKN1A; GNB1; SHOC2; RALA;	GO:0007265~Ras protein signal transduction	8	73	10.958904109589	0.00213335189220154	0.0212876794611441	1	1	0.748080529798797	0.982335934257411	0.191405593172564
down	PTGES; TYMS; BCL2; PML; IL6ST; LIFR; RELB; TIMP4; NFKB2;	GO:0034097~response to cytokine	9	48	18.75	0.00214369681710125	0.0267265513025181	1	1	0.823891219301255	0.999999999865279	0.247700124879776
up	AGT; TGFB1; INHBA; AGTR1;	GO:0032270~positive regulation of cellular protein metabolic process	4	16	25	0.00217893850208095	0.0214096136043248	1	1	0.750401585183374	0.982335934257411	0.192501949261827
up	CYP27B1; SPP1; PTGS2; STC1;	GO:0033280~response to vitamin D	4	16	25	0.00217893850208095	0.0214096136043248	1	1	0.750401585183374	0.982335934257411	0.192501949261827
up	EDN1; EDNRA; HTR1D; HTR1B;	GO:0042310~vasoconstriction	4	16	25	0.00217893850208095	0.0214096136043248	1	1	0.750401585183374	0.982335934257411	0.192501949261827
up	SYT7; DOC2B; RIMS1; SYT12;	GO:0048791~calcium ion-regulated exocytosis of neurotransmitter	4	16	25	0.00217893850208095	0.0214096136043248	1	1	0.750401585183374	0.982335934257411	0.192501949261827
up	CLDN3; FGF2; GJA1; WFDC1;	GO:0061045~negative regulation of wound healing	4	16	25	0.00217893850208095	0.0214096136043248	1	1	0.750401585183374	0.982335934257411	0.192501949261827
up	YWHAH; KCNH2; SCN3B; SCN9A;	GO:0086010~membrane depolarization during action potential	4	16	25	0.00217893850208095	0.0214096136043248	1	1	0.750401585183374	0.982335934257411	0.192501949261827
up	KCNH1; NGF; NPR3; RHOA; NCS1; INPP5F; PLCB4;	GO:0048015~phosphatidylinositol-mediated signaling	7	57	12.280701754386	0.00222474031522579	0.0217195397610564	1	1	0.752820027507163	0.982335934257411	0.195288612786011
up	IL6; EDN1; THBS1; PTGS2; HBEGF; FOXP1; NOTCH3;	GO:0048661~positive regulation of smooth muscle cell proliferation	7	57	12.280701754386	0.00222474031522579	0.0217195397610564	1	1	0.752820027507163	0.982335934257411	0.195288612786011
up	NFATC1; SNAI1; TGFB1; ELN; HEYL;	GO:0003180~aortic valve morphogenesis	5	28	17.8571428571429	0.00224419191322667	0.0217195397610564	1	1	0.75404848284416	0.982335934257411	0.195288612786011
up	GSK3B; GBE1; PPP1R3B; PPP1R3C; UGP2;	GO:0005977~glycogen metabolic process	5	28	17.8571428571429	0.00224419191322667	0.0217195397610564	1	1	0.75404848284416	0.982335934257411	0.195288612786011
up	SNAI1; NGFR; FST; TGFB2; INTU;	GO:0031069~hair follicle morphogenesis	5	28	17.8571428571429	0.00224419191322667	0.0217195397610564	1	1	0.75404848284416	0.982335934257411	0.195288612786011
up	KIF1B; BLOC1S2; FAM98A; MAP6; NDEL1;	GO:0032418~lysosome localization	5	28	17.8571428571429	0.00224419191322667	0.0217195397610564	1	1	0.75404848284416	0.982335934257411	0.195288612786011
up	DNM1L; PLAUR; BNIP3; MLLT11; FAM162A;	GO:0090200~positive regulation of release of cytochrome c from mitochondria	5	28	17.8571428571429	0.00224419191322667	0.0217195397610564	1	1	0.75404848284416	0.982335934257411	0.195288612786011
down	ANKRD16; ADAT2; NSUN6; QTRT1; PUS3; THG1L; AARS2;	GO:0006400~tRNA modification	7	30	23.3333333333333	0.0022802177508382	0.028014491754039	1	1	0.831001686651766	0.999999999865279	0.259636682165765
down	ITGB1BP1; THY1; PTN; MADCAM1; MAGI2; SYNGAP1; DLG4;	GO:0043113~receptor clustering	7	30	23.3333333333333	0.0022802177508382	0.028014491754039	1	1	0.831001686651766	0.999999999865279	0.259636682165765
down	KLF4; HMOX1; NPR1; OGN; IGFBP5; PPARG; PPARGC1A;	GO:0048662~negative regulation of smooth muscle cell proliferation	7	30	23.3333333333333	0.0022802177508382	0.028014491754039	1	1	0.831001686651766	0.999999999865279	0.259636682165765
down	FGF10; MAPK3; PTGER4; MAP2K2; ZFP36L2; CCL11; ZFP36L1;	GO:0070371~ERK1 and ERK2 cascade	7	30	23.3333333333333	0.0022802177508382	0.028014491754039	1	1	0.831001686651766	0.999999999865279	0.259636682165765
down	BMP2; BMP4; PTN; SMAD3; ATRAID; OSR2; OSR1; P2RX7;	GO:0030501~positive regulation of bone mineralization	8	39	20.5128205128205	0.00229179408503866	0.028014491754039	1	1	0.831763032512769	0.999999999865279	0.259636682165765
down	APOE; BMP4; SMPD1; NUP62; HYAL2; CDK5RAP3; IRAK3; SPRY1;	GO:0043407~negative regulation of MAP kinase activity	8	39	20.5128205128205	0.00229179408503866	0.028014491754039	1	1	0.831763032512769	0.999999999865279	0.259636682165765
up	FGF2; PGF; DLG1; ADAMTS16; GZF1; WNT6;	GO:0001658~branching involved in ureteric bud morphogenesis	6	42	14.2857142857143	0.00229725864465791	0.0220909093548127	1	1	0.756644134863913	0.982335934257411	0.19862773753697
up	SNAI1; TGFB1; COL1A1; IL6; TGFBR1; TGFB2;	GO:0010718~positive regulation of epithelial to mesenchymal transition	6	42	14.2857142857143	0.00229725864465791	0.0220909093548127	1	1	0.756644134863913	0.982335934257411	0.19862773753697
up	TGFB1; THBS1; TSPO; OXTR; TGFB2; DSG2;	GO:0032570~response to progesterone	6	42	14.2857142857143	0.00229725864465791	0.0220909093548127	1	1	0.756644134863913	0.982335934257411	0.19862773753697
down	TBX3; HOXA3; BMP4;	GO:0010159~specification of animal organ position	3	3	100	0.00230861865499121	0.028014491754039	1	1	0.832534233983623	0.999999999865279	0.259636682165765
down	OTUD3; USP30; USP13;	GO:0044313~protein K6-linked deubiquitination	3	3	100	0.00230861865499121	0.028014491754039	1	1	0.832534233983623	0.999999999865279	0.259636682165765
down	FAT4; DCHS1; SIX2;	GO:0072137~condensed mesenchymal cell proliferation	3	3	100	0.00230861865499121	0.028014491754039	1	1	0.832534233983623	0.999999999865279	0.259636682165765
down	SIX1; EYA1; TBX5;	GO:0072513~positive regulation of secondary heart field cardioblast proliferation	3	3	100	0.00230861865499121	0.028014491754039	1	1	0.832534233983623	0.999999999865279	0.259636682165765
down	SOS1; FLCN; FNIP1;	GO:2000973~regulation of pro-B cell differentiation	3	3	100	0.00230861865499121	0.028014491754039	1	1	0.832534233983623	0.999999999865279	0.259636682165765
down	PARP1; PID1; FLCN;	GO:2001170~negative regulation of ATP biosynthetic process	3	3	100	0.00230861865499121	0.028014491754039	1	1	0.832534233983623	0.999999999865279	0.259636682165765
down	CLN5; GRN; CCDC115; CLN6;	GO:0007042~lysosomal lumen acidification	4	8	50	0.00233650376828709	0.028014491754039	1	1	0.834106979278284	0.999999999865279	0.259636682165765
down	EGFR; SERPINF1; TYRO3; TIMP4;	GO:0042698~ovulation cycle	4	8	50	0.00233650376828709	0.028014491754039	1	1	0.834106979278284	0.999999999865279	0.259636682165765
down	THOC5; DDX39B; THOC6; THOC2;	GO:0046784~viral mRNA export from host cell nucleus	4	8	50	0.00233650376828709	0.028014491754039	1	1	0.834106979278284	0.999999999865279	0.259636682165765
down	FGFR1; TEAD2; NUP133; EPB41L5;	GO:0048339~paraxial mesoderm development	4	8	50	0.00233650376828709	0.028014491754039	1	1	0.834106979278284	0.999999999865279	0.259636682165765
down	DLL1; NUP160; NUP133; SIX2;	GO:0072006~nephron development	4	8	50	0.00233650376828709	0.028014491754039	1	1	0.834106979278284	0.999999999865279	0.259636682165765
up	DHDDS; DOLPP1; NUS1;	GO:0006489~dolichyl diphosphate biosynthetic process	3	7	42.8571428571429	0.00235934618835576	0.0223074450932589	1	1	0.759794695739721	0.982335934257411	0.2005746924193
up	SHMT2; PSPH; PSAT1;	GO:0006564~L-serine biosynthetic process	3	7	42.8571428571429	0.00235934618835576	0.0223074450932589	1	1	0.759794695739721	0.982335934257411	0.2005746924193
up	TMEM189; AGPS; FAR1;	GO:0008611~ether lipid biosynthetic process	3	7	42.8571428571429	0.00235934618835576	0.0223074450932589	1	1	0.759794695739721	0.982335934257411	0.2005746924193
up	ARL13B; RPGRIP1L; DZIP1L;	GO:0021532~neural tube patterning	3	7	42.8571428571429	0.00235934618835576	0.0223074450932589	1	1	0.759794695739721	0.982335934257411	0.2005746924193
up	NPR3; AQP1; COPA;	GO:0030157~pancreatic juice secretion	3	7	42.8571428571429	0.00235934618835576	0.0223074450932589	1	1	0.759794695739721	0.982335934257411	0.2005746924193
up	OAT; PYCR1; ALDH18A1;	GO:0055129~L-proline biosynthetic process	3	7	42.8571428571429	0.00235934618835576	0.0223074450932589	1	1	0.759794695739721	0.982335934257411	0.2005746924193
up	ATP2A2; SLC9A1; PLN;	GO:0086036~regulation of cardiac muscle cell membrane potential	3	7	42.8571428571429	0.00235934618835576	0.0223074450932589	1	1	0.759794695739721	0.982335934257411	0.2005746924193
up	CD55; IL11; TGFB2;	GO:1903659~regulation of complement-dependent cytotoxicity	3	7	42.8571428571429	0.00235934618835576	0.0223074450932589	1	1	0.759794695739721	0.982335934257411	0.2005746924193
down	FGF10; SMAD3; ZBTB16; SMAD1; DISP1; SATB2;	GO:0009880~embryonic pattern specification	6	22	27.2727272727273	0.0024068576274201	0.0286271646205347	1	1	0.837586454342195	0.999999999865279	0.265314898701213
down	ARHGAP42; ADRA1A; BCL6; SCAI; FLCN; ARHGAP35;	GO:0035024~negative regulation of Rho protein signal transduction	6	22	27.2727272727273	0.0024068576274201	0.0286271646205347	1	1	0.837586454342195	0.999999999865279	0.265314898701213
down	SMAD6; AP2B1; TAB1; ROBO2; SUFU; ROBO1;	GO:0035904~aorta development	6	22	27.2727272727273	0.0024068576274201	0.0286271646205347	1	1	0.837586454342195	0.999999999865279	0.265314898701213
down	SOBP; CHL1; CTNS; CBR3; FAM107A; LHCGR; ADORA1; DGCR2; ST3GAL4;	GO:0050890~cognition	9	49	18.3673469387755	0.00242522867370987	0.0287880936577896	1	1	0.838652694632494	0.999999999865279	0.266806379669843
up	BHLHE40; BDNF; LEP; GSK3B; KLF10; CRY1; NPAS2; ATF5;	GO:0007623~circadian rhythm	8	75	10.6666666666667	0.00248975912144633	0.0234912419199225	1	1	0.766845809405471	0.982335934257411	0.211218658297165
up	AKAP5; YWHAG; LTBP2; AP4E1; TRAK1; SRPRA;	GO:0006605~protein targeting	6	43	13.953488372093	0.00255580365669861	0.024064038604824	1	1	0.770309218180672	0.982335934257411	0.216368890357028
up	TGFB1; PKD1; C2CD3; DACT1; INTU;	GO:0021915~neural tube development	5	29	17.2413793103448	0.00257030882377207	0.0240999850212309	1	1	0.771092647131622	0.982335934257411	0.216692098209125
up	ABL2; RHOA; HBEGF; SSX2IP; INPP5F;	GO:2000145~regulation of cell motility	5	29	17.2413793103448	0.00257030882377207	0.0240999850212309	1	1	0.771092647131622	0.982335934257411	0.216692098209125
down	SNAI2; BMP2; HGF; TGFBR3; TRIM28; CUL7; DDX17; EPB41L5;	GO:0001837~epithelial to mesenchymal transition	8	40	20	0.00262990799209883	0.0308482501558417	1	1	0.849349840962512	0.999999999865279	0.285899790415708
down	HEXB; SMPD1; ASAH1; UGCG; SUMF2; SUMF1; CERK; NEU1;	GO:0006687~glycosphingolipid metabolic process	8	40	20	0.00262990799209883	0.0308482501558417	1	1	0.849349840962512	0.999999999865279	0.285899790415708
down	ADCY6; ADCY3; ADCY9; LHCGR; GIPR; ADCY2; ADCY1; ADCY4;	GO:0007190~activation of adenylate cyclase activity	8	40	20	0.00262990799209883	0.0308482501558417	1	1	0.849349840962512	0.999999999865279	0.285899790415708
up	UGDH; ACVR2A; ACVR1; TENM4;	GO:0001702~gastrulation with mouth forming second	4	17	23.5294117647059	0.00263160404799778	0.0243207669189959	1	1	0.774058468534281	0.982335934257411	0.218677231919007
up	MYL4; ATP2A2; PLN; SLC8A1;	GO:0002026~regulation of the force of heart contraction	4	17	23.5294117647059	0.00263160404799778	0.0243207669189959	1	1	0.774058468534281	0.982335934257411	0.218677231919007
up	SLC25A4; GCLM; HK2; DNM1L;	GO:0008637~apoptotic mitochondrial changes	4	17	23.5294117647059	0.00263160404799778	0.0243207669189959	1	1	0.774058468534281	0.982335934257411	0.218677231919007
up	KCNN4; KCNK9; KCNK6; KCNK15;	GO:0030322~stabilization of membrane potential	4	17	23.5294117647059	0.00263160404799778	0.0243207669189959	1	1	0.774058468534281	0.982335934257411	0.218677231919007
up	WNT5A; BMPR2; TAPT1; SCX;	GO:0061036~positive regulation of cartilage development	4	17	23.5294117647059	0.00263160404799778	0.0243207669189959	1	1	0.774058468534281	0.982335934257411	0.218677231919007
up	DUSP1; CDKN1A; FAP; NKX3-1;	GO:0071850~mitotic cell cycle arrest	4	17	23.5294117647059	0.00263160404799778	0.0243207669189959	1	1	0.774058468534281	0.982335934257411	0.218677231919007
up	HAX1; DNM1L; VDAC1; ATP13A2;	GO:1903146~regulation of autophagy of mitochondrion	4	17	23.5294117647059	0.00263160404799778	0.0243207669189959	1	1	0.774058468534281	0.982335934257411	0.218677231919007
down	NRP1; GREM1; GNRH1; THY1; AR; MAPT; BMP2; ADORA1; CXCL5; GDF5; CX3CL1; CCL8; CXCL6; SEMA5A; GPNMB; EFNB3; FGF13; GAL3ST4; TBX5; CCL13; GUCA1B; ADRA1A; ADRA1B; PANX2;	GO:0007267~cell-cell signaling	24	230	10.4347826086957	0.00263686021938014	0.0308689128438065	1	1	0.849349840962512	0.999999999865279	0.286091291007433
up	EDN1; NPR3; AKAP5; EDNRA; HTR1D; HTR1B; ADCY7;	GO:0007193~adenylate cyclase-inhibiting G protein-coupled receptor signaling pathway	7	59	11.864406779661	0.00265617031074683	0.0244476083703433	1	1	0.775601730738074	0.982335934257411	0.21981771147566
up	ACVR2A; ACVR1; RPGRIP1L; DAAM2; BBS7; PITX2; ARL6;	GO:0007368~determination of left/right symmetry	7	59	11.864406779661	0.00265617031074683	0.0244476083703433	1	1	0.775601730738074	0.982335934257411	0.21981771147566
down	SFTPD; ERMAP; CD276; BTN3A3; BTN3A1; BTN2A3P; BTN3A2;	GO:0001817~regulation of cytokine production	7	31	22.5806451612903	0.00267456675104127	0.0311265136368737	1	1	0.851398341871826	0.999999999865279	0.288478720193101
down	SYF2; POLE; PTCH1; WDR48; ZFPM2; RARG; TEAD2;	GO:0048568~embryonic organ development	7	31	22.5806451612903	0.00267456675104127	0.0311265136368737	1	1	0.851398341871826	0.999999999865279	0.288478720193101
down	BCL2; SFTPD; NNT; PDK4; LRRK2; P2RX7; SESN1;	GO:0072593~reactive oxygen species metabolic process	7	31	22.5806451612903	0.00267456675104127	0.0311265136368737	1	1	0.851398341871826	0.999999999865279	0.288478720193101
