down	NME5; ARMC4; SEMA6D; AK8; BBS4;	GO:0021591~ventricular system development	5	19	26.3157894736842	0.00627928454628812	0.0540418309649428	1	1	0.975286131195895	0.999999999865279	0.50085654999891
down	S1PR1; NBR1; TWIST1; OMD; TXLNG;	GO:0030500~regulation of bone mineralization	5	19	26.3157894736842	0.00627928454628812	0.0540418309649428	1	1	0.975286131195895	0.999999999865279	0.50085654999891
down	PFN2; BBS4; SSH2; SSH3; KANK3;	GO:0030837~negative regulation of actin filament polymerization	5	19	26.3157894736842	0.00627928454628812	0.0540418309649428	1	1	0.975286131195895	0.999999999865279	0.50085654999891
down	CAT; TYMS; PPARG; CYP26B1; DNMT3A;	GO:0033189~response to vitamin A	5	19	26.3157894736842	0.00627928454628812	0.0540418309649428	1	1	0.975286131195895	0.999999999865279	0.50085654999891
down	SOCS1; JAK1; STAT3; STAT5A; TSLP;	GO:0038111~interleukin-7-mediated signaling pathway	5	19	26.3157894736842	0.00627928454628812	0.0540418309649428	1	1	0.975286131195895	0.999999999865279	0.50085654999891
down	ARHGAP33; LRRK2; SHANK3; ABI2; ARHGAP44;	GO:0061001~regulation of dendritic spine morphogenesis	5	19	26.3157894736842	0.00627928454628812	0.0540418309649428	1	1	0.975286131195895	0.999999999865279	0.50085654999891
down	MEN1; POR; APEX1; ZFP36L1; CYP11A1;	GO:0071375~cellular response to peptide hormone stimulus	5	19	26.3157894736842	0.00627928454628812	0.0540418309649428	1	1	0.975286131195895	0.999999999865279	0.50085654999891
down	ITGB1BP1; ADCY6; ROCK2; ACE; NPR1;	GO:0097746~regulation of blood vessel diameter	5	19	26.3157894736842	0.00627928454628812	0.0540418309649428	1	1	0.975286131195895	0.999999999865279	0.50085654999891
down	SESN3; STK11; FNIP1; KPTN; SESN1;	GO:1904262~negative regulation of TORC1 signaling	5	19	26.3157894736842	0.00627928454628812	0.0540418309649428	1	1	0.975286131195895	0.999999999865279	0.50085654999891
up	GJA1; HK2; REST; EIF4EBP1; CPEB4; HYOU1;	GO:0002931~response to ischemia	6	53	11.3207547169811	0.00648541783758594	0.0458279875782982	1	1	0.896601494571114	0.982335934257411	0.412056803201115
down	SRSF11; SRSF5; THOC5; DDX39B; THOC6; SRRM1; THOC2; NUP133; NUP62;	GO:0006405~RNA export from nucleus	9	58	15.5172413793103	0.00649097748523308	0.0556222523122207	1	1	0.980137600270196	0.999999999865279	0.51550380323605
up	NFATC1; WNT11; WNT5A; GNB1; PPP3CA;	GO:0007223~Wnt signaling pathway, calcium modulating pathway	5	37	13.5135135135135	0.00652157110670293	0.0458279875782982	1	1	0.897959467300491	0.982335934257411	0.412056803201115
up	ATP2A2; GORASP2; HPS5;	GO:0006996~organelle organization	3	11	27.2727272727273	0.00657443635546762	0.0458279875782982	1	1	0.899341474945432	0.982335934257411	0.412056803201115
up	MICAL2; CFL1; DSTN;	GO:0030042~actin filament depolymerization	3	11	27.2727272727273	0.00657443635546762	0.0458279875782982	1	1	0.899341474945432	0.982335934257411	0.412056803201115
up	COL4A1; COL1A1; UBASH3B;	GO:0038063~collagen-activated tyrosine kinase receptor signaling pathway	3	11	27.2727272727273	0.00657443635546762	0.0458279875782982	1	1	0.899341474945432	0.982335934257411	0.412056803201115
up	LMOD1; SPIRE1; EVL;	GO:0045010~actin nucleation	3	11	27.2727272727273	0.00657443635546762	0.0458279875782982	1	1	0.899341474945432	0.982335934257411	0.412056803201115
up	ITGB3; ITGB1; INHBA;	GO:0048333~mesodermal cell differentiation	3	11	27.2727272727273	0.00657443635546762	0.0458279875782982	1	1	0.899341474945432	0.982335934257411	0.412056803201115
up	SERPINE2; LIF; CLCF1;	GO:0048711~positive regulation of astrocyte differentiation	3	11	27.2727272727273	0.00657443635546762	0.0458279875782982	1	1	0.899341474945432	0.982335934257411	0.412056803201115
up	NPAS2; GLRX2; SLC7A11;	GO:0051775~response to redox state	3	11	27.2727272727273	0.00657443635546762	0.0458279875782982	1	1	0.899341474945432	0.982335934257411	0.412056803201115
up	SLC9A1; DNAJC3; EIF2AK3;	GO:0070417~cellular response to cold	3	11	27.2727272727273	0.00657443635546762	0.0458279875782982	1	1	0.899341474945432	0.982335934257411	0.412056803201115
up	DERL1; UGGT1; UGGT2;	GO:0071712~ER-associated misfolded protein catabolic process	3	11	27.2727272727273	0.00657443635546762	0.0458279875782982	1	1	0.899341474945432	0.982335934257411	0.412056803201115
up	DLG1; DSG2; PKP2;	GO:0098911~regulation of ventricular cardiac muscle cell action potential	3	11	27.2727272727273	0.00657443635546762	0.0458279875782982	1	1	0.899341474945432	0.982335934257411	0.412056803201115
up	THBS1; SKIL; PEA15;	GO:1902043~positive regulation of extrinsic apoptotic signaling pathway via death domain receptors	3	11	27.2727272727273	0.00657443635546762	0.0458279875782982	1	1	0.899341474945432	0.982335934257411	0.412056803201115
up	TGFB1; IL6; MAP2K1;	GO:1903800~positive regulation of production of miRNAs involved in gene silencing by miRNA	3	11	27.2727272727273	0.00657443635546762	0.0458279875782982	1	1	0.899341474945432	0.982335934257411	0.412056803201115
up	GOT1; PLN; CDH6; NOTCH2; CHAC1; HEYL; SEL1L; NOTCH3; HEY1;	GO:0007219~Notch signaling pathway	9	109	8.25688073394496	0.0066256855978053	0.0461139537748486	1	1	0.900748161298318	0.982335934257411	0.414628033643491
down	PHKG2; PPP1CC; IL6ST; LEPR; PPP1R1A; PPP1R3E;	GO:0005977~glycogen metabolic process	6	28	21.4285714285714	0.00663275470925462	0.0564306040857471	1	1	0.982867095470283	0.999999999865279	0.522995560514529
down	ZFP36L2; RIDA; KHSRP; NUDT16; LSM2; ZHX2;	GO:0006402~mRNA catabolic process	6	28	21.4285714285714	0.00663275470925462	0.0564306040857471	1	1	0.982867095470283	0.999999999865279	0.522995560514529
down	FANCG; PPM1D; BCL2; CXCL12; CCL11; FKBPL;	GO:0009314~response to radiation	6	28	21.4285714285714	0.00663275470925462	0.0564306040857471	1	1	0.982867095470283	0.999999999865279	0.522995560514529
down	C3; C5; ARNT; IL6ST; CYP1B1; CCBE1;	GO:0010575~positive regulation of vascular endothelial growth factor production	6	28	21.4285714285714	0.00663275470925462	0.0564306040857471	1	1	0.982867095470283	0.999999999865279	0.522995560514529
down	BCL2L11; PLA2G6; BAD; BMF; MFF; WDR35;	GO:0090200~positive regulation of release of cytochrome c from mitochondria	6	28	21.4285714285714	0.00663275470925462	0.0564306040857471	1	1	0.982867095470283	0.999999999865279	0.522995560514529
up	SIPA1L1; RAP1GAP; EPHA5; AJUBA; RAB3GAP2; PLXNA3; PLXNB3;	GO:0043087~regulation of GTPase activity	7	71	9.85915492957746	0.00673012485399305	0.0464322537852222	1	1	0.902180193351257	0.982335934257411	0.41748998965911
up	PLCB4; TUBB2B; PACSIN2; SLC7A11; NGF; BDNF; GRIA3;	GO:0050804~modulation of chemical synaptic transmission	7	71	9.85915492957746	0.00673012485399305	0.0464322537852222	1	1	0.902180193351257	0.982335934257411	0.41748998965911
up	ACSL3; ACSL1; ACOT2; ACOT1;	GO:0001676~long-chain fatty acid metabolic process	4	23	17.3913043478261	0.00674348696880722	0.0464322537852222	1	1	0.903627253820168	0.982335934257411	0.41748998965911
up	BAIAP2L1; SERP1; FER1L4; MYOF;	GO:0007009~plasma membrane organization	4	23	17.3913043478261	0.00674348696880722	0.0464322537852222	1	1	0.903627253820168	0.982335934257411	0.41748998965911
up	RAB5A; NCS1; STXBP5; CADPS;	GO:0045921~positive regulation of exocytosis	4	23	17.3913043478261	0.00674348696880722	0.0464322537852222	1	1	0.903627253820168	0.982335934257411	0.41748998965911
up	CALR; CDKN1A; CDKN2B; MAP2K1;	GO:0090398~cellular senescence	4	23	17.3913043478261	0.00674348696880722	0.0464322537852222	1	1	0.903627253820168	0.982335934257411	0.41748998965911
up	CDH2; REST; HOOK3; MMP24;	GO:0097150~neuronal stem cell population maintenance	4	23	17.3913043478261	0.00674348696880722	0.0464322537852222	1	1	0.903627253820168	0.982335934257411	0.41748998965911
down	CHL1; CNP; PBX3; CXCL12; ID2; LGI4; TSC1; SLITRK6;	GO:0008344~adult locomotory behavior	8	48	16.6666666666667	0.00693242243620373	0.0587280857950194	1	1	0.990063193789773	0.999999999865279	0.544288487531346
down	BCL2; HGF; ADRA1A; STAT3; LEPR; KLHL22; SIRT2; BMF;	GO:0010507~negative regulation of autophagy	8	48	16.6666666666667	0.00693242243620373	0.0587280857950194	1	1	0.990063193789773	0.999999999865279	0.544288487531346
down	SDCBP; BMP2; BMP4; ACVRL1; RBPMS; TWSG1; GDF5; GDF11;	GO:0010862~positive regulation of pathway-restricted SMAD protein phosphorylation	8	48	16.6666666666667	0.00693242243620373	0.0587280857950194	1	1	0.990063193789773	0.999999999865279	0.544288487531346
down	CCDC40; ARMC4; LRRC6; DNAAF5; DNAH5; DNAH1; WDR78;	GO:0003341~cilium movement	7	38	18.4210526315789	0.00707222131321417	0.0597421877126202	1	1	0.992623150334801	0.999999999865279	0.553687125192723
down	C2CD5; VAMP1; SNAP25; STX10; TSNARE1; VAMP2; SYT11;	GO:0006906~vesicle fusion	7	38	18.4210526315789	0.00707222131321417	0.0597421877126202	1	1	0.992623150334801	0.999999999865279	0.553687125192723
down	ATG2A; ATG14; PACS2; AMBRA1; MAP1LC3A; WDR45; TP53INP1; ATG16L2; ULK2;	GO:0000045~autophagosome assembly	9	59	15.2542372881356	0.0071526393989112	0.0598312845826915	1	1	0.994216876448657	0.999999999865279	0.554512869808751
down	KLF4; CAT; INSR; MAP2K5; TWIST1; SFRP1; FEZ1; TGFBR2; ACVRL1;	GO:0071363~cellular response to growth factor stimulus	9	59	15.2542372881356	0.0071526393989112	0.0598312845826915	1	1	0.994216876448657	0.999999999865279	0.554512869808751
up	PRKCI; CLTCL1; RAP1A; SORBS1; FGF21;	GO:0046326~positive regulation of glucose import	5	38	13.1578947368421	0.00721034641829243	0.0493108523516306	1	1	0.91463748188944	0.982335934257411	0.443372560237777
up	SLC9A1; VDAC1; LRRC8A; SLC9A7; SLC13A5;	GO:0098656~anion transmembrane transport	5	38	13.1578947368421	0.00721034641829243	0.0493108523516306	1	1	0.91463748188944	0.982335934257411	0.443372560237777
up	ARPC2; P4HB; CALR; LIMS1; LIMS2;	GO:1900026~positive regulation of substrate adhesion-dependent cell spreading	5	38	13.1578947368421	0.00721034641829243	0.0493108523516306	1	1	0.91463748188944	0.982335934257411	0.443372560237777
up	WNT5A; GSK3B; AIMP2; PICALM; SARM1;	GO:1901216~positive regulation of neuron death	5	38	13.1578947368421	0.00721034641829243	0.0493108523516306	1	1	0.91463748188944	0.982335934257411	0.443372560237777
down	TOX; ID2; SP3; TYRO3;	GO:0001779~natural killer cell differentiation	4	12	33.3333333333333	0.00730410502892787	0.0598312845826915	1	1	0.998010189325209	0.999999999865279	0.554512869808751
down	THY1; BCL2; MINK1; TSC1;	GO:0001952~regulation of cell-matrix adhesion	4	12	33.3333333333333	0.00730410502892787	0.0598312845826915	1	1	0.998010189325209	0.999999999865279	0.554512869808751
down	SCTR; TRPV1; APPL2; OMA1;	GO:0002024~diet induced thermogenesis	4	12	33.3333333333333	0.00730410502892787	0.0598312845826915	1	1	0.998010189325209	0.999999999865279	0.554512869808751
down	ARHGAP42; ADORA1; TRPV1; BBS4;	GO:0003085~negative regulation of systemic arterial blood pressure	4	12	33.3333333333333	0.00730410502892787	0.0598312845826915	1	1	0.998010189325209	0.999999999865279	0.554512869808751
down	ADH1B; ALDH2; ADH1A; ADH5;	GO:0006069~ethanol oxidation	4	12	33.3333333333333	0.00730410502892787	0.0598312845826915	1	1	0.998010189325209	0.999999999865279	0.554512869808751
down	MANBA; FBXO17; FBXO6; FBXO44;	GO:0006516~glycoprotein catabolic process	4	12	33.3333333333333	0.00730410502892787	0.0598312845826915	1	1	0.998010189325209	0.999999999865279	0.554512869808751
down	CYP11A1; FDXR; STAR; STARD3;	GO:0006700~C21-steroid hormone biosynthetic process	4	12	33.3333333333333	0.00730410502892787	0.0598312845826915	1	1	0.998010189325209	0.999999999865279	0.554512869808751
down	CTDNEP1; LPIN1; NEK9; NEK6;	GO:0007077~mitotic nuclear envelope disassembly	4	12	33.3333333333333	0.00730410502892787	0.0598312845826915	1	1	0.998010189325209	0.999999999865279	0.554512869808751
down	PARP1; AR; WBP2; PAGR1;	GO:0033148~positive regulation of intracellular estrogen receptor signaling pathway	4	12	33.3333333333333	0.00730410502892787	0.0598312845826915	1	1	0.998010189325209	0.999999999865279	0.554512869808751
down	ABCA1; APOE; APOC1; ABCA7;	GO:0033700~phospholipid efflux	4	12	33.3333333333333	0.00730410502892787	0.0598312845826915	1	1	0.998010189325209	0.999999999865279	0.554512869808751
down	HEXB; GNS; OGN; OMD;	GO:0042340~keratan sulfate catabolic process	4	12	33.3333333333333	0.00730410502892787	0.0598312845826915	1	1	0.998010189325209	0.999999999865279	0.554512869808751
down	MPV17; SMAD1; CREBBP; TRERF1;	GO:0042592~homeostatic process	4	12	33.3333333333333	0.00730410502892787	0.0598312845826915	1	1	0.998010189325209	0.999999999865279	0.554512869808751
down	USP2; ID2; MTA1; KCND2;	GO:0045475~locomotor rhythm	4	12	33.3333333333333	0.00730410502892787	0.0598312845826915	1	1	0.998010189325209	0.999999999865279	0.554512869808751
down	TRAFD1; TYRO3; DHX58; IRAK3;	GO:0045824~negative regulation of innate immune response	4	12	33.3333333333333	0.00730410502892787	0.0598312845826915	1	1	0.998010189325209	0.999999999865279	0.554512869808751
down	PDE5A; GSTM2; KCNJ2; CAMK2D;	GO:0055119~relaxation of cardiac muscle	4	12	33.3333333333333	0.00730410502892787	0.0598312845826915	1	1	0.998010189325209	0.999999999865279	0.554512869808751
down	SCN2B; KCNJ2; SCN1B; CACNA1C;	GO:0086012~membrane depolarization during cardiac muscle cell action potential	4	12	33.3333333333333	0.00730410502892787	0.0598312845826915	1	1	0.998010189325209	0.999999999865279	0.554512869808751
down	STXBP4; PAF1; PHB2; PAGR1;	GO:1902808~positive regulation of cell cycle G1/S phase transition	4	12	33.3333333333333	0.00730410502892787	0.0598312845826915	1	1	0.998010189325209	0.999999999865279	0.554512869808751
down	MGMT; SPIDR; SPIRE2; NUDT16;	GO:2000781~positive regulation of double-strand break repair	4	12	33.3333333333333	0.00730410502892787	0.0598312845826915	1	1	0.998010189325209	0.999999999865279	0.554512869808751
down	STAT3; TAZ; PID1; PPARGC1A;	GO:2001171~positive regulation of ATP biosynthetic process	4	12	33.3333333333333	0.00730410502892787	0.0598312845826915	1	1	0.998010189325209	0.999999999865279	0.554512869808751
down	SRGAP2; GNRH1; STAT3; CX3CL1;	GO:2001223~negative regulation of neuron migration	4	12	33.3333333333333	0.00730410502892787	0.0598312845826915	1	1	0.998010189325209	0.999999999865279	0.554512869808751
up	TRAF5; IL6; EDN1; CEBPG; PPP3CA; PPP2R5B; FANK1; NKX3-1; RNF41;	GO:0051091~positive regulation of DNA-binding transcription factor activity	9	111	8.10810810810811	0.007373237885825	0.0493108523516306	1	1	0.918060152750179	0.982335934257411	0.443372560237777
down	EGFR; IGF2; ARNT; SP3; EPAS1;	GO:0001892~embryonic placenta development	5	20	25	0.00752694932727405	0.0612349762644306	1	1	0.999999999865279	0.999999999865279	0.567522202772211
down	ADCY1; TSSK4; CRTC1; PRKD2; CRTC3;	GO:0032793~positive regulation of CREB transcription factor activity	5	20	25	0.00752694932727405	0.0612349762644306	1	1	0.999999999865279	0.999999999865279	0.567522202772211
down	HDAC4; SIRT2; HDAC11; HDAC9; HDAC5;	GO:0070932~histone H3 deacetylation	5	20	25	0.00752694932727405	0.0612349762644306	1	1	0.999999999865279	0.999999999865279	0.567522202772211
down	APEX1; ALKBH2; APOBEC3C; ALKBH4; APOBEC3G;	GO:0080111~DNA demethylation	5	20	25	0.00752694932727405	0.0612349762644306	1	1	0.999999999865279	0.999999999865279	0.567522202772211
up	FURIN; COMP; MMP16; C2CD3; SDE2; CPE;	GO:0016485~protein processing	6	55	10.9090909090909	0.00762076809070655	0.0493108523516306	1	1	0.923456098137772	0.982335934257411	0.443372560237777
up	SPRY2; WNT5B; WNT11; WNT6; GATA6; WNT5A;	GO:0045165~cell fate commitment	6	55	10.9090909090909	0.00762076809070655	0.0493108523516306	1	1	0.923456098137772	0.982335934257411	0.443372560237777
down	ZFP36L1; NUP133; DCHS1; AMBRA1; ZNF358; SALL2;	GO:0021915~neural tube development	6	29	20.6896551724138	0.00766846843575597	0.061962475254675	1	1	0.999999999865279	0.999999999865279	0.574264621152112
down	MEN1; CDKN2C; TFAP4; HHEX; HEXIM2; CDKN1C;	GO:0045736~negative regulation of cyclin-dependent protein serine/threonine kinase activity	6	29	20.6896551724138	0.00766846843575597	0.061962475254675	1	1	0.999999999865279	0.999999999865279	0.574264621152112
down	EGFR; GAS1; SMAD3; ANGEL2; NLE1; CDKN1C;	GO:0045930~negative regulation of mitotic cell cycle	6	29	20.6896551724138	0.00766846843575597	0.061962475254675	1	1	0.999999999865279	0.999999999865279	0.574264621152112
down	PTPRD; NTNG2; CLSTN3; LRRC4B; LRFN3; LRFN5;	GO:1905606~regulation of presynapse assembly	6	29	20.6896551724138	0.00766846843575597	0.061962475254675	1	1	0.999999999865279	0.999999999865279	0.574264621152112
down	GRIA1; DAPK1; DLG4; MAPK8IP2; NLGN1; PPARGC1A;	GO:2000310~regulation of NMDA receptor activity	6	29	20.6896551724138	0.00766846843575597	0.061962475254675	1	1	0.999999999865279	0.999999999865279	0.574264621152112
up	SMAD7; LDLRAD4; VASN; STRAP;	GO:0010719~negative regulation of epithelial to mesenchymal transition	4	24	16.6666666666667	0.0076932572720394	0.0493550359842072	1	1	0.925328917670923	0.982335934257411	0.443769832022016
up	ZDHHC17; ZDHHC16; ZDHHC9; HHAT;	GO:0018345~protein palmitoylation	4	24	16.6666666666667	0.0076932572720394	0.0493550359842072	1	1	0.925328917670923	0.982335934257411	0.443769832022016
up	HAX1; PAK3; ELN; ESAM;	GO:0030833~regulation of actin filament polymerization	4	24	16.6666666666667	0.0076932572720394	0.0493550359842072	1	1	0.925328917670923	0.982335934257411	0.443769832022016
up	ENTPD5; HIF1A; PFKFB3; PFKFB4;	GO:0045821~positive regulation of glycolytic process	4	24	16.6666666666667	0.0076932572720394	0.0493550359842072	1	1	0.925328917670923	0.982335934257411	0.443769832022016
up	CLDN3; VTN; ITGB1; HBEGF;	GO:0090303~positive regulation of wound healing	4	24	16.6666666666667	0.0076932572720394	0.0493550359842072	1	1	0.925328917670923	0.982335934257411	0.443769832022016
up	SLC2A1; SLC2A3; SLC2A4; SLC2A14;	GO:1904659~glucose transmembrane transport	4	24	16.6666666666667	0.0076932572720394	0.0493550359842072	1	1	0.925328917670923	0.982335934257411	0.443769832022016
down	SDCBP; ADORA1; PARD3; VPS37D; ZDHHC1; ZDHHC7; ZDHHC14; EXOC4;	GO:0006612~protein targeting to membrane	8	49	16.3265306122449	0.00771425519034696	0.0622478637951064	1	1	0.999999999865279	0.999999999865279	0.576909585566112
up	AGT; ACSL1; GLIPR1; FHL2; ACOX1; TRIB3; NPAS2; TM6SF2;	GO:0019216~regulation of lipid metabolic process	8	92	8.69565217391304	0.00772506986614518	0.0494887288299926	1	1	0.927008383937422	0.982335934257411	0.444971915062452
down	HPX; HMOX1; ACO1; CYBRD1; SCARA5; CCDC115; SLC40A1; ISCU; ABCB7;	GO:0006879~cellular iron ion homeostasis	9	60	15	0.00786462957010836	0.0632895156338761	1	1	0.999999999865279	0.999999999865279	0.586563554296458
down	LRP3; GLI3; BMP2; BMP4; HGF; IL6ST; CEBPD; SMAD1; ATRAID;	GO:0045669~positive regulation of osteoblast differentiation	9	60	15	0.00786462957010836	0.0632895156338761	1	1	0.999999999865279	0.999999999865279	0.586563554296458
down	RGS12; RGS10; SOCS5; RGS20; RGS11; RGS22; RGS17;	GO:0009968~negative regulation of signal transduction	7	39	17.9487179487179	0.00798464409044664	0.063808515180337	1	1	0.999999999865279	0.999999999865279	0.59137361194347
down	CCDC78; NPHP1; CDK10; PKN2; PIFO; TSC1; KIF17;	GO:0030030~cell projection organization	7	39	17.9487179487179	0.00798464409044664	0.063808515180337	1	1	0.999999999865279	0.999999999865279	0.59137361194347
down	FOXO3; BCL2; SESN3; ATG14; PIK3R4; KPTN; SESN1;	GO:0042149~cellular response to glucose starvation	7	39	17.9487179487179	0.00798464409044664	0.063808515180337	1	1	0.999999999865279	0.999999999865279	0.59137361194347
down	DVL2; GREM1; ACE; DLG4; UNC119; CASS4; GPRC5B;	GO:0061098~positive regulation of protein tyrosine kinase activity	7	39	17.9487179487179	0.00798464409044664	0.063808515180337	1	1	0.999999999865279	0.999999999865279	0.59137361194347
up	SLC25A4; LONP1; MSTO1;	GO:0000002~mitochondrial genome maintenance	3	12	25	0.00804619453076416	0.0497782405126836	1	1	0.933358565568643	0.982335934257411	0.447575024314309
up	NOG; DUSP1; DUSP2;	GO:0001706~endoderm formation	3	12	25	0.00804619453076416	0.0497782405126836	1	1	0.933358565568643	0.982335934257411	0.447575024314309
up	MET; STC1; CLIC4;	GO:0001886~endothelial cell morphogenesis	3	12	25	0.00804619453076416	0.0497782405126836	1	1	0.933358565568643	0.982335934257411	0.447575024314309
up	BMPR2; KCNK6; NPPB;	GO:0003085~negative regulation of systemic arterial blood pressure	3	12	25	0.00804619453076416	0.0497782405126836	1	1	0.933358565568643	0.982335934257411	0.447575024314309
up	PDPK1; BMP6; WNT5A;	GO:0003323~type B pancreatic cell development	3	12	25	0.00804619453076416	0.0497782405126836	1	1	0.933358565568643	0.982335934257411	0.447575024314309
up	EDN1; SLC9A1; SLC9A7;	GO:0006885~regulation of pH	3	12	25	0.00804619453076416	0.0497782405126836	1	1	0.933358565568643	0.982335934257411	0.447575024314309
up	AGPS; ACSL1; DOLPP1;	GO:0008610~lipid biosynthetic process	3	12	25	0.00804619453076416	0.0497782405126836	1	1	0.933358565568643	0.982335934257411	0.447575024314309
up	SGPL1; PIP5K1A; TNS1;	GO:0010761~fibroblast migration	3	12	25	0.00804619453076416	0.0497782405126836	1	1	0.933358565568643	0.982335934257411	0.447575024314309
up	AQP1; RPGRIP1L; TSKU;	GO:0021670~lateral ventricle development	3	12	25	0.00804619453076416	0.0497782405126836	1	1	0.933358565568643	0.982335934257411	0.447575024314309
up	EGR2; ACVR1; INTU;	GO:0030278~regulation of ossification	3	12	25	0.00804619453076416	0.0497782405126836	1	1	0.933358565568643	0.982335934257411	0.447575024314309
up	ACSL3; P4HB; MFSD2A;	GO:0034379~very-low-density lipoprotein particle assembly	3	12	25	0.00804619453076416	0.0497782405126836	1	1	0.933358565568643	0.982335934257411	0.447575024314309
up	IFRD1; RORA; SYNE1;	GO:0042692~muscle cell differentiation	3	12	25	0.00804619453076416	0.0497782405126836	1	1	0.933358565568643	0.982335934257411	0.447575024314309
up	EEF1E1; SPRED2; SPRED3;	GO:0043517~positive regulation of DNA damage response, signal transduction by p53 class mediator	3	12	25	0.00804619453076416	0.0497782405126836	1	1	0.933358565568643	0.982335934257411	0.447575024314309
up	WNT5A; TGFB2; BMPR2;	GO:0045778~positive regulation of ossification	3	12	25	0.00804619453076416	0.0497782405126836	1	1	0.933358565568643	0.982335934257411	0.447575024314309
up	SLC2A4; SESN2; SORT1;	GO:0046323~glucose import	3	12	25	0.00804619453076416	0.0497782405126836	1	1	0.933358565568643	0.982335934257411	0.447575024314309
up	ENPP1; LEP; PEA15;	GO:0046325~negative regulation of glucose import	3	12	25	0.00804619453076416	0.0497782405126836	1	1	0.933358565568643	0.982335934257411	0.447575024314309
up	RCN3; GPAM; LIPG;	GO:0055091~phospholipid homeostasis	3	12	25	0.00804619453076416	0.0497782405126836	1	1	0.933358565568643	0.982335934257411	0.447575024314309
up	ATP2A2; PLN; SLC8A1;	GO:0055119~relaxation of cardiac muscle	3	12	25	0.00804619453076416	0.0497782405126836	1	1	0.933358565568643	0.982335934257411	0.447575024314309
up	SLC8A1; CACNA2D1; JPH2;	GO:0060402~calcium ion transport into cytosol	3	12	25	0.00804619453076416	0.0497782405126836	1	1	0.933358565568643	0.982335934257411	0.447575024314309
up	PKD1; MAP2K1; NOTCH2;	GO:0060674~placenta blood vessel development	3	12	25	0.00804619453076416	0.0497782405126836	1	1	0.933358565568643	0.982335934257411	0.447575024314309
up	SLC8A1; SCN3B; HCN4;	GO:0086012~membrane depolarization during cardiac muscle cell action potential	3	12	25	0.00804619453076416	0.0497782405126836	1	1	0.933358565568643	0.982335934257411	0.447575024314309
up	SERPINE2; UBASH3B; SH2B3;	GO:0090331~negative regulation of platelet aggregation	3	12	25	0.00804619453076416	0.0497782405126836	1	1	0.933358565568643	0.982335934257411	0.447575024314309
up	KCNH2; KCNE4; KCND3;	GO:0098915~membrane repolarization during ventricular cardiac muscle cell action potential	3	12	25	0.00804619453076416	0.0497782405126836	1	1	0.933358565568643	0.982335934257411	0.447575024314309
up	FZD9; SLC8A1; WNT5A;	GO:0099566~regulation of postsynaptic cytosolic calcium ion concentration	3	12	25	0.00804619453076416	0.0497782405126836	1	1	0.933358565568643	0.982335934257411	0.447575024314309
up	RAB1A; GOLGA2; UBE2S;	GO:1904668~positive regulation of ubiquitin protein ligase activity	3	12	25	0.00804619453076416	0.0497782405126836	1	1	0.933358565568643	0.982335934257411	0.447575024314309
up	GJA1; WNT5A; NEDD4; GSK3B; RNF41; DACT1; HECW1;	GO:0045732~positive regulation of protein catabolic process	7	74	9.45945945945946	0.00823732469391736	0.0508908689994072	1	1	0.939055015106579	0.982335934257411	0.457579088677958
down	FOXP2; VAMP5; SVIL; DCN; MEOX2; SIX1; TAZ; POPDC2;	GO:0007519~skeletal muscle tissue development	8	50	16	0.00856049943303505	0.0662523059243319	1	1	0.999999999865279	0.999999999865279	0.614022522594749
down	DLL1; ITGB1BP1; FGF10; STAT3; TSPAN5; NEPRO; CREBBP; DLL4;	GO:0045747~positive regulation of Notch signaling pathway	8	50	16	0.00856049943303505	0.0662523059243319	1	1	0.999999999865279	0.999999999865279	0.614022522594749
down	MAPT; PTN; HRH1; SCTR; CX3CL1; AGER; KAT2A; SYNGAP1;	GO:0048167~regulation of synaptic plasticity	8	50	16	0.00856049943303505	0.0662523059243319	1	1	0.999999999865279	0.999999999865279	0.614022522594749
down	SQSTM1; ATG14; AMBRA1;	GO:0000423~mitophagy	3	6	50	0.00864499569485144	0.0662523059243319	1	1	0.999999999865279	0.999999999865279	0.614022522594749
down	BCL2L11; BAD; BMF;	GO:0001844~protein insertion into mitochondrial membrane involved in apoptotic signaling pathway	3	6	50	0.00864499569485144	0.0662523059243319	1	1	0.999999999865279	0.999999999865279	0.614022522594749
down	MMP2; CTSK; AXIN2;	GO:0001957~intramembranous ossification	3	6	50	0.00864499569485144	0.0662523059243319	1	1	0.999999999865279	0.999999999865279	0.614022522594749
down	BMP4; TGFBR3; FZD2;	GO:0003150~muscular septum morphogenesis	3	6	50	0.00864499569485144	0.0662523059243319	1	1	0.999999999865279	0.999999999865279	0.614022522594749
down	ALDH2; ADH1A; ALDH3B1;	GO:0006066~alcohol metabolic process	3	6	50	0.00864499569485144	0.0662523059243319	1	1	0.999999999865279	0.999999999865279	0.614022522594749
down	POLD1; POLE; POLL;	GO:0006287~base-excision repair, gap-filling	3	6	50	0.00864499569485144	0.0662523059243319	1	1	0.999999999865279	0.999999999865279	0.614022522594749
