up	SUN1; COL3A1; DCN; THBS1; SRC; CCNB1; ETS1; FOSL1; TNC; CHI3L1; TGFBR2; MAP1B; MMP14; CLCN6; RHOA; PSPH; BTG2; PTCH1; ENDOG; MBD2; JUND; COL1A1;	GO:0009612~response to mechanical stimulus	22	57	38.5964912280702	0.00114354577516196	0.00933171953233429	1	1	0.833089923059606	1	0.091022067851299
up	SNU13; TAF9; ZNHIT6; PIH1D1; NUFIP1; RUVBL1; RUVBL2; ZNHIT3;	GO:0000492~box C/D snoRNP assembly	8	9	88.8888888888889	0.00118921242926451	0.00954330638256248	1	1	0.836496474721806	1	0.0930858967706295
up	HMGB1; TOP1; TOP2A; ERCC3; HMGB2; TOP2B; TOP3A; TOP1MT;	GO:0006265~DNA topological change	8	9	88.8888888888889	0.00118921242926451	0.00954330638256248	1	1	0.836496474721806	1	0.0930858967706295
up	PCCA; PCCB; PC; BTD; PDZD11; MCCC1; MCCC2; SLC5A6;	GO:0006768~biotin metabolic process	8	9	88.8888888888889	0.00118921242926451	0.00954330638256248	1	1	0.836496474721806	1	0.0930858967706295
up	PLK1; CENPE; CDC26; CDC6; RIOK2; NEK6; CDC23; UBE2C;	GO:0030071~regulation of mitotic metaphase/anaphase transition	8	9	88.8888888888889	0.00118921242926451	0.00954330638256248	1	1	0.836496474721806	1	0.0930858967706295
up	TPPP; EZR; LIMK2; DLG1; KPNB1; NUMA1; CLASP1; CEP120;	GO:0030953~astral microtubule organization	8	9	88.8888888888889	0.00118921242926451	0.00954330638256248	1	1	0.836496474721806	1	0.0930858967706295
up	SEC16A; TECPR2; SURF4; LMAN1; SEC13; TMED9; PREB; RANGRF;	GO:0032527~protein exit from endoplasmic reticulum	8	9	88.8888888888889	0.00118921242926451	0.00954330638256248	1	1	0.836496474721806	1	0.0930858967706295
up	RNF40; RNF8; RNF20; CDC73; CTR9; PAF1; DTX3L; LEO1;	GO:0033523~histone H2B ubiquitination	8	9	88.8888888888889	0.00118921242926451	0.00954330638256248	1	1	0.836496474721806	1	0.0930858967706295
up	EXOSC3; EXOSC5; EXOSC7; EXOSC8; EXOSC2; EXOSC4; EXOSC6; EXOSC9;	GO:0034427~nuclear-transcribed mRNA catabolic process, exonucleolytic, 3'-5'	8	9	88.8888888888889	0.00118921242926451	0.00954330638256248	1	1	0.836496474721806	1	0.0930858967706295
up	TTC19; UQCC3; UQCC2; SLC25A33; UQCC1; BCS1L; UQCR10; UQCRB;	GO:0034551~mitochondrial respiratory chain complex III assembly	8	9	88.8888888888889	0.00118921242926451	0.00954330638256248	1	1	0.836496474721806	1	0.0930858967706295
up	BTAF1; PPP3CA; TDG; NFATC4; MEPCE; WAPL; SENP2; ZNF304;	GO:0035562~negative regulation of chromatin binding	8	9	88.8888888888889	0.00118921242926451	0.00954330638256248	1	1	0.836496474721806	1	0.0930858967706295
up	EFEMP2; TNXB; LOX; MFAP4; ATP7A; THSD4; FBLN5; EMILIN1;	GO:0048251~elastic fiber assembly	8	9	88.8888888888889	0.00118921242926451	0.00954330638256248	1	1	0.836496474721806	1	0.0930858967706295
up	BRCA2; BLM; ZRANB3; ZNF830; DONSON; SMARCAL1; TIPIN; TIMELESS;	GO:0048478~replication fork protection	8	9	88.8888888888889	0.00118921242926451	0.00954330638256248	1	1	0.836496474721806	1	0.0930858967706295
up	EZR; PAFAH1B1; DLG1; MAD2L1; MISP; CEP83; FHOD1; PARD3B;	GO:0051660~establishment of centrosome localization	8	9	88.8888888888889	0.00118921242926451	0.00954330638256248	1	1	0.836496474721806	1	0.0930858967706295
up	ADAM10; HRAS; RAP1A; PRKCZ; DAG1; IQSEC2; GPC4; GPC6;	GO:0098696~regulation of neurotransmitter receptor localization to postsynaptic specialization membrane	8	9	88.8888888888889	0.00118921242926451	0.00954330638256248	1	1	0.836496474721806	1	0.0930858967706295
up	CHTF8; PCNA; RFC4; RFC2; RFC5; RFC3; CHTF18; DSCC1;	GO:1900264~positive regulation of DNA-directed DNA polymerase activity	8	9	88.8888888888889	0.00118921242926451	0.00954330638256248	1	1	0.836496474721806	1	0.0930858967706295
up	TNKS; PARP1; TERF1; TERF2; SLX4; ERCC4; PINX1; TNKS2;	GO:1904357~negative regulation of telomere maintenance via telomere lengthening	8	9	88.8888888888889	0.00118921242926451	0.00954330638256248	1	1	0.836496474721806	1	0.0930858967706295
up	BAG2; RPL5; RPS7; RPL23; RPL11; MAD2L1; MAD2L2; FBXO5;	GO:1904667~negative regulation of ubiquitin protein ligase activity	8	9	88.8888888888889	0.00118921242926451	0.00954330638256248	1	1	0.836496474721806	1	0.0930858967706295
up	RPA2; CUL4A; RNASEH2B; RFWD3; ETAA1; FEM1B; FBXO4; WDR76;	GO:2000001~regulation of DNA damage checkpoint	8	9	88.8888888888889	0.00118921242926451	0.00954330638256248	1	1	0.836496474721806	1	0.0930858967706295
up	OPA1; SLC25A4; LONP1; MPV17; MEF2A; MGME1; SLC25A33; PIF1; AKT3;	GO:0000002~mitochondrial genome maintenance	9	12	75	0.00133852742264307	0.0104349498350087	1	1	0.847655826070322	1	0.10178303244284
up	DLL1; PDPK1; BMP4; BMP5; BMP6; HNF4A; CDK6; SIDT2; SMO;	GO:0003323~type B pancreatic cell development	9	12	75	0.00133852742264307	0.0104349498350087	1	1	0.847655826070322	1	0.10178303244284
up	CCNB2; CTDNEP1; CDK1; CCNB1; PRKCA; PLK1; NEK9; VRK1; NEK6;	GO:0007077~mitotic nuclear envelope disassembly	9	12	75	0.00133852742264307	0.0104349498350087	1	1	0.847655826070322	1	0.10178303244284
up	ZW10; KNTC1; MAD2L1BP; SIRT2; PPP1R9B; ANLN; CDC23; CDC14B; CDC14A;	GO:0007096~regulation of exit from mitosis	9	12	75	0.00133852742264307	0.0104349498350087	1	1	0.847655826070322	1	0.10178303244284
up	AGPS; SREBF1; ACLY; PRKAA1; GPAT4; ACSS2; CLN8; PRPF19; DOLPP1;	GO:0008610~lipid biosynthetic process	9	12	75	0.00133852742264307	0.0104349498350087	1	1	0.847655826070322	1	0.10178303244284
up	PDLIM1; SGPL1; PML; IQGAP1; ILK; ARID5B; TMEM201; PIP5K1A; LAMTOR2;	GO:0010761~fibroblast migration	9	12	75	0.00133852742264307	0.0104349498350087	1	1	0.847655826070322	1	0.10178303244284
up	TTLL1; TTLL4; TPGS2; TTLL5; TTLL7; TPGS1; TTLL11; CEP41; CFAP20;	GO:0018095~protein polyglutamylation	9	12	75	0.00133852742264307	0.0104349498350087	1	1	0.847655826070322	1	0.10178303244284
up	DCN; VCAN; BGN; CSPG4; DSEL; CHST14; CHST12; DSE; UST;	GO:0030208~dermatan sulfate biosynthetic process	9	12	75	0.00133852742264307	0.0104349498350087	1	1	0.847655826070322	1	0.10178303244284
up	SAE1; ATG7; UBA5; UBA1; UBA3; UBA6; UBA2; NAE1; MOCS3;	GO:0032446~protein modification by small protein conjugation	9	12	75	0.00133852742264307	0.0104349498350087	1	1	0.847655826070322	1	0.10178303244284
up	KMT2D; PARP1; YAP1; FOXA1; PAK1; SKP2; MED1; WBP2; PAGR1;	GO:0033148~positive regulation of intracellular estrogen receptor signaling pathway	9	12	75	0.00133852742264307	0.0104349498350087	1	1	0.847655826070322	1	0.10178303244284
up	ADGRB2; NFATC1; PPP3CB; RCAN1; PPP3R1; PPP3CA; NFAT5; NFATC3; NFATC4;	GO:0033173~calcineurin-NFAT signaling cascade	9	12	75	0.00133852742264307	0.0104349498350087	1	1	0.847655826070322	1	0.10178303244284
up	ARNT; HDAC4; PIAS4; MUL1; RASD2; GNL3; SAE1; UBA2; PIAS3;	GO:0033235~positive regulation of protein sumoylation	9	12	75	0.00133852742264307	0.0104349498350087	1	1	0.847655826070322	1	0.10178303244284
up	RNF8; HNRNPU; EZH2; EAPP; RNF168; NELFB; NELFCD; NELFE; NELFA;	GO:0034244~negative regulation of transcription elongation from RNA polymerase II promoter	9	12	75	0.00133852742264307	0.0104349498350087	1	1	0.847655826070322	1	0.10178303244284
up	MFN2; PACS2; PIK3C3; WIPI2; WDR45B; ATG13; WDR45; WIPI1; ATG9A;	GO:0034497~protein localization to phagophore assembly site	9	12	75	0.00133852742264307	0.0104349498350087	1	1	0.847655826070322	1	0.10178303244284
up	NPHP4; CNGB1; IFT20; AHI1; MFSD2A; CDHR1; BBS4; IFT140; TOPORS;	GO:0035845~photoreceptor cell outer segment organization	9	12	75	0.00133852742264307	0.0104349498350087	1	1	0.847655826070322	1	0.10178303244284
up	CHEK2; ABL1; GADD45A; CASP9; GRB2; MAPK14; CEP63; ATAD5; NBN;	GO:0042770~signal transduction in response to DNA damage	9	12	75	0.00133852742264307	0.0104349498350087	1	1	0.847655826070322	1	0.10178303244284
up	NRP1; HGF; STMN1; MST1; BCAR1; RAC1; MST1R; PAK1; SIRT2;	GO:0048012~hepatocyte growth factor receptor signaling pathway	9	12	75	0.00133852742264307	0.0104349498350087	1	1	0.847655826070322	1	0.10178303244284
up	TLCD2; ABCA1; FABP3; HNF4A; ABCG1; TLCD1; RCN3; GPAM; LIPG;	GO:0055091~phospholipid homeostasis	9	12	75	0.00133852742264307	0.0104349498350087	1	1	0.847655826070322	1	0.10178303244284
up	CASQ2; CALM1; CALM2; CALM3; SRI; FKBP1A; FKBP1B; GSTO1; PKD2;	GO:0060315~negative regulation of ryanodine-sensitive calcium-release channel activity	9	12	75	0.00133852742264307	0.0104349498350087	1	1	0.847655826070322	1	0.10178303244284
up	IL5; SRC; MSN; CAPG; MAPK9; RHOA; ARHGEF5; FSCN1; ASAP1;	GO:0071803~positive regulation of podosome assembly	9	12	75	0.00133852742264307	0.0104349498350087	1	1	0.847655826070322	1	0.10178303244284
up	NRP1; SEMA3F; PLXNB2; PLXNB1; PLXNA4; PLXNA1; PLXNB3; PLXNA3; PLXND1;	GO:1902287~semaphorin-plexin signaling pathway involved in axon guidance	9	12	75	0.00133852742264307	0.0104349498350087	1	1	0.847655826070322	1	0.10178303244284
up	UBE2C; CDC14B; PLK1; RAB1A; CDC20; UBE2S; MASTL; GORASP1; FZR1;	GO:1904668~positive regulation of ubiquitin protein ligase activity	9	12	75	0.00133852742264307	0.0104349498350087	1	1	0.847655826070322	1	0.10178303244284
up	ADAM10; NRP1; FADS1; GREM1; MPZL1; NUDT3; AGT; PDGFA; THY1; GJB1; INHBA; NMB; PTHLH; ADCYAP1; EFNA1; FGFR2; FGFR3; TNFSF8; GJA4; TNFSF9; VIPR2; CXCL5; PGF; TNFSF10; EFNA4; CCL18; GRB2; CXCL6; TNFAIP6; EFNB1; TEK; ENPEP; AIMP1; KLF10; SEMA3B; TMED1; FAT1; EFNB3; ZYX; CTF1; GJC2; FGF13; FGF11; SFRP2; GAL3ST4; PKP4; GDF15; BARX1; ASH1L; GJB4; IL36G; IL17B; TRHDE; TNFSF18; FZD1; ADGRG1; DRD2; ADRA1D; PANX1; FJX1;	GO:0007267~cell-cell signaling	60	230	26.0869565217391	0.00154052911963098	0.0117235104193136	1	1	0.862717670158205	1	0.114351718045607
up	ORC3; MCM3; MCM6; MCM7; MCM2; MCM4; MCM5;	GO:0006267~pre-replicative complex assembly involved in nuclear cell cycle DNA replication	7	7	100	0.00157105531153856	0.0117495010538112	1	1	0.865140707698532	1	0.114605232018947
up	SNAPC5; BRF1; GTF3C4; GTF3C5; GTF3C1; POLR3H; CRCP;	GO:0006384~transcription initiation from RNA polymerase III promoter	7	7	100	0.00157105531153856	0.0117495010538112	1	1	0.865140707698532	1	0.114605232018947
up	TPR; NUP98; NUP133; SEH1L; NUP35; NUP54; NDC1;	GO:0006999~nuclear pore organization	7	7	100	0.00157105531153856	0.0117495010538112	1	1	0.865140707698532	1	0.114605232018947
up	TGFB1; FKBP1A; SMAD3; SMAD4; SMAD2; SMAD1; EID2;	GO:0007183~SMAD protein complex assembly	7	7	100	0.00157105531153856	0.0117495010538112	1	1	0.865140707698532	1	0.114605232018947
up	DNMT1; CTCF; ZNF445; USP7; UHRF1; HELLS; UHRF2;	GO:0010216~maintenance of DNA methylation	7	7	100	0.00157105531153856	0.0117495010538112	1	1	0.865140707698532	1	0.114605232018947
up	TPR; NSUN2; SUPT6H; THOC2; IWS1; SETD2; AKAP8L;	GO:0010793~regulation of mRNA export from nucleus	7	7	100	0.00157105531153856	0.0117495010538112	1	1	0.865140707698532	1	0.114605232018947
up	PLOD2; PLOD3; PLOD1; P3H3; P3H4; VPS33B; VIPAS39;	GO:0017185~peptidyl-lysine hydroxylation	7	7	100	0.00157105531153856	0.0117495010538112	1	1	0.865140707698532	1	0.114605232018947
up	CCNB1; NCBP2; NCBP1; CDC73; PAF1; LEO1; DHX36;	GO:0031442~positive regulation of mRNA 3'-end processing	7	7	100	0.00157105531153856	0.0117495010538112	1	1	0.865140707698532	1	0.114605232018947
up	TP53; RBBP4; CHAF1A; CHAF1B; CDAN1; M1AP; NOC2L;	GO:0031497~chromatin assembly	7	7	100	0.00157105531153856	0.0117495010538112	1	1	0.865140707698532	1	0.114605232018947
up	TNKS; ATM; TERF2; SMG6; POT1; SMG5; SMG7;	GO:0032210~regulation of telomere maintenance via telomerase	7	7	100	0.00157105531153856	0.0117495010538112	1	1	0.865140707698532	1	0.114605232018947
up	SNAPC5; ELL; SNAPC4; ICE2; ZC3H8; ICE1; SNAPC1;	GO:0042796~snRNA transcription by RNA polymerase III	7	7	100	0.00157105531153856	0.0117495010538112	1	1	0.865140707698532	1	0.114605232018947
up	GTF3C1; GTF3C2; GTF3C6; GTF3C4; GTF3C5; GTF3C3; POLR2L;	GO:0042797~tRNA transcription by RNA polymerase III	7	7	100	0.00157105531153856	0.0117495010538112	1	1	0.865140707698532	1	0.114605232018947
up	KAT7; BRD1; BRPF1; ING5; KAT2A; MEAF6; BRPF3;	GO:0044154~histone H3-K14 acetylation	7	7	100	0.00157105531153856	0.0117495010538112	1	1	0.865140707698532	1	0.114605232018947
up	HSPA8; PPIB; STOM; TBC1D20; NUCKS1; YTHDC2; VAPA;	GO:0044829~positive regulation by host of viral genome replication	7	7	100	0.00157105531153856	0.0117495010538112	1	1	0.865140707698532	1	0.114605232018947
up	XRCC1; MTOR; MAP1A; ITPR1; VTI1A; VPS35; HIPK2;	GO:0050882~voluntary musculoskeletal movement	7	7	100	0.00157105531153856	0.0117495010538112	1	1	0.865140707698532	1	0.114605232018947
up	PARN; EXOSC6; EXOSC4; EXOSC2; EXOSC10; EXOSC5; EXOSC3;	GO:0071051~polyadenylation-dependent snoRNA 3'-end processing	7	7	100	0.00157105531153856	0.0117495010538112	1	1	0.865140707698532	1	0.114605232018947
up	KLF4; ASS1; SREBF2; MAP2K5; MAPK7; NFE2L2; KLF2;	GO:0071499~cellular response to laminar fluid shear stress	7	7	100	0.00157105531153856	0.0117495010538112	1	1	0.865140707698532	1	0.114605232018947
up	KIF3B; KIF5B; KIF23; KIFAP3; FYCO1; KIF13A; KIF3A;	GO:0072383~plus-end-directed vesicle transport along microtubule	7	7	100	0.00157105531153856	0.0117495010538112	1	1	0.865140707698532	1	0.114605232018947
up	DVL2; LATS1; CD63; DMD; WNT3A; ITSN1; DUOXA1; RRAGB; AP1AR; LAMTOR1; NIPBL; RRAGA; EXOC8; SCYL3; AHI1; AJUBA; SCYL1; SIN3A; ARMCX3; PRPF19; LAMTOR2; AXIN2;	GO:0034613~cellular protein localization	22	59	37.2881355932203	0.001631321409722	0.0121813729976924	1	1	0.86950217527112	1	0.118817732967226
up	ANO9; CLIC1; SLC26A3; SLC1A4; GABRA2; GLRB; CLCN2; CLCN3; CLCN5; CLCN6; CLCN7; SLC12A2; ANO4; ANO6; ANO5; SLC26A9; CLCC1; SLC26A6; TTYH3; ANO10; SLC17A7; PCYOX1; GABRQ; CLCA2; CLIC4; GABRA3; SLC12A9; SLC12A8; GABRE; SLC12A4; SLC12A7;	GO:1902476~chloride transmembrane transport	31	97	31.9587628865979	0.00169369505650774	0.0126178976860014	1	1	0.874199140349291	1	0.123075617021751
up	ZFP36L2; ZFP36L1; PDE12; DCPS; CNOT1; CNOT3; CNOT2; POLR2D;	GO:0000288~nuclear-transcribed mRNA catabolic process, deadenylation-dependent decay	8	10	80	0.0018757978936339	0.0135264471524533	1	1	0.886247643352835	1	0.131937654816082
up	RAD51C; BRCA2; RAD51; SMC5; NSMCE2; SMC6; TEP1; RAD50;	GO:0000722~telomere maintenance via recombination	8	10	80	0.0018757978936339	0.0135264471524533	1	1	0.886247643352835	1	0.131937654816082
up	MPG; ALKBH1; ALKBH2; ALKBH5; ASCC3; ASCC1; ALKBH3; FTO;	GO:0006307~DNA dealkylation involved in DNA repair	8	10	80	0.0018757978936339	0.0135264471524533	1	1	0.886247643352835	1	0.131937654816082
up	SRPRA; SRP14; SSR1; SSR2; SEC61A1; TRAM1; SEC62; ARL6IP1;	GO:0006613~cotranslational protein targeting to membrane	8	10	80	0.0018757978936339	0.0135264471524533	1	1	0.886247643352835	1	0.131937654816082
up	HMGB2; AGFG1; TBPL1; NECTIN2; MFSD14A; GOPC; PYGO2; PYGO1;	GO:0007289~spermatid nucleus differentiation	8	10	80	0.0018757978936339	0.0135264471524533	1	1	0.886247643352835	1	0.131937654816082
up	HMGN1; BCL3; YY1; ERCC5; BRCA2; WRN; BAK1; POLH;	GO:0010225~response to UV-C	8	10	80	0.0018757978936339	0.0135264471524533	1	1	0.886247643352835	1	0.131937654816082
up	CLASP2; HNF4A; DAG1; CLASP1; PHLDB2; PHLDB1; POGLUT1; TGIF2;	GO:0010470~regulation of gastrulation	8	10	80	0.0018757978936339	0.0135264471524533	1	1	0.886247643352835	1	0.131937654816082
up	NBN; PML; SIRT6; RAD50; PPP1R10; GNL3; DHX36; RTEL1;	GO:0032206~positive regulation of telomere maintenance	8	10	80	0.0018757978936339	0.0135264471524533	1	1	0.886247643352835	1	0.131937654816082
up	AP2A2; AP2A1; CLTA; AP2S1; AP2B1; CLTC; PCSK9; AP2M1;	GO:0032802~low-density lipoprotein particle receptor catabolic process	8	10	80	0.0018757978936339	0.0135264471524533	1	1	0.886247643352835	1	0.131937654816082
up	MT-CYB; CYC1; QDPR; CREB1; CCNA2; SREBF1; CDO1; ABCC2;	GO:0033762~response to glucagon	8	10	80	0.0018757978936339	0.0135264471524533	1	1	0.886247643352835	1	0.131937654816082
up	DCTN1; NIN; CCDC120; CEP19; BBS4; CCDC68; KIF3A; PCM1;	GO:0034454~microtubule anchoring at centrosome	8	10	80	0.0018757978936339	0.0135264471524533	1	1	0.886247643352835	1	0.131937654816082
up	DVL1; MID1; DIAPH1; MAPRE1; CHAMP1; KIF20B; MAPRE3; MAPRE2;	GO:0035372~protein localization to microtubule	8	10	80	0.0018757978936339	0.0135264471524533	1	1	0.886247643352835	1	0.131937654816082
up	IFI6; CEACAM1; CDH13; PTPN12; RHBDF1; MVB12A; WDR54; RHBDF2;	GO:0042058~regulation of epidermal growth factor receptor signaling pathway	8	10	80	0.0018757978936339	0.0135264471524533	1	1	0.886247643352835	1	0.131937654816082
up	LAMTOR5; CD81; SZT2; C12orf66; RTN4; GGA3; SH3BP4; KPTN;	GO:0061462~protein localization to lysosome	8	10	80	0.0018757978936339	0.0135264471524533	1	1	0.886247643352835	1	0.131937654816082
up	DNM2; TP53BP1; ATM; NIPBL; SFRP2; NUCKS1; XRCC6; XRCC5;	GO:0071481~cellular response to X-ray	8	10	80	0.0018757978936339	0.0135264471524533	1	1	0.886247643352835	1	0.131937654816082
up	NCL; MTOR; SMARCA4; SMARCB1; PWP1; NOL11; IPPK; PIH1D1;	GO:1901838~positive regulation of transcription of nucleolar large rRNA by RNA polymerase I	8	10	80	0.0018757978936339	0.0135264471524533	1	1	0.886247643352835	1	0.131937654816082
up	CHMP2A; IST1; CHMP1B; CHMP7; CHMP1A; VTA1; CHMP5; VPS4A;	GO:1904903~ESCRT III complex disassembly	8	10	80	0.0018757978936339	0.0135264471524533	1	1	0.886247643352835	1	0.131937654816082
up	WDR43; WDR75; UTP15; RIOK1; RIOK2; HEATR1; TRMT112; DIMT1;	GO:2000234~positive regulation of rRNA processing	8	10	80	0.0018757978936339	0.0135264471524533	1	1	0.886247643352835	1	0.131937654816082
up	GXYLT2; ST6GAL1; GALNT2; GALNT3; ST3GAL2; MUC17; MUC6; MUC19; GALNT7; GALNT10; GALNT15; GALNT4; XXYLT1; GALNT6; GALNT11; POMGNT1; B3GNT5; B3GNT4; MUC13; POFUT1; GCNT4; ST6GALNAC2;	GO:0016266~O-glycan processing	22	60	36.6666666666667	0.00193535660139221	0.0139455278207621	1	1	0.889555486982921	1	0.1360253890106
up	SNAI2; SNAI1; BMP4; ENG; MSX1; NOTCH1; RBPJ; SMAD4; HEY2;	GO:0003198~epithelial to mesenchymal transition involved in endocardial cushion formation	9	13	69.2307692307692	0.00198214920493678	0.0140214943758147	1	1	0.891972757327983	1	0.136766370659745
up	ERCC1; ERCC3; XPA; ERCC5; FEN1; MFAP4; SCARA3; ERCC4; SDF4;	GO:0009650~UV protection	9	13	69.2307692307692	0.00198214920493678	0.0140214943758147	1	1	0.891972757327983	1	0.136766370659745
up	TUSC3; SLC41A1; MMGT1; MAGT1; NIPAL4; NIPA1; NIPAL3; NIPA2; MRS2;	GO:0015693~magnesium ion transport	9	13	69.2307692307692	0.00198214920493678	0.0140214943758147	1	1	0.891972757327983	1	0.136766370659745
up	SNAPIN; STX1B; STX3; SNAP23; STX4; STX2; STX1A; SNAP29; SNAP47;	GO:0031629~synaptic vesicle fusion to presynaptic active zone membrane	9	13	69.2307692307692	0.00198214920493678	0.0140214943758147	1	1	0.891972757327983	1	0.136766370659745
up	WNT10B; XPO1; UFL1; ARAF; RAD23A; RAD23B; UBE2K; GNA12; UBQLN4;	GO:0032434~regulation of proteasomal ubiquitin-dependent protein catabolic process	9	13	69.2307692307692	0.00198214920493678	0.0140214943758147	1	1	0.891972757327983	1	0.136766370659745
up	PLOD3; COL1A2; TNXB; P3H1; TNS2; P3H2; VPS33B; VIPAS39; P3H3;	GO:0032963~collagen metabolic process	9	13	69.2307692307692	0.00198214920493678	0.0140214943758147	1	1	0.891972757327983	1	0.136766370659745
up	MBD3; PARP1; BRCA1; GRHL2; KDM1B; MPHOSPH8; MIS18A; MBD2; MBD1;	GO:0044030~regulation of DNA methylation	9	13	69.2307692307692	0.00198214920493678	0.0140214943758147	1	1	0.891972757327983	1	0.136766370659745
up	ARF4; RDX; NAPA; SHROOM2; DLG5; JAM3; GOPC; CELSR1; VANGL2;	GO:0045176~apical protein localization	9	13	69.2307692307692	0.00198214920493678	0.0140214943758147	1	1	0.891972757327983	1	0.136766370659745
up	TFRC; TP53BP1; EXOSC6; RIF1; PAXIP1; KMT5C; HMCES; EXOSC3; MAD2L2;	GO:0045830~positive regulation of isotype switching	9	13	69.2307692307692	0.00198214920493678	0.0140214943758147	1	1	0.891972757327983	1	0.136766370659745
up	TNFRSF11B; ALAD; FECH; SERPINF1; CDKN1A; GCLC; RNF4; ABCC2; SRRT;	GO:0046685~response to arsenic-containing substance	9	13	69.2307692307692	0.00198214920493678	0.0140214943758147	1	1	0.891972757327983	1	0.136766370659745
up	ERCC1; SRF; TAF1; XPA; GTF2B; PAXIP1; DHX36; SUB1; GTF2F2;	GO:0060261~positive regulation of transcription initiation from RNA polymerase II promoter	9	13	69.2307692307692	0.00198214920493678	0.0140214943758147	1	1	0.891972757327983	1	0.136766370659745
up	TP53; BMP5; NOTCH1; JAG1; MDM2; MKS1; CHD7; HEY2; HEY1;	GO:0060411~cardiac septum morphogenesis	9	13	69.2307692307692	0.00198214920493678	0.0140214943758147	1	1	0.891972757327983	1	0.136766370659745
up	IRF6; LATS1; CEBPB; AKT1; AKT2; PTCH1; LBH; SMO; ZNF703;	GO:0060644~mammary gland epithelial cell differentiation	9	13	69.2307692307692	0.00198214920493678	0.0140214943758147	1	1	0.891972757327983	1	0.136766370659745
up	WDR47; MELK; TARBP2; DBN1; IFT20; KCTD13; ZNF503; TMEM14B; ORC3;	GO:0061351~neural precursor cell proliferation	9	13	69.2307692307692	0.00198214920493678	0.0140214943758147	1	1	0.891972757327983	1	0.136766370659745
up	NPC1; URI1; NR3C1; ATP1A1; ATP1A2; UBE2L3; MED1; ADTRP; NKX3-1;	GO:0071383~cellular response to steroid hormone stimulus	9	13	69.2307692307692	0.00198214920493678	0.0140214943758147	1	1	0.891972757327983	1	0.136766370659745
up	PTK7; FZD2; SFRP2; CELSR1; VANGL2; FZD1; DVL3; DVL1; DVL2;	GO:0090179~planar cell polarity pathway involved in neural tube closure	9	13	69.2307692307692	0.00198214920493678	0.0140214943758147	1	1	0.891972757327983	1	0.136766370659745
up	CST3; COL3A1; HSP90AB1; COL5A1; MFAP4; FKBP1A; ILK; LTBP2; B4GALT7;	GO:0097435~supramolecular fiber organization	9	13	69.2307692307692	0.00198214920493678	0.0140214943758147	1	1	0.891972757327983	1	0.136766370659745
up	ALG11; PIGB; ALG3; ALG1; ALG12; ALG8; PIGM; ALG2; PIGV;	GO:0097502~mannosylation	9	13	69.2307692307692	0.00198214920493678	0.0140214943758147	1	1	0.891972757327983	1	0.136766370659745
up	PXN; NMI; FHL3; TRIP13; PTPN14; SND1; DDX1; SGF29; RALY;	GO:1903506~regulation of nucleic acid-templated transcription	9	13	69.2307692307692	0.00198214920493678	0.0140214943758147	1	1	0.891972757327983	1	0.136766370659745
up	PLD2; PLA2G10; PLCH2; LIPA; PAFAH1B1; PPT1; RAB7A; PAFAH1B2; PLCB3; LIPE; PAFAH1B3; PLCB4; IAH1; LIPK; PLBD1; PLD6; PLCD3; DDHD1; PLBD2; ABHD4; PAFAH2; PLCD4; PLA2G2F; LDAH; PLCB1; LIPG; CES4A;	GO:0016042~lipid catabolic process	27	81	33.3333333333333	0.00199862431504572	0.0141173828535369	1	1	0.893082728404797	1	0.137701671757806
up	HYAL3; CEBPB; NFKB1; YY1; CHI3L1; RBMX; ADAMTS12; SIRPA; AKAP12; RELA; CD47; HYAL1; HYAL2; USP10; MAPK11; ZC3H12A; DAB2IP; CACTIN; TANK; ABCC2; UPF1; OTUB1; NKX3-1; ADAMTS7; PYCARD; KLF2; CCL18;	GO:0071347~cellular response to interleukin-1	27	81	33.3333333333333	0.00199862431504572	0.0141173828535369	1	1	0.893082728404797	1	0.137701671757806
down	IGLV1-50; TRBV20-1; TRBV24-1; TRGV2; TRGJ1; TRAV12-2; TRAV36DV7; TRAJ3; TRAJ42; IGLV5-52; TRBJ2-6; TRBJ2-7; TRAV8-3; TRAV19; TRGV5; IGKV1D-43; TRAV13-2; TRAV8-2; TRAV1-2; TRAV10; TRAV13-1; TRAV5; TRAV8-6; TRAV38-1; TRAV41; TRAV24; TRAV17; TRAV21; TRBV12-4; TRGV8; TRGV4; IGKV3D-7; TRBV5-4; TRBJ1-3; TRBJ1-6; TRBJ1-4; TRBJ1-5; TRBV6-5; TRBV27; TRBV10-3; TRBV7-6; TRBV6-4; TRDV1; TRBV2; TRBV12-5; TRBV4-2; TRBV4-1; TRBV11-2; TRBV5-5; TRBV5-6; TRBV14; TRBV29-1; TRAV38-2DV8; TRDV2; TNFRSF13B; TRAV8-4; HLA-DQA2; TRGV3; TRGC2; CD3D; TRBV7-9; HLA-DQB2; CD1A; CD3G; TRGC1; TRAV35; TRBD1; CD8B; CD1E; HLA-DMB; CD1C; CD79B; TNFRSF17; SLAMF1; TRAT1; NLRP10; SKAP1; CLEC10A; ZNF683; CLEC4C; FCGR1B; FCRL4; TRGV9; CD84; CLEC4A; SIT1;	GO:0002250~adaptive immune response	86	347	24.7838616714697	0.00206901152238703	1	1	1	1	1	1
up	NME4; APOD; GM2A; CHKA; FABP6; PLTP; HDLBP; PDZD8; SLCO2A1; PLEKHA8; APOLD1; SIGMAR1; ESYT1; APOO; STOML1; CLN8; VPS51; STARD10; CAV2; ABCA7; ABCA1; ABCA2; CAV1;	GO:0006869~lipid transport	23	65	35.3846153846154	0.00224625467576112	0.0157858159263154	1	1	0.906621831195624	1	0.153975652970977
up	EEF2K; HSPA5; JUND; RYR1; ITPKB; PPIF; ADD1; FUS; AKR1C3; IQGAP1; MEF2A; PRKAA1; PKD2; ENDOG; SLC25A24; NCSTN; LGMN; CPNE1; SLC25A23; ECT2; CACYBP; CPNE7; CLIC4; SYT13; SYT12; SYT11; CPNE8;	GO:0071277~cellular response to calcium ion	27	82	32.9268292682927	0.00230360649513528	0.0161185780086528	1	1	0.909888996356091	1	0.157221431279241
up	PLPP1; AGPAT2; PLPP2; PLA2G4B; GPX4; PIP4K2A; PIP4K2B; PLA2G4E; PLBD1; PLA2G4D; PCSK9; PLA2G15; PLPP5; AGPAT1; ACP6; GDE1; CLN8; PLAA; PLPPR4; PLPPR2; PLA2G2F;	GO:0006644~phospholipid metabolic process	21	57	36.8421052631579	0.00231214723069317	0.0161432951052729	1	1	0.910262723213189	1	0.157462523099227
up	PIP5K1C; TUSC2; ITGB1; RAB5A; AXL; DNM2; LRP1; GAS6; NCF4; RAB11FIP2; ABCA7; TM9SF4; ELMO3; PIP5K1A; MYD88; EIF2AK1; C1orf43; CD93; CDC42SE2; CDC42SE1; CORO1C;	GO:0006909~phagocytosis	21	57	36.8421052631579	0.00231214723069317	0.0161432951052729	1	1	0.910262723213189	1	0.157462523099227
up	XPO1; RAN; NMD3; SDAD1; NUP88; RRS1; NPM1;	GO:0000055~ribosomal large subunit export from nucleus	7	8	87.5	0.00258670704791764	0.0174674980121254	1	1	0.925359808133546	1	0.170378865732411
up	TP53; SMARCA1; RECQL; BLM; ZRANB3; RAD54L; SMARCAL1;	GO:0000733~DNA strand renaturation	7	8	87.5	0.00258670704791764	0.0174674980121254	1	1	0.925359808133546	1	0.170378865732411
up	TRAF3IP2; TNFRSF21; BCL10; CRKL; BAX; PKN1; BAK1;	GO:0001783~B cell apoptotic process	7	8	87.5	0.00258670704791764	0.0174674980121254	1	1	0.925359808133546	1	0.170378865732411
up	ANKRD17; MMP2; S1PR1; CDH5; DDIT3; ACVRL1; RECK;	GO:0001955~blood vessel maturation	7	8	87.5	0.00258670704791764	0.0174674980121254	1	1	0.925359808133546	1	0.170378865732411
up	GOT2; GOT1; MDH2; ACLY; NIT2; MDH1; MDH1B;	GO:0006107~oxaloacetate metabolic process	7	8	87.5	0.00258670704791764	0.0174674980121254	1	1	0.925359808133546	1	0.170378865732411
up	APEH; ETF1; C12orf65; TRMT112; ABCE1; MTRF1; MTRF1L;	GO:0006415~translational termination	7	8	87.5	0.00258670704791764	0.0174674980121254	1	1	0.925359808133546	1	0.170378865732411
up	SNAP23; YKT6; CLASP2; SNAP29; MAP4K2; CLASP1; AP1M2;	GO:0006903~vesicle targeting	7	8	87.5	0.00258670704791764	0.0174674980121254	1	1	0.925359808133546	1	0.170378865732411
up	DDX3X; DHX9; DDX39B; DHX36; AGO3; AGO2; AGO1;	GO:0010501~RNA secondary structure unwinding	7	8	87.5	0.00258670704791764	0.0174674980121254	1	1	0.925359808133546	1	0.170378865732411
