up	ADAM10; ABCG1; PSEN1; BACE1; NCSTN; APH1A; PSENEN;	GO:0042987~amyloid precursor protein catabolic process	7	10	70	0.0060349068631127	0.0332901023196234	1	1	1	1	0.324713354448135
up	BMP5; GATA3; ECE1; DDR1; SHROOM2; RDH10; STRA6;	GO:0043583~ear development	7	10	70	0.0060349068631127	0.0332901023196234	1	1	1	1	0.324713354448135
up	NPM1; STIL; CEP76; CENPJ; PLK2; ALMS1; CEP295;	GO:0046599~regulation of centriole replication	7	10	70	0.0060349068631127	0.0332901023196234	1	1	1	1	0.324713354448135
up	PNP; ADA; GLI3; ITPKB; SYK; RHOA; NKAP;	GO:0046638~positive regulation of alpha-beta T cell differentiation	7	10	70	0.0060349068631127	0.0332901023196234	1	1	1	1	0.324713354448135
up	CNP; PPIF; STAT3; BCL2L1; BAK1; BAD; SPG7;	GO:0046902~regulation of mitochondrial membrane permeability	7	10	70	0.0060349068631127	0.0332901023196234	1	1	1	1	0.324713354448135
up	EHMT2; SETDB2; SETD5; EHMT1; PRDM5; ASH1L; SETDB1;	GO:0051567~histone H3-K9 methylation	7	10	70	0.0060349068631127	0.0332901023196234	1	1	1	1	0.324713354448135
up	LMNA; CDK1; CCNB1; MYH10; FHL2; ATG5; HEY2;	GO:0055015~ventricular cardiac muscle cell development	7	10	70	0.0060349068631127	0.0332901023196234	1	1	1	1	0.324713354448135
up	G6PD; YY1; RGS4; GSK3A; PPARA; PAK1; CTDP1;	GO:0061052~negative regulation of cell growth involved in cardiac muscle cell development	7	10	70	0.0060349068631127	0.0332901023196234	1	1	1	1	0.324713354448135
up	ZNF205; GSK3A; GSK3B; BAX; BAK1; CHCHD10; BOK;	GO:1901030~positive regulation of mitochondrial outer membrane permeabilization involved in apoptotic signaling pathway	7	10	70	0.0060349068631127	0.0332901023196234	1	1	1	1	0.324713354448135
up	NCK2; NCK1; PTPN2; DDIT3; SERINC3; SIRT1; BOK;	GO:1902237~positive regulation of endoplasmic reticulum stress-induced intrinsic apoptotic signaling pathway	7	10	70	0.0060349068631127	0.0332901023196234	1	1	1	1	0.324713354448135
up	TOR1A; CTNNB1; RAB11B; HFE; GBF1; RAB11FIP5; ABCA2;	GO:2000008~regulation of protein localization to cell surface	7	10	70	0.0060349068631127	0.0332901023196234	1	1	1	1	0.324713354448135
up	TYMS; BCHE; SPARC; HSPD1; ALAD; GOT1; SDC1; BMP6; AGL; CASP3; UCP3; WNT7B; RHOA; HSD11B2; ADAM9; CDO1; PPARGC1B; PDCD7; PTPRU; BAD;	GO:0051384~response to glucocorticoid	20	60	33.3333333333333	0.00715138988190167	0.0390700226881295	1	1	1	1	0.381090992260151
up	COL12A1; COL6A1; SCARA3; MATN3; MATN2; VWA1; COCH; COL6A3; COL6A2;	GO:0003429~growth plate cartilage chondrocyte morphogenesis	9	17	52.9411764705882	0.00732053733588189	0.0397917909151084	1	1	1	1	0.388131156326522
up	SLC25A4; NDUFS1; PPIF; AKT1; BAX; BCL2L1; BIK; DNM1L; HSPD1;	GO:0008637~apoptotic mitochondrial changes	9	17	52.9411764705882	0.00732053733588189	0.0397917909151084	1	1	1	1	0.388131156326522
up	MEN1; COL1A1; LGALS1; NOTCH1; RHOA; SPOCK1; TBCD; FZD4; CORO2B;	GO:0010812~negative regulation of cell-substrate adhesion	9	17	52.9411764705882	0.00732053733588189	0.0397917909151084	1	1	1	1	0.388131156326522
up	BMP4; MYH9; FASN; PDE1B; SP3; THOC5; MED1; IFI16; IL31RA;	GO:0030224~monocyte differentiation	9	17	52.9411764705882	0.00732053733588189	0.0397917909151084	1	1	1	1	0.388131156326522
up	PPM1D; TRIAP1; NBN; TP53; BCL3; USP10; ACER2; PAXIP1; E2F7;	GO:0030330~DNA damage response, signal transduction by p53 class mediator	9	17	52.9411764705882	0.00732053733588189	0.0397917909151084	1	1	1	1	0.388131156326522
up	CYTH3; IQSEC2; IQSEC1; GBF1; CYTH2; FBXO8; ARFGEF2; ARFGEF1; ARFGAP1;	GO:0032012~regulation of ARF protein signal transduction	9	17	52.9411764705882	0.00732053733588189	0.0397917909151084	1	1	1	1	0.388131156326522
up	EGFR; APP; IFNGR1; C5AR1; PSEN1; SMO; TREM2; BACE2; CNTF;	GO:0048143~astrocyte activation	9	17	52.9411764705882	0.00732053733588189	0.0397917909151084	1	1	1	1	0.388131156326522
up	SRF; CD38; STXBP1; ARF1; SORCS2; ABHD6; PICK1; PLK2; SLC24A1;	GO:0060292~long-term synaptic depression	9	17	52.9411764705882	0.00732053733588189	0.0397917909151084	1	1	1	1	0.388131156326522
up	IGLC7; DNASE2; IGKV1D-16; IGKV1-5; IGLV1-44; IGLV1-40; IGLV2-23; IGLV3-19; IGLV6-57; IGHV1-69; IGHV1-46; IGHV3-11; IGHV3-48; IGHV4-39; IGKC; COL1A1; COL3A1; IGKV1-16; ITGB1; COL1A2; FCGR3A; IFITM1; ITGA4; PVR; VCAM1; CD22; CD34; CD200; CD81; FKBP1A; IGLV3-21; SMAD3; MADCAM1; MICB; MICA; CD276; NCR3LG1; LAIR2; JAML; OSCAR; SPPL2B; SPPL2A; NECTIN2; ULBP1; NPDC1; TREM2; CLEC2D; COL17A1; BTN2A1; BTN2A3P; ICOSLG; BTNL3; BTN3A3;	GO:0050776~regulation of immune response	53	216	24.537037037037	0.00770649631681275	0.0409547513867258	1	1	1	1	0.399474732029709
up	CS; ACO1; ACLY; ACO2; IREB2;	GO:0006101~citrate metabolic process	5	5	100	0.00772930933617111	0.0409547513867258	1	1	1	1	0.399474732029709
up	AK1; AK4; AK2; AK3; AK5;	GO:0006172~ADP biosynthetic process	5	5	100	0.00772930933617111	0.0409547513867258	1	1	1	1	0.399474732029709
up	UBTF; POLR2K; POLR2L; TAF1C; MED1;	GO:0006356~regulation of transcription by RNA polymerase I	5	5	100	0.00772930933617111	0.0409547513867258	1	1	1	1	0.399474732029709
up	LSM11; SLBP; ZNF473; CPSF2; CPSF3;	GO:0006398~mRNA 3'-end processing by stem-loop binding and cleavage	5	5	100	0.00772930933617111	0.0409547513867258	1	1	1	1	0.399474732029709
up	KDM1A; PHF2; JMJD6; ALKBH4; PPME1;	GO:0006482~protein demethylation	5	5	100	0.00772930933617111	0.0409547513867258	1	1	1	1	0.399474732029709
up	OAZ2; ODC1; AMD1; SRM; SMS;	GO:0006595~polyamine metabolic process	5	5	100	0.00772930933617111	0.0409547513867258	1	1	1	1	0.399474732029709
up	PES1; RPS19; NOLC1; RRN3; USP36;	GO:0007000~nucleolus organization	5	5	100	0.00772930933617111	0.0409547513867258	1	1	1	1	0.399474732029709
up	ETS1; FGFR4; LRP1; DDR1; DDR2;	GO:0010715~regulation of extracellular matrix disassembly	5	5	100	0.00772930933617111	0.0409547513867258	1	1	1	1	0.399474732029709
up	HMGCR; ACAT1; ACLY; MCCC2; CROT;	GO:0015936~coenzyme A metabolic process	5	5	100	0.00772930933617111	0.0409547513867258	1	1	1	1	0.399474732029709
up	LOX; LOXL3; LOXL2; LOXL1; LOXL4;	GO:0018057~peptidyl-lysine oxidation	5	5	100	0.00772930933617111	0.0409547513867258	1	1	1	1	0.399474732029709
up	BAG2; MMP16; ACACA; NECAB3; NUMBL;	GO:0019538~protein metabolic process	5	5	100	0.00772930933617111	0.0409547513867258	1	1	1	1	0.399474732029709
up	PNRC2; DCP1B; DCP1A; EDC3; EDC4;	GO:0031087~deadenylation-independent decapping of nuclear-transcribed mRNA	5	5	100	0.00772930933617111	0.0409547513867258	1	1	1	1	0.399474732029709
up	PUS10; PUS7; PUS3; PUSL1; PUS1;	GO:0031119~tRNA pseudouridine synthesis	5	5	100	0.00772930933617111	0.0409547513867258	1	1	1	1	0.399474732029709
up	ACACB; FASN; ACLY; ACACA; AGPAT1;	GO:0031325~positive regulation of cellular metabolic process	5	5	100	0.00772930933617111	0.0409547513867258	1	1	1	1	0.399474732029709
up	CLPTM1; SOD1; ZEB1; SOS1; CAMK4;	GO:0033081~regulation of T cell differentiation in thymus	5	5	100	0.00772930933617111	0.0409547513867258	1	1	1	1	0.399474732029709
up	TCF7; LIG4; PRKDC; BCL11B; LEF1;	GO:0033153~T cell receptor V(D)J recombination	5	5	100	0.00772930933617111	0.0409547513867258	1	1	1	1	0.399474732029709
up	OMA1; YME1L1; STOML2; AFG3L2; ATP23;	GO:0034982~mitochondrial protein processing	5	5	100	0.00772930933617111	0.0409547513867258	1	1	1	1	0.399474732029709
up	ABL1; PDGFRB; PTPN1; LOX; PDGFRL;	GO:0035791~platelet-derived growth factor receptor-beta signaling pathway	5	5	100	0.00772930933617111	0.0409547513867258	1	1	1	1	0.399474732029709
up	ARID1A; NR3C1; CALR; NEDD4; YWHAH;	GO:0042921~glucocorticoid receptor signaling pathway	5	5	100	0.00772930933617111	0.0409547513867258	1	1	1	1	0.399474732029709
up	MSH3; MSH2; MSH6; TCF7L2; AXIN2;	GO:0043570~maintenance of DNA repeat elements	5	5	100	0.00772930933617111	0.0409547513867258	1	1	1	1	0.399474732029709
up	SOX15; BMP4; SIRT2; LUC7L; LEF1;	GO:0045843~negative regulation of striated muscle tissue development	5	5	100	0.00772930933617111	0.0409547513867258	1	1	1	1	0.399474732029709
up	CHEK1; NEK2; KIF11; MAP9; CEP85;	GO:0046602~regulation of mitotic centrosome separation	5	5	100	0.00772930933617111	0.0409547513867258	1	1	1	1	0.399474732029709
up	PAFAH1B1; PLK1; DCTN1; NDEL1; AKAP8L;	GO:0051081~nuclear envelope disassembly	5	5	100	0.00772930933617111	0.0409547513867258	1	1	1	1	0.399474732029709
up	SRF; BMP4; FGFR2; ZEB1; MYOCD;	GO:0051150~regulation of smooth muscle cell differentiation	5	5	100	0.00772930933617111	0.0409547513867258	1	1	1	1	0.399474732029709
up	NUMA1; SMC5; SMC6; CDC6; RAD18;	GO:0051984~positive regulation of chromosome segregation	5	5	100	0.00772930933617111	0.0409547513867258	1	1	1	1	0.399474732029709
up	NFIB; CREB1; KLF2; THRA; THRB;	GO:0060509~type I pneumocyte differentiation	5	5	100	0.00772930933617111	0.0409547513867258	1	1	1	1	0.399474732029709
up	OGT; PHF1; EED; PHF19; MTF2;	GO:0061087~positive regulation of histone H3-K27 methylation	5	5	100	0.00772930933617111	0.0409547513867258	1	1	1	1	0.399474732029709
up	ALDOB; VMA21; TMEM199; TM9SF4; CCDC115;	GO:0070072~vacuolar proton-transporting V-type ATPase complex assembly	5	5	100	0.00772930933617111	0.0409547513867258	1	1	1	1	0.399474732029709
up	TERT; BRCA2; ACD; NABP2; POT1;	GO:0070200~establishment of protein localization to telomere	5	5	100	0.00772930933617111	0.0409547513867258	1	1	1	1	0.399474732029709
up	UFL1; UFM1; CDK5RAP3; UBA5; UFC1;	GO:0071569~protein ufmylation	5	5	100	0.00772930933617111	0.0409547513867258	1	1	1	1	0.399474732029709
up	EIF3D; EIF3G; EIF3B; EIF3A; EIF3L;	GO:0075525~viral translational termination-reinitiation	5	5	100	0.00772930933617111	0.0409547513867258	1	1	1	1	0.399474732029709
up	DKC1; TCP1; CCT4; CCT2; WRAP53;	GO:0090666~scaRNA localization to Cajal body	5	5	100	0.00772930933617111	0.0409547513867258	1	1	1	1	0.399474732029709
up	TLCD2; TRIAP1; TLCD1; GBA2; PRELID1;	GO:0097035~regulation of membrane lipid distribution	5	5	100	0.00772930933617111	0.0409547513867258	1	1	1	1	0.399474732029709
up	AKR1B10; AKR1A1; RDH11; RDH12; PARK7;	GO:0110095~cellular detoxification of aldehyde	5	5	100	0.00772930933617111	0.0409547513867258	1	1	1	1	0.399474732029709
up	SMARCB1; KDM4D; SIRT1; KDM4C; PIH1D1;	GO:1900113~negative regulation of histone H3-K9 trimethylation	5	5	100	0.00772930933617111	0.0409547513867258	1	1	1	1	0.399474732029709
up	TP53; PLK1; PAXIP1; NEK10; GTSE1;	GO:1902749~regulation of cell cycle G2/M phase transition	5	5	100	0.00772930933617111	0.0409547513867258	1	1	1	1	0.399474732029709
up	RAB29; ARL3; RABEP1; WDR19; GGA1;	GO:1903441~protein localization to ciliary membrane	5	5	100	0.00772930933617111	0.0409547513867258	1	1	1	1	0.399474732029709
up	CLASP2; DAG1; CLASP1; PHLDB2; PHLDB1;	GO:1904261~positive regulation of basement membrane assembly involved in embryonic body morphogenesis	5	5	100	0.00772930933617111	0.0409547513867258	1	1	1	1	0.399474732029709
up	NBN; ATM; TERF2; SMG6; RAD50;	GO:1904354~negative regulation of telomere capping	5	5	100	0.00772930933617111	0.0409547513867258	1	1	1	1	0.399474732029709
up	HNRNPA2B1; ATM; NAF1; DHX36; RTEL1;	GO:1904358~positive regulation of telomere maintenance via telomere lengthening	5	5	100	0.00772930933617111	0.0409547513867258	1	1	1	1	0.399474732029709
up	EPB41L2; EPB41; GNAI1; GPSM2; NUMA1;	GO:1904778~positive regulation of protein localization to cell cortex	5	5	100	0.00772930933617111	0.0409547513867258	1	1	1	1	0.399474732029709
up	ENG; TGFBR1; TGFBR2; TGFB2; ACVR1;	GO:1905007~positive regulation of epithelial to mesenchymal transition involved in endocardial cushion formation	5	5	100	0.00772930933617111	0.0409547513867258	1	1	1	1	0.399474732029709
up	PTPRC; RAP1A; PTPRJ; RAPGEF1; APPL2;	GO:1905451~positive regulation of Fc-gamma receptor signaling pathway involved in phagocytosis	5	5	100	0.00772930933617111	0.0409547513867258	1	1	1	1	0.399474732029709
up	TRUB1; PUS7; PUS3; DKC1; PUS1;	GO:1990481~mRNA pseudouridine synthesis	5	5	100	0.00772930933617111	0.0409547513867258	1	1	1	1	0.399474732029709
up	UFL1; UFM1; DDRGK1; UBA5; UFC1;	GO:1990592~protein K69-linked ufmylation	5	5	100	0.00772930933617111	0.0409547513867258	1	1	1	1	0.399474732029709
up	OGT; RANBP2; DGKQ; PDK2; USP7; SLC35B4; NLN; SDHAF3;	GO:0006111~regulation of gluconeogenesis	8	14	57.1428571428571	0.00810922122537372	0.0424559660256437	1	1	1	1	0.414117656117759
up	SLC9A3R1; KLF4; STAMBP; SERPINE2; TSC2; TWIST1; DAB2IP; INPP5E;	GO:0014067~negative regulation of phosphatidylinositol 3-kinase signaling	8	14	57.1428571428571	0.00810922122537372	0.0424559660256437	1	1	1	1	0.414117656117759
up	SLC37A4; SLC37A3; ANKH; XPR1; ADAMTS8; SLC25A10; SLC25A3; SLC20A1;	GO:0035435~phosphate ion transmembrane transport	8	14	57.1428571428571	0.00810922122537372	0.0424559660256437	1	1	1	1	0.414117656117759
up	CTCF; HDAC4; MTA1; TDG; IFI16; ZNF335; HDAC6; KLF2;	GO:0040029~regulation of gene expression, epigenetic	8	14	57.1428571428571	0.00810922122537372	0.0424559660256437	1	1	1	1	0.414117656117759
up	ALDH1A2; AKR1C3; AKR1C1; CYP27C1; RDH10; SDR16C5; RDH11; RPE65;	GO:0042574~retinal metabolic process	8	14	57.1428571428571	0.00810922122537372	0.0424559660256437	1	1	1	1	0.414117656117759
up	TPR; EIF3E; FMR1; EIF4EBP2; LARP1; PAIP2; EIF2AK4; AGO2;	GO:0045947~negative regulation of translational initiation	8	14	57.1428571428571	0.00810922122537372	0.0424559660256437	1	1	1	1	0.414117656117759
up	DGAT1; DGKQ; DGKZ; DGKD; PGS1; GPAT4; DGKI; DGKH;	GO:0046339~diacylglycerol metabolic process	8	14	57.1428571428571	0.00810922122537372	0.0424559660256437	1	1	1	1	0.414117656117759
up	MT-CYB; MT-CO1; SOD1; CDK1; ATP7B; SORD; S100A13; LOXL2;	GO:0046688~response to copper ion	8	14	57.1428571428571	0.00810922122537372	0.0424559660256437	1	1	1	1	0.414117656117759
up	TPPP; PIN1; CKAP5; MAPRE1; MAP7D3; FGF13; CENPJ; FBXO5;	GO:0046785~microtubule polymerization	8	14	57.1428571428571	0.00810922122537372	0.0424559660256437	1	1	1	1	0.414117656117759
up	DGKI; DGKQ; DGKZ; DGKD; AGK; SPHK2; SPHK1; DGKH;	GO:0046834~lipid phosphorylation	8	14	57.1428571428571	0.00810922122537372	0.0424559660256437	1	1	1	1	0.414117656117759
up	AGR2; EGFR; GLI1; EPHB3; BBS7; SFRP2; STRA6; VANGL2;	GO:0048546~digestive tract morphogenesis	8	14	57.1428571428571	0.00810922122537372	0.0424559660256437	1	1	1	1	0.414117656117759
up	PDGFRB; BMP4; ENG; NF1; DLG1; PTCH1; SMO; STRA6;	GO:0048745~smooth muscle tissue development	8	14	57.1428571428571	0.00810922122537372	0.0424559660256437	1	1	1	1	0.414117656117759
up	PER2; SNAI2; FABP4; CEBPA; CTBP2; CTBP1; AACS; SIRT1;	GO:0050872~white fat cell differentiation	8	14	57.1428571428571	0.00810922122537372	0.0424559660256437	1	1	1	1	0.414117656117759
up	MT-CYB; MT-ATP6; COL1A1; PDGFRB; CDK4; CDKN1A; POLG; HDAC2;	GO:0055093~response to hyperoxia	8	14	57.1428571428571	0.00810922122537372	0.0424559660256437	1	1	1	1	0.414117656117759
up	CDH1; FABP4; CALR; CEBPA; GSK3A; LIG4; XRCC4; NFATC4;	GO:0071285~cellular response to lithium ion	8	14	57.1428571428571	0.00810922122537372	0.0424559660256437	1	1	1	1	0.414117656117759
up	ATP1A1; PRKACA; GJA5; ATP1A2; FKBP1B; CACNA1C; GJD3; PKP2;	GO:0086064~cell communication by electrical coupling involved in cardiac conduction	8	14	57.1428571428571	0.00810922122537372	0.0424559660256437	1	1	1	1	0.414117656117759
up	ABL1; ATF4; MAPK1; DNM2; GABPA; HDAC2; SIN3A; HCN3;	GO:1903351~cellular response to dopamine	8	14	57.1428571428571	0.00810922122537372	0.0424559660256437	1	1	1	1	0.414117656117759
up	CTNNB1; TRA2B; MFSD2A; MED12; IFT140; TUBB2B; TBC1D23; MKS1;	GO:1990403~embryonic brain development	8	14	57.1428571428571	0.00810922122537372	0.0424559660256437	1	1	1	1	0.414117656117759
up	SLC24A1; CACNA1H; ITGAV; ANXA6; ATP2A2; ATP2B4; PSEN1; SEC61A1; NCS1; FKBP1A; CACNB1; PKD2; CACNA1C; GAS6; ANO6; CACHD1; SLC25A25; PKD1L2; TRPV1; TRPV3; GRIN3A; TRPM4; MCOLN3; PKD1L1; TRPC4AP; TRPM7; PANX1; P2RX4; STIM2; TMCO1; ATP2C1; TMEM165;	GO:0070588~calcium ion transmembrane transport	32	115	27.8260869565217	0.00814991661305187	0.0426361324962126	1	1	1	1	0.415875009052748
up	DNM1L; SLC24A1; RAMP1; RAMP2; FYN; SLC3A2; VDR; RYR1; PLN; SRI; GJA4; CACNB3; ATP2C1; CAV1; PPP3CA; PKD2; ITPR1; GRIN3A; SARAF; PANX1; CAMK2A; CACNA1C; PSEN1;	GO:0006816~calcium ion transport	23	74	31.0810810810811	0.008152451808221	0.0426361324962126	1	1	1	1	0.415875009052748
up	NFIB; RAB29; PPM1D; CFLAR; SNX3; LY6G6C; PYGL; FABP4; MLH1; ST13; GPC3; CAV1; CD47; FKBP5; FER1L6; OCIAD2; CCDC80; CEP192; KLHL6; HMCN1; RNF5; FUCA2; SLC17A5; ERAP1; CHD7; BAIAP2; LSM5;	GO:0009617~response to bacterium	27	92	29.3478260869565	0.00820339263617698	0.0428793550226115	1	1	1	1	0.418247413969564
up	DLL1; RAMP2; LRP5; SOD1; AGT; ATP1A1; COL1A2; ACE; GNB3; ATP2B1; NPR2; PTGS1; CD34; ACVRL1; ATP1A2; ACTA2; AGTRAP; P2RX4; ERAP1; NISCH;	GO:0008217~regulation of blood pressure	20	61	32.7868852459016	0.00825736655265097	0.0431381602183333	1	1	1	1	0.420771813037027
up	XRCC1; LIG4; ERCC8; APTX; APLF; SIRT1; TDP1;	GO:0000012~single strand break repair	7	11	63.6363636363636	0.00868161257094913	0.0440124984005667	1	1	1	1	0.429300152221727
up	ASS1; ASL; CPS1; CEBPA; NAGS; NMRAL1; SLC25A15;	GO:0000050~urea cycle	7	11	63.6363636363636	0.00868161257094913	0.0440124984005667	1	1	1	1	0.429300152221727
up	SETMAR; MUS81; REXO4; EXOG; ENDOG; DNASE1L3; DNASE1L1;	GO:0000737~DNA catabolic process, endonucleolytic	7	11	63.6363636363636	0.00868161257094913	0.0440124984005667	1	1	1	1	0.429300152221727
up	LDOC1; NR2F2; PRDX3; AKT1; BMPR2; TMED2; DAZAP1;	GO:0001893~maternal placenta development	7	11	63.6363636363636	0.00868161257094913	0.0440124984005667	1	1	1	1	0.429300152221727
up	MTHFD1; PRPS1; PPAT; PRPS2; PRPSAP2; GART; PRPSAP1;	GO:0006164~purine nucleotide biosynthetic process	7	11	63.6363636363636	0.00868161257094913	0.0440124984005667	1	1	1	1	0.429300152221727
up	NME4; NME6; NME1; NME2; NME3; NME7; IMPDH2;	GO:0006183~GTP biosynthetic process	7	11	63.6363636363636	0.00868161257094913	0.0440124984005667	1	1	1	1	0.429300152221727
up	ATG7; ABCA1; PIK3C3; WDR45B; WIPI1; WDR45; WIPI2;	GO:0006497~protein lipidation	7	11	63.6363636363636	0.00868161257094913	0.0440124984005667	1	1	1	1	0.429300152221727
up	ACACB; PRKAB2; SLC25A20; CPT2; CPT1A; ACACA; MID1IP1;	GO:0006853~carnitine shuttle	7	11	63.6363636363636	0.00868161257094913	0.0440124984005667	1	1	1	1	0.429300152221727
up	MAN2B1; HEXB; GM2A; NEU1; MAN2C1; NEU3; MAN2B2;	GO:0009313~oligosaccharide catabolic process	7	11	63.6363636363636	0.00868161257094913	0.0440124984005667	1	1	1	1	0.429300152221727
up	TPR; IFNAR1; GATA3; AXL; GAS6; PYHIN1; PDE12;	GO:0035457~cellular response to interferon-alpha	7	11	63.6363636363636	0.00868161257094913	0.0440124984005667	1	1	1	1	0.429300152221727
up	SRI; PKD2; TONSL; MDFI; NFKBIL1; KEAP1; SUFU;	GO:0042994~cytoplasmic sequestering of transcription factor	7	11	63.6363636363636	0.00868161257094913	0.0440124984005667	1	1	1	1	0.429300152221727
up	TK2; TK1; DCK; PUDP; UCK2; UCK1; UCKL1;	GO:0043097~pyrimidine nucleoside salvage	7	11	63.6363636363636	0.00868161257094913	0.0440124984005667	1	1	1	1	0.429300152221727
up	COL1A1; COL1A2; SRF; ITGB4; ITGA6; PSEN1; TP63;	GO:0043589~skin morphogenesis	7	11	63.6363636363636	0.00868161257094913	0.0440124984005667	1	1	1	1	0.429300152221727
up	KDM6B; ITGB1; INHBA; ITGB4; FGFR2; ITGA3; HMGA2;	GO:0048333~mesodermal cell differentiation	7	11	63.6363636363636	0.00868161257094913	0.0440124984005667	1	1	1	1	0.429300152221727
up	KLK8; LRIG2; PTPRS; CERS2; KREMEN1; RTN4R; INPP5F;	GO:0048681~negative regulation of axon regeneration	7	11	63.6363636363636	0.00868161257094913	0.0440124984005667	1	1	1	1	0.429300152221727
up	BIN1; SERPINE2; LIF; IL6ST; NOTCH1; CLCF1; PRPF19;	GO:0048711~positive regulation of astrocyte differentiation	7	11	63.6363636363636	0.00868161257094913	0.0440124984005667	1	1	1	1	0.429300152221727
up	APP; PPT1; SYNGAP1; SLC17A7; DNM3; DNM2; DNM1;	GO:0050803~regulation of synapse structure or activity	7	11	63.6363636363636	0.00868161257094913	0.0440124984005667	1	1	1	1	0.429300152221727
up	CRLF1; JAK1; CANX; TYK2; IL6ST; STAT3; IL27RA;	GO:0070106~interleukin-27-mediated signaling pathway	7	11	63.6363636363636	0.00868161257094913	0.0440124984005667	1	1	1	1	0.429300152221727
up	SLC9A1; FOXO1; DNAJC3; NFE2L1; RNF34; EIF2AK3; EIF2AK4;	GO:0070417~cellular response to cold	7	11	63.6363636363636	0.00868161257094913	0.0440124984005667	1	1	1	1	0.429300152221727
up	JAK1; CANX; IL6ST; STAT3; STAT4; IL27RA; IL12RB2;	GO:0070757~interleukin-35-mediated signaling pathway	7	11	63.6363636363636	0.00868161257094913	0.0440124984005667	1	1	1	1	0.429300152221727
up	CD81; TMEM30B; TM9SF4; TMEM30A; SAR1B; SEC16A; SAR1A;	GO:0070863~positive regulation of protein exit from endoplasmic reticulum	7	11	63.6363636363636	0.00868161257094913	0.0440124984005667	1	1	1	1	0.429300152221727
up	EGFR; TGFB1; TP53; BMP4; DDX5; MAP2K2; RIPK1;	GO:1903800~positive regulation of production of miRNAs involved in gene silencing by miRNA	7	11	63.6363636363636	0.00868161257094913	0.0440124984005667	1	1	1	1	0.429300152221727
up	SPINT2; BTG2; ILK; RAPGEF1; LIMS2; APPL2; KDM2B;	GO:2000178~negative regulation of neural precursor cell proliferation	7	11	63.6363636363636	0.00868161257094913	0.0440124984005667	1	1	1	1	0.429300152221727
up	WDR1; ACE; ADAM17; KMT2E; JAGN1; IRAK4;	GO:0002446~neutrophil mediated immunity	6	8	75	0.00873877941355616	0.0440124984005667	1	1	1	1	0.429300152221727
up	FH; MDH2; ME3; MDH1; ME2; MDH1B;	GO:0006108~malate metabolic process	6	8	75	0.00873877941355616	0.0440124984005667	1	1	1	1	0.429300152221727
up	RNASE4; POLR2I; CSTF3; ZNRD1; CPSF2; CPSF3;	GO:0006379~mRNA cleavage	6	8	75	0.00873877941355616	0.0440124984005667	1	1	1	1	0.429300152221727
up	SRP54; TRAM2; TRAM1; SEC61B; SEC61A2; SEC61A1;	GO:0006616~SRP-dependent cotranslational protein targeting to membrane, translocation	6	8	75	0.00873877941355616	0.0440124984005667	1	1	1	1	0.429300152221727
up	PLPP1; PLPP2; SGPP2; SGPP1; SPHK2; SPHK1;	GO:0006670~sphingosine metabolic process	6	8	75	0.00873877941355616	0.0440124984005667	1	1	1	1	0.429300152221727
up	DNAJC24; DPH3; DPH2; DPH7; DPH1; DPH5;	GO:0017183~peptidyl-diphthamide biosynthetic process from peptidyl-histidine	6	8	75	0.00873877941355616	0.0440124984005667	1	1	1	1	0.429300152221727
up	HSP90AA1; HSP90AB1; PTK2; NDEL1; ARHGAP35; B4GALT6;	GO:0021955~central nervous system neuron axonogenesis	6	8	75	0.00873877941355616	0.0440124984005667	1	1	1	1	0.429300152221727
up	PDLIM1; ARPC5; SLC9A1; GSK3B; DST; DLG5;	GO:0030011~maintenance of cell polarity	6	8	75	0.00873877941355616	0.0440124984005667	1	1	1	1	0.429300152221727
up	CAPN2; MAPKAPK2; SIRPA; CD47; CXorf40A; TREM2;	GO:0032675~regulation of interleukin-6 production	6	8	75	0.00873877941355616	0.0440124984005667	1	1	1	1	0.429300152221727
up	CCND1; IQGAP3; RREB1; ZNF703; RTN4; MST1;	GO:0033601~positive regulation of mammary gland epithelial cell proliferation	6	8	75	0.00873877941355616	0.0440124984005667	1	1	1	1	0.429300152221727
up	LETM1; MAT2A; LRRC8A; LRRC8C; YME1L1; SPAST;	GO:0034214~protein hexamerization	6	8	75	0.00873877941355616	0.0440124984005667	1	1	1	1	0.429300152221727
up	CTCF; MYOCD; PARK7; PYGO2; SETD5; EID1;	GO:0035065~regulation of histone acetylation	6	8	75	0.00873877941355616	0.0440124984005667	1	1	1	1	0.429300152221727
up	CDH1; SRC; CBL; CTNNB1; GRB2; CBLL1;	GO:0035635~entry of bacterium into host cell	6	8	75	0.00873877941355616	0.0440124984005667	1	1	1	1	0.429300152221727
up	PLXNB1; RYR1; THBS3; RHOA; FAT4; DCHS1;	GO:0043931~ossification involved in bone maturation	6	8	75	0.00873877941355616	0.0440124984005667	1	1	1	1	0.429300152221727
up	TIMM10; AGK; NDUFA13; TIMM22; TIMM9; TIMM13;	GO:0045039~protein insertion into mitochondrial inner membrane	6	8	75	0.00873877941355616	0.0440124984005667	1	1	1	1	0.429300152221727
up	CHEK1; NME6; TOM1L1; BMP4; MTBP; AURKAIP1;	GO:0045839~negative regulation of mitotic nuclear division	6	8	75	0.00873877941355616	0.0440124984005667	1	1	1	1	0.429300152221727
up	TPR; PTPN11; PTPN14; UHMK1; XPO1; XPO5;	GO:0046825~regulation of protein export from nucleus	6	8	75	0.00873877941355616	0.0440124984005667	1	1	1	1	0.429300152221727
up	NCBP2; KHDRBS1; DHX9; CPSF6; NRDE2; RBM26;	GO:0046833~positive regulation of RNA export from nucleus	6	8	75	0.00873877941355616	0.0440124984005667	1	1	1	1	0.429300152221727
up	GATA3; PYGO2; PIH1D1; KMT2B; CTR9; ZNF335;	GO:0051569~regulation of histone H3-K4 methylation	6	8	75	0.00873877941355616	0.0440124984005667	1	1	1	1	0.429300152221727
up	MFN2; BRAT1; MARK2; MFN1; MUL1; HDAC6;	GO:0051646~mitochondrion localization	6	8	75	0.00873877941355616	0.0440124984005667	1	1	1	1	0.429300152221727
up	NRDC; FURIN; PSMA3; HDAC1; ABCA2; ATP13A2;	GO:0052548~regulation of endopeptidase activity	6	8	75	0.00873877941355616	0.0440124984005667	1	1	1	1	0.429300152221727
up	WNT10B; COL1A1; MMP2; FBN2; THBS3; PPARGC1B;	GO:0060346~bone trabecula formation	6	8	75	0.00873877941355616	0.0440124984005667	1	1	1	1	0.429300152221727
up	ZFP36L1; FBXW8; ASCL2; SENP2; BIRC6; ZFAT;	GO:0060712~spongiotrophoblast layer development	6	8	75	0.00873877941355616	0.0440124984005667	1	1	1	1	0.429300152221727
up	KLF4; ETS1; FOSL1; DDX5; RELA; SMAD4;	GO:0061614~pri-miRNA transcription by RNA polymerase II	6	8	75	0.00873877941355616	0.0440124984005667	1	1	1	1	0.429300152221727
up	BLM; TERF1; WRN; TERF2; SLX4; POT1;	GO:0061820~telomeric D-loop disassembly	6	8	75	0.00873877941355616	0.0440124984005667	1	1	1	1	0.429300152221727
up	SHMT2; LRPPRC; ALKBH1; TACO1; MTG1; MTG2;	GO:0070129~regulation of mitochondrial translation	6	8	75	0.00873877941355616	0.0440124984005667	1	1	1	1	0.429300152221727
up	SNAI1; HP1BP3; SETD7; LOXL2; SETDB2; SETDB1;	GO:0070828~heterochromatin organization	6	8	75	0.00873877941355616	0.0440124984005667	1	1	1	1	0.429300152221727
up	SGF29; PIH1D1; H2AFY2; LRWD1; RUVBL2; NIPBL;	GO:0071169~establishment of protein localization to chromatin	6	8	75	0.00873877941355616	0.0440124984005667	1	1	1	1	0.429300152221727
up	RAF1; TNFRSF1A; TRAF2; FADD; RIPK1; TRADD;	GO:0071550~death-inducing signaling complex assembly	6	8	75	0.00873877941355616	0.0440124984005667	1	1	1	1	0.429300152221727
up	BRCA1; RNF4; UBE2S; BARD1; UBE2T; RNF6;	GO:0085020~protein K6-linked ubiquitination	6	8	75	0.00873877941355616	0.0440124984005667	1	1	1	1	0.429300152221727
