DGE	Genes	Process~name	num_of_Genes	gene_group	percentage%	P-value	Benjamini and Hochberg (FDR)	 Hommel singlewise process	Bonferroni single-step process	Hommel singlewise process	Hochberg step-up process	Benjamini and Yekutieli
up	SIRPB1; DOK2; LILRA1; LILRB3; TSPAN12; IGSF6; EGFR; F2; PRL; IFNG; IL2RA; CD3D; ASGR2; CD3E; CD14; CD3G; IFITM1; EDN3; CXCR2; FPR2; CD27; BDKRB2; CDA; LIFR; GLP1R; CXCR3; CCR5; PTH1R; ADGRE1; LY6E; ADGRD1; ADGRG3; LILRB2; NFAM1; TNFRSF14; KLRG1; P2RX7; ADGRE3; ADGRL3; MKNK2; CLEC1B; SIGLEC9; LY96; TRBV24-1; TRBV19; TRBV6-6; TRBV5-1; CD80; TRBV6-1; TRBV7-1; TRBV27; TRBV6-8; TRBV17; TRBV5-5; TRBV3-1; TRBV2; TRBV13; TRBV28; TRBV6-2; TRBV25-1; TRBV7-2; TRBV4-1; TRBV11-3; TRBV7-6; TRBV29-1; TRBV10-1; TRBV7-7; TRBV14; TRBV15; TRBV5-7; TRBV30; TRBV6-7; TRBV4-2; TRBV20-1; TRBV7-4; TRBV12-5; TRBV6-5; TRBV12-4; TRBV5-6; TRBV16; TRBV23-1; TRBV5-4; TRBV9; TRBV12-3; TRBV18; TRBV7-9; TRBV11-2; TRBV10-3;	GO:0007166~cell surface receptor signaling pathway	88	268	32.8358208955224	0	0	0	0	0	0	0
up	SIRPB1; SDCBP; RNASET2; FCN1; MGAM; SYNGR1; TYROBP; GMFG; LILRB3; PGLYRP1; TRPM2; HP; SERPINA1; LRG1; PPBP; LTF; CAT; ITGB2; MPO; MME; CD14; FGR; ALOX5; RNASE2; MGST1; ITGAM; FCGR2A; CYBA; SELL; MMP9; ANPEP; CD36; HSPA6; CD53; ORM2; CD33; TNFRSF1B; ITGAL; ITGAX; FPR1; FCAR; PRTN3; CXCR2; FPR2; PTAFR; CTSS; PTX3; CFP; GCA; PTPN6; FCER1G; CEACAM8; CDA; MNDA; FOLR3; ALDH3B1; SLC11A1; CAMP; P2RX1; HK3; NCKAP1L; GSDMD; SNAP25; B2M; HBB; ADAM8; S100A12; SIGLEC14; BST1; BST2; PLD1; QPCT; CLEC12A; OLFM4; UNC13D; DOK3; ADGRG3; TBC1D10C; OSCAR; LILRB2; NFAM1; PLEKHO2; ATP8B4; CLEC4C; CLEC4D; ARHGAP45; PTPRN2; RAB37; HVCN1; ADGRE3; METTL7A; MMP25; CD300A; PYCARD; SIGLEC9;	GO:0043312~neutrophil degranulation	95	483	19.6687370600414	0	0	0	0	0	0	0
down	PPP1R12A; ENSA; SSNA1; PPP1R12B; OFD1; DCTN3; CDK14; PCNT; LATS1; TUBB; HSP90AA1; CALM3; CCNB1; PRKACA; CCNA2; TUBG1; CDK2; PPP2R1A; WEE1; CETN2; CDKN2B; PAFAH1B1; NES; CSNK1D; CSNK1E; DNM2; CDK7; CCNH; MNAT1; PLK1; ARPP19; ACTR1A; YWHAG; PPP1CB; YWHAE; PPP2R2A; DYNLL1; SKP1; TUBA4A; TUBB4B; KHDRBS1; DYNC1I2; DCTN2; CUL1; CKAP5; DCTN1; DYNC1H1; PCM1; MAPRE1; TPD52L1; ODF2; CEP78; HAUS3; TAF2; TUBA1A; HAUS6; KDM8; CCNY; CEP70; NEDD1; ALMS1; BRSK1; OPTN; MASTL; AJUBA; CDK5RAP2; PKMYT1; HAUS7; AKAP9; CEP250; PLK3; CENPJ; HAUS2; CEP72; LCMT1; FBXL7; FBXW11; CEP164; BTRC; PPME1; FBXL22; FBXL3; FBXL12; FBXL18;	GO:0000086~G2/M transition of mitotic cell cycle	84	133	63.1578947368421	0	0	0	0	0	0	0
down	NRP2; SRPX2; RAMP1; FGF18; ANG; PDGFA; THY1; SERPINE1; FGF1; ITGAV; ANXA2; MMP2; COL4A2; ITGA5; FGFR1; SCG2; CEACAM1; VEGFA; XBP1; EPHA1; COL8A2; ACKR3; COL8A1; EPHB2; SHC1; RORA; MYH9; SOX18; GJA5; COL15A1; PIK3CA; MCAM; MEOX2; VAV2; EPHB3; PKNOX1; PROK1; PTEN; HAND2; ACTG1; SRPK2; HSPG2; RBPJ; MFGE8; FAP; AIMP1; FOXC1; AAMP; KLF5; PRKD1; SHB; MED1; ECM1; HIF1A; ZC3H12A; RASIP1; DAB2IP; CSPG4; CXCL17; VASH1; ADM2; FMNL3; UNC5B; AGGF1; MYDGF; NUS1; SIRT1; CIB1; JAM3; NAA15; SETD2; PDCL3; FZD8; POFUT1; RHOJ; CCDC134; ZNF304; C1GALT1; TMEM100; UBP1; EIF2AK3; APLN; HIF3A; HEY1; WASF2; AMOTL2; AMOTL1; PGF; CLIC4; COL18A1; TIE1; ACVR1; TBX4;	GO:0001525~angiogenesis	93	230	40.4347826086956	0	0	0	0	0	0	0
down	E2F3; POLR2D; MED24; MED26; NR3C1; RARA; NR2F6; VDR; ESRRA; NR2C1; GTF2F2; CCNB1; TCF4; ERCC2; POLR2C; POLR2E; ERCC3; NR1D1; TAF1; CCNC; POLR2A; TEAD1; RXRB; GTF2E1; GTF2E2; POLR2B; GTF2H1; RORA; POLR2I; YAP1; NR2C2; CDK8; TAF6; CDK7; CDK9; MECP2; CCNH; MNAT1; POLR2H; POLR2J; GTF2A1; GTF2A2; POLR2K; NR1H2; PTEN; POLR2F; POLR2G; GTF2B; ZNF45; PPARD; NOTCH2; RBPJ; PPARA; TAF10; TRIM28; SNW1; GTF2H3; TAF5; TAF13; TAF7; TEAD4; MED1; TAF12; TAF9; TAF3; TAF2; MED27; NR2C2AP; MAML1; TAF4B; CREBBP; TAF15; KAT2B; NRBF2; MED8; MED15; TBX5; TEAD3; MED10; WWTR1; MED20; MED4; MED17; MED13; NRBP1; MED23; NOTCH3; THRAP3; MED16;	GO:0006367~transcription initiation from RNA polymerase II promoter	89	161	55.2795031055901	0	0	0	0	0	0	0
down	SUPT5H; POLR2D; CCNK; GTF2F2; ERCC2; NELFE; POLR2C; POLR2E; ERCC3; TCEA1; POLR2A; POLR2B; GTF2H1; POLR2I; CDK7; CDK9; CCNH; MNAT1; NCBP2; POLR2H; POLR2J; POLR2K; ELL; POLR2F; POLR2G; MLLT1; SSRP1; NCBP1; GTF2H3; ADRM1; CDC73; CTR9; SUPT6H; NELFCD; PAF1; LEO1; NELFB; RTF1; EAF1; IWS1; SETD2; WDR61; AFF4; CTDP1; SUPT16H; ELOF1; CDK13; PBRM1;	GO:0006368~transcription elongation from RNA polymerase II promoter	48	71	67.6056338028169	0	0	0	0	0	0	0
down	EIF3F; DDX3X; EIF3D; EIF3H; EIF4G3; EIF4E2; EIF1B; EIF5B; EIF3G; EIF3J; RPLP1; RPLP2; RPLP0; RPS17; RPSA; RPL7; RPL17; EIF2S2; RPS3; EIF4B; RPS12; RPL10; RPL12; RPL9; RPL22; RPL4; EIF2S3; EIF1; RPL27A; RPL5; RPL28; RPS9; RPS5; EIF1AX; RPL29; RPL34; RPL14; EIF3B; EIF6; EIF4A1; RPL15; RPL27; RPL37A; RPL37; RPS8; RPS15A; RPS14; RPS18; RPS13; RPS11; RPL7A; RPS4X; RPS6; RPL23; RPS24; RPS25; RPS26; RPL30; RPL31; RPL10A; RPL32; RPL11; RPL8; RPS27A; UBA52; RPL38; EIF4G2; RPL24; RPL36A; RPL19; RPL6; EIF4G1; RPL18; EIF2B5; EIF3I; EIF3A; EIF4H; LARP1; EIF3M; COPS5; EIF3C; EIF2A; PAIP1; DHX33; EIF2B3; EIF3K; EIF2B4; EIF3L; ABCE1;	GO:0006413~translational initiation	89	130	68.4615384615385	0	0	0	0	0	0	0
down	PFDN6; PFDN1; DNAJB6; MPDU1; RP2; RGS9; CLPX; FKBP9; BAG4; BAG2; BAG3; CRYAB; GNAI3; HSPA8; PRKCSH; GNB3; NPPB; TCP1; ATF6; GNAT2; CALR; CANX; PDIA3; DNAJA1; CCT6A; CCT5; LMAN1; CCT3; RANBP2; ST13; CCT8; CCT4; RAD23B; VCP; VBP1; PSMC1; GNB1; GNB2; PPIA; CSNK2B; CSNK2A1; CCT2; FKBP4; PPIL2; PDCL; MOGS; NFYC; MLEC; PDIA5; GANAB; PDIA6; P3H1; DNAJC21; CWC27; ERO1B; DNAJA3; ERO1A; DNAJC1; TTC1; DNAJC7; CCT7; ERP44; DERL1; ALG12; LMAN2L; SIL1; GNB4; GRPEL1; PDRG1; SPHK1; SACS; HSPBP1; DNAJB11; PFDN2; AMFR; BAG5; RUVBL2; PPIL1; NUDC; TRAP1; DNAJC25; HSP90B1; CDC37; QSOX2; HSP90AA2P; P4HB; HSP90AA1; HSP90AB1; PDIA4; HSP90AB3P; PTGES3; CDC37L1;	GO:0006457~protein folding	92	150	61.3333333333333	0	0	0	0	0	0	0
down	STK25; ADAM10; RIOK3; BCKDK; CASK; GAK; CHUK; PDPK1; MAP3K13; DAPK3; DYRK3; KALRN; NUAK1; BRD4; ULK1; ERN1; PRKRA; RPS6KA4; CCNK; TRIO; STK10; PRKD3; MAP3K6; OXSR1; LATS1; ABL1; TGFB1; RAF1; ERBB2; APP; ROS1; RARA; BCR; ERG; PIM1; FGFR1; PSKH1; PHKG2; FER; PRKACA; IGFBP3; ERCC2; ERCC3; TAF1; CFL1; PRKCH; CCNE1; CDK2; MARK3; MAPK1; AKT1; GRK4; RYK; BMPR1A; TGFBR1; CCNF; PIK3CA; MTOR; MAPK8; MAPK9; CSNK1A1; CSNK1D; MAPKAPK2; CSNK1E; CLK2; CLK3; GSK3B; STK19; RASSF2; CDK9; IRAK1; CCL11; MNAT1; PLK1; LIMK1; LIMK2; SIK1; RIPK4; GMFB; TGFB2; CSNK2A1; SRPK2; CSNK1G2; CCNA1; PRKDC; MAP3K9; CDK5; ACVR1; DMPK; ST3GAL1; AKAP13; MERTK; ILF3; PRKAA1; STK3; PTK7; ATM; CTBP1; ILK; ROCK1; CAMK2G; DYRK1A; PTK6; MORC3; FASTK; GAS6; FASTKD3; PRKD1; STK38; MYLK; SPEG; PKN1; PKN2; MAPK6; PLK5; FASTKD1; CDC42BPA; MAST2; SCYL2; MEX3B; MARK2; TAOK1; FASTKD5; ADM2; ADCK2; TLK2; VRK2; HIPK1; CAMK1D; LMTK2; FAM20C; STK40; CAMKK1; PIK3C3; BRSK1; STK35; PPP4R1; NPRL2; TRIB2; MAML1; DYRK2; TBRG4; RSRC1; NEK1; LMTK3; CAMKK2; RPS6KC1; TP53RK; PPP1R9B; SRPK1; PIK3R4; COPS8; PKMYT1; VRK1; RIOK1; EIF2A; HIPK3; WNK1; PLK3; BIRC6; PICK1; LATS2; PLK2; FASTKD2; EIF2AK3; FNIP2; STK26; EIF2AK4; STK39; HSPB8; CAMK2A; AKT3; STK38L; MAP3K2; MAP4K5; CDC42BPB; BMPR2; PHKA2; HUNK; RPS6KB2; CDK13; CHEK1; CDK12; PRPF4B; RPS6KB1; ACVR2A; RPS6KA3; PHKB; CDK14; CDK7; NRBP1; CDK16; CDK3; CDK17; RPS6KA2; FAM20B; NRBP2; CDKL5; PEAK1; CDK8;	GO:0006468~protein phosphorylation	200	482	41.49377593361	0	0	0	0	0	0	0
down	ARNTL; E2F3; IPO13; AGT; LMNA; TP53; TPR; AKT1; MMP12; STAT3; PTTG1IP; NUTF2; RAN; PPP3CA; MBTPS1; KPNB1; MED1; ELAVL1; RPAIN; TNPO1; PRICKLE1; IPO9; PPP1R10; RANBP17; APPL1; TNPO3; NUP85; NUP88; NUP133; NUP188; FAM53A; POM121C; NXT1; NUP155; TNPO2; IPO8; NUP98; NUP62; SPRN; FAM53C; RANBP6; NUP50; NXT2; HEATR3; NUP93; NUP153; IPO11; IPO5; POM121; IPO7;	GO:0006606~protein import into nucleus	50	79	63.2911392405063	0	0	0	0	0	0	0
down	NBAS; COPE; KIF3C; KIF3B; RER1; SURF4; ZW10; KDELR3; KIF1C; SEC22B; ARF4; KDELR1; KDELR2; COPB2; HTT; NSF; PITPNB; TMED10; COPB1; COPA; NAPA; ARF3; COPZ1; RAB1A; COG7; ARF5; KLC1; TMEM115; LMAN2; BNIP1; KIF22; TMED2; ARFGAP2; ARFGAP1; BICD2; SCFD1; GBF1; KIFAP3; COG3; SCYL1; ERGIC2; TMED9; KLC2; RAB1B; ARFGAP3; PICK1; RAB6B; COPZ2; STX18; TMED7; TMED3; COPG1; ATP9B; ATP9A; GOLPH3; ERGIC3;	GO:0006890~retrograde vesicle-mediated transport, Golgi to endoplasmic reticulum	56	85	65.8823529411765	0	0	0	0	0	0	0
down	ESYT2; SSC5D; PIK3C2A; NPC1; INPPL1; TOM1; LRP5; EPN2; ZFYVE9; AP2A1; ABL1; HRAS; LDLR; VTN; APP; NME1; RAB5A; ENDOU; ENPP1; PIK3CB; DNM2; RAB7A; APLP1; PRSS12; RAB1A; DNM1; LGALS3BP; MYO1E; PICALM; ENPP2; BECN1; CLINT1; GAPVD1; EEA1; RABEP1; MIA3; FKBP15; LRP10; MICALL1; EHBP1; STEAP2; SSC4D; RUBCN; PRG4; SH3KBP1; HOOK2; SCARF2; LOXL4; HHIPL1; PGBD1; MTMR9; SNX18; FNBP1; CYTH2; SORT1; SH3GL3; EHD1; RABEP2; TMPRSS4; EHD2; SH3BP4; ANKFY1; EPS15L1; MRC2; ATP6V1H; RABGEF1; MYO6; MTMR6; USP20; LOXL2; LRP12; EPN1; WASF2; HEATR5A; ATP9B; ATP9A; RAB34; RHOJ; TIGD5; WIPF3; MIB1; RALBP1; RHOV; WIPF2; PIK3C3; CDC42; DENND1B; HEATR5B;	GO:0006897~endocytosis	88	174	50.5747126436782	0	0	0	0	0	0	0
down	PANO1; TNFRSF10A; HIP1; TNFRSF11B; EI24; APAF1; MAP2K7; PDCD5; CHEK1; AREL1; AXIN1; ALOX15B; SIAH2; DAPK3; RIPK2; TRIAP1; RAD21; OPA1; KIF1B; GREM1; GADD45B; PPP1R15A; PSMD10; SMNDC1; MFN2; UNC5C; RTN3; GADD45G; GJB6; AIFM1; PAK4; CST3; RAF1; NR3C1; S100A8; S100A9; LGALS1; PARP1; RALB; PIM1; GJA1; IGFBP3; ERCC2; ERCC3; NFKB1; MX1; VDAC1; RPS3; RPS6KB1; MAPK1; PRDX5; PRDX3; PPP2R1A; TGFBR1; CEACAM6; IFI27; CASP3; HTT; BAG6; IER3; ARRB1; COMP; TAF6; DAP; BCAP31; APLP1; RPS6KA3; CASP7; PTEN; PSME3; DAD1; POLR2G; DYNLL1; EIF5A; RACK1; PPP2CA; CSNK2A1; MAP3K9; DAB2; TIAL1; MAP3K10; RASSF7; KMT2A; PPARD; NOTCH2; C1QBP; EP300; AIMP1; TAF10; BNIP1; BNIP2; BNIP3; AIMP2; FADD; STK3; BIK; ROCK1; RIPK1; PMAIP1; TNFAIP1; C1D; DOCK1; GAS6; BECN1; RRP1B; MFSD10; MEF2D; ARL6IP1; PEA15; PRKD1; RABEP1; DHCR24; SHB; PDCD2; PKN2; BAK1; PHLDA2; ZC3H12A; EMC4; C3orf38; KANK2; MAP1S; CIAPIN1; ZFAND6; XAF1; JADE1; GDF6; TMEM214; TRAF7; SHC4; DPP8; RRAGA; G2E3; SHF; C6orf120; SH3RF1; ATG4D; TAX1BP1; PACS2; THOC6; SULF1; CCAR1; UNC5B; RYBP; PCSK9; TNIP2; RHBDD1; PPP1R13L; BCL7C; CKAP2; CTNNBL1; DPF2; RFK; MYDGF; RNF34; MUL1; ZDHHC16; SH3KBP1; IFI27L1; BIRC7; APIP; PAWR; ITCH; ELMO2; CLPTM1L; GSDMA; DLC1; CSRNP1; RMDN3; CIB1; BCL7B; MIEN1; RTKN; TCHP; TRAF4; FAIM2; CADM1; API5; NLRP1; PEG3; CSRNP2; ATG5; MAGEH1; SLK; PDCL3; IFI27L2; CDIP1; GHITM; HIPK3; PLK3; EGLN3; SUDS3; UBE2Z; CAAP1; EVA1A; BCL2L12; TRIM39; BRMS1; S100A14; SRA1; RTN4; AVEN; BIRC6; GLRX2; C19orf12; FAIM; RNF216; SLTM; BCLAF1; MTCH1; BFAR; STK26; UXT; TNFRSF10D; MTFP1; SAP30BP; PUF60; DDX41; FEM1B; TAOK2; BOK; FAF1; TRIM35; NOD1; PRELID1; ZNF443; NCKAP1; HIF3A; KCNIP3; SH3GLB1; PTRH2; NOC2L; FAM32A; ATCAY; DDIT4; FIS1; PRUNE2;	GO:0006915~apoptotic process	237	552	42.9347826086957	0	0	0	0	0	0	0
down	STXBP3; PITPNM1; KCNK3; SNPH; GRIN2D; PHGDH; NDUFS4; TSPAN2; TULP3; UNC5C; ACSL3; BAG3; MBD3; CST3; GNAI3; ATXN1L; BCR; XRCC6; XRCC5; SNRPB; ARF4; CD9; PTPRG; AK4; MTOR; BAG6; PPP3CC; NES; RGS4; ITGA8; NAPA; FOXG1; OXCT1; UFM1; PRKDC; HSPG2; HMGCS1; UBE3A; FPGS; PTPN11; DLX2; PPP3CA; BPTF; ATM; BMPR2; COX17; WRN; RAB3GAP1; MED1; ITSN1; BAK1; C2CD3; GJC2; HES5; MAP1S; NIPBL; BBS7; MFSD2A; SPATA5; DMBX1; BCL2L2; DNAJC30; CIC; CDK5RAP2; SLC38A3; ROGDI; SHARPIN; ARL6; SMG9; SLC6A17; CHD8; ABCB6; RAB18; UTP3; SPHK2; TBC1D23; DDIT4; SPHK1; IFT172; SHROOM4; BOK; BAIAP2; UFC1; IRS2; KLHL17; AMIGO2; ZFHX3; PAFAH1B2; CDH2; ADGRL2; SYNJ2;	GO:0007420~brain development	91	217	41.9354838709677	0	0	0	0	0	0	0
down	MICAL2; MBD3; TGFB1; COL3A1; RAF1; ERBB2; EDN1; GLI2; PSKH1; SRF; PCNA; GYS1; GJA1; PTN; ERBB3; GRK2; EDNRA; CAD; SHC1; GNA11; OXTR; SRI; FBN1; TGFBR1; CASP3; OXCT1; PTEN; HAND2; TGFB2; CXADR; PRKDC; PKD1; ID3; PPARD; PTPN11; SOX4; PPARA; EP300; AP1B1; AKAP13; FOXF1; FOXC1; FOXL1; ATM; PKD2; CACNA1C; COX17; JMJD6; BCOR; ADIPOR2; BVES; RB1CC1; KAT2B; ZDHHC16; TBC1D32; TBX5; FOXC2; PKP2; STRA6; WDR11; SMG9; MIXL1; POFUT1; SENP2; SMYD2; MBD2; HSPB7; MBD1; HSPB11; PDLIM5; CACYBP; ZFPM2; PDLIM1; ACVR1; PDLIM3; ZFPM1; PDLIM4; HEG1; NIPBL; PDLIM2; POPDC3; PDLIM7;	GO:0007507~heart development	82	190	43.1578947368421	0	0	0	0	0	0	0
down	SAP18; MPHOSPH10; LSM1; DHX15; RBFOX2; PRPF3; DHX16; SYNCRIP; ZPR1; SF3B1; BCAS2; PRPF6; ECD; HNRNPC; SNRPB; SON; SFPQ; PTBP1; PPP2R1A; FUS; NCBP2; SNRPF; SNRPG; SNRPD1; SNRPD2; SNRPD3; PPP2CA; SRPK2; RBM10; SRSF11; FMR1; C1QBP; SRSF4; NCBP1; PPP1R8; SF3B2; PRPF4B; THOC5; RBM39; DHX8; RRP1B; WTAP; NONO; SF3B4; SNRNP35; SRSF7; USP39; ZNF326; MBNL2; THOC7; SNRNP48; JMJD6; PRPF8; SUPT6H; THOC6; SRRM1; CLASRP; SREK1IP1; RBM15B; THOC2; RP9; ZCRB1; FAM172A; TAF15; KHSRP; SNRNP40; RSRC1; QKI; PPP1R9B; SRPK1; IWS1; SCAF11; PRPF18; DDX23; SNRNP25; RBM24; SCAF1; PRKRIP1; MBNL1; RBM28; PPP4R2; CDK12; ZMAT5; ACIN1; THRAP3; LSM4; IVNS1ABP; SMU1; SLU7; RNPS1; SART3; WBP4; MAGOH;	GO:0008380~RNA splicing	93	156	59.6153846153846	0	0	0	0	0	0	0
down	POLR2D; RBFOX2; FIBP; FGF18; FGF1; FGF2; HNRNPA1; FGFR1; FGF5; GTF2F2; POLR2C; POLR2E; FGF7; FGFR3; CBL; ANOS1; POLR2A; PTBP1; MAPK1; POLR2B; HNRNPH1; POLR2I; CRKL; IQGAP1; HNRNPM; NCBP2; POLR2H; POLR2J; HNRNPF; NDST1; POLR2K; RAB14; POLR2F; POLR2G; GRB2; TIAL1; PTPN11; NCBP1; FGFBP1; FAT4; SETX; SPRED2; KLB; FGFRL1; FRS2; KIF16B; ESRP2; FGF22; FLRT1; SHOC2;	GO:0008543~fibroblast growth factor receptor signaling pathway	50	79	63.2911392405063	0	0	0	0	0	0	0
down	ZBTB7B; INPPL1; CLDN3; KDM4A; CILP; STC2; HRAS; LDLR; TGFB1; APOE; IGF1; APP; RB1; ROS1; FGF2; ACE; MIF; CCNB1; NME1; VEGFA; ENG; NFKB1; ANXA7; TAF1; AKT1; SERPINF1; VHL; CRKL; YAP1; PSEN1; MECP2; DGKQ; WNT4; HAND2; TGFB2; RACK1; TMF1; NOTCH2; REST; PRKAA1; PICALM; HDAC1; TERF2; BAK1; OCLN; HIF1A; ZC3H12A; TIPARP; TNRC6A; SMCR8; FBXW7; CREB3L1; SIRT1; DDRGK1; VPS35; ATOH8; PARK7; GPER1; LGMN; OLFM1; CCDC3; BRIP1; ADNP; GGNBP2; AGO3; TNRC6C; SLC35C2; NDFIP2; CNOT7; NOCT; AGO1; APLN; SNX12; ZNF148; PTPN22; ZNF281; PTRH2; EMILIN1; SETDB1;	GO:0010629~negative regulation of gene expression	79	204	38.7254901960784	0	0	0	0	0	0	0
down	POM121C; IPO5; DDX3X; PSMA7; XPO1; MAP3K7; SYNGR2; SGTA; CREB3; NRP2; SYNCRIP; BRD4; NBN; RNGTT; KDM4A; ANKRD17; KHDRBS3; PRKRA; NUP155; MPDZ; RNF8; ATG12; UBR5; RTN3; SNAPIN; IPO7; AHSA1; STAU1; MMP1; TP53; HSPB1; SLC25A5; KRT18; KRT8; RB1; NPM1; ANXA2; HSP90AA1; KRT19; KRT7; HMGB1; HNRNPA1; POLA1; CALM1; HSPD1; HSPA8; TOP1; PCNA; TPR; SRC; FDPS; PSMC3; ERCC2; PLCG1; POLR2E; ERCC3; CCNA2; PSMB1; TAF1; VDAC1; HNRNPA2B1; POLR2A; ACKR3; BRD2; PSMA3; PSMA4; MSN; CANX; PSMB4; PSMB6; PSMB5; MAPK1; GTF2E1; SHC1; YWHAB; CTNNB1; TRIM23; NUP62; IFI27; STAT3; TSPAN7; RANBP1; IQGAP1; CD151; TUFM; PSMB3; PSMB2; NUP153; RANBP2; BCAP31; IRAK1; USP11; GTF2A2; MSH6; NUP98; COPB1; RAD23A; SEC13; EIF4A1; ABCE1; PSME3; HNRNPK; PPP1CA; YWHAE; RAN; RBX1; GRB2; SUMO1; DYNLL1; SKP1; RACK1; RAE1; FOXK1; GTF2B; HSF1; HNRNPU; SET; RELA; EIF4G1; UBE3A; FMR1; C1QBP; KLC1; SSRP1; VAC14; EP300; DLG1; BNIP1; BNIP3; NFX1; IK; CALCOCO2; FADD; GPS2; TRIM28; G3BP1; DYNC1I2; SF3B2; RIPK1; SNW1; CUL1; CUL4A; DYRK1A; CACNA1C; CDK13; KEAP1; MORC3; BECN1; RRP1B; CUL7; EIF4H; ZMYND11; TAF5; TRAM1; ITSN1; ZYX; NFE2L2; PKN2; DDB1; BAK1; MICA; SMU1; ZC3H12A; NUP188; UBR4; RAET1L; E4F1; RAET1G; TAPT1; CRTC3; ATF7IP; SUPT6H; SND1; EIF3M; COPS6; NUP54; WAPL; SH3RF1; NLRX1; ALYREF; PACS2; CARM1; VRK2; TICAM1; ABI1; RPTOR; NUP93; RBM15B; PDZD8; NUP35; GADD45GIP1; WDR48; DNAJB14; CHD6; NUP133; DDX1; GBF1; NUP205; CREBBP; KAT2B; UPF1; TNPO1; KAT5; USP7; CUL5; FBXW7; CREB3L1; OPTN; SIRT1; SEH1L; MCRS1; BICD1; POM121; PRMT6; VPS35; SRPK1; RBM15; SPEN; PSMB7; NUP88; MXRA8; DERL1; NUP58; NUP85; CADM1; SETD2; ULBP2; ULBP1; NLRP1; DERL2; ACBD3; CCDC86; AZI2; TMEM134; XPO5; UBN1; RNF216; UCKL1; KCTD5; DNAJB12; NDUFA13; VAPA; MDFIC; VPS29; NXF1; COPS7A; FBXW11; RCOR1; NUP50; APLN; G3BP2; USP24; BTRC; NCKAP1; AP3M1; TLN1; DCAF1; USP15; YTHDF2; SUPT16H; HCFC2; DYNC1LI1; WASF2; IVNS1ABP;	GO:0016032~viral process	264	456	57.8947368421053	0	0	0	0	0	0	0
down	SPTBN2; KALRN; ZFPL1; RTN3; NSF; RAB38; RAB10; RAB14; ACTR1A; ARF6; RAB11A; RAB1A; SPIRE1; TBC1D8B; GOLGA4; PICALM; RAB32; RABEP1; VAMP3; JAGN1; BVES; SFT2D1; YIPF2; CECR2; CHMP1A; ARFGAP3; TBC1D23; VTI1B; VPS4A; AP4E1; AP3M1; GOLT1B; MYO5A; SYT7; HSPA2; EXOC2; KIF1B; CACFD1; ARL5A; CHM; ARF5; HSPA1A; CCZ1B; HSPA13; VPS39; AP2S1; ARL1; ARF3; GDI2; TRIM23; ARL5B; AP2B1; ARF4; HSPA8; ARL4A; GDI1; AP3B1; AP3S1; TGFBRAP1; AP4B1; KIF1C; CHML; KIF1A; SPAG9; ARL6; ARF1; TVP23B; SYT12; ARL4D; AP1B1;	GO:0016192~vesicle-mediated transport	70	141	49.645390070922	0	0	0	0	0	0	0
down	VPS37C; HGS; AP5Z1; CHMP2A; TOM1; VPS4B; TMCC1; UBC; RAB10; RPS27A; UBA52; ARHGAP1; PICALM; SNX17; RAB35; KIAA1109; AP5B1; LAMTOR1; VPS37A; ALMS1; CHMP7; STAM; CHMP4C; MVB12A; CHMP6; SNF8; ALS2; SNX18; TSG101; VPS25; CHMP4A; DPY30; AP5M1; RBSN; CHMP4B; VPS37B; VTA1; ARL8B; UBAP1; CHMP5; ANKFY1; CORO1C; VPS4A; CHMP2B; CLEC16A; BLOC1S2; ZFYVE9; CALY;	GO:0016197~endosomal transport	48	83	57.8313253012048	0	0	0	0	0	0	0
down	FOXE1; ARPC5; PDPK1; NCK2; PRPF40A; PAK4; TGFB1; ANG; VTN; ITGB1; CD63; PDGFRB; PTPRF; LAMC1; FGFR1; CEACAM1; JUP; ARF4; CDH2; PLCG1; SLC9A1; COL5A1; APC; EPHA2; PIK3CB; IQGAP1; VAV2; EPHB3; EMP2; BCAR1; PTEN; TGFB2; RAB1A; SIRPA; FOXC1; PTK7; CUL3; TNFAIP1; PTK6; SCRIB; DOCK1; HES1; MAPRE1; FSCN1; CCDC88A; CDC42BPA; SYDE2; CARMIL1; SYDE1; FMNL3; MISP; PALLD; MYO18A; SH3KBP1; CTHRC1; PPP1R9B; PIP5K1A; GOLPH3; FAM83D; PEAK1; ARHGAP35; ZRANB1; TAOK2; CDC42BPB; GPC6; EMILIN1; MERTK; CD151; NEDD9; ITGBL1; CORO1C; PIK3CA; FMNL2; AXL; ITGB3; SDC1; USP34; LAMB2; ARPC5L; FSCN2; RHOJ; NDEL1; USP9X; CD248; RHOV; EFS; SDC3; FSCN3; CDC42; NCKAP1; CLEC14A; FER; RHOD; APC2; ITGB5; SDC2; PIK3C2A; RHOC;	GO:0016477~cell migration	98	225	43.5555555555556	0	0	0	0	0	0	0
down	TMEM129; UBA6; RNF103; SOCS7; SOCS6; ENC1; AREL1; TRIM24; RNF113A; PJA2; PEX10; PPP1R11; RNF40; SOCS5; PEX14; MYCBP2; KLHL18; ARIH2; HERC2; BCL10; FBXO45; UBC; PCNA; UCHL3; UBA1; CBL; AKT1; TRIM23; VHL; CCNF; USP5; NEDD4; ARRB1; PLK1; VCP; UBE2G2; CDC42; UBE2M; UBE2K; UBE2N; DCAF7; UBE2D2; RBX1; RPS27A; UBA52; UBE2B; SKP1; RACK1; UBE2L3; PRKDC; XIAP; RAB40B; CDC20; NFX1; TRIM28; MKRN4P; OS9; MED21; CUL1; CUL3; CUL4A; TNFAIP1; KEAP1; CUL7; HERPUD1; LRRC41; MED1; HERC1; UBE2V2; NEDD8; NFE2L2; DDB1; HIF1A; UBE2S; DCAF6; HECTD3; UBR4; RNF220; RNF20; RNF123; E4F1; RNF43; KCTD11; SPOPL; SDE2; CDC73; MED27; CTR9; TRAF7; KLHL17; RNF111; UBR3; NCCRP1; RRAGA; G2E3; BRAP; FBXO33; UBE2Q1; SYVN1; ZNF598; DTX2; CAND1; FBXO11; MIB1; UBR1; KLHL7; RNF168; UBE2J2; FBXW8; FBXL6; ARRDC1; LZTR1; COMMD1; PAF1; RNF214; DCAF11; TRPC4AP; RNF139; DCAF4; NSMCE1; TRIM41; LEO1; RNF138; UBE2Q2; PCNP; LMO7; SOCS4; RTF1; PEX13; USP9X; USP7; CUL5; FBXW7; RNF34; UBE2F; MUL1; UBE2W; C18orf25; SPSB1; RNF25; OTULIN; BIRC7; RSPRY1; SIRT1; TRIM11; TSPAN17; MED8; ITCH; VCPIP1; DCAF5; NEURL4; FEM1C; C10orf90; RNF145; RCHY1; UHRF2; RAB40C; CRBN; BARD1; FEM1A; UBAC1; WAC; MED10; DERL1; TRIM62; TRIM7; WDR61; WWTR1; MKRN2; BTBD1; KLHL25; WWP1; IRF2BPL; GAN; KCTD10; ASB7; UBE2Z; RNF121; MED20; MAGEF1; SMURF1; TRIM39; CCNB1IP1; BIRC6; TULP4; RAD18; DCAF13; RLIM; ASB6; ANAPC11; WSB2; KCMF1; RNF181; KLHL9; SAE1; RNF7; RNF14; PEF1; MALT1; FBXL17; KLHL21; FBXL7; MID2; FEM1B; FBXO9; FBXW11; FBXO5; FBXL3; ZNRF3; CBLC; STUB1; BTRC; KLHL20; HIF3A; UBE2D4; UBE2J1; DCAF1; HECTD4; ARIH1; ASB3; NUB1; RNF215; MGRN1; MIB2; HUWE1; CHFR; CDC27; MSL2; AMFR; DCAF15; PJA1; HECW1; RNF126; ANAPC7; RNF115; CDC23; UBR2; RNF8;	GO:0016567~protein ubiquitination	238	444	53.6036036036036	0	0	0	0	0	0	0
down	PDLIM1; SLC9A3R1; MRAS; FSCN2; ARPC5; PDPK1; PIP5K1C; DIAPH1; NPHP4; DNAJB6; FLNB; ABL1; KRAS; PDGFA; PFN1; BCR; SRF; CFL1; NF2; PAFAH1B1; CRK; CAPZB; ARFIP2; CDC42; RAC1; FGD1; SPIRE1; FLII; ROCK1; KANK1; FSCN1; INF2; KLHL17; DAAM2; PHACTR4; POF1B; PALLD; SSH1; DOCK2; ARPC1A; ARHGEF17; DLC1; CYTH2; INPP5K; PDCL3; RHOJ; SPTBN5; DIAPH3; TAOK2; SHROOM4; PACSIN2; CORO2B; DAAM1; WASF2; PDLIM2; SMTNL2; SMTN; CAPZA2; PDLIM4; SDAD1; ARFGEF3; EHBP1L1; LIMK2; PDLIM5; SPECC1L; PDLIM7; PDLIM3; MICALL1; TESK1; SHROOM1; FHL3; AMOTL2; MICAL3; AMOTL1; LIMK1; CSRP1; SPECC1; EHBP1; MICAL2; CAPZA1; CSRP2; SHROOM3; VASP; RHOV; ARHGEF10L;	GO:0030036~actin cytoskeleton organization	85	157	54.140127388535	0	0	0	0	0	0	0
down	TNFRSF11B; AGRN; MATN3; ADAM12; SPINT1; DNAJB6; COL3A1; VTN; PDGFA; APP; ITGB3; SERPINE1; ITGB1; COL5A2; ITGAV; COL1A2; COL4A2; ITGA5; FGF2; FURIN; ATXN1L; SPP1; HAPLN1; LAMC1; COL6A1; COL6A2; COL6A3; CDH1; ITGA4; B4GALT1; ELN; ERCC2; ITGB5; COL5A1; BGN; MATN1; TNC; COL8A2; COL5A3; COL8A1; FBN1; SERPINB5; ITGAE; COL18A1; COMP; LUM; ITGA8; MFAP2; LAMB2; ITGA1; ELF3; FBLN2; HSPG2; ATP7A; COL16A1; LOXL1; FOXF1; FOXF2; PRDX4; MFAP5; ITGA7; NID2; DAG1; LAMA4; DDR2; HSD17B12; COL13A1; SH3PXD2A; EGFLAM; VWA1; NPNT; CCDC80; ADAMTSL2; ERO1B; EGFL6; PXDN; APBB2; ERO1A; KAZALD1; SERAC1; JAM3; CRISPLD2; FBLN5; ITGA11; POMT1; MMP2; COL15A1; MMP23B; MMP12; MMP10; MMP1; MMP16; GFOD2; MMP15; MMP3; RECK;	GO:0030198~extracellular matrix organization	96	230	41.7391304347826	0	0	0	0	0	0	0
down	SMIM22; MYO1C; RHOD; CLDN4; ADAM10; CLDN3; DAPK3; SPRY2; ACTN4; SPAG9; DIAPH1; CLDN1; HRAS; TGFB1; PDGFA; IGF1; FGF1; EDN1; ITGB1; ITGAV; IGF1R; RHOC; ITGA5; PDGFRB; HSPA5; F3; VEGFA; FER; XBP1; NTF3; EPHA1; APC; MAPK1; AKT2; RDX; TGFBR1; COL18A1; CEACAM6; STAT3; MCAM; CD151; CCL11; BCAR1; RACK1; ACTG1; TNFAIP6; DAB2; ACVR1; TJP1; PPP3CA; MGAT5; ELP6; STX4; FOXF1; ATM; ILK; GRB7; NEDD9; ZNF268; MAPRE1; MYLK; CARMIL1; RUFY3; CCAR1; ARHGEF39; FAM89B; ELP5; SH3RF2; LRRC15; SYNE2; DDRGK1; GPER1; CIB1; MIEN1; WNT5B; ZNF703; ELP3; ZNF304; SPHK1; SUN2; CCL26; IRS2; PDGFC; SEMA4F; SEMA3E; SEMA7A;	GO:0030335~positive regulation of cell migration	86	226	38.0530973451327	0	0	0	0	0	0	0
down	PSMD11; PSMD12; PSMD14; PSMA7; PSMD3; BUB3; PSMD10; PTTG1; UBC; CCNB1; PSMC3; PSMB1; CDK2; PSMA1; PSMA3; PSMA4; PSMA5; PSMB4; PSMB6; PSMB5; CDC27; PSMC2; PSMC4; PSMD8; PSMB3; PSMB2; PSMD7; PLK1; PSMD4; ANAPC15; PSME3; PSMC1; PSMC5; RPS27A; UBA52; CDC20; PSMD2; CUL3; PSME4; PSMD6; UBE2S; CDC26; PSMF1; PSMB7; PSMD1; ANAPC11; CDC23; ANAPC7; ANAPC5; FBXO5; FZR1; PSMD13;	GO:0031145~anaphase-promoting complex-dependent catabolic process	52	81	64.1975308641975	0	0	0	0	0	0	0
down	DVL1; SMAD7; SOCS5; PSMD10; IL33; BAG2; HSPA1A; CLU; TAF1; AKT1; USP5; GCLC; CSNK1A1; CSNK1D; CSNK1E; PSEN1; GSK3B; PLK1; RAD23A; VCP; SUMO2; RBX1; SUMO1; RACK1; DAB2; KEAP1; BBS7; ZFAND2A; SH3RF2; SOCS4; TRIB2; CHFR; DDRGK1; PRICKLE1; RCHY1; ZYG11B; PLK2; HSPBP1; STUB1; NUB1; DDA1; RNF217; ANKIB1; ARIH1; ARIH2; RNF19A; RNF14;	GO:0032436~positive regulation of proteasomal ubiquitin-dependent protein catabolic process	47	74	63.5135135135135	0	0	0	0	0	0	0
down	ARNTL; BHLHE40; PRMT5; PER2; HDAC3; CLOCK; MYCBP2; NGFR; TOP1; DRD2; ATF4; NR1D1; KDM5A; RORA; PPP1CC; NRIP1; CSNK1D; CSNK1E; PPP1CA; PPP1CB; HNRNPU; KMT2A; GFPT1; PPARA; MTA1; HDAC1; NCOA2; ZFHX3; CRY1; CRY2; RAI1; HUWE1; CIART; KDM8; HDAC2; SIRT1; NPAS2; MYBBP1A; LGR4; NOCT; KDM2A; MAGED1; BHLHE41; ID3; ID4;	GO:0032922~circadian regulation of gene expression	45	65	69.2307692307692	0	0	0	0	0	0	0
down	CTDSP2; GOSR2; ASNA1; KDELR3; ERN1; WFS1; SEC31A; YIF1A; VAPB; LMNA; SRPRA; HSPA5; XBP1; PTPN1; SHC1; SSR1; ACADVL; GFPT1; ZBTB17; DNAJC3; DCTN1; PDIA5; CUL7; PDIA6; PPP2R5B; WIPI1; SYVN1; PARP16; ARFGAP1; EDEM1; EXTL1; TATDN2; MYDGF; KLHDC3; TSPYL2; PREB; FKBP14; CXXC1; EXTL2; DNAJB9; DNAJB11; TLN1; HYOU1; SRPRB; SERP1;	GO:0036498~IRE1-mediated unfolded protein response	45	55	81.8181818181818	0	0	0	0	0	0	0
down	HAX1; ATOX1; CBX4; EEF2K; DDX3X; AREL1; HDAC3; SIAH2; RIPK2; LAMTOR5; SPRY2; TRIAP1; DYRK3; OPA1; NUPR1; GREM1; PSMD10; BAG4; CLDN7; BAG3; DDAH2; NGF; CRYAB; TFRC; RAF1; ANXA1; PRNP; TP53; HSPB1; IGF1; IL6; KRT18; NPM1; IGF1R; NGFR; ASNS; ANXA5; GSTP1; PDGFRB; UBC; HSPA1A; GLI2; RARA; HSPD1; HSPA5; PIM1; SRC; TPT1; MIF; HSP90B1; VEGFA; EPCAM; ZNF16; XBP1; ARF4; SON; SLC9A1; NFKB1; POU3F3; RASA1; FLNA; NME2; CBL; RPS6KB1; CFL1; EDNRB; RPL10; MSX1; SHC1; AQP1; PRDX5; PRDX3; DNAJA1; AKT1; AKT2; PRDX2; CTNNB1; NUP62; HSPA9; GDNF; VHL; WNT5A; CASP3; PTGFR; MAPK8; BAG6; IER3; GCLC; COMP; PSEN1; GSK3B; IRAK1; STAT5B; RPS6KA3; MNAT1; ARHGDIA; PLK1; TMBIM6; ADAR; PTEN; DAD1; UFM1; HNRNPK; RPS27A; UBA52; UBE2B; ACTC1; PRKDC; TMF1; DAB2; XIAP; PPARD; RELA; NOTCH2; GLO1; MCL1; BNIP1; BNIP2; BNIP3; PRKAA1; DNAJC3; RIPK1; HDAC1; FHL2; GAS6; BECN1; ZNF268; ARL6IP1; ANGPT1; DHCR24; STIL; MED1; DDB1; TAF9; NAA35; CIAPIN1; ZFAND6; CDC73; DSTYK; SCX; SETX; LIMS2; SH3RF1; AMIGO2; MTDH; TAX1BP1; THOC6; ANKLE2; CAMK1D; ERC1; SUPV3L1; STK40; TXNDC5; RHBDD1; SH3RF2; MYO18A; HDAC2; BCL2L2; KIFAP3; APBB2; COPS5; GATA6; MYDGF; BIRC7; SIRT1; APIP; DDRGK1; ITCH; USP47; SIN3A; YME1L1; PAFAH2; PARK7; BARD1; CIB1; NAA38; MIEN1; FAIM2; NAA15; API5; ATG5; HIPK3; GOLPH3; PLK3; AVEN; BIRC6; TOPORS; ATAD3A; AATF; SPHK1; PLK2; PLAC8; BFAR; TNFRSF10D; MALT1; SIX4; PA2G4; HIGD1A; PRELID1; ATF5; KLHL20; UBE2O; AXL; MAEA; UBE2Z; PSEN2;	GO:0043066~negative regulation of apoptotic process	206	489	42.1267893660532	0	0	0	0	0	0	0
