down	SMAD7; CALM1; CALM2; CALM3; PRKACA; ADRA1B; GJA5; EHD3;	GO:0055117~regulation of cardiac muscle contraction	8	19	42.1052631578947	0.0127382668519777	0.0687335648887961	1	1	0.999999764780283	0.999999764780283	0.663997925034461
down	EDN1; SRC; POR; XBP1; APEX1; MAP1B; NKX6-1; GPER1;	GO:0071375~cellular response to peptide hormone stimulus	8	19	42.1052631578947	0.0127382668519777	0.0687335648887961	1	1	0.999999764780283	0.999999764780283	0.663997925034461
down	ADCY6; ACE; NPPB; GCLC; GCLM; FOXC1; ROCK1; FOXC2;	GO:0097746~regulation of blood vessel diameter	8	19	42.1052631578947	0.0127382668519777	0.0687335648887961	1	1	0.999999764780283	0.999999764780283	0.663997925034461
down	RHOD; SEMA3E; DAPK3; ABL1; ABL2; ARHGDIA; NOTCH2; PHPT1;	GO:2000249~regulation of actin cytoskeleton reorganization	8	19	42.1052631578947	0.0127382668519777	0.0687335648887961	1	1	0.999999764780283	0.999999764780283	0.663997925034461
down	HAX1; ABL1; HRAS; NTF3; CDC42; CDK5; BAIAP2L1; BAIAP2;	GO:2000251~positive regulation of actin cytoskeleton reorganization	8	19	42.1052631578947	0.0127382668519777	0.0687335648887961	1	1	0.999999764780283	0.999999764780283	0.663997925034461
down	CPSF4; CSTF2; CPSF1; TRPT1; DDX1; CLP1; RTCB;	GO:0006388~tRNA splicing, via endonucleolytic cleavage and ligation	7	15	46.6666666666667	0.0129428888403638	0.0690758055322687	1	1	0.999999764780283	0.999999764780283	0.667304127433477
down	ADCY6; RGS9; GNAI3; DRD4; GSK3B; KLF16; CALY;	GO:0007212~dopamine receptor signaling pathway	7	15	46.6666666666667	0.0129428888403638	0.0690758055322687	1	1	0.999999764780283	0.999999764780283	0.667304127433477
down	PRNP; SERPINE2; GLG1; CHAC1; TMEM59; SNX12; TMEM98;	GO:0010955~negative regulation of protein processing	7	15	46.6666666666667	0.0129428888403638	0.0690758055322687	1	1	0.999999764780283	0.999999764780283	0.667304127433477
down	SPINT2; ABL1; TGFB1; CDH1; NF2; GTPBP4; EPB41L5;	GO:0022408~negative regulation of cell-cell adhesion	7	15	46.6666666666667	0.0129428888403638	0.0690758055322687	1	1	0.999999764780283	0.999999764780283	0.667304127433477
down	WDR1; RHOV; RHOJ; CDC42; RTKN; ANLN; RAC1;	GO:0030865~cortical cytoskeleton organization	7	15	46.6666666666667	0.0129428888403638	0.0690758055322687	1	1	0.999999764780283	0.999999764780283	0.667304127433477
down	FGF18; VTN; ITGB3; ITGA5; VEGFA; GRB10; HIF1A;	GO:0030949~positive regulation of vascular endothelial growth factor receptor signaling pathway	7	15	46.6666666666667	0.0129428888403638	0.0690758055322687	1	1	0.999999764780283	0.999999764780283	0.667304127433477
down	KDM1A; KDM4A; KDM4B; KDM4C; KDM3A; HR; JMJD1C;	GO:0033169~histone H3-K9 demethylation	7	15	46.6666666666667	0.0129428888403638	0.0690758055322687	1	1	0.999999764780283	0.999999764780283	0.667304127433477
down	ENTPD6; ENTPD5; ENTPD1; NUDT18; NUDT15; NUDT5; ENTPD4;	GO:0034656~nucleobase-containing small molecule catabolic process	7	15	46.6666666666667	0.0129428888403638	0.0690758055322687	1	1	0.999999764780283	0.999999764780283	0.667304127433477
down	CTNNB1; SOX18; GJA5; FOXC1; TBX2; MED1; FOXC2;	GO:0035050~embryonic heart tube development	7	15	46.6666666666667	0.0129428888403638	0.0690758055322687	1	1	0.999999764780283	0.999999764780283	0.667304127433477
down	DYRK3; KDM1A; PSMD10; MIF; PTTG1IP; DYRK1A; SIRT1;	GO:0043518~negative regulation of DNA damage response, signal transduction by p53 class mediator	7	15	46.6666666666667	0.0129428888403638	0.0690758055322687	1	1	0.999999764780283	0.999999764780283	0.667304127433477
down	SIAH2; HTRA2; IDE; UBE2G2; RIPK1; DAB2IP; RNF5;	GO:0044257~cellular protein catabolic process	7	15	46.6666666666667	0.0129428888403638	0.0690758055322687	1	1	0.999999764780283	0.999999764780283	0.667304127433477
down	HTT; CCDC88A; CROCC; TAPT1; KCTD17; CEP120; ARHGAP35;	GO:0045724~positive regulation of cilium assembly	7	15	46.6666666666667	0.0129428888403638	0.0690758055322687	1	1	0.999999764780283	0.999999764780283	0.667304127433477
down	SLC9A1; CDC42; RAC1; ACTG1; ROCK1; ALMS1; TSC1;	GO:0051492~regulation of stress fiber assembly	7	15	46.6666666666667	0.0129428888403638	0.0690758055322687	1	1	0.999999764780283	0.999999764780283	0.667304127433477
down	OBSL1; PDGFRB; SRF; MYH10; ACTC1; MYOM1; MYOM3;	GO:0055003~cardiac myofibril assembly	7	15	46.6666666666667	0.0129428888403638	0.0690758055322687	1	1	0.999999764780283	0.999999764780283	0.667304127433477
down	DGAT1; APOE; GOT1; XBP1; ABCD1; PRKAA1; SIRT1;	GO:0055089~fatty acid homeostasis	7	15	46.6666666666667	0.0129428888403638	0.0690758055322687	1	1	0.999999764780283	0.999999764780283	0.667304127433477
down	KCNK2; GJA1; PTEN; CXADR; RIPK1; VGLL4; TBX5;	GO:0060044~negative regulation of cardiac muscle cell proliferation	7	15	46.6666666666667	0.0129428888403638	0.0690758055322687	1	1	0.999999764780283	0.999999764780283	0.667304127433477
down	EZR; RELA; PRDX1; DLG1; UACA; AKIP1; PTPN22;	GO:1901222~regulation of NIK/NF-kappaB signaling	7	15	46.6666666666667	0.0129428888403638	0.0690758055322687	1	1	0.999999764780283	0.999999764780283	0.667304127433477
down	TRIM13; TRIM27; TRIM26; TRIM28; TRIM11; MID2; TRIM35;	GO:1902187~negative regulation of viral release from host cell	7	15	46.6666666666667	0.0129428888403638	0.0690758055322687	1	1	0.999999764780283	0.999999764780283	0.667304127433477
up	SLC4A1; P2RX7; PLSCR4; PLSCR2;	GO:0017121~plasma membrane phospholipid scrambling	4	9	44.4444444444444	0.0130530332074397	0.58704157093697	1	1	0.999999999953083	0.999999999953083	1
up	LY86; SCIMP; CD180; LY96;	GO:0031666~positive regulation of lipopolysaccharide-mediated signaling pathway	4	9	44.4444444444444	0.0130530332074397	0.58704157093697	1	1	0.999999999953083	0.999999999953083	1
up	FCGR2B; NR1H3; IL31RA; LRFN5;	GO:0043031~negative regulation of macrophage activation	4	9	44.4444444444444	0.0130530332074397	0.58704157093697	1	1	0.999999999953083	0.999999999953083	1
up	FES; LYN; RAC2; UNC13D;	GO:0043304~regulation of mast cell degranulation	4	9	44.4444444444444	0.0130530332074397	0.58704157093697	1	1	0.999999999953083	0.999999999953083	1
up	LYN; CYBA; PTPN6; CORO1A; ANK2;	GO:0051279~regulation of release of sequestered calcium ion into cytosol	5	15	33.3333333333333	0.0141801194090162	0.58704157093697	1	1	0.999999999953083	0.999999999953083	1
up	CCL5; CXCL12; AIF1; PYCARD; TNFRSF14;	GO:2000406~positive regulation of T cell migration	5	15	33.3333333333333	0.0141801194090162	0.58704157093697	1	1	0.999999999953083	0.999999999953083	1
up	TNFRSF21; IL2RA; CTLA4; HLA-G; IL10; PTPN6; LILRB2; LILRB1; CD80;	GO:0042130~negative regulation of T cell proliferation	9	43	20.9302325581395	0.0144629987091137	0.58704157093697	1	1	0.999999999953083	0.999999999953083	1
down	SMAD7; PTEN; PPP2CA; DAB2IP; VASN; DACT3; TBX5; TRIM62; STRAP;	GO:0010719~negative regulation of epithelial to mesenchymal transition	9	24	37.5	0.0148564677419064	0.0772315083374441	1	1	0.999999764780283	0.999999764780283	0.746091976551964
down	HAX1; LATS1; ELN; RASA1; GBA2; DBN1; FCHSD1; CTTN; PFN1;	GO:0030833~regulation of actin filament polymerization	9	24	37.5	0.0148564677419064	0.0772315083374441	1	1	0.999999764780283	0.999999764780283	0.746091976551964
down	FSTL3; CTNNB1; FBN1; TCTA; TOB2; LRRC17; ZNF675; UBASH3B; PIAS3;	GO:0045671~negative regulation of osteoclast differentiation	9	24	37.5	0.0148564677419064	0.0772315083374441	1	1	0.999999764780283	0.999999764780283	0.746091976551964
down	GOT2; GOT1; MDH2; ACLY; MDH1;	GO:0006107~oxaloacetate metabolic process	5	8	62.5	0.0149095575941012	0.0772315083374441	1	1	0.999999764780283	0.999999764780283	0.746091976551964
down	ERN1; PCF11; POLR2I; CSTF3; CPSF2;	GO:0006379~mRNA cleavage	5	8	62.5	0.0149095575941012	0.0772315083374441	1	1	0.999999764780283	0.999999764780283	0.746091976551964
down	MVD; MVK; PDSS1; PDSS2; HMGCR;	GO:0008299~isoprenoid biosynthetic process	5	8	62.5	0.0149095575941012	0.0772315083374441	1	1	0.999999764780283	0.999999764780283	0.746091976551964
down	DDX3X; DHX9; DHX36; AGO3; AGO1;	GO:0010501~RNA secondary structure unwinding	5	8	62.5	0.0149095575941012	0.0772315083374441	1	1	0.999999764780283	0.999999764780283	0.746091976551964
down	GJB6; GJA1; GJB2; CTNNA1; GJA5;	GO:0016264~gap junction assembly	5	8	62.5	0.0149095575941012	0.0772315083374441	1	1	0.999999764780283	0.999999764780283	0.746091976551964
down	GALNT2; GALNT1; GALNT16; GALNT4; GALNT11;	GO:0018243~protein O-linked glycosylation via threonine	5	8	62.5	0.0149095575941012	0.0772315083374441	1	1	0.999999764780283	0.999999764780283	0.746091976551964
down	CHFR; UBA52; UBC; NEDD8; RPS27A;	GO:0019941~modification-dependent protein catabolic process	5	8	62.5	0.0149095575941012	0.0772315083374441	1	1	0.999999764780283	0.999999764780283	0.746091976551964
down	PDLIM1; ARPC5; SLC9A1; GSK3B; DLG5;	GO:0030011~maintenance of cell polarity	5	8	62.5	0.0149095575941012	0.0772315083374441	1	1	0.999999764780283	0.999999764780283	0.746091976551964
down	BCAP31; RAP1GDS1; BAK1; THADA; FIS1;	GO:0032471~negative regulation of endoplasmic reticulum calcium ion concentration	5	8	62.5	0.0149095575941012	0.0772315083374441	1	1	0.999999764780283	0.999999764780283	0.746091976551964
down	FSTL3; SKI; FST; ACVR1; LEMD3;	GO:0032926~negative regulation of activin receptor signaling pathway	5	8	62.5	0.0149095575941012	0.0772315083374441	1	1	0.999999764780283	0.999999764780283	0.746091976551964
down	RPS6KA4; CCNB1; CDK9; FMR1; ATM;	GO:0033129~positive regulation of histone phosphorylation	5	8	62.5	0.0149095575941012	0.0772315083374441	1	1	0.999999764780283	0.999999764780283	0.746091976551964
down	UGDH; LETM1; MAT2A; LRRC8A; YME1L1;	GO:0034214~protein hexamerization	5	8	62.5	0.0149095575941012	0.0772315083374441	1	1	0.999999764780283	0.999999764780283	0.746091976551964
down	EXOSC9; EXOSC2; EXOSC4; EXOSC8; EXOSC3;	GO:0034475~U4 snRNA 3'-end processing	5	8	62.5	0.0149095575941012	0.0772315083374441	1	1	0.999999764780283	0.999999764780283	0.746091976551964
down	CTCF; MYOCD; PARK7; SETD5; EID1;	GO:0035065~regulation of histone acetylation	5	8	62.5	0.0149095575941012	0.0772315083374441	1	1	0.999999764780283	0.999999764780283	0.746091976551964
down	CDH1; SRC; CBL; CTNNB1; GRB2;	GO:0035635~entry of bacterium into host cell	5	8	62.5	0.0149095575941012	0.0772315083374441	1	1	0.999999764780283	0.999999764780283	0.746091976551964
down	SRF; ENG; BMPR1A; RBPJ; HEY1;	GO:0035912~dorsal aorta morphogenesis	5	8	62.5	0.0149095575941012	0.0772315083374441	1	1	0.999999764780283	0.999999764780283	0.746091976551964
down	ERN1; MARK3; ATM; RIPK1; DYRK1A;	GO:0036289~peptidyl-serine autophosphorylation	5	8	62.5	0.0149095575941012	0.0772315083374441	1	1	0.999999764780283	0.999999764780283	0.746091976551964
down	TGFB1; TPR; NUP62; NUP54; NUP58;	GO:0042306~regulation of protein import into nucleus	5	8	62.5	0.0149095575941012	0.0772315083374441	1	1	0.999999764780283	0.999999764780283	0.746091976551964
down	WDR1; RHOC; VCL; CTNNA1; PKN2;	GO:0043297~apical junction assembly	5	8	62.5	0.0149095575941012	0.0772315083374441	1	1	0.999999764780283	0.999999764780283	0.746091976551964
down	MAPKAPK2; DNM2; CARMIL1; DOCK2; RAB34;	GO:0044351~macropinocytosis	5	8	62.5	0.0149095575941012	0.0772315083374441	1	1	0.999999764780283	0.999999764780283	0.746091976551964
down	ACSL3; RPS6KB1; ACSL1; SLC27A4; SLC27A1;	GO:0044539~long-chain fatty acid import into cell	5	8	62.5	0.0149095575941012	0.0772315083374441	1	1	0.999999764780283	0.999999764780283	0.746091976551964
down	THOC5; THOC7; ALYREF; THOC6; THOC2;	GO:0046784~viral mRNA export from host cell nucleus	5	8	62.5	0.0149095575941012	0.0772315083374441	1	1	0.999999764780283	0.999999764780283	0.746091976551964
down	DNM1L; OPA1; CLUH; SYNJ2BP; BHLHA15;	GO:0048312~intracellular distribution of mitochondria	5	8	62.5	0.0149095575941012	0.0772315083374441	1	1	0.999999764780283	0.999999764780283	0.746091976551964
down	FGFR1; YAP1; POGLUT1; NUP133; EPB41L5;	GO:0048339~paraxial mesoderm development	5	8	62.5	0.0149095575941012	0.0772315083374441	1	1	0.999999764780283	0.999999764780283	0.746091976551964
down	ARPC5; ACTN1; CARMIL1; PLS3; PLS1;	GO:0051639~actin filament network formation	5	8	62.5	0.0149095575941012	0.0772315083374441	1	1	0.999999764780283	0.999999764780283	0.746091976551964
down	MFN2; MARK2; MFN1; MUL1; HDAC6;	GO:0051646~mitochondrion localization	5	8	62.5	0.0149095575941012	0.0772315083374441	1	1	0.999999764780283	0.999999764780283	0.746091976551964
down	CALM1; CALM2; CALM3; GSTO1; JPH2;	GO:0060316~positive regulation of ryanodine-sensitive calcium-release channel activity	5	8	62.5	0.0149095575941012	0.0772315083374441	1	1	0.999999764780283	0.999999764780283	0.746091976551964
down	ABL1; CDH2; SOX4; TMEM231; B9D1;	GO:0060563~neuroepithelial cell differentiation	5	8	62.5	0.0149095575941012	0.0772315083374441	1	1	0.999999764780283	0.999999764780283	0.746091976551964
down	KLF7; HMGCR; FKBP1B; NDUFAF2; JAGN1;	GO:0061179~negative regulation of insulin secretion involved in cellular response to glucose stimulus	5	8	62.5	0.0149095575941012	0.0772315083374441	1	1	0.999999764780283	0.999999764780283	0.746091976551964
down	RECQL4; TERF1; WRN; TERF2; SLX4;	GO:0061820~telomeric D-loop disassembly	5	8	62.5	0.0149095575941012	0.0772315083374441	1	1	0.999999764780283	0.999999764780283	0.746091976551964
down	BANF1; XRCC6; XRCC5; LIG4; PPIA;	GO:0075713~establishment of integrated proviral latency	5	8	62.5	0.0149095575941012	0.0772315083374441	1	1	0.999999764780283	0.999999764780283	0.746091976551964
down	RNF4; UBE2S; BARD1; RNF6; UBE2D4;	GO:0085020~protein K6-linked ubiquitination	5	8	62.5	0.0149095575941012	0.0772315083374441	1	1	0.999999764780283	0.999999764780283	0.746091976551964
down	CALM1; CALM2; CALM3; SRI; PDE4D;	GO:1901844~regulation of cell communication by electrical coupling involved in cardiac conduction	5	8	62.5	0.0149095575941012	0.0772315083374441	1	1	0.999999764780283	0.999999764780283	0.746091976551964
down	RAP1B; TJP1; RAPGEF1; RAPGEF2; ROCK1;	GO:1901888~regulation of cell junction assembly	5	8	62.5	0.0149095575941012	0.0772315083374441	1	1	0.999999764780283	0.999999764780283	0.746091976551964
down	SETD1A; HNRNPU; SSRP1; METTL4; SETD5;	GO:1902275~regulation of chromatin organization	5	8	62.5	0.0149095575941012	0.0772315083374441	1	1	0.999999764780283	0.999999764780283	0.746091976551964
down	IDE; SHMT2; VCP; BNIP3; HIF1A;	GO:1903715~regulation of aerobic respiration	5	8	62.5	0.0149095575941012	0.0772315083374441	1	1	0.999999764780283	0.999999764780283	0.746091976551964
down	FOXE1; CTNNB1; CRKL; TGFB2; COLEC10;	GO:1904888~cranial skeletal system development	5	8	62.5	0.0149095575941012	0.0772315083374441	1	1	0.999999764780283	0.999999764780283	0.746091976551964
down	SFXN3; SFXN5; UCP3; SFXN4; SFXN1;	GO:1990542~mitochondrial transmembrane transport	5	8	62.5	0.0149095575941012	0.0772315083374441	1	1	0.999999764780283	0.999999764780283	0.746091976551964
down	SMARCA5; NPM1; SETSIP; BRD2; ATRX; NAP1L1; HILS1; SET; SART3; HP1BP3; SPTY2D1; TSPYL5; ANP32B; RSF1; NAP1L4; GRWD1; TSPYL1; TSPYL2; SMYD3; NAA60; CHAF1B;	GO:0006334~nucleosome assembly	21	84	25	0.015005773515382	0.0776842102154345	1	1	0.999999764780283	0.999999764780283	0.750465285402322
up	IFNG; CSF1; BMP4; MMP9; SPI1; IL31RA;	GO:0030225~macrophage differentiation	6	22	27.2727272727273	0.0159394420775206	0.58704157093697	1	1	0.999999999953083	0.999999999953083	1
up	ITGA2; ITGB6; ITGB8; ITGB2; ITGB7; ITGB4;	GO:0033627~cell adhesion mediated by integrin	6	22	27.2727272727273	0.0159394420775206	0.58704157093697	1	1	0.999999999953083	0.999999999953083	1
up	LILRA5; IFNG; ORM2; AKAP12; LRRK2; LILRA2;	GO:1904469~positive regulation of tumor necrosis factor secretion	6	22	27.2727272727273	0.0159394420775206	0.58704157093697	1	1	0.999999999953083	0.999999999953083	1
down	NBN; FOXO4; TAOK1; BRSK1; TRIM39; DONSON; TAOK2; TOPBP1;	GO:0007095~mitotic G2 DNA damage checkpoint	8	20	40	0.0159670430862017	0.0812664207712156	1	1	0.999999764780283	0.999999764780283	0.785071090876308
down	AGT; IGF1; EDN1; PARP1; SLC9A1; CDK9; HAND2; ROCK1;	GO:0010613~positive regulation of cardiac muscle hypertrophy	8	20	40	0.0159670430862017	0.0812664207712156	1	1	0.999999764780283	0.999999764780283	0.785071090876308
down	NUDT21; TP53; SHMT2; PKD2; CPSF6; HOMER1; CPSF7; TRPM7;	GO:0051262~protein tetramerization	8	20	40	0.0159670430862017	0.0812664207712156	1	1	0.999999764780283	0.999999764780283	0.785071090876308
down	WDR1; ZMPSTE24; GJA5; CACNA2D1; KCNH2; SCN5A; AKAP9; KCNE4;	GO:0060307~regulation of ventricular cardiac muscle cell membrane repolarization	8	20	40	0.0159670430862017	0.0812664207712156	1	1	0.999999764780283	0.999999764780283	0.785071090876308
down	DNM1L; TP53; RIPK1; ITPK1; TICAM1; PGAM5; TRPM7; CYLD;	GO:0070266~necroptotic process	8	20	40	0.0159670430862017	0.0812664207712156	1	1	0.999999764780283	0.999999764780283	0.785071090876308
down	NRP2; CDKL5; HSPA8; ARF4; WNT5A; ABHD17A; EGLN1; CHMP2B;	GO:0099175~regulation of postsynapse organization	8	20	40	0.0159670430862017	0.0812664207712156	1	1	0.999999764780283	0.999999764780283	0.785071090876308
up	ARHGAP6; FAM107A; VIL1; HCLS1; AIF1; LMOD2; MSRB1;	GO:0030041~actin filament polymerization	7	29	24.1379310344828	0.0161293502668236	0.58704157093697	1	1	0.999999999953083	0.999999999953083	1
up	F2; PRL; CCL5; AKR1B1; IL10; CYP1B1; IL26;	GO:0046427~positive regulation of receptor signaling pathway via JAK-STAT	7	29	24.1379310344828	0.0161293502668236	0.58704157093697	1	1	0.999999999953083	0.999999999953083	1
up	CD3E; CD7; CD3G; CD8B; ZAP70; SMAD3; IRF4; TREML2; HSH2D;	GO:0042110~T cell activation	9	44	20.4545454545455	0.0162928907017514	0.58704157093697	1	1	0.999999999953083	0.999999999953083	1
down	GADD45B; GADD45G; DAB2IP; TRAF7; KSR1; MAP4K5;	GO:0000185~activation of MAPKKK activity	6	12	50	0.0165890108714996	0.0812664207712156	1	1	0.999999764780283	0.999999764780283	0.785071090876308
down	CCL21; NCK2; MSN; CD81; DLG1; DOCK2;	GO:0001771~immunological synapse formation	6	12	50	0.0165890108714996	0.0812664207712156	1	1	0.999999764780283	0.999999764780283	0.785071090876308
down	SYT7; MYH9; MYH10; SYTL4; MYOF; ANXA6;	GO:0001778~plasma membrane repair	6	12	50	0.0165890108714996	0.0812664207712156	1	1	0.999999764780283	0.999999764780283	0.785071090876308
down	UBE2N; UBE2B; WDR33; RAD18; UBE2V2; NSMCE1;	GO:0006301~postreplication repair	6	12	50	0.0165890108714996	0.0812664207712156	1	1	0.999999764780283	0.999999764780283	0.785071090876308
down	ATRX; NASP; HIRA; RBBP4; UBN1; CABIN1;	GO:0006336~DNA replication-independent nucleosome assembly	6	12	50	0.0165890108714996	0.0812664207712156	1	1	0.999999764780283	0.999999764780283	0.785071090876308
down	EDN1; SLC9A1; EDNRB; CLCN3; SLC9A7; RHCG;	GO:0006885~regulation of pH	6	12	50	0.0165890108714996	0.0812664207712156	1	1	0.999999764780283	0.999999764780283	0.785071090876308
down	ZW10; KNTC1; MAD2L1BP; PPP1R9B; ANLN; CDC23;	GO:0007096~regulation of exit from mitosis	6	12	50	0.0165890108714996	0.0812664207712156	1	1	0.999999764780283	0.999999764780283	0.785071090876308
down	MTA2; FER; GNA12; RCC2; APPL1; CORO1C;	GO:0010762~regulation of fibroblast migration	6	12	50	0.0165890108714996	0.0812664207712156	1	1	0.999999764780283	0.999999764780283	0.785071090876308
down	AQP1; MYH10; RPGRIP1L; TSKU; DPCD; NUMBL;	GO:0021670~lateral ventricle development	6	12	50	0.0165890108714996	0.0812664207712156	1	1	0.999999764780283	0.999999764780283	0.785071090876308
down	C2CD3; PARL; SERPINB13; SPOP; SPOPL; NEDD8;	GO:0030162~regulation of proteolysis	6	12	50	0.0165890108714996	0.0812664207712156	1	1	0.999999764780283	0.999999764780283	0.785071090876308
down	CSPG5; BGN; CSPG4; CHST12; DSE; UST;	GO:0030208~dermatan sulfate biosynthetic process	6	12	50	0.0165890108714996	0.0812664207712156	1	1	0.999999764780283	0.999999764780283	0.785071090876308
down	SAE1; UBA5; UBA1; UBA3; UBA6; UBA2;	GO:0032446~protein modification by small protein conjugation	6	12	50	0.0165890108714996	0.0812664207712156	1	1	0.999999764780283	0.999999764780283	0.785071090876308
down	NFATC1; PPP3CC; RCAN1; PPP3R1; PPP3CA; NFATC3;	GO:0033173~calcineurin-NFAT signaling cascade	6	12	50	0.0165890108714996	0.0812664207712156	1	1	0.999999764780283	0.999999764780283	0.785071090876308
down	CLPP; SPPL3; SPPL2B; HM13; PARL; AFG3L2;	GO:0033619~membrane protein proteolysis	6	12	50	0.0165890108714996	0.0812664207712156	1	1	0.999999764780283	0.999999764780283	0.785071090876308
down	LRP5; ABL1; ITGAV; TMEM119; CTHRC1; FBLN5;	GO:0033690~positive regulation of osteoblast proliferation	6	12	50	0.0165890108714996	0.0812664207712156	1	1	0.999999764780283	0.999999764780283	0.785071090876308
down	GLB1; GALNS; LUM; PRELP; FMOD; OMD;	GO:0042340~keratan sulfate catabolic process	6	12	50	0.0165890108714996	0.0812664207712156	1	1	0.999999764780283	0.999999764780283	0.785071090876308
down	NCOR1; NAGLU; PTEN; MTA1; NCOA2; CIART;	GO:0045475~locomotor rhythm	6	12	50	0.0165890108714996	0.0812664207712156	1	1	0.999999764780283	0.999999764780283	0.785071090876308
down	GLI1; ESRRA; PRKACA; DDX5; RASSF2; REST;	GO:0045667~regulation of osteoblast differentiation	6	12	50	0.0165890108714996	0.0812664207712156	1	1	0.999999764780283	0.999999764780283	0.785071090876308
down	PTN; WNT5A; TGFB2; BMPR2; TOB2; NIPBL;	GO:0045778~positive regulation of ossification	6	12	50	0.0165890108714996	0.0812664207712156	1	1	0.999999764780283	0.999999764780283	0.785071090876308
down	SLC2A4; SESN2; TSC1; SORT1; SLC2A13; SLC2A8;	GO:0046323~glucose import	6	12	50	0.0165890108714996	0.0812664207712156	1	1	0.999999764780283	0.999999764780283	0.785071090876308
down	SPTLC1; SPTLC2; ABCA2; SPHK2; ACER3; SPHK1;	GO:0046512~sphingosine biosynthetic process	6	12	50	0.0165890108714996	0.0812664207712156	1	1	0.999999764780283	0.999999764780283	0.785071090876308
down	SCD; FASN; SLC25A1; ACLY; ACACA; GCDH;	GO:0046949~fatty-acyl-CoA biosynthetic process	6	12	50	0.0165890108714996	0.0812664207712156	1	1	0.999999764780283	0.999999764780283	0.785071090876308
down	IL33; IL6; GPI; XBP1; STX4; VAMP3;	GO:0051024~positive regulation of immunoglobulin secretion	6	12	50	0.0165890108714996	0.0812664207712156	1	1	0.999999764780283	0.999999764780283	0.785071090876308
down	CNOT1; TOB1; TNRC6C; CNOT7; TNRC6A; POLR2G;	GO:0060213~positive regulation of nuclear-transcribed mRNA poly(A) tail shortening	6	12	50	0.0165890108714996	0.0812664207712156	1	1	0.999999764780283	0.999999764780283	0.785071090876308
down	VEGFA; EPHB2; RYK; GDNF; DAG1; ROBO3;	GO:0071679~commissural neuron axon guidance	6	12	50	0.0165890108714996	0.0812664207712156	1	1	0.999999764780283	0.999999764780283	0.785071090876308
down	ATRX; SMAD4; WDR48; TBC1D20; BRIP1; ING2;	GO:0072520~seminiferous tubule development	6	12	50	0.0165890108714996	0.0812664207712156	1	1	0.999999764780283	0.999999764780283	0.785071090876308
down	ITGB3; DRD4; EFNB2; USP46; SCRIB; ATAD1;	GO:0099149~regulation of postsynaptic neurotransmitter receptor internalization	6	12	50	0.0165890108714996	0.0812664207712156	1	1	0.999999764780283	0.999999764780283	0.785071090876308
down	GLI1; EZH2; CDC73; PAF1; DDRGK1; FAM83D;	GO:1902808~positive regulation of cell cycle G1/S phase transition	6	12	50	0.0165890108714996	0.0812664207712156	1	1	0.999999764780283	0.999999764780283	0.785071090876308
down	GRIN2D; PDPK1; EDN1; PLCG1; EDNRB; RCAN2; BHLHA15; MCU; TRPM4; SGCD; CAMKK2; SPHK1; EIF2AK3; NUDT4; CALM3; CALML6; ACKR3; CALM1; CALM2; SAMD14; PPP1R9B;	GO:0019722~calcium-mediated signaling	21	85	24.7058823529412	0.0166190910118066	0.0812664207712156	1	1	0.999999764780283	0.999999764780283	0.785071090876308
down	EDN1; MIF; PTGS1; PTGES3; PTGIS; PLA2G4F; PNPLA8;	GO:0001516~prostaglandin biosynthetic process	7	16	43.75	0.016685203034435	0.0812664207712156	1	1	0.999999764780283	0.999999764780283	0.785071090876308
down	CST3; CSTA; CSTB; ECM1; UMODL1; PI16; WFDC10B;	GO:0010466~negative regulation of peptidase activity	7	16	43.75	0.016685203034435	0.0812664207712156	1	1	0.999999764780283	0.999999764780283	0.785071090876308
down	TACSTD2; PTPRG; DAB2IP; MARVELD3; EVL; CORO1C; STRAP;	GO:0010633~negative regulation of epithelial cell migration	7	16	43.75	0.016685203034435	0.0812664207712156	1	1	0.999999764780283	0.999999764780283	0.785071090876308
down	SLFN11; DEDD2; DROSHA; DIS3; EXOSC9; EXOSC4; EXOSC8;	GO:0016075~rRNA catabolic process	7	16	43.75	0.016685203034435	0.0812664207712156	1	1	0.999999764780283	0.999999764780283	0.785071090876308
down	UNC13B; NAPA; SV2A; CADPS2; SNAP29; UNC13A; SNAP47;	GO:0016082~synaptic vesicle priming	7	16	43.75	0.016685203034435	0.0812664207712156	1	1	0.999999764780283	0.999999764780283	0.785071090876308
down	GREM1; ENPP1; ECM1; HIF1A; BCOR; TRPM4; LTBP3;	GO:0030502~negative regulation of bone mineralization	7	16	43.75	0.016685203034435	0.0812664207712156	1	1	0.999999764780283	0.999999764780283	0.785071090876308
down	SUPT5H; ELL; THOC5; ALYREF; SCAF8; SUPT16H; CCNK;	GO:0032786~positive regulation of DNA-templated transcription, elongation	7	16	43.75	0.016685203034435	0.0812664207712156	1	1	0.999999764780283	0.999999764780283	0.785071090876308
down	GCLC; GCLM; BCAR1; RELA; MED1; LGMN; APPL1;	GO:0035729~cellular response to hepatocyte growth factor stimulus	7	16	43.75	0.016685203034435	0.0812664207712156	1	1	0.999999764780283	0.999999764780283	0.785071090876308
down	INHA; INHBA; CDKN2B; DYNLL1; ANKLE2; SIRT1; PRKRIP1;	GO:0042326~negative regulation of phosphorylation	7	16	43.75	0.016685203034435	0.0812664207712156	1	1	0.999999764780283	0.999999764780283	0.785071090876308
down	ALOX15B; CYP27B1; VDR; NME2; PRKCH; FOXC1; MED1;	GO:0045618~positive regulation of keratinocyte differentiation	7	16	43.75	0.016685203034435	0.0812664207712156	1	1	0.999999764780283	0.999999764780283	0.785071090876308
down	APOE; AKT1; MTOR; CCDC3; ABHD6; SORBS1; ZBTB20;	GO:0046889~positive regulation of lipid biosynthetic process	7	16	43.75	0.016685203034435	0.0812664207712156	1	1	0.999999764780283	0.999999764780283	0.785071090876308
down	ADA; GLI2; TGFB2; FOXF2; PKDCC; RARRES2; STRA6;	GO:0048566~embryonic digestive tract development	7	16	43.75	0.016685203034435	0.0812664207712156	1	1	0.999999764780283	0.999999764780283	0.785071090876308
